publish_date,title,summary
2024-07-05,"SSI Research dự báo lợi nhuận của 11 nhà băng: VPBank có thể tăng trưởng đến 60%, OCB và VIB đi lùi","SSI Research dự báo lợi nhuận quý II/2024 của 11 ngân hàng:  * **Tăng trưởng mạnh:** VPBank (60%, đạt 4.200 tỷ đồng do FE Credit hòa vốn), Techcombank (31%, đạt 7.000 tỷ đồng), HDBank (28-31%, đạt 3.500-3.600 tỷ đồng). * **Tăng trưởng vừa phải:** Vietcombank (8-10%, đạt 10.000-10.300 tỷ đồng), BIDV (12%, đạt 7.800 tỷ đồng), VietinBank (15%, đạt 7.500 tỷ đồng). * **Giảm lợi nhuận:** VIB (giảm 25-28%, đạt 2.100-2.200 tỷ đồng do giảm lãi suất), OCB (giảm 5-14%, đạt 1.350-1.500 tỷ đồng do chi phí dự phòng tăng).   "
2024-08-15,SSI Research dự báo Bách Hoá Xanh có thể lãi 228 tỷ trong năm 2024,"SSI Research dự báo Bách Hóa Xanh sẽ lãi 228 tỷ đồng trong năm 2024, đạt 40.000 tỷ đồng doanh thu (tăng lên 45.000 tỷ đồng năm 2025).  Doanh thu/tháng/cửa hàng đạt 2 tỷ đồng trong quý II/2024 nhờ cơ cấu sản phẩm tốt hơn và thu hút khách từ chợ truyền thống.  SSI Research cho rằng Bách Hóa Xanh sẽ tối ưu hóa chi phí và mở rộng mạng lưới cửa hàng để tăng trưởng dài hạn, dự kiến vượt số lượng cửa hàng điện máy trong trung hạn.  FPTS cũng đánh giá cao sự đa dạng sản phẩm của Bách Hóa Xanh so với đối thủ.  Ngược lại, chuỗi nhà thuốc An Khang dự kiến tiếp tục lỗ trong 2 năm tới (339 tỷ và 243 tỷ đồng), do đó MWG đang đóng cửa nhiều nhà thuốc.  Việc đóng cửa nhà thuốc được cho là không ảnh hưởng đáng kể đến lợi nhuận ròng tổng thể của MWG. "
2024-04-18,"Cập nhật số liệu CTCK ngày 18/4: Thêm SSI, FPTS, Vietinbank Securities,... ồ ạt công bố KQKD quý 1, một công ty tăng lãi hơn 800%","Tính đến ngày 18/4/2024, 34 công ty chứng khoán đã công bố báo cáo kết quả kinh doanh quý I/2024.  Một số điểm nổi bật:  * **SSI:** Doanh thu 1.945 tỷ đồng (+33%), lợi nhuận trước thuế (LNTT) 900 tỷ đồng (+53%). * **FPTS:** Doanh thu 299 tỷ đồng (+68%), LNTT 191 tỷ đồng (+93%). * **Vietinbank Securities (CTS):** Doanh thu 324 tỷ đồng (+63%), LNTT 124 tỷ đồng (+822%). * **Bảo Việt Securities (BVSC):** Doanh thu 236 tỷ đồng (+71%), LNTT 67 tỷ đồng (gấp đôi cùng kỳ). * **Lỗ:** Chứng khoán Vina và Stanley Brothers đều báo lỗ trong quý I/2024.  Vietinbank Securities có mức tăng trưởng lợi nhuận ấn tượng nhất (+822%).  Nhiều công ty chứng khoán khác cũng ghi nhận tăng trưởng doanh thu và lợi nhuận so với cùng kỳ năm trước. "
2024-10-10,Trong dự báo lợi nhuận quý III của SSI có một doanh nghiệp VN30 tăng 1250%,"SSI Research dự báo lợi nhuận quý III/2024 của Masan Group sẽ cao hơn quý II, nhờ WinCommerce có thể lãi lần đầu tiên, Masan Consumer tăng trưởng và các mảng kinh doanh khác tích cực.  Masan dự kiến nhận 70-80 triệu USD từ việc bán HCS cho MMC trong quý IV/2024.  Trong 17 năm, Masan đã huy động được khoảng 5 tỷ USD. J.P. Morgan đánh giá tích cực triển vọng kinh tế Việt Nam và khuyến nghị đầu tư vào cổ phiếu MSN (Masan Group), đặc biệt nhấn mạnh tiềm năng của ngành tiêu dùng thiết yếu.  Masan Group cho biết, trong 4 năm qua, chỉ số EBITDA của WinCommerce đã chuyển từ âm 7% lên dương 4%. "
2024-01-18,SSI báo lãi trước thuế quý 4/2023 tăng 151% so với cùng kỳ năm trước,"SSI công bố báo cáo tài chính riêng lẻ quý 4/2023: doanh thu 2.023 tỷ đồng (+48%), lợi nhuận trước thuế 616 tỷ đồng (+151%).  Doanh thu đến từ dịch vụ chứng khoán (827 tỷ đồng) và đầu tư (1.000 tỷ đồng).  Cả năm 2023, doanh thu riêng lẻ đạt 6.984 tỷ đồng (+12%), lợi nhuận trước thuế 2.705 tỷ đồng (+35%).  Kết quả hợp nhất cả năm: doanh thu 7.285 tỷ đồng (+11,8%), lợi nhuận trước thuế 2.848 tỷ đồng (+35%).  Tăng trưởng mạnh đến từ mảng đầu tư (tăng 58%).  Tổng tài sản và vốn chủ sở hữu tăng lần lượt 33% và 3%.  Thị phần môi giới cổ phiếu của SSI duy trì trong top 2 tại HoSE. "
2024-10-14,Kinh tế trưởng Chứng khoán SSI: “Sai lầm khi nghĩ rằng có nhiều tiền là sẽ có nhiều kinh nghiệm và kiến thức”,"Chương trình truyền hình thực tế The Moneyverse tập 3, với chủ đề ""Tinh vân tiết kiệm"", có sự tham gia của ông Phạm Lưu Hưng (Kinh tế trưởng SSI) với vai trò giám khảo.  Ông Hưng nhấn mạnh sai lầm khi cho rằng nhiều tiền đồng nghĩa với nhiều kinh nghiệm và kiến thức đầu tư.  Ông nhận định thế hệ trẻ (Gen Z) có kiến thức tốt nhưng cần được trang bị kinh nghiệm thực tế và khả năng kiểm soát cảm xúc khi đầu tư.  Chương trình nhằm phổ cập kiến thức tài chính cho giới trẻ.  Đội Trường Đại học Duy Tân giành chiến thắng chung cuộc.  Bà Lê Thị Thuý Sen (Vụ trưởng Vụ Truyền thông Ngân hàng Nhà nước) cho rằng phổ cập kiến thức tài chính là cần thiết nhưng khó khăn.   "
2024-06-06,SSI tung thông điệp “Chính là tôi” bằng MV ca nhạc ấn tượng,"SSI ra mắt MV ""Chính là Tôi"" nhằm thu hút giới trẻ tham gia đầu tư, khẳng định sự tự tin và cá tính trong đầu tư.  SSI cung cấp nhiều ưu đãi cho khách hàng trẻ, bao gồm:  * **Ưu đãi giao dịch:** Miễn phí giao dịch và hoàn lãi margin. * **Công cụ đầu tư:** Ứng dụng SSI iBoard Pro và sản phẩm đầu tư theo danh mục mẫu iFollow. * **Hoạt động cộng đồng:** Cộng đồng Zalo, chương trình ""The Moneyverse"", ""Cafe Chứng"", ""Đóng bảng cuối tuần"".  SSI hướng đến việc phá bỏ rào cản tâm lý, kiến thức và tài chính để giúp giới trẻ tự tin đầu tư và cải thiện kinh tế. "
2024-03-02,"Tuần 26/2 - 1/3: Khối ngoại ""tung"" hơn 600 tỷ gom cổ phiếu quốc dân, SSI và DGC cũng được mua mạnh","Tuần 26/2-1/3, Vn-Index tăng 3,82%, mức tăng mạnh nhất trong 4 tuần tăng liên tiếp.  Khối ngoại giao dịch tương đối cân bằng, mua ròng 116 tỷ đồng (mua ròng 110 tỷ trên HoSE).  HPG dẫn đầu danh sách mua ròng với 622 tỷ đồng, tiếp theo là SSI (533 tỷ đồng) và DGC (329 tỷ đồng).  Khối ngoại cũng mua ròng VND, VIX, BID, VCI, IDC, KBC.  Ngược lại, FUEVFVND dẫn đầu danh sách bán ròng với 352 tỷ đồng, tiếp theo là VNN, VHM, VRE, MSN và VPB.   "
2024-08-28,"Con trai Chủ tịch SSI Nguyễn Duy Hưng bán ra cổ phiếu, ai là người mua vào?","Ông Nguyễn Duy Linh (con trai Chủ tịch SSI Nguyễn Duy Hưng) đã bán 47 triệu cổ phiếu SSI (3.1% vốn) thông qua giao dịch thỏa thuận từ 19-23/8/2024.  Đồng thời, Công ty TNHH Đầu tư NDH (thuộc sở hữu của ông Nguyễn Duy Hưng) đã mua 32 triệu cổ phiếu SSI trong cùng thời gian đó, nâng sở hữu lên 8.354%.  Ước tính giao dịch của ông Linh có giá trị khoảng 1.550 tỷ đồng, và của Đầu tư NDH khoảng 1.065 tỷ đồng.  Giới quan sát cho rằng đây là giao dịch chuyển nhượng nội bộ.  Lũy kế 6 tháng đầu năm 2024, SSI đạt lợi nhuận trước thuế hơn 2.000 tỷ đồng, gần 60% kế hoạch năm.  SSI hiện là công ty chứng khoán lớn nhất về quy mô tài sản. "
2024-07-18,"Kết quả kinh doanh quý 2/2024 ngày 18/7: SSI, VIX, FPT, ... cùng loạt doanh nghiệp ồ ạt công bố","Ngày 18/7/2024, nhiều doanh nghiệp công bố báo cáo tài chính quý II/2024:  * **SSI:** Lợi nhuận trước thuế 1.041 tỷ đồng (+59%), lũy kế 6 tháng 1.941 tỷ đồng (+56%). * **TCM:** Doanh thu tháng 6 tăng 10%, lợi nhuận tăng 624%; lũy kế 6 tháng doanh thu tăng 12%, lợi nhuận tăng 29%. * **FPT:** Doanh thu 6 tháng tăng 21,4%, LNTT tăng 19,8%, lãi ròng tăng 22,3%; LNTT quý 2 tăng 20,1%, lãi ròng tăng 24%. * **TCBS:** LNTT quý 2 tăng 39% so với quý 1 và 192% so với cùng kỳ. * **PGD:** Doanh thu quý 2 tăng 9%, LNTT tăng 94%. * **VTO:** LNTT quý 2 tăng 291% do giá vốn giảm mạnh. * **DRC:** LNTT quý 2 tăng 55%, lũy kế 6 tháng tăng 69%. * **Kafiex:** LNTT quý 2 tăng 118%. * **Bảo Minh Securities:** LNTT quý 2 giảm 80%. * **VOS:** LNTT quý 2 tăng hơn 5.200% do thanh lý tài sản. * **DDV:** LNTT quý 2 tăng 4.826%. * **VRG:** LNTT quý 2 tăng 1.138%. * **HBC:** LNTT quý 2 đạt 727 tỷ đồng (lỗ cùng kỳ) do thanh lý tài sản.  Nhiều doanh nghiệp ghi nhận tăng trưởng lợi nhuận mạnh, một số nhờ vào hoạt động thanh lý tài sản. "
2024-01-18,"Kết quả kinh doanh ngày 18/1: SSI, VIX cùng loạt CTCK, bất động sản, phân bón, thép ... báo lãi tăng trưởng mạnh, một ngân hàng bất ngờ lỗ","Ngày 18/1, nhiều doanh nghiệp công bố báo cáo tài chính quý IV/2023:  * **Tăng trưởng mạnh:** TCBS (LNTT tăng 176%), KBSV (lãi thay vì lỗ cùng kỳ), VIX (lãi thay vì lỗ cùng kỳ), NDN (lãi thay vì lỗ cùng kỳ), DDV (LNTT tăng gần 8 lần), NTC (LNTT tăng 31%), LHG (LNTT tăng 104%), DHA (LNTT tăng 53%), NTP (LNTT tăng 240%), DVP (LNTT tăng nhẹ), VFG (LNTT tăng 31%), PDN (LNTT tăng 26%).  * **Giảm lợi nhuận/lỗ:** PGB (lỗ 4 tỷ đồng - lần đầu lỗ quý), L14 (LNTT giảm 70%), CSM (LNTT giảm 29%), BOT (tiếp tục lỗ), HND (lỗ do chi phí sửa chữa), TMG (LNTT giảm 94%).  Nhiều công ty chứng khoán và doanh nghiệp bất động sản, phân bón, thép có kết quả kinh doanh tích cực.  PGBank bất ngờ báo lỗ quý IV/2023.  Một số doanh nghiệp có mức tăng trưởng lợi nhuận rất cao, một phần do thanh lý tài sản.   "
2024-03-12,SSI Research dự báo BMP có thể vào VNDiamond thay thế MWG,"SSI Research dự báo rổ chỉ số VNDiamond sẽ loại bỏ MWG và bổ sung BMP trong đợt cơ cấu quý I/2024 do MWG không đáp ứng yêu cầu P/E.  Việc thay đổi này sẽ ảnh hưởng đến 3 ETF sử dụng VNDiamond làm chỉ số tham chiếu (VFMVN DIAMOND, MAFM VNDIAMOND, BVFVN DIAMOND), đặc biệt là quỹ VFMVN Diamond sẽ bán ra cổ phiếu MWG và mua vào cổ phiếu BMP.  Các cổ phiếu VRE, HDB, REE, ACB, GMD, PNJ trong VNDiamond cũng được dự báo sẽ hưởng lợi từ sự thay đổi này.  BMP đã tăng hơn 8% kể từ đầu năm 2024. "
2024-03-06,"Tăng trưởng lợi nhuận dự báo bước vào pha phục hồi, Giám đốc Phân tích SSI tiết lộ nhóm cổ phiếu yêu thích trong năm 2024","Bà Phạm Huyền Trang (Giám đốc Phân tích cổ phiếu SSI Research) cho rằng thị trường chứng khoán hồi phục nhờ niềm tin nhà đầu tư được củng cố bởi các chính sách hỗ trợ của Chính phủ (hạ lãi suất 4 lần) và sự phục hồi tăng trưởng lợi nhuận doanh nghiệp từ quý 3/2023.  Tuy nhiên, bà cho rằng còn quá sớm để khẳng định sự phục hồi kinh tế.  SSI dự báo tăng trưởng lợi nhuận năm 2024 khoảng 15-16%, phân hóa giữa các ngành.  Các ngành có triển vọng tốt là VLXD (thép), bán lẻ, một số ngành xuất khẩu và chứng khoán. Ngành bất động sản và ngân hàng sẽ khó có mức tăng trưởng lợi nhuận khả quan trong năm 2024. Bà Trang ưa thích ngành thép (dài hạn tích cực) và tiêu dùng (dân số vàng).  Áp lực margin hiện chưa cao và vẫn còn nguồn tiền chờ đầu tư vào thị trường.  Nhà đầu tư cần thời gian quan sát hiệu quả các chính sách hỗ trợ. "
2024-09-10,SSI Research: Chứng khoán Việt Nam sẽ khởi sắc hơn trong nửa cuối của tháng 9,"SSI Research dự báo thị trường chứng khoán Việt Nam sẽ khởi sắc hơn trong nửa cuối tháng 9.  Thị trường đã phục hồi mạnh sau đợt bán tháo đầu tháng 8, nhờ thông điệp của FED về khả năng cắt giảm lãi suất và các yếu tố nội tại tích cực:  phục hồi kinh tế, tăng trưởng lợi nhuận doanh nghiệp, giảm rủi ro tỷ giá.  Tháng 9 thường ít biến động, trừ các năm ảnh hưởng bởi tỷ giá.  P/E Forward của VN-Index hấp dẫn so với các thị trường khác trong khu vực.  SSI dự báo tăng trưởng lợi nhuận nửa cuối năm 2024 sẽ đạt 21,7%, cao hơn nửa đầu năm (6,2%).  Dòng tiền trong nước kỳ vọng sẽ tăng khi NHNN nới lỏng chính sách.  SSI khuyến nghị đầu tư cân bằng vào các nhóm ngành: tiêu dùng, xuất khẩu, ngân hàng, xây dựng/VLXD. "
2024-01-21,"Dư nợ cho vay tại các công ty chứng khoán lên cao nhất 7 quý, bất ngờ cái tên dẫn đầu không phải SSI, VNDirect, Mirae Asset hay VPS","Dư nợ cho vay tại các công ty chứng khoán đạt mức cao nhất trong 7 quý cuối năm 2023 (khoảng 180.000 tỷ đồng, margin khoảng 172.000 tỷ đồng), tăng mạnh so với quý 3.  TCBS bất ngờ dẫn đầu về dư nợ cho vay, vượt SSI, VNDirect và Mirae Asset.  MBS, Vietcap, VPBankS cũng tăng mạnh.  Mirae Asset và VNDirect giảm nhẹ.  Việc tăng dư nợ cho vay được thúc đẩy bởi giảm lãi suất, triển vọng chứng khoán Việt Nam tích cực (kinh tế ổn định, lợi nhuận doanh nghiệp phục hồi, nâng hạng) và xu hướng nhà đầu tư cá nhân sử dụng đòn bẩy mạnh mẽ.  Dragon Capital đánh giá cổ phiếu là kênh đầu tư hấp dẫn nhất năm 2024 so với các kênh khác (bất động sản). "
2024-08-16,"SSI Research: Lợi nhuận của các doanh nghiệp trên sàn quý 2/2024 tiệm cận mức đỉnh năm 2022, ngành bán lẻ tăng hơn 400%, tiết lộ 'ông lớn' khiến ngành BĐS đi lùi","SSI Research báo cáo lợi nhuận sau thuế của 1111 doanh nghiệp niêm yết quý II/2024 tăng 19,2% so với cùng kỳ và 7,5% so với quý trước, gần bằng đỉnh quý I/2022.  Ngành bán lẻ tăng trưởng mạnh nhất (+400%), tiếp theo là tài nguyên (+314%).  Ngân hàng (+20,1%) và công nghệ thông tin (+26,6%) duy trì tăng trưởng ổn định.  Bất động sản (-17,1%) và điện, nước, xăng dầu giảm lợi nhuận.  Lợi nhuận ngân hàng tăng nhờ tăng trưởng tín dụng, NIM, phí dịch vụ và thu hồi nợ xấu, nhưng tỷ lệ nợ xấu và chi phí tín dụng cao hơn dự kiến.  Doanh thu nhóm phi tài chính vượt đỉnh, lợi nhuận lõi tăng mạnh, trừ bất động sản.  Lỗ của Vingroup (mảng xe điện) khiến lợi nhuận ngành bất động sản giảm.  SSI dự báo lợi nhuận nửa cuối năm 2024 sẽ tăng 22,3% so với cùng kỳ.  "
2024-10-06,"""Người cũ"" của SSI, VinaCapital trở thành Chủ tịch một CTCK, vừa thâu tóm hơn 60% công ty","Bà Nguyễn Thị Hương Giang, cựu giám đốc khối cổ phiếu niêm yết VinaCapital và cựu giám đốc khối tư vấn doanh nghiệp SSI, đã trở thành Chủ tịch HĐQT của Saigonbank Berjaya (SBBS) và hiện sở hữu hơn 60% cổ phần công ty sau khi mua 4 triệu cổ phiếu và nhận 5 triệu cổ phiếu phát hành thêm.  SBBS đã lãi sau thuế hơn 3 tỷ đồng trong 6 tháng đầu năm 2024, giảm lỗ lũy kế. "
2024-05-28,"Doanh nghiệp ô tô lớn nhất trên sàn dự chi 6.700 tỷ để chia cổ tức tỷ lệ 50%, giá trị công ty vọt lên 60.000 tỷ đồng vượt Vietjet, VIB, SSI…","VEAM dự kiến chia cổ tức 50% (6.690 tỷ đồng) cho cổ đông năm 2023, tuy chưa được Bộ Công Thương chấp thuận.  Kế hoạch kinh doanh năm 2024 của công ty mẹ dự báo doanh thu và lợi nhuận giảm so với năm 2023 do khó khăn kinh tế, công nợ khó đòi và khó khăn trong tiêu thụ hàng tồn kho.  Lợi nhuận VEAM chủ yếu đến từ cổ phần tại các liên doanh ô tô lớn.  Giá cổ phiếu VEA tăng mạnh gần đây, đưa vốn hóa thị trường lên gần 60.000 tỷ đồng, vượt Vietjet, VIB và SSI.  "
2024-02-20,Chứng khoán SSI bổ nhiệm Phó tổng giám đốc,"Công ty Chứng khoán SSI bổ nhiệm ông Nguyễn Đức Thông làm Phó Tổng Giám đốc từ ngày 1/3/2024. Ông Thông tốt nghiệp Đại học Cambridge, có kinh nghiệm làm việc tại Goldman Sachs và Morgan Stanley.  Tại SSI từ năm 2019, ông đóng góp vào phát triển sản phẩm chứng quyền có bảo đảm và hiện đang là Giám đốc Khối kiêm Trợ lý Chủ tịch HĐQT. "
2024-03-19,"Chứng khoán SSI đặt mục tiêu lợi nhuận 2024 cao kỷ lục, tiếp tục phát hành thêm cổ phiếu","SSI đặt mục tiêu doanh thu hợp nhất năm 2024 là 8.112 tỷ đồng và lợi nhuận trước thuế hợp nhất là 3.398 tỷ đồng (+19% so với năm 2023), mức cao nhất trong lịch sử công ty.  SSI sẽ trình ĐHĐCĐ thường niên (25/4/2024) kế hoạch này, kế hoạch phát hành ESOP 2024, chào bán cổ phiếu (tiếp tục kế hoạch năm 2023), và bầu thành viên HĐQT.  Năm 2023, SSI đạt doanh thu 7.158 tỷ đồng (+13%), lợi nhuận trước thuế 2.849 tỷ đồng (+35%), và tăng vốn điều lệ lên gần 19.645 tỷ đồng.  Giá cổ phiếu SSI chốt phiên 19/3 là 36.150 đồng/cp. "
2024-08-27,Con trai Chủ tịch Nguyễn Duy Hưng bán ra toàn bộ 47 triệu cổ phiếu SSI,"Ông Nguyễn Duy Linh (con trai Chủ tịch SSI Nguyễn Duy Hưng) đã bán toàn bộ 47,1 triệu cổ phiếu SSI (3,11% vốn) từ 19-23/8/2024.  Trong cùng thời gian, Công ty TNHH Đầu tư NDH (thuộc sở hữu của ông Nguyễn Duy Hưng) đã mua 32 triệu cổ phiếu SSI, nâng sở hữu lên 8,35%.  Quý II/2024, SSI đạt doanh thu 2.307 tỷ đồng (+37%) và lợi nhuận sau thuế 848,5 tỷ đồng (+51%). Dư nợ cho vay margin đạt 19.600 tỷ đồng (+16% so với quý trước). Tổng tài sản đạt 71.108 tỷ đồng.   "
2024-08-20,Đến lượt chủ tịch chứng khoán SSI Nguyễn Duy Hưng bị kẻ gian mạo danh,"Chủ tịch HĐQT của SSI, ông Nguyễn Duy Hưng, đang bị mạo danh trên Zalo và Telegram.  Các đối tượng sử dụng AI để tạo hình ảnh và video giả mạo ông Hưng để tư vấn đầu tư và lừa đảo.  SSI khẳng định chỉ có một tài khoản Facebook chính thức (có tích xanh) của ông Hưng và không sử dụng các nền tảng khác để tư vấn đầu tư.  Đây là một thủ đoạn lừa đảo tinh vi sử dụng công nghệ AI, cũng đã xảy ra với nhiều công ty khác như MBS, VNDIRECT và các tập đoàn lớn như Hòa Phát và Vingroup.   "
2024-10-19,"Cập nhật số liệu CTCK ngày 19/10: SSI, VPBankS, HSC cùng loạt tên tuổi lớn tấp nập công bố lợi nhuận quý 3 trong ngày cuối tuần","Tính đến ngày 19/10/2024, 69 công ty chứng khoán đã công bố báo cáo tài chính quý III/2024.  Kết quả nổi bật:  * **SSI:** Doanh thu 1.975 tỷ đồng (+5%), LNTT 937 tỷ đồng (+11%), lũy kế 9 tháng đạt 80% kế hoạch doanh thu và 88% kế hoạch LNTT. * **HSC:** LNTT quý 3 đạt 275 tỷ đồng, lũy kế 9 tháng đạt 1.011 tỷ đồng (+64%), hoàn thành 70% kế hoạch năm. * **VPBankS:** LNTT quý 3 tăng 13% so với cùng kỳ, lũy kế 9 tháng đạt 830 tỷ đồng. * **SHS:** Doanh thu giảm mạnh 81%, LNTT giảm 70% so với cùng kỳ, nhưng lũy kế 9 tháng vẫn tăng gấp đôi.  Nhiều công ty chứng khoán lớn công bố kết quả kinh doanh quý III trong ngày 19/10.   "
2024-08-14,SSI Research: Bách Hóa Xanh khó tăng doanh thu lên cao hơn mức 2 tỷ đồng/cửa hàng/tháng nhưng có thể lãi hàng trăm tỷ trong năm 2024 và 2025,"SSI Research dự báo Bách Hóa Xanh khó vượt doanh thu 2 tỷ đồng/cửa hàng/tháng nhưng có thể lãi 228 tỷ đồng năm 2024 và 668 tỷ đồng năm 2025 (so với lỗ 1.200 tỷ năm 2023).  Doanh thu quý II/2024 đạt hơn 10.200 tỷ đồng (+41%), đạt 2 tỷ đồng/cửa hàng/tháng nhờ cơ cấu sản phẩm tốt hơn.  MWG dự kiến mở rộng mạng lưới Bách Hóa Xanh để tăng trưởng dài hạn, vượt số lượng cửa hàng điện máy trong trung hạn.  Thế Giới Di Động và Điện Máy Xanh đạt doanh thu 22.800 tỷ đồng quý II (+6%), nhờ thời tiết nóng và EURO 2024. Biên LNTT phục hồi nhờ giảm tồn kho và tối ưu chi phí, cũng như Apple hạn chế bán hàng trên livestream.  SSI Research dự báo doanh thu 2 chuỗi này năm 2024-2025 lần lượt là 89.000 tỷ và 96.000 tỷ đồng.  Chuỗi An Khang dự kiến tiếp tục lỗ (339 tỷ và 243 tỷ đồng năm 2024-2025) do đó MWG đang đóng cửa nhiều nhà thuốc.   "
2024-07-24,"Giám đốc Chiến lược SSI gọi tên nhóm cổ phiếu tăng trưởng tốt, dự kiến ""hút tiền"" cuối năm","Tọa đàm ""Thị trường chứng khoán Việt Nam: Động lực mới, cơ hội mới"" có sự tham gia của ông Bùi Hoàng Hải (Phó Chủ tịch UBCKNN) và bà Lê Thị Lệ Hằng (Giám đốc Chiến lược Chứng khoán SSI).  Ông Hải nhấn mạnh sự phát triển vượt bậc của thị trường chứng khoán Việt Nam (gần 70% GDP, thanh khoản cao) nhưng cũng chỉ ra thách thức trong việc đạt được các mục tiêu tham vọng trong chiến lược phát triển đến năm 2030.  Bà Hằng cho rằng Việt Nam có tiềm năng tăng trưởng lớn nhờ dân số trẻ và GDP cao nhưng cần cải thiện quy định để thu hút nhà đầu tư nước ngoài. Bà cho rằng các ngành có triển vọng tốt là công nghệ (nhờ dịch chuyển chuỗi cung ứng và quan hệ với Mỹ), tiêu dùng nội địa (dân số trẻ) và đầu tư công (cơ sở hạ tầng).   "
2024-01-18,"Cập nhật số liệu CTCK ngày 18/1: Xuất hiện hai công ty chứng khoán báo lợi nhuận quý 4 tăng 1.100%, SSI lãi hơn 2.800 tỷ trong năm 2023","Ngày 18/1, nhiều công ty chứng khoán công bố báo cáo tài chính quý IV/2023:  * **SSI:** Doanh thu quý IV tăng 48%, LNTT tăng 151%; cả năm 2023, doanh thu tăng 12%, LNTT tăng 35%, đạt 2.848 tỷ đồng. * **KIS:** LNTT quý IV tăng 1.078%. * **VDSC:** LNTT quý IV tăng 1.130%, cả năm lãi 409 tỷ đồng (lỗ cùng kỳ). * **TCBS:** LNTT quý IV tăng 176%, cả năm vượt 51% kế hoạch. * **KBSV:** Lãi quý IV (lỗ cùng kỳ). * **TCI:** Lãi quý IV (lỗ cùng kỳ). * **EVS:** LNTT quý IV giảm 95%, cả năm giảm 50%. * **JSI:** LNTT quý IV tăng gần 10 lần. * **Kafi:** LNTT quý IV tăng gần 9 lần, cả năm tăng 540%. * **LPBank Securities:** LNTT quý IV giảm 91%. * **Stanley Brothers:** Lỗ quý IV (lãi cùng kỳ), lỗ cả năm lớn nhất ngành.  Nhiều công ty chứng khoán có lợi nhuận tăng trưởng mạnh, trong khi một số khác giảm lợi nhuận hoặc lỗ.  SSI đạt lợi nhuận trước thuế hơn 2.800 tỷ đồng trong năm 2023. KIS và VDSC có mức tăng trưởng lợi nhuận vượt trội (trên 1.000%). "
2024-11-10,SSI Research điểm tên 3 nhóm cổ phiếu có thể hưởng lợi từ chính sách thương mại mới của Mỹ,"SSI Research nhận định thị trường chứng khoán Việt Nam giảm 1,8% trong tháng 10 do rủi ro địa chính trị, tỷ giá và kết quả kinh doanh quý III không đột biến.  Tháng 11 có thể tiếp tục biến động do bầu cử Mỹ và các chính sách trong nước.  Tuy nhiên, các yếu tố tích cực bao gồm: định giá VN-Index hấp dẫn, tăng trưởng lợi nhuận quý III tốt và kỳ vọng Thông tư 68 và sửa đổi Luật chứng khoán sẽ thu hút đầu tư nước ngoài.  SSI khuyến nghị đầu tư dài hạn vào các doanh nghiệp có lợi nhuận tăng trưởng mạnh và bền vững, đặc biệt là các công ty trong ngành dệt may, thủy sản (cá tra) và cảng/vận tải biển (có thể hưởng lợi từ chính sách thương mại mới của Mỹ).  Nhà đầu tư cần theo dõi chặt chẽ lãi suất và tỷ giá. "
