publish_date,title,summary
2024-05-08,VIB đồng hành cùng sự kiện Chuyển đổi số ngành ngân hàng năm 2024,"VIB tham gia sự kiện Chuyển đổi số ngành Ngân hàng năm 2024, giới thiệu các giải pháp công nghệ số như ngân hàng số MyVIB (giao dịch giọng nói, AR), VIB Checkout (thanh toán di động), VIB Verse (trải nghiệm thực tế ảo), và chuyên gia tài chính ảo Vie.  VIB cũng được khen thưởng vì thành tích xuất sắc trong chuyển đổi số.  Ngân hàng tập trung vào việc số hóa các dịch vụ cho khách hàng doanh nghiệp vừa và nhỏ (SME) với các gói tài khoản iBusiness và sBusiness, đặc biệt là VIB Checkout, cho phép thanh toán bằng điện thoại thông minh. VIB đã có tốc độ tăng trưởng giao dịch số ấn tượng, với 96% giao dịch ngân hàng bán lẻ được thực hiện trên kênh số trong quý 1/2024.  VIB khẳng định vị thế tiên phong trong chuyển đổi số ngành ngân hàng. "
2024-01-02,"Cảm ơn 5 năm đồng hành, VIB tặng hàng nghìn ưu đãi cho khách hàng","VIB tặng hàng nghìn ưu đãi cho khách hàng thân thiết kỷ niệm 5 năm đồng hành.  Khách hàng có lịch sử sử dụng thẻ tốt, chi tiêu cao, và đóng góp tích cực sẽ nhận được voucher ăn uống, hỗ trợ sân bay, và tiền mặt.  Top 100 khách hàng có lịch sử sử dụng tốt nhất nhận voucher ăn uống trị giá 3 triệu đồng; Top 80 tiếp theo nhận voucher hỗ trợ tại sân bay; và 1.000 khách hàng khác nhận voucher 200.000 đồng.  Thêm vào đó, tất cả chủ thẻ đều được tích lũy 5.000 điểm thưởng (hoặc tương đương) mỗi năm và 25 dặm thưởng cho các thẻ du lịch.  Top 20 khách hàng chi tiêu cao nhất sẽ nhận vé xem The Masked Singer Vietnam, còn 200 khách hàng tiếp theo nhận ly mascot phiên bản giới hạn.  Chương trình diễn ra từ bây giờ đến 30/11/2023.   "
2024-06-15,VIB tung loạt ưu đãi thẻ hấp dẫn hưởng ứng 'Cashless Day 2024',"VIB tung ra nhiều ưu đãi thẻ tín dụng hấp dẫn trong ""Cashless Day 2024"", bao gồm giảm giá lên đến 65% tại hàng trăm thương hiệu,  khuyến mãi trên 4 danh mục: VIB Shop (mua sắm), VIB Travel (du lịch), VIB Dine (ăn uống) và VIB Move (di chuyển).  Khách hàng mới mở thẻ có thể được miễn phí thường niên và hoàn tiền.  Ưu đãi được áp dụng cho cả giao dịch trực tuyến và ngoại tuyến, và liên kết với nhiều sàn thương mại điện tử và nhà hàng. Chương trình kéo dài suốt tháng 6. "
2024-01-05,"VIB đồng hành Giải thưởng Sách Quốc Gia, đóng góp tích cực vào các hoạt động tôn vinh tri thức và văn hóa Việt Nam","VIB đã đồng hành cùng Giải thưởng Sách Quốc Gia năm 2023, thể hiện cam kết của ngân hàng trong việc tôn vinh tri thức và văn hóa Việt Nam.  VIB cũng tham gia nhiều hoạt động khác như tài trợ cho Vietnam Young Lions (cuộc thi sáng tạo) và Let's Feast Vietnam (chương trình truyền hình trên Netflix), nhằm thúc đẩy sáng tạo và quảng bá văn hóa Việt Nam ra quốc tế.  Các hoạt động này góp phần xây dựng một xã hội văn minh, giàu mạnh.   "
2024-02-16,VIB lì xì tiền mặt cho khách hàng giao dịch đầu Xuân,"VIB đang tung ra nhiều chương trình ""lì xì"" cho khách hàng trong dịp đầu xuân 2024.  Khách hàng nhận tiền kiều hối sẽ được hoàn 100.000 đồng.  Khách hàng doanh nghiệp siêu nhỏ mở tài khoản gửi tiền trực tuyến với 1 tỷ đồng trở lên, kỳ hạn tối thiểu 1 tháng, sẽ được lì xì 5 triệu đồng. Khách hàng cá nhân mở mới tài khoản gửi tiết kiệm trực tuyến hoặc chuyển khoản với số tiền từ 50 triệu đồng (trực tuyến) hoặc 300 triệu đồng (tại quầy) sẽ được lì xì 500.000 đồng.  Ngoài ra, VIB tăng lãi suất tiền gửi ngoại tệ lên 2%/năm cho khách hàng doanh nghiệp siêu nhỏ gửi tiền bằng EUR/AUD.  Tất cả các ưu đãi này có hiệu lực đến hết ngày 29/02/2024 hoặc 31/03/2024, tùy chương trình. "
2024-04-02,"Những con số ấn tượng về thẻ tín dụng, banca và ngân hàng số của VIB năm 2023","VIB đạt nhiều thành tích ấn tượng trong năm 2023, dẫn đầu xu hướng thẻ tín dụng với tăng trưởng 61%/năm trong 5 năm qua, đạt gần 3 triệu thẻ phát hành và 700.000 thẻ tín dụng đang lưu hành, và chi tiêu qua thẻ tăng hơn 10 lần.  Ngân hàng cũng tiên phong trong việc số hoá toàn bộ quy trình phát hành thẻ tín dụng và dẫn đầu trong việc tích hợp công nghệ Cloud-native và AR trên ứng dụng ngân hàng số MyVIB,  đạt nhiều kỷ lục về ngân hàng số.  VIB cũng củng cố vị thế trong mảng bancassurance với hợp tác chiến lược Prudential và việc thiết lập ủy ban quản lý chuẩn mực ứng xử khách hàng.  Ngân hàng mở rộng mạng lưới chi nhánh và nâng cấp dịch vụ khách hàng trên cả kênh trực tuyến và truyền thống.  Nhìn chung, VIB đã có năm 2023 thành công với tăng trưởng mạnh mẽ trên các mảng thẻ tín dụng, ngân hàng số, và bancassurance. "
2024-11-06,"'Cá mập' ngoại CBA thoái bớt vốn, Unicap biến động sở hữu cổ phiếu VIB","Cổ đông lớn VIB,  Commonwealth Bank of Australia (CBA), đã thoái vốn 10%  vào ngày 29/10/2024,  giảm tỷ lệ sở hữu từ 14,77% xuống còn 4,7%.  Đồng thời, Unicap, một công ty mới thành lập,  có những biến động trong tỷ lệ sở hữu cổ phiếu VIB, mua vào và sau đó lại giảm sở hữu.  Tổng quan, lợi nhuận của VIB trong quý III năm 2024 giảm 13% so với cùng kỳ năm ngoái.  Tuy nhiên, tổng tài sản của VIB trong 9 tháng đầu năm 2024 tăng 9% lên gần 445.378 tỷ đồng.  Chất lượng nợ vay của VIB  trong quý III  được cho là yếu đi do tỷ lệ nợ xấu tăng lên 3,85%.   "
2024-10-04,Hiện tượng chibi “lên ngôi” tại đêm nhạc Anh Trai Say Hi – Hứa hẹn bùng nổ cá tính với VIB,"Tại đêm nhạc ""Anh Trai Say Hi"", VIB giới thiệu tính năng cá nhân hóa hình ảnh thẻ tín dụng sử dụng công nghệ AI, tạo ra hình ảnh chibi.  Khách hàng có thể tùy chỉnh hình ảnh của mình thành các phong cách nghệ thuật khác nhau.  Đây là một phiên bản thử nghiệm, tính năng này sẽ chính thức được ra mắt vào 20/10, cho phép khách hàng tùy chỉnh cả diện mạo thẻ tín dụng của mình, không chỉ các tính năng.  VIB đang không ngừng đổi mới và áp dụng công nghệ AI để đáp ứng nhu cầu cá nhân hóa của khách hàng.   "
2024-01-23,"15 ngân hàng đã công bố KQKD đến sáng 23/1: Cập nhật Techcombank, VIB,...","VIB và Techcombank công bố kết quả kinh doanh năm 2023 khả quan.  VIB đạt doanh thu 22.000 tỷ đồng, tăng 23%, lợi nhuận trước thuế hơn 10.700 tỷ đồng (tăng 31% so với 2022), và tổng tài sản gần 410.000 tỷ đồng (tăng 20%).  Techcombank cũng vượt mục tiêu lợi nhuận, đạt hơn 22.900 tỷ đồng trước thuế, với tỷ lệ CASA (tiền gửi không kỳ hạn) đứng đầu ngành (39,9%).  Cả hai ngân hàng đều cho thấy tăng trưởng mạnh mẽ trong năm 2023,  dù VIB có giảm lợi nhuận so với kế hoạch ban đầu. "
2024-09-30,VIB ghi đậm dấu ấn dẫn đầu xu thế thẻ qua Anh Trai “Say Hi”,"VIB được ca ngợi là một trong những ngân hàng tiên phong trong việc tài trợ cho chương trình âm nhạc ""Anh Trai 'Say Hi'"".  Sự kiện này đạt kỷ lục về lượt xem trên toàn cầu, tạo nên hiệu ứng mạnh mẽ trên mạng xã hội, góp phần tăng cường nhận diện thương hiệu và tiếp cận nhóm khách hàng trẻ, Gen Z, của VIB.  VIB kết hợp thành công việc tài trợ này với việc quảng bá các sản phẩm thẻ tín dụng của mình, đặc biệt là tính năng cá nhân hóa thiết kế thẻ mới.  Sự hợp tác giữa VIB và nhà sản xuất Vie Channel được đánh giá là thành công, giúp VIB khẳng định vị thế dẫn đầu xu hướng thẻ và nâng cao trải nghiệm khách hàng.   "
2024-03-06,"VIB triển khai phương thức thanh toán qua Apple Pay đơn giản, an toàn và bảo mật","VIB đã tích hợp Apple Pay vào các thẻ VIB Mastercard, cho phép thanh toán nhanh chóng, an toàn và bảo mật.  Khách hàng có thể thêm thẻ VIB Mastercard vào ví điện tử Apple Wallet trên các thiết bị Apple.  Giao dịch qua Apple Pay được mã hóa, bảo vệ thông tin thẻ, và chỉ cần vài bước đơn giản.  Một ưu đãi hoàn 50.000 VND cho giao dịch Apple Pay đầu tiên trị giá trên 100.000 VND được áp dụng đến ngày 05/05/2024.   "
2024-07-16,VIB khiến fan Anh Trai “Say Hi” nức lòng với bộ quà tặng phiên bản giới hạn,"VIB đang tung ra các quà tặng có liên quan đến chương trình ""Anh Trai Say Hi"", bao gồm áo khoác phiên bản giới hạn cho khách hàng mới mở thẻ tín dụng VIB. Khách hàng mới cũng được miễn phí thường niên năm đầu tiên khi chi tiêu từ 1 triệu đồng trong vòng 30 ngày.  Ngoài ra, người dùng mới đăng ký MyVIB có thể nhận mũ, và nhiều ưu đãi khác cho giao dịch trên ứng dụng này.  Chương trình kéo dài đến hết tháng 9/2024 và tháng 10/2024, tùy quà tặng.  VIB cũng quảng bá các dòng thẻ khác như Ivy Card, Super Card, và Travel Élite. "
2024-10-22,"VIB: Lợi nhuận 9 tháng đạt 6.600 tỷ đồng, tín dụng tăng 12%, vượt trội trung bình ngành","VIB đạt lợi nhuận 6.600 tỷ đồng trong 9 tháng đầu năm 2024, vượt trội so với mức trung bình ngành.  Tăng trưởng tín dụng đạt 12%, cao hơn nhiều so với mức trung bình.  Tổng tài sản tăng 9% lên hơn 445.000 tỷ đồng.  Tuy nhiên, lợi nhuận giảm nhẹ so với cùng kỳ năm ngoái do VIB giảm lãi suất để kích cầu và tăng chi phí dự phòng.  VIB duy trì chất lượng tài sản tốt, nợ xấu giảm, và giữ tỷ lệ nợ xấu ở mức thấp nhất ngành.  Ngân hàng cũng được công nhận là một trong những doanh nghiệp tư nhân nộp ngân sách lớn nhất Việt Nam năm 2023, đồng thời tiếp tục các hoạt động hỗ trợ cộng đồng.  VIB cũng được vinh danh với các giải thưởng về đổi mới công nghệ và doanh nghiệp xuất sắc. "
2024-07-16,Vụ kẻ lừa đảo giả danh nhân viên ngân hàng VIB để chiếm đoạt tiền trong thẻ tín dụng: Công an tìm bị hại trên toàn quốc,"Cảnh sát tỉnh Kiên Giang đang điều tra một vụ lừa đảo chiếm đoạt tài sản liên quan đến các nghi phạm giả danh nhân viên ngân hàng VIB.  Từ tháng 7/2023 đến tháng 2/2024, các nghi phạm gọi điện cho chủ thẻ tín dụng VIB, giả danh nhân viên ngân hàng, yêu cầu cung cấp thông tin thẻ để nâng hạng tín dụng hoặc hoàn phí. Sau khi lấy được thông tin thẻ, họ đặt hàng trực tuyến tại các cửa hàng như FPT Shop, Top Zone, dùng thông tin đó mua hàng có giá trị cao và bán lại để chiếm đoạt tiền.  Cảnh sát đang kêu gọi những người bị lừa đảo liên hệ với số điện thoại 02973 863513 hoặc 091.579.9191 trước ngày 15/8/2024 để được hỗ trợ.   "
2024-01-16,VIB dành nhiều ưu đãi cho sinh viên Đại học Quốc tế Hồng Bàng khi thanh toán học phí,"VIB hợp tác với Đại học Quốc tế Hồng Bàng để cung cấp dịch vụ thanh toán học phí không dùng tiền mặt, bao gồm tài khoản số đẹp, thiết bị SoftPOS, và nhiều ưu đãi cho sinh viên.  Sinh viên được tặng thẻ tín dụng FamilyLink miễn phí thường niên, 200.000 đồng khi mở tài khoản và thanh toán học phí lần đầu, và 100.000 đồng cho các lần thanh toán tiếp theo.  VIB cũng cung cấp các sản phẩm ngân hàng khác phù hợp với sinh viên, như tài khoản, tiết kiệm, và thẻ tín dụng.  VIB hướng tới chiếm lĩnh thị trường khách hàng trẻ (Gen Z và Millennials).   "
2024-11-15,"VIB đóng hơn 3.102 tỷ đồng tiền thuế năm 2023, hoàn tất nộp bổ sung 8,5 tỷ đồng cho năm 2022-2023","VIB đóng góp hơn 3.102 tỷ đồng tiền thuế trong năm 2023, cùng với việc hoàn tất nộp bổ sung 8,5 tỷ đồng cho các năm trước đó.  Đây là một trong những ngân hàng tư nhân đóng góp ngân sách lớn nhất Việt Nam.  Trong năm 2024, VIB đạt được thành tích này nhờ mô hình bán lẻ bền vững và hiệu quả cao. Trong 7 năm qua, tổng đóng góp vào ngân sách nhà nước đạt hơn 11.900 tỷ đồng, với tốc độ tăng trưởng trung bình gần 40%/năm.  Ngoài đóng góp tài chính, VIB cũng tích cực tham gia tài trợ các chương trình cộng đồng.  Báo cáo kinh doanh quý 3 cho thấy tăng trưởng tín dụng và huy động vốn vượt trội so với ngành. VIB cũng cải thiện chất lượng tài sản, giảm đáng kể nợ nhóm 2.  Ngân hàng đang kỳ vọng sẽ có kết quả kinh doanh tốt trong thời gian tới. "
2024-11-04,Phó Tổng giám đốc VIB đăng ký mua 3 triệu cổ phiếu,"Phó Tổng giám đốc kiêm Giám đốc Tài chính của VIB, ông Hồ Vân Long, đăng ký mua 3 triệu cổ phiếu VIB.  Giao dịch dự kiến từ 7/11 đến 6/12/2024, với giá trị ước tính gần 57 tỷ đồng.  Việc mua cổ phiếu này diễn ra trong bối cảnh VIB có kết quả kinh doanh quý 3 tốt, tăng trưởng tín dụng và huy động vốn vượt trội so với ngành, chất lượng tài sản cải thiện, và lợi nhuận 9 tháng đầu năm đạt hơn 6.600 tỷ đồng.  Ông Long cũng đang giữ vị trí cao trong ngân hàng và đã từng nhận được giải thưởng.   "
2024-11-20,"Kỷ niệm 6 năm đổi mới mảng thẻ, VIB dành tặng hàng trăm đặc quyền cho khách hàng","VIB kỷ niệm 6 năm dẫn đầu xu hướng thẻ tín dụng bằng việc triển khai chương trình ưu đãi lớn cho khách hàng.  Chương trình bao gồm cuộc thi ảnh/video về trải nghiệm thẻ, bình chọn thẻ yêu thích, và tặng e-voucher cho phòng chờ sân bay/dịch vụ đón/tiễn nhanh.  Khách hàng mới được hoàn phí thường niên năm đầu khi chi tiêu tối thiểu.  Các ưu đãi trả góp 0% lãi suất và giảm giá lên đến 40% tại các đối tác cũng được áp dụng.  VIB cũng nhấn mạnh sự sáng tạo, sử dụng công nghệ AI trong thiết kế thẻ cá nhân hoá, và tăng trưởng mạnh mẽ trong 6 năm qua về số lượng thẻ và chi tiêu qua thẻ.   "
2024-11-08,VIB “Say hi Hà Nội”: mang cơ hội giao lưu Anh trai cùng vé concert 3 miễn phí đến tận tay fan hâm mộ,"VIB đang tổ chức nhiều hoạt động để fan hâm mộ chương trình ""Anh Trai Say Hi"" có cơ hội nhận vé concert và vé bus miễn phí.  Các hoạt động bao gồm: chia sẻ hình ảnh trên Facebook với hashtag #VIBSayHiHaNoi, tham gia minigame trên Fanpage VIB, mở thẻ tín dụng VIB và chi tiêu đạt top đầu để nhận vé concert, tham gia các minigame khác trên MyVIB, và livestream với các nghệ sĩ để nhận quà tặng.  Các ưu đãi mở thẻ tín dụng và ưu đãi khác trên ứng dụng MyVIB cũng được đề cập.  Chương trình kéo dài từ ngày 10/11 đến hết ngày 28/11/2024.   "
2024-11-15,Nữ đại gia đứng sau doanh nghiệp 6 tháng tuổi vừa chi 300 tỷ nắm vốn VIB là ai?,"Công ty Quang Kim, một doanh nghiệp 6 tháng tuổi chuyên buôn bán thực phẩm, đã chi hơn 310 tỷ đồng để mua 17,2 triệu cổ phiếu VIB vào ngày 11/11/2024.  Người đại diện pháp luật của Quang Kim là bà Đỗ Xuân Hà, em ruột của ông Đỗ Xuân Hoàng, thành viên HĐQT của VIB.  Việc mua cổ phiếu này được thực hiện bởi một nhóm cổ đông có liên quan, bao gồm cả ông Hoàng và bố ông, ông Đỗ Xuân Thụ, cùng các thành viên khác trong gia đình.  Nhóm cổ đông này hiện đang nắm giữ gần 10% vốn điều lệ của VIB.     "
2024-09-21,Chủ tịch VIB Đặng Khắc Vỹ kiến nghị không nới lỏng các điều kiện cấp tín dụng để tăng trưởng tín dụng bằng mọi giá,"Chủ tịch VIB, ông Đặng Khắc Vỹ,  kiến nghị Chính phủ không nên nới lỏng các điều kiện cấp tín dụng để đạt tăng trưởng tín dụng nhanh chóng.  Ông Vỹ cho rằng, việc giảm lãi suất cho vay mạnh mẽ mà VIB thực hiện là nhằm hỗ trợ doanh nghiệp và người dân, và là bước tạo điều kiện phát triển bền vững.  Tuy nhiên, ông Vỹ nhấn mạnh việc cần duy trì các tiêu chuẩn cấp tín dụng chặt chẽ để tránh rủi ro nợ xấu trong tương lai, đồng thời đề xuất áp dụng các chuẩn mực quốc tế về quản trị rủi ro và báo cáo tài chính trong ngành ngân hàng.  Ông Vỹ cũng đề xuất Chính phủ nên có giải pháp hỗ trợ thị trường bất động sản phát triển lành mạnh và bền vững. "
2024-04-22,"VIB: Doanh thu tăng 8%, lợi nhuận quý 1 đạt hơn 2.500 tỷ đồng","VIB đạt doanh thu tăng 8% và lợi nhuận trước thuế hơn 2.500 tỷ đồng trong quý 1 năm 2024.  Thu nhập ngoài lãi đóng góp đáng kể.  Tín dụng tăng 1%, huy động vốn tăng trưởng tốt, và tỷ lệ nợ xấu ở mức 2,4%.  Ngân hàng tiếp tục giữ vị thế dẫn đầu về hiệu quả, được xếp hạng cao nhất ngành, và có kế hoạch chi trả cổ tức 29,5% trong năm.  VIB cũng đầu tư mạnh vào công nghệ, số hóa, và hiện đại hóa cơ sở hạ tầng, đặc biệt là việc triển khai core banking trên nền tảng đám mây AWS.   "
2024-11-01,HoSE loại bỏ giao dịch bán cổ phiếu VIB của chị dâu Chủ tịch HĐQT Đặng Khắc Vỹ,"HoSE đã loại bỏ giao dịch bán 2.610.349 cổ phiếu VIB của bà Lê Thị Huệ (chị dâu Chủ tịch VIB) do thiếu báo cáo trước khi giao dịch.  Đây là hành động do không tuân thủ quy định công bố thông tin của HoSE.  Sự kiện này diễn ra trong bối cảnh nhiều cổ đông lớn của VIB, bao gồm cả khối ngoại (CBA), đang thoái vốn do thay đổi chính sách tỷ lệ sở hữu nước ngoài của VIB.   "
2024-04-04,"Giá chung cư tăng, vay căn hộ tại VIB lãi suất từ 5,9%, miễn trả gốc đến 5 năm","VIB đang cung cấp các gói vay mua căn hộ chung cư với lãi suất hấp dẫn từ 5,9%/năm, miễn trả gốc trong 5 năm đầu.  Thời gian duyệt vay nhanh chóng (8 tiếng), định giá tài sản nhanh (1 giờ), và tỷ lệ cho vay lên tới 85%.  Các lựa chọn lãi suất cố định giúp khách hàng dễ dàng tính toán dòng tiền.  Khách hàng có thể trả nợ trước hạn lên đến 25 triệu đồng/tháng mà không mất phí.  Báo cáo thị trường cho thấy giá bất động sản chung cư tiếp tục tăng, nên vay mua nhà ngay có thể là lựa chọn tốt hơn chờ giá giảm.   "
2024-04-22,"Đã có 9 ngân hàng công bố KQKD quý 1/2024: Cập nhật Techcombank, MB, VIB, BaoVietBank,...","Kết quả kinh doanh quý 1/2024 của một số ngân hàng, bao gồm Techcombank, MB, LPBank, PGBank, Bac A Bank, BaoVietBank, và một số ngân hàng khác như SeABank và ACB, được công bố.  Techcombank có lợi nhuận trước thuế tăng mạnh (38,7%), với tỷ lệ CASA (tiền gửi không kỳ hạn) cao nhất hệ thống.  MB ghi nhận lợi nhuận trước thuế giảm 11%, nợ xấu tăng đáng kể.  LPBank tăng lợi nhuận trước thuế mạnh mẽ (84,36%).  Bac A Bank có tăng trưởng lợi nhuận nhẹ.  PGBank ghi nhận giảm lợi nhuận trước thuế (24%).  VIB có lợi nhuận trước thuế hơn 2.500 tỷ đồng, tăng trưởng tín dụng tốt.  SeABank tăng lợi nhuận trước thuế (41%).  ACB dự kiến lợi nhuận trước thuế đạt 4.900 tỷ đồng, giảm nhẹ so với cùng kỳ năm ngoái.  Một điểm chung là nhiều ngân hàng đều ghi nhận tăng trưởng tín dụng, tuy nhiên, nợ xấu cũng có sự gia tăng ở một số ngân hàng, và chi phí dự phòng rủi ro tăng ở nhiều ngân hàng.  Các ngân hàng đều có kế hoạch triển khai các chiến lược tài chính và kỹ thuật số nhằm phục vụ khách hàng và tăng trưởng kinh doanh.   "
2024-11-27,Bí quyết “săn sale” Black Friday cả khi lương chưa về với thẻ tín dụng VIB,"VIB đang tung ra nhiều ưu đãi hấp dẫn trong Black Friday, giúp khách hàng tiết kiệm từ 1,5 đến 5,5 triệu đồng khi mua điện thoại iPhone hoặc Samsung.  Khách hàng được hưởng ưu đãi trả góp 0% lãi suất lên đến 36 tháng và giảm giá lên đến 40% tại các đối tác của hệ sinh thái VIB Privileges.  Ngoài ra, còn có chương trình ""Quay là trúng"" với hàng trăm voucher mua sắm trị giá lên đến 500.000 đồng, cùng các giải thưởng khác.  Khách hàng mới mở thẻ VIB trong thời gian này được miễn phí thường niên và hoàn 10% chi tiêu trong 30 ngày đầu.  VIB khuyến khích khách hàng tận dụng các ưu đãi này để mua sắm và nâng cấp trải nghiệm trong mùa Black Friday. "
2024-02-12,Thẻ tín dụng VIB tăng cao về mức độ nhận diện và thu hút thương hiệu,"VIB's credit cards have seen a significant increase in brand awareness and search interest in 2023, according to Google search data.  VIB is the only bank to show positive growth across all key metrics (search, click, and click-per-search).  This success is attributed to a strategic marketing campaign that aligned with the popular television show ""The Masked Singer,"" leveraging AI-driven digital marketing tactics.  The campaign successfully increased brand recall, intent to apply for a VIB card, and generated significant search interest.  VIB's diverse suite of personalized credit cards, which offer high cashback and rewards, also contributed to its strong performance.  The bank emphasizes digital-first experiences, including online application processes and innovative features like virtual cards, virtual customer service, and AI-powered financial advisors, further enhancing customer experience and driving card usage. "
