publish_date,title,summary
2024-10-04,"Lộ diện một ""cá mập"" nội vừa tung 1.200 tỷ đồng ôm hàng chục triệu cổ phiếu VIB","Công ty Unicap đã mua gần 67 triệu cổ phiếu VIB với giá trị khoảng 1.200 tỷ đồng, nâng tỷ lệ sở hữu lên 2,241%.  Nhóm Unicap, bao gồm Chủ tịch và thành viên HĐQT của Unicap, hiện nắm giữ tổng cộng gần 222,6 triệu cổ phiếu VIB, chiếm 7,47% vốn.  Đáng chú ý là giao dịch này diễn ra sau khi cổ đông ngoại CBA đã bán đi 148 triệu cổ phiếu VIB, giảm tỷ lệ sở hữu xuống dưới 15%.  Có khả năng Unicap đã mua lại cổ phiếu này từ CBA.  CBA dự kiến sẽ tiếp tục bán bớt cổ phần để đạt tỷ lệ sở hữu theo quy định là 4,99%. "
2024-06-14,VIB đồng hành cùng show truyền hình mới Anh Trai ‘Say Hi’,"VIB tài trợ cho show truyền hình thực tế ""Anh Trai 'Say Hi'"" nhằm tiếp cận với khán giả trẻ và giới thiệu các sản phẩm thẻ tín dụng của mình.  Thông qua việc đồng hành với chương trình, VIB muốn thể hiện hình ảnh một ngân hàng hiện đại, sáng tạo, và chú trọng đến trải nghiệm khách hàng.  Các sản phẩm thẻ tín dụng như Super Card, Ivy Card và Travel Élite được giới thiệu, với những ưu điểm như tự thiết kế thẻ, hoàn tiền, và ưu đãi du lịch, nhằm thu hút nhóm khách hàng trẻ, sinh viên, và những người có nhu cầu du lịch.  Mục tiêu của VIB là tăng cường nhận diện thương hiệu, và kết nối với khách hàng mục tiêu thông qua chương trình giải trí hấp dẫn. "
2024-04-12,"VPBank, VIB, Eximbank, SHB… tăng lãi suất tiết kiệm: Lãi suất sắp đồng loạt tăng trở lại?","Một số ngân hàng, bao gồm VPBank, VIB, Eximbank, và SHB, đã tăng lãi suất tiết kiệm trong tháng 4 năm 2024.  Mức tăng dao động từ 0.1-0.3% và áp dụng cho một số kỳ hạn nhất định.  Tuy nhiên, vẫn còn nhiều ngân hàng khác giữ nguyên hoặc giảm lãi suất, dẫn đến mức lãi suất tiết kiệm chung vẫn ở mức thấp.  Các chuyên gia dự báo lãi suất tiết kiệm sẽ tiếp tục duy trì ổn định trong thời gian tới, và có thể tăng nhẹ nếu kinh tế hồi phục. "
2024-01-02,Xuất ngoại đầu năm mới với loạt ưu đãi đẳng cấp từ thẻ tín dụng VIB,"Thẻ tín dụng VIB hợp tác với MasterCard mang đến loạt ưu đãi hấp dẫn cho du khách xuất ngoại đầu năm 2024.  Chủ thẻ VIB được hoàn tiền lên đến 20% tại hơn 400 thương hiệu tại 25 quốc gia, bao gồm ưu đãi đặt phòng khách sạn (giảm 10% tại Mandarin Oriental, Prince Waikiki), ưu đãi ẩm thực (hoàn 20% tại Dominos, 10% tại Jumbo Seafood), và mua sắm miễn thuế (hoàn 20% tại King Power, Lotte Duty Free).  Ưu đãi áp dụng đến hết năm 2024, và tăng gấp đôi cho khách hàng mua sắm từ nay đến 31/01/2024.  Các dòng thẻ VIB như Travel Élite và Premier Boundless có thêm ưu đãi về phòng chờ sân bay và phí giao dịch ngoại tệ.  Khách hàng có thể tận hưởng các ưu đãi thông qua việc đăng ký tài khoản và sử dụng thẻ VIB MasterCard tại các đối tác tham gia chương trình. "
2024-01-26,VIB sBusiness - Gói tài khoản nhân 3 lợi ích tài chính cho hộ kinh doanh và doanh nghiệp siêu nhỏ,"Gói tài khoản sBusiness của VIB cung cấp ba lợi ích chính cho hộ kinh doanh và doanh nghiệp siêu nhỏ: miễn phí giao dịch, cộng thêm lãi suất tiền gửi và giảm lãi suất vay.  Khách hàng được miễn phí quản lý tài khoản trong 6 tháng đầu, phí rút, nộp, kiểm đếm tiền mặt, chuyển tiền nội địa và quốc tế.  Lãi suất tiền gửi có kỳ hạn cũng cao hơn so với khách hàng thông thường.  Ngoài ra, khách hàng được ưu đãi giảm lãi suất vay tới 0,5%/năm cho các khoản vay vốn lưu động.  Đây được xem là giải pháp tài chính toàn diện giúp doanh nghiệp tiết kiệm chi phí và tối ưu hóa lợi nhuận. "
2024-03-04,Bứt phá kinh doanh cùng ưu đãi tài chính vượt trội từ VIB,"VIB cung cấp các gói tài khoản iBusiness và sBusiness với nhiều ưu đãi cho doanh nghiệp siêu nhỏ, hộ kinh doanh và cá nhân kinh doanh.  Ưu đãi bao gồm miễn phí quản lý tài khoản trong 6 tháng, giảm phí giao dịch (chuyển khoản, rút tiền, v.v.), giảm lãi suất vay vốn lưu động lên đến 0,5%/năm, và hoàn tiền lên đến 8 triệu đồng cho cá nhân và 14 triệu đồng cho doanh nghiệp.  Khách hàng cũng được hưởng các ưu đãi khác như tặng quà, hỗ trợ SoftPOS, và ưu đãi mở tài khoản tiền gửi.  Chương trình kéo dài từ tháng 3 đến hết tháng 6 năm 2024. "
2024-05-08,"Loạt ngân hàng lớn tăng lãi suất tiết kiệm: ACB, Sacombank, Techcombank, VIB đều đã nhập cuộc","Một số ngân hàng lớn, bao gồm ACB, Sacombank, Techcombank, và VIB, đã tăng lãi suất tiết kiệm vào tháng 5 năm 2024.  Sự gia tăng này diễn ra trong bối cảnh tiền gửi của người dân và doanh nghiệp giảm, trong khi tăng trưởng tín dụng bắt đầu hồi phục.  Các chuyên gia dự đoán lãi suất tiết kiệm có thể tiếp tục tăng nhẹ trong nửa sau năm 2024 khi nền kinh tế ổn định hơn và cầu tín dụng tăng mạnh hơn.  Tuy nhiên,  tăng trưởng kinh tế vẫn cần thêm số liệu cụ thể để đảm bảo sự hồi phục bền vững. "
2024-03-28,"Vay căn hộ chung cư tại VIB: lãi suất từ 5,9%, miễn trả gốc 5 năm, 8h duyệt vay","VIB cung cấp giải pháp vay mua căn hộ chung cư với lãi suất từ 5,9%/năm, miễn trả gốc trong 5 năm đầu, và thời gian duyệt vay chỉ trong 8 tiếng.  Khách hàng có thể lựa chọn nhiều lựa chọn lãi suất cố định và linh hoạt trả gốc.  Hạn mức vay lên đến 85% giá trị căn hộ, tùy vào đánh giá tài sản.  VIB tự tin là một trong những ngân hàng hàng đầu về tín dụng bán lẻ, đặc biệt là mảng vay ô tô, với nhiều năm giữ vị trí dẫn đầu và  được Ngân hàng Nhà nước xếp hạng cao.  Giải pháp này nhắm vào nhu cầu mua nhà tăng cao trong bối cảnh thị trường bất động sản khởi sắc trở lại. "
2024-01-24,"Kết quả kinh doanh quý 4/2023 ngày 24/1: VIB, MSB, ... công bố, 1 doanh nghiệp bất động sản lãi gấp 233 lần cùng kỳ","Kết quả kinh doanh quý 4/2023 của một số doanh nghiệp được công bố, cho thấy sự chênh lệch đáng kể giữa các ngành.  VIB và MSB ghi nhận lợi nhuận trước thuế quý 4 giảm so với cùng kỳ năm trước, chủ yếu do chi phí dự phòng rủi ro tín dụng tăng cao.  Ngược lại, một doanh nghiệp bất động sản (NTL) có lợi nhuận sau thuế gấp 233 lần so với cùng kỳ năm trước.  Một số doanh nghiệp khác như GAB và VOC ghi nhận doanh thu giảm mạnh so với cùng kỳ.  PNJ có kết quả kinh doanh tốt nhất với doanh thu và lợi nhuận tăng trưởng. VHC có lợi nhuận quý 4 giảm mạnh.  TIP có lợi nhuận tăng trưởng mạnh. DHN và TBC cũng giảm doanh thu và lợi nhuận, nhưng vẫn vượt kế hoạch.  Tổng quan, kết quả kinh doanh quý 4/2023 đa dạng, phụ thuộc vào từng ngành và sự biến động của thị trường. "
2024-11-15,Một doanh nghiệp buôn thực phẩm vừa chi hàng trăm tỷ mua cổ phần ngân hàng VIB,"Công ty Cổ phần Đầu tư Phát triển Quang Kim, một doanh nghiệp buôn bán thực phẩm, đã mua 17,2 triệu cổ phiếu VIB với giá trị khoảng 313 tỷ đồng vào ngày 11/11/2024.  Đây là một giao dịch lớn, nâng tỷ lệ sở hữu của công ty này lên 0,577% tại VIB. Nhóm cổ đông liên quan với công ty Quang Kim hiện nắm giữ gần 10% vốn điều lệ của VIB.  Giao dịch này diễn ra sau khi một số cổ đông chiến lược khác, bao gồm CBA, đã bán cổ phiếu VIB.   "
2024-05-20,Thưởng thức ẩm thực 5 châu ngay tại Việt Nam với thẻ tín dụng VIB,"Chủ thẻ tín dụng VIB hạng Platinum trở lên có thể thưởng thức ẩm thực 5 châu ngay tại Việt Nam thông qua chương trình VIB Dine, hợp tác với 12 thương hiệu nhà hàng thuộc IN Dining.  Khách hàng được giảm 10% khi đặt bàn qua tổng đài, và có thêm ưu đãi giảm 10% trên hóa đơn khi là khách hàng Platinum.  Chương trình kéo dài đến hết năm 2024.  Ngoài ra, chủ thẻ VIB hạng Platinum còn được hưởng thêm một số ưu đãi khác như giảm 30% tại các nhà hàng cao cấp, trở thành hội viên Bông Sen Vàng hạng Bạch Kim, tỷ giá ngoại tệ thấp, quà sinh nhật, miễn phí quản lý tài khoản, và SMS banking.   "
2024-07-05,"SSI Research dự báo lợi nhuận của 11 nhà băng: VPBank có thể tăng trưởng đến 60%, OCB và VIB đi lùi","SSI Research dự báo lợi nhuận của 11 ngân hàng trong quý II/2024. VPBank được dự báo tăng trưởng mạnh nhất, khoảng 60%, lên 4.200 tỷ đồng. Techcombank dự kiến tăng trên 30%, đạt 7.000 tỷ đồng. HDBank dự kiến tăng 28-31% lên 3.500-3.600 tỷ đồng. Các ngân hàng nhà nước (Vietcombank, BIDV, VietinBank) được dự báo tăng trưởng lợi nhuận từ 8-15% so với cùng kỳ. Tuy nhiên, VIB và OCB dự kiến có mức tăng trưởng lợi nhuận kém hơn, giảm 25-28% và 5-14% so với cùng kỳ, xuống 2.100-2.200 tỷ đồng và 1.350-1.500 tỷ đồng.  Sự chênh lệch này chủ yếu do tác động của việc giảm lãi suất để kích cầu tín dụng, dẫn đến giảm NIM và tăng chi phí dự phòng rủi ro tín dụng. "
2024-11-14,Công an tìm người bị lừa chuyển tiền vào số tài khoản 9396187306 tại Vietcombank và 962617045 tại VIB,Cơ quan chức năng đang điều tra vụ lừa đảo chiếm đoạt tài sản liên quan đến đối tượng Bùi Mạnh Linh.  Đối tượng này được cho là đã lừa đảo người dân chuyển tiền vào các tài khoản 9396187306 tại Vietcombank và 962617045 tại VIB để mua sản phẩm gỗ.  Công an TP Rạch Giá đang kêu gọi những người bị lừa đảo liên hệ để được hỗ trợ.  Số điện thoại liên hệ là 0834344323. 
2024-07-29,"VIB: Lợi nhuận đạt 4.600 tỷ, tín dụng và huy động vốn tăng trưởng 5% trong 6 tháng đầu năm 2024","VIB đạt lợi nhuận 4.600 tỷ đồng trong 6 tháng đầu năm 2024, với mức tăng trưởng huy động vốn và tín dụng ở mức 5%, cao hơn mức trung bình của ngành.  Tuy nhiên, lợi nhuận này giảm so với cùng kỳ năm ngoái.  Ngân hàng tập trung vào các sản phẩm bán lẻ, bao gồm gói cho vay nhà phố và căn hộ với lãi suất cạnh tranh và thời gian phê duyệt nhanh chóng.  VIB duy trì chất lượng tài sản tốt với tỷ lệ nợ xấu ổn định và rủi ro tập trung thấp.  Ngân hàng cũng có kế hoạch chi trả cổ tức và cổ phiếu thưởng cho cổ đông, đồng thời duy trì chiến lược quản lý rủi ro thận trọng trong bối cảnh thị trường biến động. "
2024-01-27,"Hé lộ thù lao, lương thưởng năm 2023 của lãnh đạo LPBank, VIB, MSB, BVBank: Gấp bao nhiêu lần so với nhân viên thông thường?","Bài báo này so sánh thù lao và lương thưởng của lãnh đạo các ngân hàng (LPBank, VIB, MSB, BVBank) năm 2023 với nhân viên.  LPBank giảm thù lao cho HĐQT và Ban Tổng Giám đốc, nhưng tăng cho Ban Kiểm soát.  VIB tăng thù lao HĐQT và Ban Kiểm soát, giảm cho Ban Tổng Giám đốc và Kế toán trưởng. MSB cũng giảm thù lao lãnh đạo, và BVBank có mức thù lao ổn định.  Mức thù lao của các lãnh đạo thường cao hơn nhiều so với mức lương bình quân của nhân viên.  Techcombank không công bố thù lao lãnh đạo, nhưng vẫn giữ mức lương bình quân nhân viên cao nhất. "
2024-10-30,"Ngân hàng nước ngoài ""xả"" hơn 300 triệu cổ phiếu VIB, thu về 5.300 tỉ đồng","Ngân hàng nước ngoài Commonwealth Bank of Australia (CBA) đã bán khoảng 10% cổ phần của Ngân hàng TMCP Quốc tế Việt Nam (VIB), thu về hơn 5.300 tỷ đồng.  Giao dịch diễn ra ngày 29/10/2024.  Mặc dù lợi nhuận của VIB trong 9 tháng đầu năm 2024 giảm 21%, nhưng tăng trưởng tín dụng và huy động vốn vẫn tốt hơn mức trung bình ngành.  CBA lý giải việc thoái vốn dựa trên chiến lược tập trung vào thị trường Úc và New Zealand. "
2024-09-18,VIB - Hành trình 28 năm sáng tạo và hướng tới triệu khách hàng Việt,"VIB, trong hành trình 28 năm hoạt động, đã phát triển thành một hệ sinh thái sản phẩm đa dạng và chuyên biệt, hướng đến mục tiêu trở thành ""người bạn tài chính thông minh"" cho hơn 5 triệu khách hàng cá nhân và hàng chục ngàn doanh nghiệp.  Ngân hàng tập trung vào việc sáng tạo và đổi mới, đặc biệt là trong lĩnh vực ngân hàng số (MyVIB) và thẻ tín dụng (VIB Daily Deals).  MyVIB được ghi nhận là ứng dụng mobile banking cloud-native đầu tiên và thân thiện nhất tại Việt Nam, sử dụng công nghệ tiên tiến như AR và bảo mật cao.  VIB liên tục cho ra mắt các sản phẩm vay mới,  có lãi suất cạnh tranh và ưu đãi hấp dẫn, như gói vay mua nhà phố và căn hộ.  Ngân hàng cũng xây dựng hình ảnh thân thiện, gần gũi với khách hàng thông qua các hoạt động truyền thông và chương trình ưu đãi. "
2024-04-25,VIB cùng các tài năng sáng tạo trẻ chinh phục thử thách digital tại Vietnam Young Lion 2024,"VIB tài trợ cho cuộc thi Vietnam Young Lion 2024, khuyến khích các tài năng trẻ tạo ra các chiến dịch tiếp thị kỹ thuật số cá nhân hoá cho ngân hàng số MyVIB.  Cuộc thi tập trung vào việc tìm kiếm ý tưởng sáng tạo đáp ứng nhu cầu ngày càng tăng của thế hệ GenZ.  MyVIB nổi bật với các tính năng như AR, AI Voice Banking, Social Keyboard, và mã QR do người dùng tự tạo,  giúp MyVIB dẫn đầu các cuộc thảo luận về ngân hàng số trên mạng xã hội Việt Nam trong hai năm qua.   "
2024-01-17,Hoàn tiền không giới hạn khi nhận kiều hối tại VIB,"VIB cung cấp chương trình hoàn tiền 100.000 đồng cho khách hàng nhận tiền kiều hối.  Ưu đãi này áp dụng cho mọi số tiền nhận và không giới hạn số lần nhận.  VIB hợp tác với nhiều công ty chuyển tiền quốc tế như RIA, MoneyGram, iFAST Global Bank, Sigue Global Services, và Contact để cung cấp dịch vụ nhận tiền kiều hối.  Khách hàng có thể nhận tiền mặt hoặc chuyển vào tài khoản tại bất kỳ chi nhánh VIB nào, với thủ tục đơn giản chỉ mất khoảng 10 phút.   "
2024-11-24,Lãnh đạo ngân hàng và người nhà liên tục mua cổ phiếu VIB,"Các thành viên trong gia đình Phó Chủ tịch VIB và các nhân sự cấp cao của ngân hàng liên tục mua cổ phiếu VIB trong thời gian gần đây.  Vợ của ông Đặng Văn Sơn, Phó chủ tịch HĐQT VIB, đăng ký mua 10 triệu cổ phiếu, và con gái ông cũng đăng ký mua 4 triệu cổ phiếu.  Ngoài ra, Phó Tổng Giám đốc VIB Hồ Vân Long cũng mua thêm 3 triệu cổ phiếu.  Các giao dịch này diễn ra trong bối cảnh khối ngoại bán ròng mạnh trên thị trường chứng khoán Việt Nam.  Một công ty khác, Quang Kim, cũng mua vào 17,2 triệu cổ phiếu VIB.  Các động thái mua bán cổ phiếu này diễn ra trong bối cảnh một số cổ đông chiến lược, như CBA, đang thoái vốn khỏi VIB.  Bên cạnh đó, bài báo cũng đề cập đến các hoạt động khác trên thị trường chứng khoán, bao gồm việc Bac A Bank tạm hoãn kế hoạch tăng vốn và CII có nợ vay tăng mạnh. "
2024-05-06,Hơn 11 nghìn nhân viên VIB có thu nhập bình quân 95 triệu đồng/người trong quý 1,"VIB có hơn 11.000 nhân viên với thu nhập bình quân 95 triệu đồng/người trong quý 1/2024.  Tuy nhiên, thu nhập này giảm nhẹ so với cùng kỳ năm trước.  Lương bình quân tăng, nhưng thù lao của lãnh đạo giảm so với cùng kỳ.  Lợi nhuận trước thuế của VIB đạt 2.500 tỷ đồng, giảm 7,1% so với cùng kỳ năm ngoái, chủ yếu do chi phí dự phòng rủi ro tín dụng tăng mạnh.  Tổng tài sản tăng nhẹ lên 413.888 tỷ đồng, nhưng tiền gửi của khách hàng giảm 1%.   "
2024-09-04,Bay khắp thế giới với bộ đôi đặc quyền từ thẻ tín dụng VIB,"VIB mở rộng đặc quyền phòng chờ thương gia (lounge) và dịch vụ đón/tiễn nhanh chóng (Fast Track) cho tất cả chủ thẻ tín dụng, không chỉ riêng Travel Élite và Premier Boundless.  Khách hàng có thể sử dụng dịch vụ lounge tại hơn 800 sân bay trên thế giới với chi phí quy đổi rất hấp dẫn (999.000 VNĐ/lượt). Dịch vụ Fast Track giúp khách hàng làm thủ tục nhanh chóng tại sân bay, với fastline riêng tại một số sân bay Châu Á và Châu Âu.  Khách hàng có thể đặt dịch vụ này qua tổng đài hoặc đổi điểm thưởng trên ứng dụng MyVIB.  Các dòng thẻ tín dụng VIB, như Travel Élite, Premier Boundless, Super Card, và VIB Online Plus 2in1 cũng được đề cập với các ưu đãi dành cho du lịch quốc tế. "
2024-12-02,"VIB và Techcombank hưởng lợi gì khi tài trợ cho Anh trai ""say Hi"" và Anh trai vượt ngàn chông gai?","VIB và Techcombank đều hưởng lợi từ việc tài trợ cho các chương trình ca nhạc, đặc biệt là ""Anh trai 'say Hi'"" và ""Anh trai vượt ngàn chông gai"". VIB sử dụng tài trợ cho ""Anh trai 'say Hi'"" để tăng nhận diện thương hiệu và thúc đẩy tăng trưởng kinh doanh thẻ (tăng trưởng kép 44%/năm cho thẻ và 56%/năm cho chi tiêu qua thẻ).  Techcombank tài trợ ""Anh trai vượt ngàn chông gai"" để tăng trưởng huy động vốn và thu hút khách hàng trẻ, quảng bá sản phẩm mới ""Sinh lời tự động"".  Techcombank cũng tăng trưởng huy động vốn và tín dụng tốt, nhưng lãi suất cho vay trên huy động (LDR) khá cao, cần chú trọng huy động thêm.  Sự thành công của việc tài trợ phụ thuộc vào sự lựa chọn chương trình phù hợp với đối tượng khách hàng và mục tiêu của ngân hàng.   "
2024-03-30,"Agribank, BIDV, TPBank, VIB... công khai lãi suất cho vay: Chỉ từ 5%/năm","Một số ngân hàng lớn như Agribank, BIDV, VIB, LPBank, TPBank, ACB và Sacombank đã công bố lãi suất cho vay bình quân, phản hồi yêu cầu của Ngân hàng Nhà nước.  Các mức lãi suất cho vay bình quân khác nhau tùy theo ngân hàng, từ 5%/năm đến trên 8%/năm, phân biệt giữa các khoản vay ngắn hạn, trung hạn và dài hạn, cũng như đối với khách hàng cá nhân và doanh nghiệp.  Agribank là một trong những ngân hàng đầu tiên công bố thông tin chi tiết theo chỉ đạo mới.  Các ngân hàng khác cũng được yêu cầu công bố thông tin tương tự về lãi suất cho vay, nhằm tăng tính minh bạch trong hoạt động tín dụng.   "
2024-03-14,"VIB đặt mục tiêu lợi nhuận hơn 12.000 tỷ đồng, dự kiến chia cổ tức tiền mặt tỷ lệ 12,5% trong năm 2024","VIB đặt mục tiêu lợi nhuận trước thuế đạt 12.045 tỷ đồng trong năm 2024, tăng 13% so với năm 2023.  Tổng tài sản dự kiến tăng 20% lên 492.000 tỷ đồng, dư nợ tín dụng tăng 20% lên 320.600 tỷ đồng, và huy động vốn tăng 21% lên 315.200 tỷ đồng.  VIB cũng dự kiến tăng vốn điều lệ bằng cách phát hành 431,3 triệu cổ phiếu thưởng cho cổ đông hiện hữu (tỷ lệ 17%) và 11,1 triệu cổ phiếu thưởng cho nhân viên (tỷ lệ 0,44%).  Ngoài ra, ngân hàng sẽ chia cổ tức tiền mặt với tỷ lệ tối đa 12,5%, bao gồm hai đợt tạm ứng là 6% và 6,5%. Tổng số tiền chi trả cổ tức là 3.171 tỷ đồng.   "
2024-08-19,"Thời điểm vàng để vay mua nhà tại VIB: vay 2 tỷ, chỉ cần trả 12,5 triệu/tháng trong 24 tháng đầu","VIB đang cung cấp các gói vay mua nhà phố và căn hộ với lãi suất hấp dẫn, từ 5,9% đến 7,9%.  Đặc biệt, khách hàng có thể được miễn trả gốc trong 5 năm đầu đối với vay mua căn hộ và 4 năm đầu đối với vay mua nhà phố.  Thời gian duyệt vay nhanh chóng, chỉ trong 8 tiếng.  VIB cũng hỗ trợ giải ngân trước để khách hàng có thể tất toán khoản vay cũ tại ngân hàng khác.  Các ưu đãi này diễn ra trong bối cảnh lãi suất đang ở mức thấp và thị trường bất động sản đang khởi sắc.   "
2024-10-18,Cá nhân hóa thiết kế thẻ theo nhu cầu với Gen AI - Đậm cá tính và sáng tạo cùng VIB,"VIB giới thiệu tính năng Cá nhân hóa thiết kế thẻ tín dụng, cho phép khách hàng tự thiết kế hình ảnh trên thẻ của mình bằng công nghệ Gen AI.  Khách hàng có thể tạo ra các phong cách thiết kế độc đáo, từ ảnh cá nhân, ảnh từ thư viện của VIB, hoặc sử dụng các chủ đề thiết kế có sẵn.  Tính năng này được coi là bước đột phá trong việc cá nhân hóa trải nghiệm khách hàng, thể hiện sự sáng tạo và phù hợp với nhu cầu của từng người dùng.  VIB cũng đã và đang tiên phong trong việc cá nhân hóa thẻ tín dụng, cho phép khách hàng tùy chỉnh nhiều tính năng khác như ngày sao kê, số tiền thanh toán tối thiểu, v.v.  Với việc liên tục đổi mới và tập trung vào trải nghiệm khách hàng, VIB đã đạt được thành công đáng kể, giữ vị trí dẫn đầu thị trường về số lượng thẻ phát hành, chi tiêu qua thẻ, và mức độ tin cậy từ các tổ chức quốc tế.   "
2024-04-11,VIB tăng lãi suất tiết kiệm từ hôm nay 11/4,"VIB tăng lãi suất tiết kiệm kỳ hạn 1 tháng lên 2,6%/năm từ ngày 11/4/2024.  Lãi suất các kỳ hạn khác được giữ nguyên.  Tuy nhiên, ngân hàng cũng điều chỉnh giảm lãi suất gửi tại quầy cho kỳ hạn 2 tháng.  Khách hàng thuộc một số phân khúc (Diamond/Sapphire payroll, iBusiness/Sapphire) và khách hàng mới có thể nhận được thêm lãi suất. "
2024-11-19,"Hàng chục ngàn khách hàng VIB đang săn cơ hội gặp gỡ Anh Trai, bạn sẵn sàng nhập hội chưa?","VIB đang tổ chức nhiều chương trình khuyến mãi để thu hút khách hàng mở thẻ tín dụng và chi tiêu qua thẻ, nhằm tăng cơ hội trúng vé xem concert ""Anh Trai 'Say Hi'"".  Khách hàng có tổng chi tiêu cao nhất trong tuần từ 11-17/11 được nhận vé bus dạo Hà Nội cùng các nghệ sĩ.  Các chương trình khuyến mãi khác bao gồm miễn phí phí thường niên, hoàn tiền 10% chi tiêu trong 30 ngày đầu, ưu đãi ""Mua ngay, góp nhẹ"", và giảm giá 40% tại các đối tác.  Có nhiều cơ hội nhận vé concert và quà tặng khi mở tài khoản, tải ứng dụng MyVIB, và giới thiệu bạn bè.  Những ưu đãi này sẽ kết thúc vào ngày 27/11.   "
2024-05-23,Đón xem livestream của VIB và tận hưởng loạt ưu đãi giảm đến 65%,"VIB tổ chức livestream ""Siêu thẻ Siêu deal - Trọn deal Chị đẹp"" vào tối 24/5 với nhiều ưu đãi giảm giá lên đến 65% cho các sản phẩm thời trang, mỹ phẩm, du lịch, và ẩm thực.  Khách hàng mới mở thẻ VIB trong livestream sẽ nhận được nhiều ưu đãi hấp dẫn từ các thương hiệu nổi tiếng, bao gồm miễn phí phí thường niên và hoàn tiền 10% trong 30 ngày đầu.  Các ưu đãi dành cho cả nam và nữ, và được áp dụng cho ba dòng thẻ mua sắm của VIB.  VIB cũng gợi ý các chương trình ưu đãi mua sắm thường niên khác dành cho chủ thẻ.   "
