publish_date,title,summary
2024-10-09,Khám phá Series Card Education của VIB – Bí quyết khai thác tối đa lợi ích thẻ tín dụng dành cho bạn!,"VIB giới thiệu ""Series Card Education"", một loạt video hướng dẫn khách hàng sử dụng thẻ tín dụng hiệu quả.  Họ chia sẻ các bí quyết về chi tiêu, quản lý thẻ, tận dụng ưu đãi, tăng hạn mức, và thậm chí trở thành cộng tác viên để kiếm thêm thu nhập.  Các ưu đãi được đề cập bao gồm chương trình trả góp 0% lãi suất, ưu đãi từ các đối tác (du lịch, mua sắm), và các cách sử dụng thẻ an toàn.  Series này nhằm giúp khách hàng tối đa hóa lợi ích từ thẻ tín dụng VIB. "
2024-11-11,"VIB chuyển đổi website sang nền tảng đám mây AWS, bước tiến trong chiến lược Cloud First, AI First","Ngân hàng VIB đã chuyển đổi website sang nền tảng điện toán đám mây AWS, một bước đi nhằm nâng cao hiệu suất, bảo mật, và khả năng mở rộng.  Việc chuyển đổi này cho phép VIB xử lý lượng truy cập lớn hơn, giảm chi phí vận hành, và tăng cường bảo mật dữ liệu.  Đây là một phần trong chiến lược số hóa dài hạn của VIB, bao gồm cả việc sử dụng đa đám mây và phát triển ngân hàng số.   "
2024-06-19,Cùng Bảo Thy ‘săn’ ưu đãi giảm đến 67% khi mua sắm bằng thẻ VIB,"VIB, partnering with Bảo Thy, is hosting a livestream event on June 20, 2024, offering significant discounts on a wide range of products, including home goods, beauty products, and luggage.  The event is designed to attract new and existing VIB cardholders, with special offers like a one-million-dong bonus for the first 100 cardholders who open an account during the livestream.  The event also promotes a range of VIB privileges, including discounts on travel, dining, and shopping, further enticing potential customers. "
2024-04-10,"Vay VIB mua ô tô Huyndai lãi suất 1,5%/năm, duyệt vay siêu tốc trong 15 phút","VIB đang cung cấp lãi suất vay mua xe Hyundai ưu đãi, chỉ 1,5%/năm,  áp dụng cho các dòng xe như Grand i10, Accent, Elantra, và Creta trong 12 tháng.  Khách hàng được vay tối đa 80% giá trị xe và được ân hạn gốc trong 6 tháng.  Quy trình vay nhanh chóng, chỉ 15 phút thông qua ứng dụng VIB Champion, kết nối khách hàng trực tiếp với showroom và ngân hàng.  Đây là thời điểm thích hợp để mua xe do thị trường ôtô đang có xu hướng hạ nhiệt.   "
2024-07-29,"'Sướng' như bankers: Nhân viên VIB được thưởng cổ phiếu trị giá 230 tỷ đồng, người Nam A Bank và Techcombank được mua cổ phiếu ESOP giá rẻ","VIB đã phát hành hơn 11 triệu cổ phiếu thưởng (ESOP) cho gần 2.000 nhân viên, trị giá hơn 230 tỷ đồng.  Đây là một chính sách phúc lợi nhân viên, giúp giữ chân nhân tài và không tốn chi phí đáng kể trên báo cáo tài chính.  Techcombank và Nam A Bank cũng có kế hoạch tương tự.  Những đợt phát hành này giúp tăng vốn điều lệ cho các ngân hàng, nhưng cũng có thể dẫn đến tình trạng pha loãng cổ phần.   "
2024-01-22,Cẩm nang Tết 2024: Bí quyết chi tiêu mà vẫn tiết kiệm với thẻ VIB,"VIB offers a range of discounts and perks for customers during the Tet holiday season (and beyond), focusing on convenience and savings across various spending categories.  These include discounts on home goods, electronics, beauty treatments, travel, and even medical checkups.  VIB also highlights its 0% interest credit card deals and rewards programs for various spending categories, encouraging spending and potentially boosting customer loyalty.  The campaign emphasizes ease of use through online platforms and partnerships with various retailers. "
2024-07-10,"VIB ra mắt gói vay nhà phố 30.000 tỷ, lãi suất chỉ 5,9%, miễn trả gốc đến 48 tháng","VIB giới thiệu gói vay mua nhà phố mới với quy mô lớn, lãi suất cố định hấp dẫn (5,9%) và ân hạn gốc lên đến 48 tháng.  Gói vay này hướng tới khách hàng cá nhân, có quy trình nhanh chóng,  giảm thiểu áp lực tài chính ban đầu.  VIB cũng hỗ trợ khách hàng đang vay ở các ngân hàng khác.  Đây được xem là phản ứng trước nhu cầu thị trường bất động sản đang khởi sắc và sự gia tăng nhu cầu vay mua nhà trong quý 3 năm 2024.   "
2024-09-06,"Công an tìm người bị lừa đảo đầu tư, vay tiền online, đã chuyển tiền vào 4 số tài khoản ở ngân hàng VIB, VPBank, MB, Vietcombank","Công an Bình Thuận đang truy tìm các nạn nhân của vụ lừa đảo tài chính online.  Đối tượng Phạm Anh Trường,  đã lập các trang web và fanpage giả mạo các công ty tài chính để lừa đảo người dân vay tiền tín chấp có bảo hiểm khoản vay và đầu tư tài chính.  Phạm Anh Trường và đồng bọn đã dùng 4 tài khoản ngân hàng, trong đó có VIB, VPBank, MB, và Vietcombank, để nhận tiền từ các nạn nhân.  Cơ quan chức năng yêu cầu những người bị lừa liên hệ để hỗ trợ điều tra. "
2024-07-15,"Vay VIB trả nợ ngân hàng khác: lãi suất cố định 2 năm chỉ còn 7,5%/năm, hỗ trợ giải ngân trước","VIB giới thiệu gói vay mua nhà phố mới với lãi suất cố định 2 năm chỉ 7,5%/năm, hỗ trợ giải ngân trước và miễn trả gốc trong 6 tháng.  Gói vay này nhắm đến khách hàng cá nhân, có quy trình nhanh chóng và hỗ trợ cho những khách hàng đang vay nợ ở ngân hàng khác.  Đây là một sản phẩm có quy mô lớn nhất của VIB đến nay,  với mục tiêu đáp ứng nhu cầu mua nhà trong bối cảnh thị trường bất động sản đang hồi phục.   "
2024-01-14,"“Nước cờ lạ” của một số ông lớn ngành ngân hàng: Từ MB, VPB đến VIB đều đi “bán vé” show nhạc, chi hàng tỷ đồng để đồng hành ""Chị đẹp"", chuyên gia nói gì về hiện tượng này?","Several Vietnamese banks, including MB Bank, VIB, and VPBank, are heavily investing in sponsoring large-scale entertainment events, particularly music concerts and TV shows.  This strategy is seen as a way to connect with younger demographics and build brand awareness, with a focus on cultural relevance and visibility.  While the financial investment in these events is significant, the return is seen as positive in terms of brand image and long-term engagement with target audiences, particularly younger customers.  The use of social media and online video platforms to further amplify the reach and impact of these events is also highlighted. "
2024-10-01,"VIB đưa ra giải pháp vay mua nhà phố, mua căn hộ linh hoạt bậc nhất thị trường","VIB giới thiệu các gói vay mua nhà phố và căn hộ mới với lãi suất cố định hấp dẫn, từ 5,9% đến 7,9%/năm trong 6, 12, hoặc 24 tháng đầu.  Có nhiều lựa chọn trả nợ linh hoạt, bao gồm ân hạn trả gốc và hỗ trợ giải ngân trước để trả nợ ở các ngân hàng khác.  Các chính sách này giúp giảm thiểu áp lực tài chính cho khách hàng, đặc biệt trong bối cảnh thị trường bất động sản đang hồi phục.  VIB tập trung vào việc tối ưu hóa quy trình thẩm định nhanh chóng và dễ dàng. "
2024-05-28,"Doanh nghiệp ô tô lớn nhất trên sàn dự chi 6.700 tỷ để chia cổ tức tỷ lệ 50%, giá trị công ty vọt lên 60.000 tỷ đồng vượt Vietjet, VIB, SSI…","VEAM, the largest automotive company listed on the Vietnamese stock exchange, is planning to distribute a significant dividend of 50% to its shareholders, equivalent to over 6,700 billion VND.  Despite this large payout, the company projects lower revenue and profit for 2024 compared to 2023.  The positive stock price performance is largely due to the anticipation of strong performance from its existing automotive business, though some challenges remain in the sector.  The company's market capitalization has also soared, exceeding those of other major players like Vinhomes, Vingroup, and certain banks. "
2024-01-23,"VIB: Doanh thu năm 2023 tăng trưởng 23%, lợi nhuận vượt 10.700 tỷ","VIB, a Vietnamese bank, reported strong 2023 financial results, with 23% revenue growth and profit exceeding 10.7 trillion VND.  Key factors include strong loan growth, particularly in retail lending, and tight risk management leading to a significantly reduced bad debt ratio.  VIB's cost-to-income ratio (CIR) also improved to a record low, indicating efficient operations.  The bank also successfully raised $280 million in international capital.  The report highlights VIB's retail focus and commitment to digital transformation,  with strong performance in digital transactions and mobile banking apps. "
2024-09-10,"Mừng 28 năm thành lập, VIB ưu đãi không giới hạn tri ân khách hàng","VIB, celebrating its 28th anniversary, is offering various promotions, including gift cards, iPhone 15 Pro Max, and concert tickets to reward its customers.  These promotions are part of a broader strategy to enhance customer experience and encourage digital banking adoption through its MyVIB app.  The bank is also offering attractive interest rates on savings accounts and bonus on new credit card applications.  VIB highlights its leading position in digital banking, technological advancements in its app, and international recognition for its innovative payment solutions. "
2024-08-08,"VIB dẫn đầu bảng xếp hạng ngân hàng được ""viral"" nhất mạng xã hội","VIB's strong social media presence, particularly through its sponsorship of the popular show ""Anh Trai 'Say Hi',"" has driven a significant increase in online discussions and engagement.  The campaign saw a 64% increase in VIB-related online conversations and a 67% increase in participant engagement, making VIB the top-ranked brand in a social media engagement index.  VIB's strategic use of influencer marketing, clever integration of branding with the show's content, and exclusive merchandise giveaways have boosted their visibility and appeal to a younger demographic. "
2024-07-29,"Cập nhật KQKD ngân hàng quý 2/2024 ngày 29/7: Thêm BIDV, VIB, TPBank, BVBank,...","Several Vietnamese banks, including BIDV, VIB, TPBank, and others, reported strong Q2 2024 financial results.  Key highlights include significant increases in profits for several institutions, particularly BIDV and Techcombank, driven by increased lending and deposit growth, while managing costs effectively.  While overall market conditions and specific sector challenges impacted some entities, the results indicate a general positive trend in the banking sector, driven by improved loan demand, particularly in the residential property sector.  However,  some banks experienced profit declines or slower growth compared to previous quarters, indicating ongoing challenges and market pressures. "
2024-07-24,"Mua nhà phố hay căn hộ chung cư, đến VIB lãi suất chỉ 5,9%, miễn gốc đến 5 năm","VIB giới thiệu các gói vay mua nhà phố và chung cư mới, với lãi suất cố định hấp dẫn (5,9-7,9%/năm), ân hạn gốc lên đến 5 năm, và hỗ trợ giải ngân nhanh chóng.  Gói vay này hướng đến cả khách hàng mua nhà để ở và đầu tư.  Các lựa chọn trả nợ linh hoạt được đưa ra để phù hợp với nhiều nhu cầu và khả năng tài chính khác nhau.  VIB nhắm đến việc dẫn đầu thị trường cho vay mua nhà trong bối cảnh thị trường bất động sản đang hồi phục, với lãi suất vay thấp nhất trong 20 năm.     "
2024-01-11,VIB mở rộng hình thức thanh toán qua Google Pay,"VIB has partnered with Google Pay to allow contactless payments using VIB Mastercard credit and debit cards.  This integration offers a more convenient and secure payment experience for VIB cardholders via the Google Wallet app, applicable on both online and offline platforms.  The announcement highlights VIB's commitment to digital banking and its leading position in contactless payment technology in Vietnam, emphasizing speed, security, and ease of use.  VIB also continues to offer various credit card promotions and benefits, including discounts and cashback opportunities with partner merchants. "
2024-10-19,VIB là ngân hàng đầu tiên triển khai mở thẻ tín dụng trực tuyến trên VNeID,"VIB is the first bank in Vietnam to allow online credit card application through the VNeID platform.  This streamlined process uses digital identification for a faster, more secure application.  The move aims to enhance customer experience, reduce fraud risk, and improve the overall digital banking experience for Vietnamese users.  VIB also highlights its strong performance in digital banking, high credit card transaction volume, and various rewards programs. "
2024-11-12,Phó Tổng Giám đốc VIB vừa chi hơn 50 tỷ mua cổ phiếu ngân hàng,"Phó Tổng Giám đốc VIB, ông Hồ Vân Long, đã mua 3 triệu cổ phiếu VIB, chi gần 55 tỷ đồng.  Đồng thời, một nhân sự khác của VIB cũng mua 100.000 cổ phiếu.  Đây là giao dịch lớn của nhân viên nội bộ VIB, diễn ra trong bối cảnh cổ đông chiến lược Commonwealth Bank of Australia (CBA) đang thoái vốn khỏi VIB.   "
2024-03-27,Chương trình Mở khóa đặc quyền 4.0 của VIB phiên bản 2024 có gì mới?,"VIB's ""Unlocking Privileges 4.0"" program offers a range of perks, particularly focusing on dining experiences with discounts at Michelin-starred restaurants and international-standard dining venues.  Cardholders can also enjoy 0% interest on various purchases and preferential exchange rates for international transactions, as well as free ATM withdrawals and other financial services.  The program is designed to enhance the overall customer experience and provide exclusive benefits for users.   "
2024-06-06,Cùng VIB và 30 Anh Trai 'Say Hi' khuấy động mùa hè,"VIB is sponsoring the new music reality show ""Anh Trai 'Say Hi',""  aimed at Gen Z and Millennials.  This is part of VIB's broader strategy to connect with younger audiences through innovative marketing campaigns and enhance its brand image.  The show's potential to generate significant viewership and social media buzz is seen as a valuable way to reach VIB's target customer segment.  The partnership is also highlighted for its potential to increase VIB's brand awareness and encourage credit card usage. "
2024-04-02,"ĐHĐCĐ VIB: Chia cổ tức tiền mặt và thưởng cổ phiếu tổng tỷ lệ 29,5%, kế hoạch lợi nhuận 12.045 tỷ đồng trong năm 2024","At the VIB annual general meeting, shareholders approved a 29.5% dividend payout, including cash and stock, and a 2024 profit plan of 12.045 trillion VND.  The bank highlighted its strong financial performance over the past seven years, achieving an average annual profit growth rate of 48%.  VIB also emphasized its retail focus,  high loan portfolio, and successful digital banking initiatives (like MyVIB).  The meeting also addressed shareholder questions on interest rates, risk management, and employee stock options plans (ESOPs). "
2024-08-12,"Case study: Cách VIB từ ""bắt trend"" đến ""tạo trend"" tại Anh Trai 'Say Hi'","VIB's sponsorship of the ""Anh Trai 'Say Hi'"" reality show is a successful marketing strategy.  The show's popularity and the bank's integration of credit card benefits into the program's content are driving significant engagement and buzz on social media.  This approach targets a younger demographic, leverages influencers, and provides a memorable and engaging way to promote VIB's products and services, particularly its credit cards.  VIB's strong social media presence and focus on innovative financial products are also key elements. "
2024-04-26,"Thẻ tín dụng VIB Family Link sẽ giảm phí, tăng hoàn điểm thế nào từ ngày 27/04?","VIB has updated its Family Link credit card program, offering more personalized choices for families.  Starting April 27, 2024, cardholders can choose from three spending categories (Education, Healthcare, and Insurance) to earn up to 10% cashback.  The program also includes reduced annual fees for both primary and secondary cards, and bonus cashback for new cardholders, making it a more attractive option for families.  The update reflects VIB's strategy to cater to the specific financial needs and lifestyle preferences of families. "
2024-05-02,VIB cùng hơn 150 thương hiệu lớn ưu đãi đến 40% cho chủ thẻ tín dụng,"VIB is offering significant discounts across various sectors for its credit cardholders during the summer.  These include discounts of up to 40% on travel (airfare, hotels, tours), 30% on dining at partner restaurants, and 20% on online shopping.  The program also highlights 0% interest promotions on various purchases,  and benefits for international transactions.  The campaign aims to attract and retain customers by offering broad, attractive, and easily accessible discounts. "
2024-09-20,VIB cùng Diamond Plaza ưu đãi hoàn tiền đến 500k cho chủ thẻ,"VIB partners with Diamond Plaza to offer cashback rewards to its credit cardholders.  From September 13th to December 31st, 2024, VIB cardholders can earn cashback of 250,000 VND for purchases above 5 million VND, and 500,000 VND for purchases above 10 million VND.  The offer is applicable across various product categories at Diamond Plaza and can be combined with other discounts offered by the mall.  VIB also promotes its flexible payment options, including 0% interest for up to 36 months, and various other benefits. "
2024-04-08,VIB sắp chi hơn 1.600 tỷ trả cổ tức tiền mặt đợt 2,"VIB sẽ chi gần 1.650 tỷ đồng để trả cổ tức tiền mặt đợt 2 cho năm 2023, với ngày chốt danh sách cổ đông là 19/4/2024 và ngày chi trả là 17/5/2024.  Đây là một phần của kế hoạch trả cổ tức 29,5% vốn điều lệ năm 2023, bao gồm cả cổ tức tiền mặt và cổ phiếu thưởng.  Ngân hàng cũng thông qua kế hoạch kinh doanh năm 2024 với mục tiêu lợi nhuận trước thuế là 12.045 tỷ đồng.   "
2024-06-26,VIB tri ân khách hàng nhân sự kiện vượt mốc 750.000 thẻ tín dụng,"VIB, celebrating reaching 750,000 credit cards in circulation, is highlighting its customer loyalty program and diverse benefits.  The bank is offering various rewards, including e-vouchers and potentially free merchandise,  to thank existing cardholders.  The program also promotes various perks for online and international transactions, focusing on convenience and ease of use in the digital age.  VIB emphasizes its commitment to providing a comprehensive and attractive ecosystem of credit card options and services. "
2024-02-23,VIB triển khai dự án Core banking Temenos trên nền tảng đám mây AWS,"VIB has implemented a new core banking system from Temenos, running on AWS cloud infrastructure.  This move is part of VIB's broader digital transformation strategy, aiming to enhance efficiency, security, and scalability of its services.  The bank expects improved customer experience, reduced operational costs, and the ability to scale operations and introduce new products more quickly.  This core banking modernization is seen as a significant step in VIB's continued commitment to digital transformation and its position as a leading retail bank in Vietnam. "
2024-10-03,Cách VIB thay đổi “cuộc chơi” trên thị trường thẻ tín dụng,"VIB, a Vietnamese bank, has successfully positioned itself as a leader in the credit card market through innovative marketing strategies, including sponsorships of popular reality TV shows and a focus on digital platforms.  Their efforts have created a significant social media buzz and increased engagement with younger demographics.  VIB's success is attributed to a combination of technology integration, attractive reward programs, and a focus on understanding and catering to evolving customer needs in a rapidly changing digital landscape. "
2024-11-14,VIB hợp tác với Flywire cung cấp giải pháp thanh toán quốc tế tiện lợi cho người Việt,"VIB hợp tác với Flywire để cung cấp giải pháp thanh toán quốc tế tiện lợi cho người dùng Việt Nam.  Khách hàng có thể thanh toán các khoản phí giáo dục quốc tế, du lịch, vv, hoàn toàn bằng VND thông qua nền tảng trực tuyến bảo mật.  Hệ thống này giúp tối ưu hóa trải nghiệm, loại bỏ phí giao dịch, và cho phép thanh toán tại hơn 240 quốc gia và vùng lãnh thổ.  Đây là một dịch vụ mới,  đáp ứng nhu cầu thanh toán quốc tế ngày càng tăng của người Việt. "
2024-11-21,Vợ và con gái Phó Chủ tịch VIB dự chi hàng trăm tỷ đồng mua lượng lớn cổ phiếu ngân hàng,"Vợ và con gái của Phó Chủ tịch VIB, bà Đặng Thị Thu Hà và bà Đặng Minh Ngọc, đăng ký mua khoảng 14 triệu cổ phiếu VIB với tổng giá trị ước tính khoảng 260 tỷ đồng.  Giao dịch dự kiến diễn ra từ 27/11 đến 26/12/2024.  Bà Hà sẽ nâng tỷ lệ sở hữu lên 3,215% và bà Ngọc lên 0,318%.  Cả hai giao dịch đều theo phương thức thỏa thuận và/hoặc khớp lệnh. "
2024-11-05,VIB nhận kỷ lục quốc gia và giải thưởng Innovation Breakthrough 2024 với tính năng Cá nhân hóa thiết kế thẻ,"VIB được công nhận là ngân hàng đầu tiên tại Việt Nam cho phép khách hàng tự thiết kế thẻ tín dụng với tính năng Cá nhân hóa thiết kế thẻ, sử dụng công nghệ AI.  Tính năng này, ra mắt tháng 10/2024, đã nhận được phản hồi tích cực từ khách hàng và các chuyên gia quốc tế, với gần 20.000 lượt thiết kế thẻ.  VIB cũng nhận được Kỷ lục quốc gia và giải thưởng Innovation Breakthrough 2024 từ Tổ chức Kỷ lục Việt Nam và Mastercard.  Tính năng này là một phần trong chiến lược cá nhân hóa trải nghiệm khách hàng của VIB, cho phép khách hàng tùy chỉnh nhiều khía cạnh khác của thẻ tín dụng thông qua ứng dụng MyVIB.  VIB cũng đang triển khai các ưu đãi cho khách hàng mới và hiện hữu, bao gồm hoàn phí thường niên năm đầu, hoàn 10% tổng giá trị chi tiêu và các ưu đãi giảm giá tại các đối tác hệ sinh thái. "
2024-08-20,"“Mua ngay, góp nhẹ” cùng VIB: 0 lãi, 0 phí và ưu đãi đến 40%","Chương trình ""Mua ngay, góp nhẹ"" của VIB cung cấp giải pháp trả góp 0% lãi suất, 0 phí ban đầu và giảm giá lên đến 40% cho 5 danh mục chi tiêu phổ biến (du lịch, mua sắm, giáo dục, mua xe máy, làm đẹp & nha khoa) trong vòng 36 tháng.  VIB  đáp ứng nhu cầu chi tiêu lớn của khách hàng bằng cách cá nhân hóa chương trình trả góp với lựa chọn kỳ hạn từ 6 đến 36 tháng, và mức trả góp hàng tháng linh hoạt.  Khách hàng có thể lựa chọn các dòng thẻ tín dụng khác nhau (Family Link, Super Card, Cash Back...) để nhận ưu đãi riêng cho từng danh mục chi tiêu.  Ngoài ra, khách hàng cũng được hưởng các ưu đãi từ hệ sinh thái VIB Privileges.  Chương trình này kéo dài đến 31/12/2024, và có thêm ưu đãi cho khách hàng mở thẻ mới. "
2024-02-06,VIB khẳng định vị thế top đầu với loạt giải thưởng từ Mastercard và Visa,"VIB được ghi nhận là một trong những ngân hàng hàng đầu về công nghệ thẻ tín dụng tại Việt Nam.  Ngân hàng nhận được nhiều giải thưởng từ Mastercard và Visa, chứng nhận vị thế dẫn đầu trong lĩnh vực này.  VIB tiên phong trong việc áp dụng công nghệ như AR, VR, Big Data và AI vào các sản phẩm thẻ, tạo trải nghiệm người dùng độc đáo, tiện lợi và cá nhân hóa, bao gồm phát hành thẻ nhanh chóng, thẻ ảo, tổng đài ảo, và chuyên gia tài chính ảo.  VIB cũng dẫn đầu về tổng chi tiêu qua thẻ ghi nợ và thẻ tín dụng quốc tế tại Việt Nam, và chi tiêu qua thẻ Mastercard tại nước ngoài, đặc biệt với các dòng thẻ chuyên biệt cho du lịch.  Ngân hàng cũng được công nhận là dẫn đầu về chi tiêu thương mại điện tử.  Với hệ sinh thái thẻ đa dạng, VIB hướng đến nhóm khách hàng hiện đại, yêu thích công nghệ, và mang lại trải nghiệm thanh toán không tiền mặt tuyệt vời. "
