publish_date,title,summary
2024-05-08,"VPBank cho vay trả nợ ngân hàng khác với lãi suất chỉ 4,6%/năm","VPBank is offering a loan to help customers pay off existing loans from other banks at a low interest rate of 4.6% per year.  This ""loan refinancing"" scheme targets individuals with existing mortgages, auto loans, business loans, or personal loans secured by assets like real estate.  The maximum loan amount is 100% of the outstanding balance on the old loan.  A key benefit is the 24-month grace period on principal repayment, and a loan term up to 35 years.  The application process is simplified, with online loan application and approval through the VPBank RACE system, reducing the need for extensive paperwork and potentially accelerating the loan disbursement process. "
2024-09-06,"Công an tìm người bị lừa đảo đầu tư, vay tiền online, đã chuyển tiền vào 4 số tài khoản ở ngân hàng VIB, VPBank, MB, Vietcombank","Vietnamese authorities are seeking victims of an online investment and loan fraud scheme.  The suspect, Phạm Anh Trường, allegedly operated fraudulent online loan platforms and investment schemes using fake company names and social media accounts.  To receive payments, Trường used four bank accounts at VIB, VPBank, MB Bank, and Vietcombank, registered under names that appeared to be legitimate companies.  Authorities are asking individuals in Bình Thuận who may have been victims of this scam to contact the local police.   "
2024-09-10,VPBank đóng cửa 2 quầy giao dịch tại Thái Nguyên do mưa lũ,"Due to severe flooding caused by Typhoon Yagi, VPBank temporarily closed two of its branches in Thái Nguyên.  The branches, located at 631 Lương Ngọc Quyến and 542-544 Cách mạng Tháng Tám, will be closed until the flood situation improves.  VPBank is encouraging customers to utilize online services during this time. "
2024-04-25,"Đến chiều 25/4, đã có 15 ngân hàng công bố lợi nhuận quý I: VPBank tăng mạnh, ACB hé lộ nguyên nhân sụt giảm","Q1 2024 saw strong results for many Vietnamese banks, with notable gains reported by VPBank (64% profit increase),  OCB (23% increase), and MSB (a slight increase).  However, some banks, like ACB, experienced a slight decline in profit compared to the same period last year, which was attributed to unusual income in prior years.  Several other banks also reported positive, but less spectacular, Q1 profit growth.  A key takeaway is the significant variation in performance across the banking sector, with some banks performing exceptionally well, while others faced modest headwinds.  This reflects the complexity of the Vietnamese financial landscape. "
2024-10-28,"Tín dụng tăng trưởng ổn định, lợi nhuận 3 quý của VPBank tăng 67% so với cùng kỳ","VPBank reported strong performance in the first nine months of 2024, with a 67% year-over-year increase in profit before tax.  This robust growth was driven by a significant increase in operating income and strong loan growth, exceeding the industry average.  The bank's efforts in debt recovery and digitalization are highlighted as key contributing factors.  VPBank also secured a significant loan from a Japanese bank to support renewable energy projects, showcasing their commitment to sustainability.  The bank's healthy balance sheet and strong capital adequacy ratio (CAR) further solidify their financial stability and position for future growth.  Strategic partnerships and branch expansion, particularly in Ho Chi Minh City, are also seen as key growth drivers.   "
2024-08-08,"VPBank vừa tăng mạnh lãi suất tiết kiệm từ hôm nay (8/8), một loạt ngân hàng lớn nâng lãi suất huy động ngay đầu tháng 8","VPBank raised its deposit interest rates by 0.5% for one-month terms and 0.2% for other terms, effective August 8, 2024.  This is the sixth interest rate hike by VPBank in the past five months, and one of several across the Vietnamese banking sector in early August.  The increases are largely driven by a combination of factors: low deposit growth and increasing loan demand leading to banks needing to attract deposits, and government interventions and currency market movements also influencing rates.  Analysts predict further interest rate hikes in the coming months, as loan demand is expected to continue accelerating in the second half of 2024. "
2024-06-12,"Tiền vào ồ ạt đẩy thanh khoản lên cao nhất 3 năm, cổ phiếu VPBank nổi sóng","VPBank's stock (VPB) saw a significant surge in trading, reaching an 8-month high and the highest single-day increase since March 2023.  This strong performance is likely due to positive investor sentiment surrounding the bank's Q1 2024 results, which showed substantial profit growth (over 65% increase year-over-year).  Analysts cite factors like improved net interest margins (NIM), potential one-time gains, and favorable valuations as supporting the positive outlook.  While future profit projections are ambitious, the current market sentiment seems to favor VPBank.  High trading volume, exceeding 3-year highs, further reinforces investor confidence.  The positive outlook also extends to potential future dividend payments and suggests that the bank is well-positioned for continued success and potentially increased investor interest.   "
2024-03-18,Lãi suất huy động ngân hàng số Cake by VPBank mới nhất tháng 3/2024: Mức cao nhất là bao nhiêu?,"Cake by VPBank, a digital-only bank, released its latest interest rate table in March 2024.  Interest rates for various deposit terms range from 3% to 5.2% per year, with the highest rate (5.2%) for 24-36 month fixed deposits.  Different payment frequencies (end-of-term, monthly, quarterly) are also available, with slightly varying rates.  The rates are generally competitive with other banks, with higher rates available for online deposits and larger balances.  Cake by VPBank targets a younger demographic, primarily in major cities. "
2024-03-15,Tổng Giám đốc VPBank: Tiền trong ngân hàng thừa hàng chục nghìn tỷ là phí phạm,"VPBank's CEO, Nguyễn Đức Vinh, expressed concern about substantial idle funds in Vietnamese banks, calling it a ""waste.""  He argued that while banks are eager to lend, many businesses lack viable projects, hindering loan disbursement.  Vinh highlighted the need for government initiatives beyond just lending policies to stimulate domestic consumption and provide targeted support for businesses.  He also stressed the need for a comprehensive legal framework for resolving bad debt, suggesting a dedicated law to address this ongoing challenge in the Vietnamese banking sector, citing the need to expedite the process of asset recovery. "
2024-11-02,"Cảnh báo loạt website giả mạo ngân hàng ACB, VPBank,...","NCSC (National Cyber Security Center) warned of fraudulent websites mimicking legitimate banking and government services.  These sites are designed to look like the real thing, tricking users into providing personal information, often via phishing emails or text messages claiming account issues or updates.  NCB advises users to verify any suspicious communication through official channels and to use strong security measures, such as antivirus software, to protect against these scams.  Users should only access banking services through verified official websites, and if there's any doubt about a communication, contact the bank's official support channels immediately. "
2024-07-17,VPBank vừa tăng lãi suất tiết kiệm tại nhiều kỳ hạn,"VPBank increased deposit interest rates by 0.1% for terms between 2 and 18 months, effective July 16, 2024.  This is part of a broader trend of interest rate increases by several Vietnamese banks in response to slowing deposit growth and recovering loan demand.  Analysts predict further rate increases in the coming months due to continued pressure on the currency, and potential intervention by the central bank (NHNN).  The increases are expected to be more moderate than in 2022, due to the different macroeconomic context.   "
2024-01-30,"Toàn cảnh KQKD 28 ngân hàng: Cập nhật Big 4, MB, SHB, Eximbank,..., HDBank và VPBank gây bất ngờ lớn","Several Vietnamese banks reported Q4 2023 financial results, with a mixed picture.  VPBank and HDBank showed significant profit growth (96% and 95% YoY increases respectively), outperforming many peers.  MB Bank also had a strong quarter, with a 38.6% profit increase.  However, some banks like REE and a number of private sector banks did not meet their profit targets.  The overall trend points towards a strong performance for the banking sector in 2023, but with a notable divergence in performance between banks.  Factors contributing to these results, especially for those exceeding targets, appear to be diverse, including improved operating income and cost management.  A notable feature was the variance in results across the banking sector, not all banks sharing the same performance. "
2024-07-30,"Toàn cảnh KQKD ngân hàng quý 2/2024: Cập nhật Vietcombank, VPBank, Sacombank, HDBank, MB,...","Q2 2024 financial results for many Vietnamese banks showed a mixed bag.  Several, including Vietcombank, HDBank, and MB Bank, reported strong profit growth, reflecting positive trends in lending and deposit growth.  However, some banks, like REE, experienced lower profits compared to the previous year, likely due to factors like cost increases or adjustments.  Sacombank and a few others also saw profit growth, but with less dramatic increases.  The overall picture indicates a resilient banking sector with substantial growth in several institutions, but with variations in performance and some challenges for others.   "
2024-10-01,"Dự báo lợi nhuận quý III của các ngân hàng: Eximbank, HDBank, LPBank, VietinBank, VPBank, TPBank sẽ tăng trưởng mạnh nhất","Analysts at MBS predict strong profit growth for several Vietnamese banks in Q3 2024, particularly Eximbank (70% YoY growth), HDBank (44% YoY growth), LPBank (41% YoY growth), VietinBank (40% YoY growth), and VPBank (37% YoY growth).  This growth is anticipated due to a combination of factors, including improving loan growth, the impact of interest rate adjustments, and a relatively low base for comparison from the previous year.  However, some banks (e.g., Techcombank, ACB, and VIB) are expected to see slower or even negative profit growth in Q3, primarily due to increased loan loss provisions.  Overall, the outlook suggests a positive, but varied, financial performance across the banking sector in Vietnam during Q3 2024, heavily influenced by the economic recovery and continued adjustments in lending and deposit rates.   "
2024-01-09,"Cập nhật lãi suất ngân hàng VPBank tháng 1/2024: Gửi kỳ hạn ngắn dưới 6 tháng, kể cả số tiền chục tỷ, thì lãi suất cũng chỉ hơn 3%/năm","VPBank's deposit interest rates in January 2024 showed a slight decrease from December 2023 levels.  Rates varied based on deposit amount and term, with the highest rates (around 5.4% per year) for longer-term deposits (15 months and longer) of 10 billion VND or more.  Rates for smaller amounts and shorter terms were considerably lower, generally below 4% per year.  The trend observed from April 2023 onward reflects a general downward adjustment in VPBank's deposit interest rate structure.   "
2024-03-08,“Bom tấn” ưu đãi dành cho giới đầu tư tại Chứng khoán VPBank,"VPBank Securities (VPBankS) launched the VPBankS Loyalty program, a customer loyalty program offering rewards and benefits to its clients.  The program allows users to earn points on various transactions (e.g., deposits, trades) redeemable for a wide range of rewards from over 1,000 brands across Vietnam.  A key differentiator is the ability to earn points across VPBank's entire ecosystem, including the parent bank and insurance services.  The program also features a tiered VIP program (Diamond/Prime) offering premium services and benefits to high-net-worth individuals.  This initiative is designed to attract and retain individual investors in the Vietnamese securities market.   "
2024-03-25,Chứng khoán VPS kinh doanh thế nào kể từ khi VPBank thoái vốn?,"VPS (VPBank Securities), a Vietnamese brokerage firm, experienced a period of growth following the divestment of its majority shareholder, VPBank, in 2015.  While 2023 saw a decrease in revenue (down 24.5% to 6.374 trillion VND) and profit (down nearly 20% to 657 billion VND) compared to 2022, VPS maintained a significant increase in assets (up 11% to 22.459 trillion VND). Key factors in their performance included a robust increase in margin loans (up 89% to 11.148 trillion VND), but also a substantial decrease in cash reserves and a corresponding rise in debt.  The brokerage's focus on securities brokerage remains, but there's a notable shift towards self-dealing, which seems less successful during the 2023 period. "
2024-04-12,"VPBank, VIB, Eximbank, SHB… tăng lãi suất tiết kiệm: Lãi suất sắp đồng loạt tăng trở lại?","Several Vietnamese banks, including VPBank, VIB, and others, have recently increased their deposit interest rates.  These increases, while generally small (0.1-0.3% points), are part of a broader trend of rate adjustments across the banking sector, following a period of generally lower rates.  The increases are driven by factors including slowing deposit growth, recovering loan demand, and potential central bank intervention.  While some analysts anticipate further moderate rate increases as the economy improves, others predict a period of stability in the near future, as the macroeconomic environment continues to be carefully watched.   "
2024-06-20,VPBank đứng đầu thị trường về tổng doanh số sử dụng thẻ tín dụng (*),"VPBank maintains its leadership position in credit card transactions, reaching over 152 trillion VND in 2023, representing 17% market share.  This success is attributed to a diverse range of credit card products catering to various customer segments.  VPBank offers premium cards like Mastercard Diamond World and Diamond World Lady for high-net-worth individuals,  StepUp for millennials focused on online spending rewards, and VPBank Shopee cards for e-commerce enthusiasts.  Gen Z customers are targeted with the VPBank JCB Z card, designed with rewards for common spending categories.  A new Flex Card, offering flexibility between credit and deposit options, and personalized reward programs, further enhance the user experience.  VPBank also leverages partnerships to provide attractive promotions and rewards, ultimately maximizing card usage value for its customers,  including special offers at Traveloka, Mytour, and major retail partners.  The bank's digital platform, VPBank NEO, plays a role in these offerings, providing tools for managing spending and accessing exclusive deals. "
2024-10-15,VPBank thông báo dừng toàn bộ giao dịch online với khách hàng chưa xác thực sinh trắc học,"VPBank announced that, effective January 1, 2025, all online transactions will require biometric verification.  This includes online payments, linking e-wallets, transferring funds, and using mobile payment services like Apple Pay and VPPay.  The requirement also applies to new online accounts and credit cards, and existing accounts will be subject to the new rules after October 1, 2024, if the supporting documents are not updated.  VPBank is urging customers to update their identification documents and biometric data to avoid disruptions in online banking services. "
2024-09-10,"Công an tìm người bị lừa đảo chuyển tiền vào 12 số tài khoản ngân hàng mở tại Vietcombank, MB, VietinBank, ACB, OCB và VPBank","In Bình Thuận, authorities are investigating a sophisticated online fraud scheme targeting individuals through fake Facebook accounts and online marketplaces.  Criminals create fake accounts, posing as romantic interests, to lure victims into investing in fictitious online marketplaces (like fake versions of eBay and Difiti). Victims are instructed to make fraudulent purchases to supposedly earn commissions.  The fraudsters use multiple bank accounts (across Vietcombank, MB Bank, VietinBank, ACB, OCB, and VPBank) to receive the stolen funds.  Similar scams have been reported nationwide, with authorities in Điện Biên identifying and prosecuting twelve suspects.  The report emphasizes the need for heightened awareness and caution against online scams and encourages victims to report fraudulent activity to the appropriate authorities. "
2024-02-23,"Khối ngoại tiếp đà bán ròng gần 790 tỷ đồng trong phiên VN-Index giảm mạnh, tâm điểm VPBank, Thế Giới Di Động","Foreign investors continued their selling spree on the Vietnamese stock market, selling off a combined 789 billion VND worth of shares.  VPBank (VPB) and Thế Giới Di Động (MWG) were among the top targets for foreign selling pressure.  While some stocks, like DGC and EVF, saw foreign buying, the overall market trend was negative, contributing to a significant drop in the VN-Index.  The high trading volume suggests significant investor activity, but the overall negative foreign investor sentiment is a notable factor impacting the market.   "
2024-07-23,"VPBank công bố danh sách cổ đông sở hữu trên 1% vốn: Hai quỹ ngoại và người liên quan nắm giữ hơn 6,2% cổ phần","VPBank published a list of shareholders holding over 1% of its shares.  The list includes 13 individual shareholders, collectively owning 40.8% of the bank's shares, and four institutional shareholders.  Two prominent foreign investment funds, and related parties, control over 6.2% of VPBank's shares.  This disclosure is in accordance with new Vietnamese regulations (Thông tư 17/2024/TT-NHNN, Thông tư 18/2024/TT-NHNN), requiring more detailed information about major shareholders and their relationships, effective January 1, 2025.  The disclosure of this information now extends to 5 generations of family members.   "
2024-08-12,VPBank khai trương chi nhánh Flagship đầu tiên tại Việt Nam,"VPBank opened its first flagship branch in Ho Chi Minh City, designed as a showcase of its commitment to digital banking and a sophisticated customer experience.  The branch features a modern, environmentally-conscious design, a ""Digital Zone"" equipped with digital devices for customers to interact with VPBank's digital ecosystem, and a ""Coffee Zone"" for casual meetings.  The flagship branch offers paperless transactions and emphasizes a premium service approach, catering to high-net-worth individuals and corporations.  This launch signifies VPBank's commitment to modernizing its service offerings and further enhancing its position in the Vietnamese banking market.  The opening also included an immersive art exhibit, showcasing the works of Japanese artist Katsushika Hokusai.   "
2024-07-30,"Kiểm soát tốt chi phí vốn, VPBank tối ưu cơ hội kinh doanh trong quý 2","VPBank reported strong Q2 2024 financial results, driven by stable loan growth, effective cost management, and a successful restructuring effort at its consumer finance arm, FE Credit.  Loan disbursement increased across key segments, including SME and individual consumer loans, reflecting a robust economy.  A notable aspect was the reduction in cost of funds (COF), helping to improve net interest margins (NIM).  The bank's healthy capital adequacy ratio (CAR) and strong cash position further solidify its financial strength.  These results, along with positive macroeconomic forecasts, indicate VPBank's strong position for continued growth and achievement of its 2024 targets.  The bank also highlights a strategic focus on expanding its FDI client base, which is expected to contribute to further growth in the coming quarters.   "
2024-08-19,"Lãi suất tiết kiệm mới nhất tại Techcombank, VPBank, SHB: Ngân hàng nào trả lãi cao nhất?","Several Vietnamese banks, including VPBank, Techcombank, and SHB, adjusted their deposit interest rates in August 2024.  The changes generally involved increases for some longer-term deposit options, with the specific amounts varying based on the amount deposited and the term.  The increases are likely in response to broader market trends, with banks adjusting rates to remain competitive and attract deposits.  While the specific increases are relatively small for individual accounts, the overall pattern suggests a gradual upward movement in deposit rates across the banking sector.   "
2024-05-19,"Techcombank, VPBank và MB sẽ chốt quyền nhận cổ tức tiền mặt vào tuần tới","Several Vietnamese banks, including Techcombank, VPBank, and MB Bank, announced dividend payment dates for Q1 2024.  Techcombank will pay out 15% in dividends (5.283 trillion VND), VPBank will pay out 10% (7.934 trillion VND), and MB Bank will distribute 5% (2.653 trillion VND).  These payouts are significant, and are among the first dividend payments in cash for some banks after a decade, suggesting confidence in their financial strength.  The move signals a return to dividend strategies after focusing on financial health, and potentially indicates that several banks expect to maintain high revenue and profit growth in 2024. "
2024-03-10,"Lãi suất VPBank mới nhất tháng 3/2024: Mức cao nhất là 4,9%/năm","VPBank's latest deposit interest rates, effective March 5, 2024, are generally in the range of 2.2% to 4.9% per year, varying by deposit amount and term.  Higher amounts and longer terms receive slightly higher rates.  Online deposit rates are 0.1% higher than in-branch rates.  The rates reflect a recent trend of lower interest rates, though the specific rates remain somewhat competitive with the broader market context. "
2024-10-05,Hàng trăm nghìn khách hàng nhận quà từ “Thành phố thịnh vượng” của VPBank,"VPBank launched a promotional game, ""Thịnh Vượng City,"" as part of its 31st anniversary celebration.  Customers could earn points by completing in-app tasks, allowing them to win prizes ranging from cash to travel experiences.  The game is designed to engage users with the VPBank NEO app and provides a platform for customers to win prizes valued at 31 billion VND.  The campaign is intended to enhance customer experience and highlight the bank's digital banking services.   "
2024-07-26,VPBank tiên phong hỗ trợ doanh nghiệp trả góp qua thẻ tín dụng,"VPBank introduced a new feature allowing businesses to use their VPBiz credit cards for installment payments.  This allows SMEs to utilize credit lines for purchases and expenses, providing a flexible financing option.  The installment feature offers two options:  installment payments for individual transactions (over 3 million VND/month) or for the full outstanding balance of the card (up to 500 million VND).  The repayment period can be up to 36 months with a low interest rate (0.9%/month). This new feature aims to help businesses manage their cash flow effectively and potentially take advantage of tax deductions for credit card expenses.  VPBank also offers various VPBiz credit cards with specific benefits to cater to different business needs and spending patterns, including premium cards with perks like airport lounge access. "
2024-08-09,VPBank tặng khách hàng 31 tỷ đồng quà tặng dịp sinh nhật 31 tuổi,"VPBank is running a promotional campaign, ""Thịnh Vượng City,"" offering over 31 billion VND in prizes to customers who use the VPBank NEO app.  The campaign includes various online transactions, like money transfers, and maintaining an average account balance.  Participants can win prizes through a game that involves building virtual city structures within the app.  Prizes include cash, travel packages (Maldives trips), and other items. The campaign runs until October 6, 2024, with drawing dates throughout the period.  It's part of VPBank's effort to enhance customer experience and showcase its digital banking capabilities.   "
2024-07-15,VPBank bổ nhiệm một Phó Tổng Giám đốc người Nhật,"VPBank appointed Kamijo Hiroki as a new Deputy General Director, effective July 27, 2024.  This is the first Japanese national appointed to a VPBank leadership position, though further details about Hiroki's background are not provided.  The appointment follows the addition of two new board members in April 2024, one of whom is from a key strategic partner, reflecting the bank's increasing international focus and potential partnerships. "
2024-10-09,"Chiến lược của Samsung, Cake by VPBank nhằm hiện thực hoá mục tiêu 50.000 nhân lực bán dẫn, AI vào năm 2030 của Việt Nam","Samsung and Cake by VPBank are actively involved in Vietnam's growing AI and semiconductor sectors.  Cake, a digital bank, emphasizes AI integration into its customer experience, from marketing and customer support to credit evaluation.  They're developing their own large language model (LLM) tailored to financial services and Vietnamese. Samsung is focused on AI-powered product development, with plans for future devices incorporating AI features and building a broader AI ecosystem.  Both companies are contributing to Vietnam's goal of developing 50,000 AI and semiconductor-related professionals by 2030, through programs, training, and partnerships.  These initiatives highlight the growing importance of AI and technology in Vietnam's economic strategy.   "
