publish_date,title,summary
2024-09-30,VPBank hợp tác cùng LOTTE C&F cung cấp giải pháp tài chính cho khách hàng mua trước trả sau,"VPBank partnered with Lotte C&F to offer financial solutions, focusing on installment payment options and digital financial services for Lotte's customers in Vietnam.  The collaboration will leverage each company's strengths, with VPBank providing comprehensive financial services, and Lotte C&F connecting and promoting VPBank's offerings to its own affiliated companies.  This is seen as a strategy to capture growing FDI investment in Vietnam and cater to the needs of international corporations operating in the country.  The partnership also involves developing joint digital platforms and products for a wider range of financial services. "
2024-10-01,"VPBank triển khai gói vay lãi suất chỉ từ 4,19% cho sản xuất kinh doanh","VPBank launched a new loan program offering interest rates starting at 4.19% per year for business and individual loans.  This represents a 1.3% reduction from previous rates.  The program targets individuals and small businesses, especially those affected by Typhoon Yagi, aiming to provide flexible financing options with terms up to 20 years and loan amounts up to 20 billion VND.  Key features include 100% funding of loan needs up to 85% of collateral value and streamlined application processes handled entirely through the VPBank Race app.  This includes reduced paperwork and automatic loan approval within five minutes.  The program is available nationwide through December 2024.   "
2024-04-03,"VPBank đặt mục tiêu tăng gấp đôi lợi nhuận năm trong năm nay, tiếp tục chia cổ tức tiền mặt 10%","VPBank aims for a substantial increase in profits (114% YoY) in 2024, reaching 23.165 trillion VND.  This ambitious target is supported by strong Q4 2023 results (96% YoY profit increase) and anticipated improvements in the cost of funds (COF).  The bank projects significant growth in lending and deposits, partly driven by the recovery of the consumer segment and leveraging its strategic partnership with SMBC.  A key part of the strategy is to continue offering dividend payments (10% in 2024), a move that reflects confidence in future performance and financial strength.  VPBank's focus on expanding its foreign direct investment (FDI) customer base and restructuring its consumer finance arm (FE Credit) are also key aspects of the projected growth. "
2024-10-22,"VPBank, TPBank, Sacombank, Nam Á Bank… dừng giao dịch với khách hàng không xác thực sinh trắc học và cập nhật CCCD gắn chip từ 1/1/2025","Several Vietnamese banks, including VPBank, TPBank, Sacombank, and others, are implementing new regulations requiring biometric verification for online banking transactions starting January 1, 2025.  These measures, mandated by the State Bank of Vietnam (NHNN) through Circulars 17 and 18 of 2024, mean that accounts without biometric verification will be restricted or shut down.  This is a nationwide effort to enhance security and reduce fraudulent activity in online banking by requiring all accounts to be verified with valid, government-issued identification (e.g., a chip-enabled national ID card).  Initial results indicate a significant reduction in fraudulent transactions and account takeovers since the new regulations were introduced in the previous quarter. "
2024-10-11,"Giá trị thương hiệu của VPBank thiết lập cột mốc mới, đạt 1,35 tỷ USD","VPBank's brand value reached a new high of $1.35 billion in 2024, climbing to 10th place among the most valuable companies in Vietnam.  This increase of 6% over 2023 is attributed to consistent revenue growth, effective communication strategies, and improved employee satisfaction.  The bank's strong financial performance in the first half of 2024, with a 68% YoY increase in consolidated profit before tax, further strengthens its brand value and overall position in the Southeast Asian financial landscape.  VPBank's significant tax contributions and inclusion in the Fortune Southeast Asia 500 also contribute to this positive image. "
2024-04-29,"ĐHĐCĐ VPBank: Chủ tịch Ngô Chí Dũng khẳng định chia cổ tức tiền mặt trong 5 năm liền, lý giải quyết định tham gia tái cơ cấu ngân hàng yếu kém","At VPBank's 2024 annual shareholder meeting, CEO Nguyễn Đức Vinh highlighted a significant focus on restructuring and future growth.  The bank aims for a substantial 114% increase in pre-tax profit, driven by a strong performance in the fourth quarter of 2023.  A key strategy is the successful acquisition of a significant stake in a consumer finance company, aiming for profitability and growth by 2025.  The bank also plans to continue its dividend payout strategy, distributing 10% of profits as cash dividends.  The strategy also incorporates increasing the bank's participation in international markets and diversification of its services, including expanding into investment banking, leveraging their new partnership with a major Japanese bank.  Despite some challenges in the previous year, VPBank expressed confidence in its future growth potential.   "
2024-03-06,"VPBank điều chỉnh lãi suất tiết kiệm từ 5/3: Gửi 50 tỷ mới được cộng 0,2%, gửi 24 tháng có lãi suất cao nhất","VPBank adjusted its deposit interest rates on March 5, 2024.  The changes resulted in a slight decrease for most terms, ranging from 1-month to 12-month deposits.  However, rates for larger deposits (over 10 billion VND) saw an increase.  The bank maintained a preferential rate for high-balance customers.  These adjustments follow a broader trend of deposit rate adjustments seen across several Vietnamese banks during early 2024.   "
2024-11-09,"Vietcombank, VietinBank, VPBank sẽ dừng giao dịch tài khoản doanh nghiệp trong trường hợp sau","Several Vietnamese banks, including VPBank, Vietcombank, and VietinBank, are implementing new regulations requiring biometric verification for business accounts.  Starting January 1, 2025,  business accounts lacking biometric verification will be restricted or closed.  This includes online transactions, card usage (debit and credit), and account opening.  The new rules are part of a national effort to improve security and prevent fraud in online banking.  Banks are advising customers to update their identification documents and biometric data.   "
2024-01-14,"“Nước cờ lạ” của một số ông lớn ngành ngân hàng: Từ MB, VPB đến VIB đều đi “bán vé” show nhạc, chi hàng tỷ đồng để đồng hành ""Chị đẹp"", chuyên gia nói gì về hiện tượng này?","Several Vietnamese banks, including MB Bank, VIB, and VPBank, are heavily sponsoring music shows and concerts.  This strategy aims to increase brand visibility and connect with younger, middle-class demographics.  While costly, these sponsorships are seen as effective marketing tools, leveraging the high viewership and social media engagement generated by these events.  Experts suggest that this approach helps establish a more relatable and culturally relevant brand image for banks, particularly in a market where younger demographics are significant drivers of growth.  However, the high cost of these events and potential risks associated with event management are also noted as factors to consider. "
2024-08-09,VPBank nhận cú đúp tại giải thưởng Ngân hàng Việt Nam tiêu biểu,"VPBank received two awards at the Vietnam Retail Banking Forum, recognizing its digital banking efforts.  The bank was named ""Outstanding Digital Bank"" and ""Outstanding Innovative Financial Products and Services"" for its VPBank NEO app.  The awards acknowledge VPBank's strong commitment to digital transformation, including developing a comprehensive digital ecosystem, increasing user engagement, and enhancing security features.  VPBank NEO, launched in 2018, boasts over 10 million registered users, with key features like eKYC and various payment methods.  The awards also highlight the bank's successful cost reduction through digitalization.   "
2024-03-07,VPBank khẳng định vị thế khi tái ngộ cộng đồng runner Sài Thành,"VPBank, partnering with VnExpress Marathon, hosted the Ho Chi Minh City Midnight Marathon (VVMM 2024).  The event, the second edition of the Ho Chi Minh City Midnight Marathon but the first collaboration with VnExpress Marathon, attracted over 11,000 runners, including nearly 600 international participants from over 30 countries.  The well-organized event, with a focus on runner support and safety, highlighted VPBank's commitment to community engagement and its reputation as a leading sponsor of large-scale running events in Vietnam.  The event was praised for its organization and presentation, showcasing VPBank's brand in the local running community. "
2024-08-25,Lãi suất ngân hàng VPBank mới nhất tháng 8: Gửi 24 tháng có lãi suất tốt nhất,"VPBank's latest interest rates, published in August 2024, show a range of options for deposit accounts.  Rates vary based on deposit amount and term, with longer-term deposits (24-36 months) generally offering the highest rates, which can reach 5.9% for preferred customers with high balances and online accounts.  Rates for shorter-term deposits are lower, and a preference is given for higher balances and online accounts.   "
2024-04-25,"Xếp hạng tín nhiệm của VPBank duy trì ở mức Ba3, triển vọng ổn định","VPBank's credit rating was maintained at Ba3 with a stable outlook by Moody's.  This positive assessment is based on the bank's strong capital base, robust deposit mobilization, and sound liquidity.  Key factors cited include a significant increase in shareholder equity (reaching second-largest in the system), a high capital adequacy ratio (CAR), and strong growth in CASA deposits.  Moody's anticipates continued loan growth and improved net interest margins (NIM) over the next 12-15 months, supported by declining cost of funds (COF).  Strong Q1 2024 financial results further bolster the positive outlook.   "
2024-08-12,"'Soi' các ngân hàng tốn nhiều tiền dự phòng nhất: VPBank, BIDV, Techcombank cùng tăng mạnh, một loạt ngân hàng tầm trung 'tăng bằng lần'","Vietnamese banks, in Q2 2024, collectively increased their loan loss provisions by 13.3% compared to Q1 2024 and 16.8% year-over-year. This surpasses the previous high set in Q4 2022.  VPBank, BIDV, and Techcombank had the highest loan loss provisions, far exceeding other banks in the sector.  While some smaller or mid-tier banks experienced decreases in loan loss provisions, the overall trend points to increased concern about potential loan defaults in the Vietnamese banking sector.  The substantial increase in provisions for some of the largest lenders, and the double-digit increases for several mid-sized banks, suggests a possible heightened risk assessment across the banking sector. "
2024-06-18,VPBank tài trợ 1.000 tỷ đồng cho An Gia (AGG) triển khai dự án The Gió Riverside,"VPBank provided a 1 trillion VND loan to An Gia Corp to develop the ""The Gio Riverside"" project in Dĩ An, Bình Dương.  The project is a large-scale residential development, planned to include approximately 3,000 units.  VPBank's involvement is intended to support An Gia's financial capacity and position them for continued success in the market, particularly given the project's location near key infrastructure and amenities.  An Gia's financial performance in prior quarters was also very strong, highlighting the bank's confidence in the project's success. "
2024-09-25,"Cổ phiếu ngân hàng đua nhau tăng giá phiên 25/9: Tâm điểm MSB, STB, MBB, VPB và VCB","Several Vietnamese bank stocks saw significant gains on September 25th, driven by positive investor sentiment and potentially supportive macroeconomic factors.  MSB, STB, MBB, and VPB were particular highlights, with strong trading volumes and percentage increases.  The positive movement comes amid speculation of increased capital injection into Vietcombank (VCB), and after the central bank's recent easing of lending rates (OMO).  The overall market trend appears bullish, with increased investor interest in the banking sector.  Several banks also announced dividend plans, adding to the positive investor outlook.   "
2024-11-19,VPBank mang âm nhạc cổ điển Vienna đến với công chúng thủ đô,"VPBank sponsored a classical music performance featuring the Vienna Chamber Orchestra at the Hồ Gươm Theatre in Hanoi.  The event, part of a larger series of international arts events, aimed to bring classical music closer to Vietnamese audiences.  The orchestra, renowned for its international tours, performed works by Haydn, Schubert, and Strauss.  VPBank's sponsorship is part of a broader cultural engagement strategy that aims to enhance the bank's image and connect with the community.   "
2024-06-28,VPBank hỗ trợ doanh nghiệp trả nợ trước hạn tại ngân hàng khác với chính sách ưu đãi vượt trội,"VPBank introduced a new loan product, ""Loan Transfer,"" designed to help businesses refinance existing loans from other banks with favorable terms.  The program offers 100% loan coverage up to 50 billion VND, flexible repayment terms (up to 36 months), reduced interest rates (around 6.1% per year), and eliminates the need for full repayment of the existing loan.  This initiative is aimed at easing the financial burden on businesses, particularly SMEs, in a challenging economic climate and provides a more competitive and convenient refinancing solution compared to other options.  Early response to the program has been positive, with hundreds of inquiries.   "
2024-05-29,"Tăng mạnh trong tháng 5, lãi suất tiết kiệm tại VPBank hiện cao nhất là bao nhiêu?","VPBank raised its deposit interest rates by 0.2% across all terms on May 16, 2024.  The new rates apply to both in-branch and online accounts, with variations based on deposit amount and term.  For example, a 24-month deposit could earn up to 5.8%/year for high-balance, preferred customers.  Customers with deposits over 50 billion VND see even higher rates.  The adjustments reflect current market interest rate trends.   "
2024-08-26,"Khách hàng VPBank được mua xe ôtô tại Carpla, Ucar Moveo và Ucar G-Stars","VPBank partnered with Carpla and Ucar (Moveo and G-Stars) to offer financing options for used car purchases.  Customers can now apply for loans through VPBank's digital platform, VPBank RACE, for used cars from Carpla and Ucar.  The process is streamlined, with online application and approval, and financing is available up to 85% of the vehicle's value.  This partnership expands VPBank's financial services offerings and aims to provide more accessible financing options for used car buyers.   "
2024-04-16,VPBank Can Tho Music Night Run 2024- Lễ hội của niềm vui,"VPBank hosted the Can Tho Music Night Run (VCMNR 2024), a running event incorporating live music performances along the course.  Over 11,000 runners, including many international participants, enjoyed music from various genres at designated stations throughout the race.  A large stage concert featuring popular artists like Isaac, further amplified the entertainment aspect of the event, creating a vibrant and memorable experience for runners and spectators alike. The event is lauded for its vibrant and engaging atmosphere.   "
2024-04-24,VPBank báo lợi nhuận trước thuế hợp nhất quý 1/2024 tăng 64% so với cùng kỳ,"VPBank's Q1 2024 performance was strong, with a 64% year-over-year increase in consolidated pre-tax profit.  This success was driven by robust loan growth (exceeding industry averages), particularly in SME and consumer lending, with notable growth in mortgage lending.  Improvements in cost of funds (COF) and proactive cost management contributed to improved net interest margins (NIM).  The bank's digital initiatives, including the VPBank NEO app, experienced substantial growth, indicating a focus on digitalization and enhanced customer experience, further contributing to efficiency gains.  Furthermore, the successful restructuring of FE Credit (VPBank's consumer finance arm) is expected to lead to future profitability.  Overall, VPBank appears well-positioned for continued growth in 2024, and is aiming for double-digit year-over-year profit growth.   "
2024-08-20,VPBank hợp tác cùng CLB Bóng đá Công an Hà Nội phát triển bóng đá Việt,"VPBank partnered with the Hanoi Police Football Club (CAHN FC) to support Vietnamese football.  The agreement will see VPBank become a strategic partner for CAHN FC, potentially providing resources and support to help the club succeed in national and regional competitions over the next few years.  The partnership also aims to boost public image for both parties,  and is part of VPBank's broader strategy to engage in cultural and community-focused events.   "
2024-04-11,Sở hữu sớm tấm bib VPBank Hanoi International Marathon với giá ưu đãi,"VPBank is offering early registration discounts for the 2024 VPBank Hanoi International Marathon.  Participants can buy race bibs with discounts of 15% (all VPBank credit card holders), 25% (VPBank Prime Champion/Raising members), and 30% (VPBank Diamond members) from April 6th to 14th via the VPBank NEO app.  This early registration period precedes the full race event on September 22, 2024, and aims to generate interest and support for the running event.   "
2024-01-26,Hợp tác chiến lược MVC & VPBANK – Thay đổi trải nghiệm xây sửa nhà của người Việt,"VPBank partnered with MVC & Co. to create a platform, xaytoam.vn, streamlining the home renovation process for Vietnamese homeowners.  This one-stop platform connects homeowners with contractors and building materials.  VPBank provides financial support for renovations through preferential loan options, while MVC provides expertise and a streamlined process for selecting and working with contractors.  The collaboration aims to improve the home-building experience in Vietnam and provide a comprehensive solution to a crucial need in the market.   "
2024-04-03,"Gây xôn xao với mức tăng kịch biên độ 15%, Viettel Global chính thức vượt VPBank lọt top 10 công ty giá trị nhất sàn chứng khoán Việt với vốn hóa đạt 6,5 tỷ USD","Viettel Global (VGI) stock experienced a significant surge in early April 2024, reaching a 5-month high and a record trading volume.  The 100% year-to-date gain and strong trading volume, along with a slight drop in VPBank stock (VPB), propelled Viettel Global's market capitalization to nearly 6.5 billion USD, surpassing VPBank to enter the top 10 most valuable companies on Vietnam's stock exchange.  This strong performance is linked to positive Q2 2024 financial results, including record revenue and a continued profitability,  driven by robust performance in several overseas markets.  While profit declined slightly from previous year-end figures, the overall positive financial performance likely fueled investor confidence and the surge in stock price.   "
2024-02-05,Chi phí vốn đi xuống giúp VPBank tối ưu lợi nhuận trong năm 2024,"VPBank's cost of funds (COF) decreased significantly in Q4 2023, falling to 5.6% from 6.4% in the previous quarter.  This decrease is primarily due to the maturity of higher-interest loans from the prior year being replaced with newer, lower-interest loans, facilitated by the central bank's easing of interest rate policies.  This lower COF led to an improvement in VPBank's net interest margin (NIM) to 6.2%.  The bank attributes its improved profitability to favorable macroeconomic factors such as low interest rates, ample liquidity, and a strong capital base, which will likely contribute to further improvements in 2024.  These factors, combined with proactive loan management strategies, are expected to positively influence VPBank's profitability in the coming year.   "
2024-04-22,Từ Hà Nội đến Cần Thơ – Giải mã chiến lược của VPBank với chạy bộ,"VPBank sponsored the Can Tho Music Night Run (VCMNR 2024), a running event that combined a race with live music performances along the course.  The event, attracting over 5,300 runners, emphasized a vibrant atmosphere with music from various genres.  VPBank's sponsorship is part of a broader strategy to engage with the Vietnamese community, particularly the running community.  The event's organization, including a large concert at the finish line, and the diverse musical acts, aimed to create a memorable and enjoyable experience for runners and attendees.  VPBank has a long-standing commitment to running events, including previous marathons and related social responsibility initiatives. "
2024-03-27,VPBank đồng loạt tăng lãi suất tiết kiệm ở tất cả kỳ hạn từ hôm nay 27/3,"VPBank increased its deposit interest rates across all terms on March 5, 2024,  with a 0.1% increase for one-month terms and a 0.2% increase for terms from 2 to 36 months.  This is part of a broader trend of some banks in Vietnam raising deposit rates to compete for funds amidst a recovering economy.  However, other major banks have either lowered or kept rates stable, showing a mixed market response.  The adjustments reflect a complex interplay of factors including loan demand, overall market liquidity, and central bank policies. "
2024-07-20,VPBank trở thành đối tác chiến lược của hãng xe điện BYD tại Việt Nam,"VPBank partnered with BYD Auto Vietnam to offer financing for BYD electric vehicle purchases.  The agreement provides customers with attractive loan terms, including a maximum loan amount of 80% of the vehicle's value and interest rates starting at 7.9% per year.  The partnership is part of VPBank's strategy to expand its financial services offerings and cater to the growing electric vehicle market.  This partnership also showcases VPBank's commitment to sustainable finance and to supporting the growth of environmentally friendly industries.   "
2024-07-19,Đón hè sôi động cùng thẻ tín dụng VPBank Mastercard,"VPBank Mastercard credit cards are offering exclusive duty-free shopping benefits at international destinations (Thailand, South Korea, Japan, Singapore) during the summer.  These benefits include discounts at major duty-free stores.  The bank also provides ongoing domestic spending rewards, including cashback on foreign transactions and in-app purchases.  This promotion aims to attract and retain customers and capitalize on summer travel and shopping demand, showcasing the VPBank Mastercard as a valuable travel companion.   "
2024-09-19,"Agribank, VPBank, MSB, BVBank,... đồng loạt giảm lãi suất cho vay khách hàng bị thiệt hại bởi bão lũ","Several Vietnamese banks, including Agribank, VPBank, MSB, BVBank, ACB, and Eximbank, are offering reduced interest rates and loan relief programs to support individuals and businesses affected by Typhoon Yagi and subsequent flooding.  These measures include interest rate reductions (0.5% to 2% depending on the bank and loan type), grace periods on loan repayments, and waivers on late fees, targeting customers in impacted areas.  The initiatives aim to help mitigate the financial strain caused by the disaster and encourage a swift economic recovery.   "
2024-08-14,VPBank ghi danh trong PRIVATE 100: Minh chứng cho hành trình tăng trưởng bền vững và sứ mệnh phụng sự đất nước,"VPBank was recognized as one of the top two private-sector banks contributing to Vietnam's national budget in 2023, with nearly 6,000 billion VND in contributions.  This reflects the bank's strong financial performance, evidenced by significant year-on-year profit growth and a large shareholder base.  VPBank's diverse product offerings and strategic focus on sustainable development, including investments in green initiatives and community support, also contributed to this recognition.  Despite economic challenges in 2023, VPBank maintained strong financial performance and growth in Q1 2024, projecting continued growth in the second half.  The bank's commitment to shareholder value and social responsibility is a key aspect of its success. "
2024-07-29,Phó Tổng giám đốc thường trực VPBank muốn chi hơn 90 tỷ đồng để tăng sở hữu tại ngân hàng gấp 6 lần,"VPBank's Deputy General Director, Phạm Thị Nhung, plans to significantly increase her stake in the bank by purchasing an additional 5 million shares.  This purchase, if successful, would raise her ownership to approximately 0.0765% of the company's shares, costing approximately 92.5 billion VND.  She currently holds a much smaller stake of 0.0134%.  Nhung has a long history with the bank and holds multiple leadership positions. "
