publish_date,title,summary
2024-04-02,"Tập đoàn có TGĐ vừa ứng cử vào HĐQT Vincom Retail: Sở hữu loạt BĐS lừng lẫy ở Việt Nam, từng chuyển nhượng 2 dự án gần 4,5 tỷ USD cho Vinhomes","Nguyễn Hoài Nam, CEO of Berjaya Vietnam, is nominated for a Vincom Retail board position.  He has a significant background in real estate development and investment, particularly in Vietnam, having led projects in several cities and having significant divestments to Vinhomes in the past.  This nomination highlights his substantial experience in the real estate and retail sector, suggesting a potential alignment of his experience with Vincom Retail's current strategy.  The nomination and his background in real estate development positions him to offer insight and expertise to Vincom Retail.     "
2024-03-23,Vincom Retail sẽ thực hiện kế hoạch mở rộng ra sao khi không còn là công ty con của Vingroup?,"Vingroup completed the sale of a significant portion of its stake in SDI, which held a major stake in Vincom Retail (VRE).  This divestiture, valued at nearly 39 trillion VND,  does not alter Vincom Retail's operational management, as Vingroup will maintain management contracts.  The report anticipates continued growth for Vincom Retail, driven by existing mall operations, the projected opening of six new malls,  and the generally strong outlook for Vietnam's retail real estate market, particularly the trend of retail space moving to more suburban locations.  VNDirect highlights Vincom Retail's strong financial position, including a low debt-to-equity ratio, suggesting that the company is well-equipped to execute its expansion plans. "
2024-02-21,"Thế trận BĐS bán lẻ Việt Nam trước thềm “tân binh” tỷ USD Central Pattana gia nhập: Vincom Retail vẫn số 1, tỷ phú Việt nỗ lực 'đấu' với đại gia ngoại","The article discusses the intensifying competition in Vietnam's retail real estate sector, particularly in shopping mall development.  Central Pattana, a major Thai developer, is entering the market, signaling increased foreign investment.  Simultaneously,  domestic players like Vincom Retail, Thaco, and KIDO are also actively expanding their mall portfolios.  This competitive environment is characterized by strong demand, limited new supply, and rising rental costs, making it a lucrative but challenging sector for both foreign and domestic players.  The article emphasizes the continued growth of Vincom Retail despite Vingroup's divestment and highlights the current strong financial position of key players in the market. "
2024-07-22,"Vincom Retail hậu Vingroup thoái vốn: Có quý thứ 6 liên tiếp lãi trên 1.000 tỷ, tổng tài sản vượt mức 50.000 tỷ đồng","Vincom Retail (VRE) had a strong Q2 2024, posting its sixth consecutive quarter of profits exceeding 1 trillion VND.  Revenue was up 14% year-over-year, driven by mall leasing and property sales.  The company also added four new malls in June, increasing its total mall portfolio and total retail space to over 1.8 million square meters.  Despite a slight dip in occupancy rate compared to the prior year, Vincom Retail's financial health, evidenced by its substantial asset base and low debt-to-equity ratio, supports its continued expansion plans. "
2024-03-18,Tổng giám đốc Vingroup nói gì về việc thoái vốn Vincom Retail?,"Vingroup's CEO clarified the rationale behind the divestment of its stake in Vincom Retail.  The move is a strategic decision to concentrate resources on high-growth areas within Vingroup, not a land-grabbing tactic.  Vingroup will maintain management contracts for Vincom Retail's malls, ensuring the rights of tenants and investors are protected.  The CEO emphasized the legal and logistical impossibility of changing the designated use of commercial land to residential. "
2024-04-23,ĐHCĐ Vincom Retail (VRE): Cần hơn 10.000 tỷ phát triển lưới dự án với diện tích hơn 800.000 m2,"Vincom Retail (VRE), following Vingroup's divestment, presented its 2024 expansion plans at its annual shareholder meeting.  The company projected over 171,000 square meters of new retail space across six new mall openings, with a focus on suburban locations.  Financial projections for the year include significant revenue and profit targets, but the report acknowledges that ongoing loans to related entities (Vingroup companies) remain outstanding.  While VRE's financial position is considered sound, the future success of its expansion hinges on market reception and the ability to manage those loans.  The report also noted an expected decrease in shophouse sales revenue in 2024, though this was anticipated, as most shophouse projects were nearly completed by the end of 2023. The company has maintained a strong position in the Vietnamese retail real estate market, with over 83 existing malls and a projected continued market share growth.     "
2024-04-22,Vincom Retail thay Tổng giám đốc,"Vincom Retail's CEO, Trần Mai Hoa, was removed from her position on April 22, 2024.  She was replaced by Phạm Thị Thu Hiền, who previously held a VP position in the company.  Hoa remains on the board of directors.  The change in leadership occurred shortly after Vingroup's divestment of its major stake in Vincom Retail.   "
2024-03-18,"Vingroup thoái vốn Vincom Retail, sẽ không còn là công ty mẹ nắm quyền kiểm soát","Vingroup completed the sale of its majority stake in SDI, a company holding a controlling interest in Vincom Retail (VRE).  This transaction removes Vincom Retail from Vingroup's subsidiary structure.  Vingroup, however, will continue to manage VRE's malls under a management contract.  The sale, valued at approximately 39 trillion VND, is a strategic move by Vingroup, likely aimed at focusing resources on core businesses and potentially raising capital.  Vincom Retail, despite no longer being a direct subsidiary, maintained strong financial performance in 2023, with substantial revenue and profit growth, and has ongoing expansion plans for 2024. "
2024-06-25,Cổ phiếu Vincom Retail lần đầu tăng trần kể từ khi Vingroup thoái vốn,"Vincom Retail (VRE) stock price rose sharply on June 25th,  its first gain since a period of decline.  This likely reflects investor optimism following reports that VRE would finalize a plan to secure land for future development from parent company Vingroup.  The increased trading volume also suggests heightened interest in the stock.  While the company's Q1 2024 earnings were strong, the stock price increase also comes with the understanding that the company has significant outstanding loan balances and deposits with Vingroup, and that their financial success and future potential depend on successfully managing these arrangements.   "
2024-04-30,"TGĐ Berjaya Việt Nam Nguyễn Hoài Nam nói về vụ đầu tư vào Vincom Retail và 'bí kíp': Điều quan trọng nhất khi đầu tư đa ngành là dám bỏ, và phải bỏ quyết liệt","This article focuses on Nguyễn Hoài Nam's perspective on Vingroup's divestment of its stake in Vincom Retail.  Nam, a newly appointed board member of Vincom Retail, emphasizes that the move is a strategic one, not a sign of weakness, and that Vincom Retail is well-positioned for continued success.  He attributes his confidence to VRE's strong financial performance, extensive mall portfolio, and strategic location advantages, and argues that the company has the financial strength and market knowledge to thrive independently.  Importantly, he emphasizes that Vingroup will continue to manage the malls, ensuring the interests of tenants and investors are protected.  Nam also shares his philosophy of embracing calculated risk-taking and strategic divestment as crucial elements in long-term success, even in the face of prior failures. "
2024-09-10,"Vinpearl lãi gần 2.600 tỷ trong nửa đầu năm 2024, tài sản gần 3 tỷ USD, vượt Vincom Retail","Vinpearl, a Vingroup company focused on tourism and resorts, reported strong financial results for the first half of 2024.  Profit after tax more than tripled, reaching 2.579 trillion VND,  and total assets topped 67.75 trillion VND (~$2.7 billion), surpassing Vincom Retail.  This success is attributed to increased room sales and strong growth in VinWonders and Vinpearl Golf.  The company also recently raised capital via international bond issuance.  Despite recent restructuring, Vinpearl remains a significant player in Vietnam's tourism sector, operating a large portfolio of hotels and resorts. "
2024-06-07,"Sau ít năm làm nông nghiệp, Thaco Agri của tỷ phú Trần Bá Dương có tài sản tăng vọt lên hơn 51.000 tỷ, vượt Vincom Retail, gần bằng Vinamilk, Becamex IDC","Thaco Agri, a subsidiary of Thaco Group, saw a significant increase in its asset value, reaching over 51 trillion VND.  This substantial growth, from a prior loss position, resulted in a large asset base,  making it comparable to other major Vietnamese companies like Vinamilk and Becamex IDC. The increase is attributed to a shift from losses to profits in 2023,  and significant investment in agricultural activities across Vietnam, Laos, and Cambodia, notably in livestock (cattle and pigs), fruit production, and rubber.  The company also has significant outstanding debt, primarily from bond issues.   "
2024-04-02,Chân dung nữ tướng 'thân cận' với tỷ phú Phạm Nhật Vượng sẽ rời chức Chủ tịch Vincom Retail sau 7 năm đảm nhiệm,"Thai Thị Thanh Hải, Chairwoman of Vincom Retail's board, will step down.  She was replaced by Trần Mai Hoa, who previously held the CEO position but was then replaced by another executive. This change in leadership follows Vingroup's recent divestment from Vincom Retail.  The report also mentions the appointment of a new board member, Nguyễn Hoài Nam, reflecting a shift in the company's ownership structure.  Notably, Vincom Retail's strong financial performance in 2023 and its ongoing expansion plans are highlighted, despite the changes. "
2024-04-26,Vincom Retail có quý thứ 5 liên tiếp lãi trên nghìn tỷ,"Vincom Retail (VRE) reported strong Q1 2024 financial results, marking its fifth consecutive profitable quarter exceeding 1 trillion VND.  Revenue increased by 16% year-over-year, driven by consistent mall operations and successful property sales.  The company projects continued growth, with plans to open six new malls in 2024, adding significantly to its existing portfolio of 83 locations.  The company's financial health is also highlighted, with a high cash flow to support future development. "
2024-04-01,"Gương mặt ""lạ mà quen"" gia nhập HĐQT Vincom Retail sau khi Vingroup thoái vốn: CEO tập đoàn sở hữu khách sạn Intercontinental Hà Nội, Sheraton Hà Nội, có phu nhân là Á hậu quý bà thế giới...","Nguyễn Hoài Nam, CEO of Berjaya Vietnam and a major real estate investor, was elected to the board of Vincom Retail (VRE) following Vingroup's divestment.  Nam's background includes significant experience in real estate development in Vietnam, and ownership of prominent properties such as hotels (Sheraton, Intercontinental).  This appointment suggests a shift in strategy and expertise for Vincom Retail, potentially focusing on further expansion and leveraging Nam's experience in the sector.  The article also highlights VRE's robust financial performance in 2023.   "
2024-09-14,"Quỹ ETF ngoại quy mô gần 500 triệu USD loại EVF, dự kiến mua mạnh VND, VRE, HPG nhưng sẽ “xả” lượng lớn một cổ phiếu chứng khoán","A large foreign ETF, Vaneck Vectors Vietnam ETF (VNM ETF), is expected to significantly increase its holdings of VND, VRE, and HPG stocks, and reduce its holdings of VIX, VHM, and VNM, during its Q3 2024 portfolio rebalancing.  This rebalancing also involves removing EVNFinance (EVF) and HNG from the index.  The rebalancing reflects the ETF's investment strategy and the market performance of these stocks in the context of Vietnam's overall economic trends and recent capital market developments. "
2024-04-01,"Nhân vật 'lạ' trên thượng tầng Vincom Retail sau vụ Vingroup thoái vốn: Là TGĐ của DN sở hữu khách sạn Sheraton Hà Nội, Long Beach Phú Quốc...","Nguyễn Hoài Nam, CEO of Berjaya Vietnam, a Malaysian company with significant holdings in Vietnamese real estate, was appointed to Vincom Retail's board of directors.  This appointment comes after Vingroup's divestment of its major stake in Vincom Retail, and likely reflects a strategic shift for Vincom Retail as it moves forward independently.  Nam's appointment brings extensive experience in the real estate and retail sectors to the board.   "
