publish_date,title,content
2024-06-27,Hơn 581 triệu cổ phiếu Hòa Phát sắp về tài khoản nhà đầu tư," Tổng Công ty Lưu ký và Bù trừ chứng khoán Việt Nam (VSDC) vừa thông báo ngày giao dịch chính chức của cổ phiếu Tập đoàn Hòa Phát (mã HPG) phát hành mới. Theo đó, VSDC đề nghị các thành viên theo dõi, thực hiện hạch toán chứng khoán HPG từ tài khoản chứng khoán chờ giao dịch sang tài khoản chứng khoán giao dịch cho khách hàng (nếu có) vào ngày 28/6/2024. Trước đó, Sở Giao dịch Chứng khoán TP HCM (HoSE) thông báo 19/6 là ngày thay đổi niêm yết có hiệu lực của 581,5 triệu cp HPG. Đây là lượngcổ phiếu Hòa Phátthực hiện phát hành tăng vốn cổ phần từ nguồn vốn chủ sở hữu theo danh sách cổ đông đăng ký cuối cùng ngày 24/5/2024. Tổng giá trị niêm yết của lượng cổ phiếu này tính theo mệnh giá đạt 5.815 tỷ đồng. Với tổng lượng cổ phiếu lưu hành gần 6,4 tỷ cổ phiếu, Hòa Phát hiện là công ty có vốn điều lệ (gần 64.000 tỷ đồng) lớn thứ 2 sàn chứng khoán Việt Nam, chỉ sau VPBank. Tại thời điểm lập danh sách họp ĐHĐCĐ thường niên 2024, tập đoàn này có đến gần 166.000 cổ đông, giảm khoảng 13.000 cổ đông so với một năm trước. Trên thị trường, cổ phiếu HPG đang dừng ở mức 28.850 đồng/cp, tăng gần 14% so với đầu năm. Giá trị vốn hóa thị của Hòa Phát tương ứng đạt 184.500 tỷ đồng, xếp thứ 4 trong danh sách các công ty niêm yết lớn nhất thị trường chứng khoán Việt Nam, sau Vietcombank, BIDV và FPT. Về kế hoạch kinh doanh năm 2024, Hòa Phát đặt mục tiêu doanh thu 140.000 tỷ và lợi nhuận sau thuế 10.000 tỷ đồng, lần lượt tăng 16% và 47% so với thực hiện năm 2023. Quý đầu năm, doanh nghiệp đầu ngành thép ghi nhận lợi nhuận sau thuế gần 2.900 tỷ đồng, gấp 7,5 lần cùng kỳ 2023. Với kết quả này, Hòa Phát đã thực hiện 29% kế hoạch lợi nhuận cả năm đề ra.  Trong báo cáo mới đây, MBS dự phóng lợi nhuận quý 2 của Hòa Phát sẽ tăng vọt 127% so với cùng kỳ năm ngoái, do sản lượng bán hàng tăng nhờ tiêu thụ thép xây dựng khả quan, giá nguyên vật liệu giảm 15% và chi phí tài chính giảm nhẹ trong bối cảnh lãi vay và tỷ giá hạ nhiệt."
2024-05-09,"Sản lượng bán hàng lần đầu vượt 800.000 tấn sau 2 năm, cổ phiếu tăng liền 4 phiên kéo vốn hóa của Hòa Phát vượt PV Gas, Vingroup, Vinhomes, Vietinbank... để xếp thứ 3 trên HoSE","Kết thúc phiên giao dịch ngày 8/5, cổ phiếu HPG của tập đoàn Hòa Phát ghi nhận mức tăng 1,82% lên 30.700 đồng/cp. Đây đã là phiên tăng thứ 4 liên tiếp của cổ phiếu này. Khối lượng khớp lệnh mỗi phiên đều ở mức cao, vài chục triệu đơn vị mỗi phiên.  Với mức giá hiện tại, vốn hóa của Hòa Phát đã đạt mức hơn 178.500 tỷ đồng (khoảng 7 tỷ USD), tăng hơn 16.000 tỷ kể từ đầu năm cho đến này. Cộng hưởng với sự đi xuống gần đây của các mã cổ phiếu bluechip, giá trị của tập đoàn thép lớn nhất Việt Nam đã vươn lên vị trí thứ 5 thị trường chứng khoán Việt Nam.Nếu chỉ xét trên sàn HoSE, vốn hóa của Hòa Phát trong những ngày qua đã lần lượt vượt PV Gas, Vietinbank, Vingroup, Vinhomes... để vươn lên vị trí thứ 3.  Sự tăng trưởng của cổ phiếu Hòa Phát trong thời gian gần đây đến từ những thông tin tích cực từ kết quả kinh doanh của công ty này. Cụ thể, trong tháng 4/2024, Hòa Phát đã sản xuất 738.000 tấn thép thô, giảm nhẹ so với tháng trước. Bán hàng các sản phẩm phôi thép, thép xây dựng, thép cuộn cán nóng (HRC) đạt 805.000 tấn, tăng 16% so với tháng 3/2024 và tăng 76% so với cùng kỳ năm trước.Đây cũng là sản lượng bán hàng cao nhất của công ty kể từ tháng 3/2022. Lũy kế 4 tháng đầu năm,sản lượng bán hàng thép xây dựng, thép HRC, phôi thép đạt 2,65 triệu tấn. Trong đó, Hòa Phát đã xuất khẩu 952.000 tấn thép, bao gồm thép xây dựng, thép chất lượng cao, thép HRC và phôi thép. Việc xuất khẩu hỗ trợ cho việc tiêu thụ sản phẩm trong thời điểm thị trường trong nước chưa thực sự khởi sắc, đồng thời đa dạng hóa kênh bán hàng.  Trước đó, trong quý 1/2024, Hòa Phát lãi sau thuế 2.869 tỷ đồng, gấp 7,5 lần cùng kỳ 2023 tuy nhiên vẫn thấp hơn đôi chút so với quý trước. Trong cơ cấu, mảng kinh doanh thép chiếm tỷ trọng lớn nhất với đóng góp lần lượt 93% doanh thu và 85% lợi nhuận sau thuế hợp nhất của Hòa Phát. Nông nghiệp đứng thứ hai về doanh thu với 5% tỷ trọng. Về lợi nhuận, vị trí này thuộc về mảng bất động sản với 9% đóng góp vào lợi nhuận sau thuế hợp nhất của tập đoàn.  Về tiềm năng trong thời gian tới của Hòa Phát, theo nhận định củaông Trần Đình Long, Chủ tịch HĐQT cho rằng tập đoàn đã trải qua thời gian khó khăn nhất, sẽ có những sự tăng trưởng nhất định trong năm 2024 nhưng khó có thể có sự đột biến.Vị tỷ phú này chỉ ra một lý do là thị trường bất động sản Việt Nam vẫn đang gặp nhiều đình trệ, khó khăn. Dù vậy, một trong những may mắn của Hòa Phát là công ty đã 'đẩy' được tồn kho giá cao, tạo thuận lợi cho năm sau. Năm 2025 có thể là một năm tốt với thép Hòa Phát. Đặc biệt, ông Trần Đình Long tiết lộ Hòa Phát đang nghiên cứu làm Tôn silic, làm cho các mô tơ điện, nghiên cứu và làm từ gốc. Đây là sản phẩm chưa công ty nào ở Việt Nam làm được. Ngoài ra, Giai đoạn 2 ở Dung Quất 2 sẽ làm đường ray xe lửa - không phải loại đường ray thông thường - mà là đường ray cho tàu tốc độ cao. Hòa Phát đã tiến hành những bước đầu tiên và sẵn sàng đấu thấu tại dự án đường sắt cao tốc Bắc – Nam. Về triển vọng 2024, SSI Research dự báo tổng sản lượng tiêu thụ thép có thể phục hồi hơn 6% so với cùng kỳ trong năm 2024, trong đó tiêu thụ nội địa đạt mức tăng trưởng gần 7%. Mức tiêu thụ thép cũng sẽ được hỗ trợ nhờ tình hình vĩ mô và thị trường bất động sản khởi sắc hơn. Trong chu kỳ trước, tiêu thụ thép xây dựng năm 2013 đã tăng khoảng 3% so với mức đáy năm 2012. Bên cạnh đó, khối lượng xuất khẩu có thể duy trì tăng trưởng nhờ triển vọng nhu cầu toàn cầu tích cực. Theo hiệp hội thép thế giới, nhu cầu thép thế giới dự kiến sẽ tăng 1,9% trong năm 2024 so với 1,8% trong năm 2023. Nhu cầu từ các nền kinh tế phát triển dự kiến sẽ tăng 2,8% trong năm 2024 sau khi giảm 1,8% trong năm 2023. Trong khi đó, nhu cầu từ các nước ASEAN (trừ Việt Nam) dự kiến sẽ tăng tăng 5,2% trong năm 2024, cao hơn mức 3,8% trong năm 2023. Đội ngũ phân tích SSI Research kỳ vọng lợi nhuận của các công ty thép sẽ đạt mức tăng trưởng cao trong năm 2024 từ mức nền thấp năm 2023 nhờ sản lượng tiêu thụ cải thiện, đặc biệt là củaHPGvà HSG, và biên lợi nhuận gộp tăng trở lại từ mức thấp trong nhiều năm do giá thép nhiều khả năng đã kết thúc xu hướng giảm của những năm trước. "
2024-03-05,"“Gã khổng lồ” ngành hàng không vừa có thêm 2 tỷ USD vốn hóa từ đầu năm, giá trị vượt Hòa Phát, Vingroup, Vinamilk và nhiều ngân hàng","Nhắc đến nhóm doanh nghiệp giá trị nhất sàn chứng khoán, không thể không kể đếnCảng hàng không (ACV)– ""gã khổng lồ"" ngành hàng không đang giao dịch trên UPCoM. Từ đầu 2024 đến nay, cổ phiếu này đã tăng hơn 30% qua đó leo lên vùng giá cao nhất trong vòng 15 tháng kể từ đầu tháng 12/2022.  Giá trị vốn hóa của ACV cũng theo đó tăng thêm gần 44.000 tỷ (~2 tỷ USD), lên trên 188.000 tỷ đồng (~7,7 tỷ USD). Con số này vượt trội hoàn toàn so với phần còn lại trên UPCoM, gần gấp đôi vốn hóa của Viettel Global (VGI), Masan Consumer (MCH) và gấp hơn 3 lần giá trị của Lọc hoá dầu Bình Sơn (BSR), VEAM (VEA),… Đà tăng mạnh từ đầu năm đưa ACV ""chễm chệ"" ở vị trí thứ 5 trong danh sách các doanh nghiệp lớn nhất toàn sàn chứng khoán, đứng trên hàng loạt cái tên ""đình đám"" như Hòa Phát,Vingroup,Vinamilk, VPBank, Techcombank,… Mức vốn hóa của ACV hiện chỉ kém ""Big 3"" ngành ngân hàng Vietcombank, BIDV, VietinBank và Vinhomes.  ACV được thành lập năm 2012 trên cơ sở hợp nhất các Tổng Công ty Cảng hàng không ở 3 miền Bắc – Trung – Nam. Năm 2015, tổng công ty được cổ phần hóa và chính thức hoạt động dưới hình thức công ty cổ phần từ ngày 1/4/2016 với vốn điều lệ 21.771 tỷ đồng, trong đó cổ đông Nhà nước nắm giữ 95,4% vốn cổ phần. Gần 2,18 tỷ cổ phiếu ACV chính thức lên giao dịch trên UPCoM ngày 21/11/2016 với giá tham chiếu 25.000 đồng/cp, tương ứng định giá ban đầu khoảng 54.400 tỷ đồng (~2,3 tỷ USD). Sau hơn 7 năm thăng trầm trên thị trường chứng khoán, giá trị vốn hóa của ""ông trùm"" cảng hàng không đã tăng gấp 3 lần. ""Gã khổng lồ"" nắm 22 sân bay ACV hiện đang nắm độc quyền cung cấp các dịch vụ hàng không cho các hãng bay trong và ngoài nước như dịch vụ an ninh, dịch vụ mặt đất, phục vụ hành khách, cất cánh và hạ cánh… Tổng công ty được giao quản lý, điều phối hoạt động và đầu tư khai thác toàn bộ hệ thống 22 cảng hàng không trên toàn lãnh thổ Việt Nam bao gồm 9 sân bay quốc tế và 13 sân bay nội địa. Tổng công ty hiện có 2 công ty con là Dịch vụ Nhiên liệu Hàng không Nội Bài (NAFSC) và Dịch vụ Bảo dưỡng máy bay Cảng hàng không Miền Nam (SAAM). Ngoài ra, ACV còn có 10 công ty liên kết, chủ yếu hoạt động trong lĩnh vực dịch vụ hàng không, trong đó có nhiều cái tên trên sàn chứng khoán như Dịch vụ Hàng không Sân bay Tân Sơn Nhất (SASCO – mã SAS), Phục vụ Mặt đất Sài Gòn (SAGS – mã SGN), Dịch vụ Hàng hóa Sài Gòn (mã SCS),… Sau khi lên sàn chứng khoán, kết quả kinh doanh của ACV liên tục được cải thiện với doanh thu và lợi nhuận tăng trưởng qua từng năm trước khi Covid-19 xuất hiện. Sau giai đoạn 2020-2021 khó khăn, ACV đã nhanh chóng tăng trưởng trở lại sau khi đại dịch được đẩy lùi và nền kinh tế bước vào pha hồi phục.  Trong năm 2023, ACV phục vụ 113,5 triệu lượt hành khách, tăng 15% so với năm 2022, trong đó khách quốc tế đạt 32,6 triệu lượt khách, tăng 173%; Tổng hàng hóa bưu kiện thông qua đạt 1,2 triệu tấn; Tổng hạ cất cánh đạt 710.000 lượt chuyến. Nhờ đó, doanh thu đạt kỷ lục trên 20.000 tỷ đồng, tăng 45% so với năm trước. Lợi nhuận sau thuế cũng tăng gần 21% so với năm 2022, đạt gần 8.600 tỷ đồng, cao nhất ACV từng đạt được kể từ khi hoạt động. Tiếp tục ""cất cánh"" Năm 2024, ngành hàng không được kỳ vọng sẽ tiếp tục hồi phục. Lượng hành khách quốc tế theo giả định trong kịch bản cơ sở của SSI Research, sẽ tăng trở lại mức của năm 2019 ở quý 4/2024 trong khi lượng hành khách nội địa dự kiến sẽ đi ngang. Theo IATA, ngành hàng không khu vực Châu Á-Thái Bình Dương có tiềm năng tăng trưởng mạnh nhất với tốc độ 4,5%/năm đến năm 2050 xét về lượng hành khách và Việt Nam là một trong những quốc gia tăng trưởng nhanh nhất khu vực. Sự hồi phục của ngành hàng không sẽ là điểm tựa để ACV có thể tiếp tục tăng trưởng trong năm tới. Bên cạnh đó, việc sửa đổi nghị định 91/2015 sắp tới sẽ cho phép ACV trả cổ tức bằng cổ phiếu để tăng vốn điều lệ và cho phép ACV có đủ vốn đối ứng cho các dự án mở rộng lớn qua đó trở thành chất xúc tác tốt cho cổ phiếu. Hiện nay, ACV đang là chủ đầu tư của nhiều dự án hàng không, với tổng mức đầu tư các dự án đang triển khai hơn 133.000 tỷ đồng. Trong đó, đáng chú ý nhất là dự án Cảng hàng không quốc tế Long Thành, nhà ga hành khách T3 Cảng hàng không quốc tế Tân Sơn Nhất. Về Dự án thành phần 3 các công trình thiết yếu trong cảng hàng không thuộc Dự án đầu tư xây dựng Cảng hàng không quốc tế Long Thành giai đoạn 1, đến thời điểm hiện tại, tiến độ thực hiện các hạng mục của Dự án bám sát kế hoạch, đáp ứng theo đúng chỉ đạo của Chính phủ. Chứng khoán DSC đánh giá đây là câu chuyện kỳ vọng dài hạn của ACV. Với thời gian hoàn thành dự kiến trong 4 năm, giai đoạn 2024-2027 sẽ là giai đoạn ACV dồn lực về vốn. Dự kiến vốn đầu tư xây dựng cơ bản rơi vào mức 4,2 tỷ USD, gấp hơn 2 lần dòng tiền từ hoạt động kinh doanh. Về Dự án xây dựng nhà ga hành khách T3 Cảng hàng không quốc tế Tân Sơn Nhất, ACV đã khởi công gói thầu số 12 ""Thi công xây dựng và lắp đặt thiết bị nhà ga hành khách T3"" với giá trị hợp đồng 9.034 tỷ đồng vào ngày 31/08/2023. ""Hiện tại, công tác giải phóng mặt bằng cơ bản được giải quyết, tình hình thi công đảm bảo tiến độ và theo đúng kế hoạch, việc kết thúc thi công phần móng cọc phù hợp với thời gian thực hiện gói thầu số 12"", đại diện ACV cho biết."
2024-06-25,Sản lượng xuất khẩu tôn mạ của Hòa Phát tăng gần gấp đôi so với cùng kỳ,"Hàng xuất khẩu thép cuộn mạ kẽm, mạ lạnh và tôn mạ màu hiện chiếm 60-70% tổng sản lượng sản xuất của Nhà máy Tôn mạ màu Hòa Phát. Toàn bộ dây chuyền sản xuất của Tôn Hòa Phát đang vận hành tốt, phục vụ nhu cầu trong nước và đáp ứng các tiêu chuẩn kỹ thuật cao của đối tác nước ngoài với những yêu cầu bề mặt sản phẩm đặc thù và hướng tới sản phẩm thép xanh. Công ty Tôn Hòa Phát đã được BSI – Tổ chức chứng nhận quốc tế hàng đầu của Vương quốc Anh kiểm tra xác nhận báo cáo kiểm kê khí nhà kính cho doanh nghiệp theo tiêu chuẩn ISO 14064-1:2018 và xác nhận Báo cáo Dấu vết Carbon trên Sản phẩm theo ISO 14067:2018 cho các dòng sản phẩm của Tôn Hòa Phát. Đây cũng là một trong những hoạt động mà doanh nghiệp sản xuất thép, tôn phải triển khai, làm tiền đề đáp ứng các yêu cầu khác khi xuất khẩu hàng hóa ra thị trường thế giới, nhất là khu vực châu Âu. Nhà máy Tôn Hoà Phát được trang bị dây chuyền thiết bị công nghệ đồng bộ hiện đại nhập khẩu từ các nước G7. Sau khi Khu liên hợp gang thép Hòa Phát Dung Quất 2 đi vào hoạt động, Hòa Phát sẽ trở thành công ty duy nhất của Việt Nam có chuỗi sản xuất khép kín từ đầu vào quặng sắt, thép cán nóng, thép cán nguội và các sản phẩm cuối gồm tôn mạ kẽm, mạ lạnh, phủ sơn. Đây là lợi thế rất lớn, giúp Hòa Phát kiểm soát, đảm bảo chất lượng sản phẩm ổn định từ khâu nguyên liệu đến đầu ra.  Trong những năm qua, Công ty liên tục nhận nhiều các đơn hàng lớn từ đối tác thương mại lớn và người mua từ Châu Âu và Châu Mỹ. Sản phẩm tôn mạ thương hiệu Tôn Hoà Phát được đánh giá cao về chất lượng sản phẩm (cơ lý tính, bề mặt), là lựa chọn của nhiều khách hàng lớn, cung cấp cho nhiều dự án công trình nhà ở, nhà xưởng ở Bắc Mỹ, Tây Âu và Anh Quốc... Một số khách hàng lớn, vốn chỉ mua các sản phẩm đặc chủng yêu cầu chất lượng cao từ Hoa Kỳ, nay đã tin tưởng chọn Tôn Hòa Phát là đối tác cung cấp duy nhất từ Việt Nam, thay thế cho hàng mua trong nước. Việc tuân thủ quy trình kiểm soát chất lượng nghiêm ngặt và các nguyên tắc xuất xứ hàng hóa đã nâng tầm chất lượng sản phẩm của Tôn Hòa Phát. Ngoài ra, danh mục hàng hóa đa dạng cùng quy trình quản trị chuyên nghiệp, dịch vụ sau bán hàng chu đáo và trách nhiệm là những yếu tố giúp Tôn Hoà Phát tạo dựng được niềm tin với khách hàng trong nước và quốc tế. Với những kết quả đạt được những tháng đầu năm, Công ty TNHH Tôn Hòa Phát dự kiến sẽ hoàn thành vượt mức kế hoạch của Tập đoàn giao cho năm 2024."
2024-04-10,"Một DN dành gần 20% tài sản cho cổ phiếu, rót hơn 5.000 tỷ vào HPG, MWG, TCB, ACB…, riêng PVD đầu tư từ 11,5 triệu lên 249 tỷ"," Mới đây, Công ty TNHH Bảo hiểm Nhân thọ Cathay Việt Nam (Cathay Life Việt Nam) đã công bố báo cáo tài chính đã kiểm toán năm 2023. Theo đó, tại ngày 31/12/2023, tổng tài sản của Cathay Life ở mức 27.548 tỷ đồng, tăng 12% so với hồi đầu năm, trong đó, các khoản đầu tư tài chính dài hạn chiếm phần lớn với 20.555 tỷ đồng, tăng gần 1 nửa so với hồi đầu năm. Trong khi đó, các khoản đầu tư tài chính ngắn hạn giảm 48% ở mức 4.738 tỷ đồng. Trong số 25.293 tỷ đồng đầu tư tài chính, Cathay Life dành hơn 5.300 tỷ đồng để đầu tư cổ phiếu, tương ứng với tỷ trọng của cổ phiếu trong danh mục đầu tư của Cathay Life là gần 21%, chiếm 19% tổng tài sản. Xét cả về giá trị lẫn tỷ trọng thì đây đều là con số lớn và hiếm có doanh nghiệp nào dành nhiều tiền như vậy để đầu tư cổ phiếu. Cathay Life đang nắm giữ nhiều cổ phiếu nằm trong nhóm VN30 như MBB, MWG, ACB, FPT, HPG, TCB. Trong đó, những cổ phiếu được đầu tư nhiều nhất là MBB với 359 tỷ đồng, MWG hơn 358 tỷ, ACB gần 331 tỷ, .... Đáng chú ý, trong năm qua, khoản đầu tư vào PVD của Cathay Life đã tăng mạnh từ 11,5 triệu đồng lên gần 249 tỷ đồng. Ngoài ra, công ty còn đầu tư gần 3.353 tỷ đồng vào các cổ phiếu khác. Hiện nay, Cathay Life đang phải dự phòng hơn 325 tỷ đồng cho giảm giá cổ phiếu.  Cathay Life Việt Nam là chi nhánh tại Việt Nam của Công ty TNHH BHNT Cathay, trực thuộc tập đoàn tài chính hàng đầu Cathay. Công ty TNHH BHNT Cathay thành lập tháng 08 năm 1962, hiện nay tại Đài Loan (Trung Quốc), công ty BHNT Cathay là thương hiệu số một trong ngành bảo hiểm nhân thọ. Năm 2023, Cathay Life ghi nhận lợi nhuận trước thuế đạt 1.682 tỷ đồng, gấp 2,2 lần kết quả năm 2022 và lợi nhuận sau thuế đạt 1.445 tỷ đồng, gấp 1,9 lần năm 2022. Phần lớn lợi nhuận của Cathay Life đến từ hoạt động tài chính. Theo đó, năm 2023, doanh thu từ hoạt động tài chính của Cathay Life đạt 2.041 tỷ đồng và lợi nhuận gộp từ hoạt động tài chính đạt 2.088 tỷ đồng, lần lượt tăng 21% và 93% so với năm 2022. Phần lớn doanh thu từ hoạt động tài chính của Cathay Life đến từ thu nhập từ lãi đầu tư trái phiếu và thu nhập từ lãi tiền gửi. Lãi từ kinh doanh chứng khoán đạt 378 tỷ đồng. Do được hoàn trích lập dự phòng giảm giá chứng khoán nên chi phí hoạt động tài chính của Cathay Life trong năm nay giảm mạnh.  Trong khi đó, doanh thu thuần từ hoạt động kinh doanh bảo hiểm là 2.841 tỷ đồng và lợi nhuận gộp từ hoạt động kinh doanh bảo hiểm đạt hơn 577 tỷ đồng."
2024-10-14,"Hòa Phát lãi hơn 3.000 tỷ trong quý 3/2024, tăng 51% so với cùng kỳ","Quý 3/2024, Tập đoàn Hòa Phát (mã chứng khoán:HPG) ghi nhận 3.022 tỷ đồng lợi nhuận sau thuế, tăng 51% so với cùng kỳ năm trước. Trước đó, doanh nghiệp này cũng đã công bố doanh thu thuần đạt 34.000 tỷ đồng, tăng 19%. Lũy kế 9 tháng, Hòa Phát ghi nhận hơn 105 nghìn tỷ đồng doanh thu tương đương hơn 4 tỷ USD, tăng 23% so với cùng kỳ năm trước (85.431 tỷ đồng), hoàn thành 75% kế hoạch năm 2024. Lợi nhuận sau thuế đạt 9.210 tỷ đồng, tăng 140% so với cùng kỳ năm trước. Đóng góp chính vào kết quả này là thép và các sản phẩm liên quan với 85%, tiếp đến là lĩnh vực nông nghiệp.  Doanh thu bán hàng tăng, biên lợi nhuận một số lĩnh vực kinh doanh được cải thiện như thép, nông nghiệp đã giúp lợi nhuận của Tập đoàn tăng trưởng. Cụ thể: Nhóm thép lợi nhuận tăng 42%, nhóm nông nghiệp tăng 80% so với cùng kỳ năm trước. Lĩnh vực cho thuê hạ tầng khu công nghiệp duy trì biên lợi nhuận ổn định ở mức 39%. Sản lượng thép xây dựng, thép chất lượng cao quý 3 đạt gần 1,1 triệu tấn, giảm 14% so với quý trước (1,27 triệu tấn). Thị phần thép xây dựng trong nước vẫn duy trì vị thế dẫn đầu với 38%. Thép cuộn cán nóng đạt 738.000 tấn, tương đương quý 2.Lũy kế 9 tháng năm 2024, Tập đoàn Hòa Phát sản xuất 6,4 triệu tấn thép thô, tăng 34% so với cùng kỳ 2023. Sản lượng bán hàng thép các loại (chưa bao gồm sản phẩm ống thép, tôn mạ) đạt 6,1 triệu tấn, tăng 32%. Trong đó, thép xây dựng, thép chất lượng cao đóng góp 3,3 triệu tấn, tăng 29%. Thép cuộn cán nóng (HRC) đạt 2,27 triệu tấn và phôi thép đạt 505.000 tấn. Đối với các sản phẩm thép hạ nguồn, Ống thép đạt 503.000 tấn tăng 3% so với 9 tháng đầu năm 2023. Tôn Hòa Phát đạt sản lượng 344.000 tấn tăng 43% so với cùng kỳ, vượt số cả năm 2023 (329.000 tấn). Hòa Phát hiện ﻿đang dồn lực triển khai xây dựng dự án Khu liên hợp sản xuất gang thép Hòa Phát Dung Quất 2, quy mô 5,6 triệu tấn thép cuộn cán nóng/năm. Theo tiến độ hiện nay, phân kỳ 1 dự kiến sẽ có sản phẩm chạy thử nóng lò cán đầu tiên vào cuối năm 2024. "
