publish_date,title,content
2024-03-12,"Hòa Phát dự kiến có năm thứ hai liên tiếp không chia cổ tức tiền mặt, doanh thu 140.000 tỷ, thưởng gần 600 triệu cổ phiếu cho cổ đông","Tập đoàn Hòa Phát (mã chứng khoán:HPG) vừa công bố một số nội dung trong cuộc họp ĐHĐCĐ thường niên năm 2024. Theo đó, ""vua"" thép đặt mục tiêu năm tới mang về doanh thu 140.000 tỷ đồng, lợi nhuận sau thuế 10.000 tỷ đồng, lần lượt tăng 18% và 47% so với thực hiện năm 2023. Nếu đạt được đây sẽ là mức doanh thu cao thứ 3 trong lịch sử và lợi nhuận cao nhất từ 2022.  Về phân phối lợi nhuận, với khoảng 6.800 tỷ lợi nhuận sau thuế, Hòa Phát dự kiến trích 340 tỷ đồng cho Quỹ khen thưởng, phúc lợi và 68 tỷ đồng để trả thù lao HĐQT và Ban kiểm soát. Lợi nhuận còn lại sau khi trích quỹ còn đến 6.392 tỷ đồng. Như vậy, Hòa Phát có thể sẽ có năm thứ hai liên tiếp không trả cổ tức bằng tiền Thay vào đó, HĐQT công ty đề xuất phương án thưởng cổ phiếu cho cổ đông với tỷ lệ 10%. Cụ thể, Hòa Phát sẽ phát hành hơn 581 triệu cổ phiếu, nhằm tăng vốn điều lệ lên mức 63.962 tỷ đồng. Nguồn vốn được lấy từ thặng dư vốn cổ phần 3.212 tỷ đồng và một phần lợi nhuận sau thuế chưa phân phối với giá trị 2.603 tỷ đồng. Thời gian thực hiện trong quý 2/2024 sau khi được UBCKNN chấp thuận. Về phương án phân phối lợi nhuận cho năm 2024, Hòa Phát dự định trích tối đa 5% lợi nhuận thực đạt cho Quỹ khen thưởng, phúc lợi và trích tối đa 5% lợi nhuận sau thuế vượt kế hoạch để thưởng Ban điều hành. Đáng chú ý là công ty của tỷ phú Trần Đình Long muốn cổ đông chấp thuận kế hoạch chi trả cổ tức năm 2024 với tỷ lệ dự kiến 10%. Về tình hình kinh doanh năm 2023, Hòa Phát đạt 120.355 tỷ đồng doanh thu, giảm 16% so với cùng kỳ năm trước. Lợi nhuận sau thuế là 6.800 tỷ đồng, tương ứng hoàn thành 85% kế hoạch năm. Lũy kế 2 tháng đầu năm 2023, tập đoàn Hòa Phát sản xuất 1,38 triệu tấn thép thô, tăng 71% so với cùng kỳ năm 2023. Bán hàng các sản phẩm thép HRC, thép xây dựng, thép chất lượng cao, phôi thép đạt 1,15 triệu tấn, tăng 32% so với cùng kỳ. Trong đó, thép xây dựng, thép chất lượng cao đạt 575.000 tấn, giảm 2% so với 2 tháng đầu 2023. Thép HRC đóng góp 542.000 tấn, tăng gấp đôi so với cùng kỳ năm trước. Với các sản phẩm hạ nguồn HRC, Ống thép Hòa Phát ghi nhận 88.000 tấn sau 2 tháng, giảm 17%. Tôn mạ các loại đạt sản lượng 66.000 tấn, tăng 39%, chủ yếu nhờ sản lượng xuất khẩu tôn 2 tháng qua tốt hơn so với cùng kỳ 2023."
2024-08-22,Tỷ phú Trần Đình Long đích thân kiểm tra đốc thúc tiến độ 'cú đấm thép' 85.000 tỷ của Hòa Phát,"Mới đây, các lãnh đạo của Hòa Phát (mã chứng khoán:HPG) gồm Chủ tịch HĐQT Trần Đình Long và Phó Chủ tịch Nguyễn mạnh Tuấn đã kiểm tra đốc thúc tiến độ Dự án Khu liên hợp sản xuất gang thép Hòa Phát Dung Quất 2. ﻿Báo cáo tiến độ với lãnh đạo Tập đoàn, ông Mai Văn Hà, Giám đốc Thép Hòa Phát Dung Quất cho biết, hiện tại dự án Dung Quất 2 đã hoàn thành 80% tiến độ phân kỳ 1 và 50% phân kỳ 2. Dự kiến, phân kỳ 1 sẽ hoàn thành lắp đặt thiết bị dây chuyền sản xuất thép cuộn cán nóng vào giữa tháng 9/2024, sau đó Công ty sẽ tiến hành chạy thử nguội, căn chỉnh thiết bị. Theo tiến độ hiện nay, phân kỳ 1 dự kiến sẽ có sản phẩm chạy thử nóng đầu tiên vào cuối năm 2024. Thị sát các hạng mục tại dự án Hòa Phát Dung Quất 2,tỷ phú Trần Đình Longghi nhận sự nỗ lực của ban lãnh đạo Công ty và các nhà thầu. Chủ tịch Hòa Phát nhấn mạnh, dự án là sự cụ thể hóa chiến lược hướng mạnh vào sản xuất thép cán nóng chất lượng cao, phục vụ cơ khí chế tạo, đưa Hòa Phát vào giai đoạn phát triển mới. Với tính chất quan trọng đó, ông Trần Đình Long yêu cầu công ty tập trung tối đa nhân lực, vật lực cùng với các nhà thầu, nhà cung cấp để đưa dự án vào hoạt động theo đúng tiến độ và chất lượng đã đề ra. Dự án Khu liên hợp sản xuất gang thép Hòa Phát Dung Quất 2. Khu liên hợp sản xuất gang thép Hòa Phát Dung Quất 2 có quy mô 280 ha, tổng vốn đầu tư 85.000 tỷ đồng, công suất thiết kế 5,6 triệu tấn thép cuộn cán nóng (HRC) chất lượng cao/năm. Theo kế hoạch, phân kỳ 1 của dự án sẽ đi vào hoạt động vào đầu quý 1/2025. Phân kỳ 2 hoàn thiện và hoạt động vào quý 4/2025. Nhằm đảm bảo cho dự án triển khai theo đúng kế hoạch đề ra, trên công trường, hàng trăm nhà thầu đang dồn lực ngày đêm vừa thi công xây dựng vừa lắp đặt thiết bị. Theo thiết kế, thể tích lò cao của dự án Dung Quất 2 là 2500m3, gấp đôi thể tích lò của Dung Quất 1, giúp tiêu hao năng lượng thấp hơn. Dự án được triển khai từ quý 1/2022. Dự kiến, khi hoàn thành vào quý 1/2025, năng lực sản xuất thép thô của Hòa Phát đạt trên 14,5 triệu tấn mỗi năm, trong đó có 8,6 triệu tấn HRC. ﻿Với dây chuyền sản xuất thép cuộn cán nóng HRC hiện đại thi công thiết kế chế tạo của Tập đoàn Primetal, Hòa Phát Dung Quất 2 sẽ tập trung phát triển các sản phẩm HRC chất lượng cao, phục vụ thép sản xuất ô tô, thép hàm lượng carbon thấp sản xuất các sản phẩm như vỏ đồ hộp, đồ gia dụng, kết cấu thép, thép HRC cho sản xuất vỏ container cường độ cao, kháng thời tiết…"
2024-10-01,"Giá thép tăng nóng sau quyết định quan trọng của Trung Quốc, Hòa Phát của tỷ phú Trần Đình Long “vượt ngàn chông gai” từ khối ngoại","Sau khi Ngân hàng Nhân dân Trung Quốc (PBOC) công bố kế hoạch tung ra gói kích thích tiền tệ lớn và quan trọng nhất kể từ thời Covid để ngăn chặn sự lao dốc không phanh của thị trường nhà ở, giá thép thế giới ngay lập tức tăng nóng. Chỉ sau vài ngày, giá thép thanh tương lai đã tăng 10% lên trên 3.400 CNY/tấn, ghi nhận mức cao nhất trong hơn 3 tháng.  Theo MBS, giá thép có thể tiếp tục phục hồi dự báo chủ yếu do nguồn cung thắt chặt kể từ quý 4/2024. Về nhu cầu, tiêu thụ thép có thể phục hồi trong ngắn hạn do một số thành phố như Thượng Hải và Giang Tô có kế hoạch tái thiết cơ sở hạ tầng. Giá thép nội địa có thể phục hồi kể từ quý 4/2024 do áp lực từ Trung Quốc giảm và nhu cầu cải thiện (nhờ nguồn cung thị trường nhà ở ấm lên và đẩy mạnh đầu tư công). Xu hướng hồi phục của giá thép mang đến hiệu ứng tích cực đối với cổ phiếu thép trên sàn chứng khoán Việt Nam,Hòa Phát (HPG)đương nhiên cũng không ngoại lệ. Cổ phiếu này đã tăng hơn 6% từ giữa tháng 9, lên cao nhất trong vòng 2 tháng. Tuy nhiên, đà hồi phục của cổ phiếu đầu ngành thép vẫn còn nhiều “chông gai”, đặc biệt là áp lực rất lớn đến từ khối ngoại.  Theo thống kê, khối ngoại đã có 4 tháng “xả hàng” liên tiếp cổ phiếu HPG. Chỉ tính riêng từ đầu tháng 8 đến nay, nhà đầu tư nước ngoài đã bán ròng tổng cộng 144 triệu cổ phiếu, giá trị tương ứng lên đến 3.700 tỷ đồng. Không có cổ phiếu nào trên sàn bị bán ròng mạnh hơn HPG trong khoảng thời gian này. Đây cũng là con số kỷ lục trong nhiều năm qua đối với riêng Hòa Phát. Trước đó vào cuối tháng 6, hơn 581 triệu cổ phiếu HPG do Hòa Phát phát hành để thưởng cho cổ đông với tỷ lệ 10%, đã được giao dịch sau khi niêm yết bổ sung. Với tỷ lệ sở hữu của nhà đầu tư nước ngoài chiếm khoảng 1/4 vốn điều lệ, ước tính khối ngoại có thêm khoảng 130 triệu cổ phiếu HPG từ đợt phát hành này. Nhiều khả năng, nguồn cungcổ phiếu HPGthời gian qua đến từ động thái trên.  Mùa xuân đến sớm? Với những tín hiệu lạc quan từ giá thép thế giới, MBS đánh giá Hòa Phát và các doanh nghiệp thép sẽ hưởng lợi vào cuối năm bởi: (1) Tiêu thụ nội địa là động lực chính cho chu kỳ tăng trưởng trong 2 năm tới và giá thép có thể phục hồi kể từ quý 4/2024; (2) Các nhà sản xuất trong nước sẽ có thể giành được thị phần nhờ thuế chống bán phá giá sẽ được ban hành từ tháng 12/2024; (3) Mức định giá của các công ty thép vẫn ở dưới mức trung bình trong giai đoạn tăng trưởng của chu kỳ thép. Đồng quan điểm, báo cáo mới đây của Chứng khoán Bảo Việt (BVSC) kỳ vọng sản lượng tiêu thụ thép trong 2 quý cuối năm sẽ tiếp tục duy trì mức tăng hai chữ số so với cùng kỳ nhờ các chương trình thúc đẩy nền kinh tế của Chính phủ dần có hiệu quả và việc xây dựng lại các công trình sau bão Yagi. Trong trung hạn, BVSC cho rằng, động lực thúc đẩy kết quả kinh doanh của Hòa Phát còn đến từ việc đưa vào vận hành dự án Khu liên hợp sản xuất gang thép Hòa Phát Dung Quất 2 với công suất tối đa đạt 5,6 triệu tấn thép/năm, tập trung vào dòng thép cuộn cán nóng (HRC) và các dòng thép chất lượng cao. Dự kiến, giai đoạn 1 và giai đoạn 2 của Dung Quất 2 sẽ đi vào hoạt động cuối 2024 và cuối năm 2025, nâng công suất thép thô của Hòa Phát thêm 8,6 triệu tấn/năm với sản phẩm chủ lực là HRC. Ước tính dự án Dung Quất 2 ghi nhận doanh thu khoảng 70.000-80.000 tỷ đồng (sau khi chạy full công suất), đóng góp 25%-30% biên lợi nhuận của Hòa Phát BVSC cũng kỳ vọng khả năng cao Bộ Công Thương sẽ áp thuế chống bán phá giá thép HRC nhập khẩu từ Trung Quốc và Ấn Độ, điều này có thể hỗ trợ các nhà sản xuất thép HRC có năng lực tranh về giá với thép nhập khẩu từ Trung Quốc, trong đó có Hòa Phát."
2024-04-11,"Ông Trần Đình Long: Tuổi tôi không phải cao mà là rất cao, đến tuổi hưu rồi, đang rút dần ra khỏi các hoạt động của Hòa Phát"," Ngày 11/4, Tập đoàn Hòa Phát tổ chức Đại hội đồng cổ đông thường niên năm 2024 tại khách sạn Melia Hà Nội. Mở đầu đại hội, ông Trần Đình Long, Chủ tịch Tập đoàn cho biết, bản thân ông đang rút dần ra khỏi các hoạt động của Hòa Phát. ""Hòa Phát thành lập từ 1992, đến nay là 32 năm, lên sàn từ 2007, cũng là một quá trình đủ dài, tính công khai minh bạch cũng như vận hành rất rõ ràng. Sau quá trình dài xây dựng tổ chức, quy chế, Hòa Phát hiện nay tách bạch rất rõ. Nếu hỏi về hoạt động kinh doanh, mọi người đừng hỏi tôi vì sự thật là tôi đang rút ra dần ra. Năm nay tôi cũng đã 64 tuổi, bình thường theo Nhà nước là nghỉ hưu lâu rồi. Giờ đây, anh Nguyễn Việt Thắng làm là chính. Cái gì về chiến lược, quy chế, nhân sự tổ chức cấp cao, vốn liếng sẽ do Hội đồng quản trị, do tôi đại diện phụ trách Còn về điều hành hàng ngày, về thép, về giá bán tôi không biết đâu, vì có biết cũng chẳng để làm gì. Các việc như mua nguyên vật liệu, bán cho ai sẽ do ban điều hành làm. Nếu mọi người nghĩ cứ Hòa Phát là ông Long làm hết thì không phải đâu"", Chủ tịchTrần Đình Longchia sẻ."
2024-07-31,"Cập nhật BCTC quý 2/2024 chiều ngày 31/7: những doanh nghiệp lớn cuối cùng công bố, Hòa Phát ra số liệu sau nhiều chờ đợi","Các doanh nghiệp mới công bố báo cáo tài chính quý 2/2024 ngày 31/7:  Doanh thu tăng 34%,Tập đoàn Hòa Phát (HPG)báo lãi trước thuế hơn 3.733 tỷ đồng, tăng 119% so với cùng kỳ, lãi sau thuế 3.320 tỷ đồng - tăng 129%. Lũy kế 6 tháng đầu năm, Hòa Phát lãi trước thuế 6.994 tỷ đồng, tăng 213% so với cùng kỳ, lãi sau thuế 6.189 tỷ đồng.  Vietjet (VJC)công bố BCTC hợp nhất quý 2/2024 với lợi nhuận trước thuế đạt gần 635 tỷ đồng, tăng gần 195 lần so với cùng kỳ năm 2023. Lũy kế 6 tháng đầu năm, Vietjet lãi trước thuế hơn 1.311 tỷ đồng, tăng hơn 4 lần so với cùng kỳ. Ngân hàng TMCP Ngoại Thương Việt Nam (Vietcombank - Mã: VCB)vừa công bố báo cáo tài chính quý 2 với lợi nhuận hợp nhất trước thuế đạt hơn 10.116 tỷ đồng, tăng 9% so với cùng kỳ 2023. Luỹ kế 6 tháng đầu năm, lợi nhuận hợp nhất trước thuế của Vietcombank đạt gần 20.835 tỷ đồng, tăng 1,6% so với cùng kỳ 2023. VietinBank (CTG)ghi nhận lợi nhuận trước thuế quý 2 đạt 6.750 tỷ đồng, tăng 3% so với cùng kỳ. Luỹ kế 6 tháng đầu năm, lợi nhuận hợp nhất trước thuế của VietinBank đạt 12.960 tỷ đồng, tăng 3% so với cùng kỳ 2023. Lợi nhuận trước thuế quý 2/2024 củaMB(MBB)đạt 7.633 tỷ đồng, tăng 22,7% so với cùng kỳ. Theo đó, lợi nhuận trước thuế hợp nhất 6 tháng đầu năm 2024 đạt 13.428 tỷ đồng, tăng 5,4%.  Petrolimex (PLX)ghi nhận lợi nhuận trước thuế đạt 1.503 tỷ đồng, tăng hơn 41% so với cùng kỳ. Lợi nhuận sau thuế đạt 1.275 tỷ, tăng 43% so với cùng kỳ. Lũy kế 6 tháng đầu năm, Petrolimex ghi nhận doanh thu thuần đạt 148.943 tỷ đồng và lợi nhuận sau thuế đạt 2.407 tỷ đồng, lần lượt tăng gần 12% và 54% so với cùng kỳ. Doanh thu tài chính trong quý 2/2024 tăng gấp 5 lần cùng kỳ lên 3.952 tỷ đồng,Novaland (NVL)báo lãi sau thuế 946 tỷ đồng, cải thiện đáng kể so với khoản lỗ 684 tỷ đồng của quý 2/2023. Lũy kế 6 tháng đầu năm 2024, Novaland ghi nhận lợi nhuận sau thuế của công ty đạt 345 tỷ đồng, tăng mạnh so với khoản lỗ 1.094 tỷ đồng của nửa đầu năm 2023. NSH Petro (PSH)báo lỗ sau thuế quý 2 hơn 344 tỷ đồng, lũy kế 6 tháng đầu năm, công ty lỗ 374 tỷ đồng. Thế Giới Di Động (MWG)ghi nhận doanh thu 34.495 tỷ đồng, lãi trước thuế 1.516 tỷ đồng, lần lượt tăng 15% và 1.000% so với cùng kỳ năm trước. Đây cũng là khoản lợi nhuận cao nhất của công ty này trong 9 quý. "
2024-04-11,Tỷ phú Trần Đình Long: Tôi đang rút dần khỏi Hòa Phát,"Ngày 11/4, Tập đoàn Hòa Phát tổ chức Đại hội đồng cổ đông thường niên năm 2024 tại khách sạn Melia Hà Nội. Mở đầu đại hội, ông Trần Đình Long, Chủ tịch Tập đoàn cho biết, bản thân ông đang rút dần ra khỏi các hoạt động của Hòa Phát. ""Hòa Phát thành lập từ 1992, đến nay là 32 năm, lên sàn từ 2007, cũng là một quá trình đủ dài, tính công khai minh bạch cũng như vận hành rất rõ ràng. Sau quá trình dài xây dựng tổ chức, quy chế, Hòa Phát hiện nay tách bạch rất rõ. Nếu hỏi về hoạt động kinh doanh, mọi người đừng hỏi tôi vì sự thật là tôi đang rút ra dần ra. Năm nay tôi cũng đã 64 tuổi, bình thường theo Nhà nước là nghỉ hưu lâu rồi. Giờ đây, anh Nguyễn Việt Thắng làm là chính. Cái gì về chiến lược, quy chế, nhân sự tổ chức cấp cao, vốn liếng sẽ do Hội đồng quản trị, do tôi đại diện phụ trách Còn về điều hành hàng ngày, về thép, về giá bán tôi không biết đâu, vì có biết cũng chẳng để làm gì. Các việc như mua nguyên vật liệu, bán cho ai sẽ do ban điều hành làm. Nếu mọi người nghĩ cứ Hòa Phát là ông Long làm hết thì không phải đâu"",Chủ tịch Trần Đình Longchia sẻ.   Tại Đại hội năm nay, Hòa Phát sẽ xin ý kiến cổ đông thông qua mục tiêu doanh thu 140.000 tỷ đồng và lợi nhuận sau thuế 10.000 tỷ đồng.﻿ So với kết quả năm 2023, doanh thu sẽ tăng 18% còn lợi nhuận tăng 47%. Về phương án trích lập các quỹ, Hòa Phát năm 2023 đạt 6.800 tỷ đồng lợi nhuận sau thuế. Công ty sẽ trích 340 tỷ đồng (5%) vào quỹ khen thưởng phúc lợi, 68 tỷ đồng (1%) thù lao Hội đồng quản trị và Ban kiểm soát. Phần lợi nhuận còn lại là 6.392 tỷ đồng﻿. Năm 2024, Hòa Phát dự kiến tăng vốn điều lệ thêm 10%, thông qua phát hành cổ phiếu tỷ lệ 10:1. Vốn điều lệ Hòa Phát sẽ tăng từ 58.148 tỷ đồng lên ﻿gần 64.000 tỷ đồng. Việc tăng vốn nhằm cân đối cơ cấu giữa vốn điều lệ và vốn chủ sở hữu tương xứng với quy mô sản xuất kinh doanh và hoạt động đầu tư của công ty.  "
2024-10-01,Hòa Phát ra mắt bộ sưu tập máy lọc nước 12 lõi vượt trội,"Bộ sưu tập Máy lọc nước RO Hòa Phát 12 lõi vượt trội Thiết kế tinh giản hiện đại Thiết kế khung tủ slim nhỏ gọn độc quyền mới lần đầu tiên được ra mắt với các đường bo tròn ở mặt trên và dưới chân tủ, tạo trải nghiệm thân thiện hơn với người dùng. Bên trong khung tủ nhỏ gọn là hệ thống 12 lõi lọc gồm: cụm 3 lõi lọc thô tích hợp Hòa Phát Ultra F3.0, cụm 8 lõi chức năng Hòa Phát thế hệ mới Ultra H8.0 với 8 lõi chức năng đúc liền nguyên khối và màng RO tiên tiến. Nâng cao chất lượng nước Máy sở hữu 12 cấp lọc vượt trội cho nước đầu ra đạt tiêu chuẩn QCVN 6-1:2010/BYT của Bộ Y tế đối với nước tinh khiết đóng chai. Đặc biệt, công nghệ màng lọc RO Dupont Filmtec nhập khẩu từ Mỹ có khả năng loại bỏ đến 99,99% vi khuẩn trong nước, đảm bảo nguồn nước an toàn tuyệt đối cho sức khỏe. Điểm nhấn khác biệt là cụm lõi chức năng Ultra H8.0, không chỉ giúp lọc sạch mà còn duy trì lượng Hydrogen trong nước gấp đôi, mang lại hiệu quả chống lão hóa cho người sử dụng  Tiết kiệm chi phí, sử dụng bền bỉ  Cụm 3 lõi lọc thô tích hợp Hòa Phát Ultra F3.0 và cụm 8 lõi chức năng Hòa Phát thế hệ mới Ultra H8.0 giúp cho việc thay lõi trở nên dễ dàng. Nhờ tối ưu các chi tiết gá đặt bên ngoài, người dùng không cần thao tác tháo rời các cút nối để thay lõi nữa, nay người dùng có thể thao thác thay thế cả cụm lõi thô và lõi chức năng đơn giản. Bộ sưu tập máy lọc nước mới của Hòa Phát đáp ứng nhu cầu về chất lượng nước cao và mang lại những giá trị sử dụng vượt trội. Các sản phẩm duy trì lượng Hydrogen gấp đôi trong nước, tăng 20% lưu lượng lọc, giảm thiểu rủi ro rò rỉ, đồng thời giúp việc thay lõi dễ dàng hơn, mang lại sự an tâm tuyệt đối cho người dùng. "
