publish_date,title,content
2024-03-04,"Loạt ông lớn gồm Hòa Phát, TH, Trung An… muốn đầu tư hơn 5 tỷ USD vào tỉnh Phú Yên","Tại Hội nghị công bố Quy hoạch và Xúc tiến đầu tư tỉnh Phú Yên năm 2024 diễn ra vào sáng 3/3, UBND tỉnh đã trao quyết định Chủ trương đầu tư và Quyết định điều chỉnh chủ trương đầu tư 14 nhà đầu tư của 14 dự án với tổng số vốn đăng ký gần 10.500 tỷ đồng và 5 Biên bản ghi nhớ hợp tác đầu tư với tổng số vốn dự kiến 128.800 tỷ đồng. Trong đó, một số dự án đáng chú ý bao gồm: Dự án Khu du lịch sinh thái Núi Thơm (hơn 2.200 tỷ đồng) của Công ty cổ phần Sao Phương Bắc Phú Yên; Dự án Xây dựng Khu nghỉ dưỡng Vũng Lắm (gần 2.000 tỷ đồng) của Công ty Cổ phần Everland Phú Yên; Dự án Khu du lịch biển Hòa Thạnh Resort (gần 1.050 tỷ đồng) của Công ty TNHH Khu du lịch biển Hòa Thạnh Resort; Dự án Khu du lịch sinh thái Bãi Nồm (hơn 1.000 tỷ đồng) của Công ty cổ phần Đầu tư và Kinh doanh nhà Việt An Phú Yên. Ngoài ra, một số dự án khác như Khu nghỉ dưỡng cao cấp Casanova Bãi Tràm (Công ty CP Đầu tư Bãi Tràm); Vùng liên kết sản xuất lúa chất lượng cao, thu mua, chế biến xuất khẩu gạo tỉnh Phú Yên (Công ty CP Nông nghiệp Công nghệ cao Trung An); Khu chăn nuôi công nghệ cao (Công ty CP Đầu tư phát triển công nghệ chăn nuôi Quang Minh); Nhà máy nước Sông Cầu 2 - Tuy An (Công ty CP Đô thị Sinh thái Việt Nam); Công trình cấp nước sạch liên xã Hòa Thắng, Hòa Định Đông, Hòa Quang Nam, Hòa Quang Bắc và Hòa Trị (Công ty TNHH Đầu tư chuyển giao công nghệ Toàn Cầu); Khu du lịch sinh thái Bãi Nồm (Công ty CP Đầu tư và Kinh doanh nhà Việt An Phú Yên. Trong số 5 nhà đầu tư nhận Biên bản ghi nhớ hợp tác đầu tư với UBND tỉnh, CTCP Tập đoàn Hòa Phát tìm hiểu cơ hội đầu tư 3 dự án là dự án Cảng Bãi Gốc, Đầu tư và kinh doanh kết cấu hạ tầng KCN Hòa Tâm, Khu liên hợp Gang thép tại KCN Hòa Tâm. Theo Tạp chí Công Thương, Dự án Cảng Bãi Gốc có vốn đầu tư dự kiến khoảng 24.000 tỷ đồng; Dự án Đầu tư và kinh doanh kết cấu hạ tầng Khu công nghiệp Hòa Tâm dự kiến khoảng 13.300 tỷ đồng và Dự án Khu liên hợp Gang thép Hòa Phát tại Khu công nghiệp Hòa Tâm dự kiến khoảng 86.000 tỷ đồng. Phát biểu tại Hội nghị, ông Trần Đình Long - Chủ tịch HĐQT Tập đoàn Hoà Phát, cho biết, dự kiến các dự án trên khi đi vào hoạt động sẽ sẽ giải quyết việc làm cho 20.000 lao động tại Phú Yên; đóng góp ngân sách mỗi năm trên dưới 10.000 tỷ đồng cho địa phương. Trước đó, năm 2023, Tập đoàn Hòa Phát đã đề xuất đầu tư các dự án tại Khu kinh tế Nam Phú Yên gồm: dự án kinh doanh hạ tầng KCN Hòa Tâm, dự án Cảng Bãi Gốc, Khu liên hợp gang thép Hòa Phát tại KCN Hòa Tâm và dự án Khu thương mại - Dịch vụ. Riêng dự án Khu thương mại - Dịch vụ triển khai đồng bộ với đầu tư dự án Khu liên hợp gang thép Hòa Phát tại KCN Hòa Tâm và các dự án thứ cấp khác. Tổng mức đầu tư đối với 4 dự án nói trên dự kiến khoảng 120.000 tỷ đồng (khoảng 5 tỷ USD). Nhu cầu sử dụng lao động (đối với nhà máy thép) khoảng 12.000 người, trong đó lao động địa phương chiếm 80 - 90%. Dự án Khu liên hợp Gang thép Hòa Phát tại tỉnh Phú Yên có quy mô vốn đầu tư tương đương với Dự án Khu liên hợp sản xuất gang thép Hòa Phát Dung Quất 2 đang được Tập đoàn Hoà Phát triển khai tại Khu kinh tế Dung Quất, huyện Bình Sơn, tỉnh Quảng Ngãi (85.000 tỷ). Quy mô diện tích dự án Khu liên hợp gang thép Hòa Phát tại KCN Hòa Tâm là 498ha. Cảng Bãi Gốc có diện tích 220 ha, có bến tổng hợp, hàng rời, hàng lỏng/khí và tiếp nhận cỡ tàu có trọng tải đến 50.000 tấn, và định hướng có bến chuyên dùng tiếp nhận tàu trọng tải đến 250.000 tấn. KCN Hòa Tâm có quy mô diện tích là 1.080 ha. Ngoài Hòa Phát, 4 doanh nghiệp khác được tỉnh Phú Yên trao quyết định Biên bản ghi nhớ hợp tác đầu tư Công ty CP Tập đoàn N&G với dự án Đầu tư và kinh doanh kết cấu hạ tầng KCN Công Nghệ cao. Công ty TNHH Công nghệ thực phẩm Phú Yên (Tập đoàn TH) với dự án Tiếp tục đầu tư Cụm nhà máy thực phẩm sạch Phú Yên. Công ty CP Nông nghiệp Công nghệ cao Trung An với dự án Nhà máy xử lý chất thải sinh hoạt và phát điện. Công ty CP Tập đoàn Vietravel với dự án Phối hợp, hỗ trợ, hợp tác phát triển lĩnh vực du lịch, dịch vụ. Tại đây, UBND tỉnh cũng công bố Quyết định phê duyệt Danh mục 70 dự án kêu gọi đầu tư trên địa bàn tỉnh, giai đoạn 2024-2030 trên 7 lĩnh vực: Công nghiệp và hạ tầng khu, cụm công nghiệp; logictics; đô thị, nhà ở xã hội; thương mại, dịch vụ, du lịch; nông nghiệp; giáo dục, văn hóa, xã hội; công nghệ thông tin và khoa học công nghiệp. Trong số Khu kinh tế Nam Phú Yên có 33/70 dự án kêu gọi đầu tư."
2024-11-12,"Tồn kho của các “ông lớn” ngành thép HPG, HSG, NKG bao nhiêu?","5 doanh nghiệp ngành thép là Tập đoàn Hòa Phát (mãHPG), Tập đoàn Hoa Sen (HSG), Thép Nam Kim (NKG), VNSteel, Tôn Đông Á chiếm đến gần 90% tổng giá trị tồn kho toàn ngành thép trên sàn chứng khoán. Tính đến ngày 30/9, ước tính tổng giá trị tồn kho của ngành thép trên sàn chứng khoán khoảng 75.000 tỷ đồng, tương đương cuối quý II trước đó, giảm khoảng 7.000 tỷ đồng so với cuối quý I/2024. Con số này thấp hơn khá nhiều so với giai đoạn chu kỳ bùng nổ của ngành thép từ năm 2021 đến đầu 2022. Hòa Phát vẫn là doanh nghiệp tích trữ tồn kho lớn nhất ngành thép trên sàn chứng khoán, với giá trị hơn 40.000 tỷ (đã bao gồm trích lập dự phòng giảm giá), nhích nhẹ so với cuối quý II. Ngoài ra, không có doanh nghiệp thép nào có giá trị hàng tồn kho vượt quá 10.000 tỷ tại thời điểm cuối quý III vừa qua.  Doanh nghiệp thép thận trọng tích trữ tồn kho trong bối cảnh giá thép có nhiều biến động khó lường. Việc chủ động tích trữ nguyên vật liệu giá rẻ khi giá nguyên liệu đầu vào giảm giúp giảm chi phí giá vốn, cải thiện biên lợi nhuận của doanh nghiệp, giúp doanh nghiệp duy trì biên lợi nhuận ở mức cao. Sau giai đoạn lao dốc xuống đáy 8 năm hồi giữa tháng 8, giá thép thanh tương lai đã hồi phục mạnh mẽ trong nửa sau của quý III. Hiện tại, giá thép thanh tương lai đang dừng ở mức 3.290 CNY/tấn, tăng 18% so với đáy cách đây hơn 2 tháng. Xu hướng hồi phục của giá thép diễn ra sau khi Ngân hàng Nhân dân Trung Quốc (PBOC) công bố kế hoạch tung ra gói kích thích tiền tệ lớn và quan trọng nhất kể từ thời Covid để ngăn chặn sự lao dốc không phanh của thị trường nhà ở. Theo MBS, giá thép có thể tiếp tục phục hồi dự báo chủ yếu do nguồn cung thắt chặt kể từ quý IV/2024. Về nhu cầu, tiêu thụ thép có thể phục hồi trong ngắn hạn do một số thành phố như Thượng Hải và Giang Tô có kế hoạch tái thiết cơ sở hạ tầng. Giá thép nội địa có thể phục hồi kể từ quý IV/2024 do áp lực từ Trung Quốc giảm và nhu cầu cải thiện (nhờ nguồn cung thị trường nhà ở ấm lên và đẩy mạnh đầu tư công). Báo cáo tài chính quý III cho thấy, sau giai đoạn phục hồi, tình hình kinh doanh của các doanh nghiệp thép đã ảm đạm hơn. Tổng lợi nhuận ngành thép (chưa bao gồm Pomina) trong quý III chỉ vào khoảng 2.600 tỷ đồng. Hòa Phát là cái tên hiếm hoi trong ngành ghi nhận lợi nhuận sau thuế đạt 3.022 tỷ đồng trong quý III, gấp rưỡi cùng kỳ 2023 nhưng thấp hơn gần 9% so với quý II trước đó. Trong khi đó, Tập đoàn Hoa Sen lỗ sau thuế 186 tỷ đồng trong quý cuối cùng niên độ 2023-2024, trong khi cùng kỳ niên độ trước có lãi 438 tỷ đồng. Mặc dù vậy, kết thúc niên độ tài chính 2023-2024,HSGghi nhận doanh thu tăng 24% so với cùng kỳ và lợi nhuận sau thuế của HSG cũng cải thiện tích cực từ mức 30 tỷ đồng trong NĐTC 2022-2023, lên mức 510 tỷ đồng trong NĐTC 2023-2024, tăng 1.597% và hoàn thành 102% so với kế hoạch kinh doanh. Tương tự, VNSteel (TVN) cũng ghi nhận lợi nhuận sau thuế âm 124 tỷ đồng. Số lỗ được thu hẹp so với cùng kỳ (lỗ 172 tỷ đồng) nhưng tệ hơn nhiều so với mức lãi 130 tỷ đồng đạt được trong quý II trước đó. Một số cái tên khác cũng lỗ nặng có thể kể đến như Thép Tiến Lên (TLH), Tisco (TIS), SMC,…  "
2024-03-04,Hòa Phát đầu tư hơn 120.000 tỷ đồng vào một tỉnh miền Trung,"Tại Hội nghị công bố Quy hoạch và Xúc tiến đầu tư tỉnh Phú Yên năm 2024 diễn ra vào sáng 3/3 tại TP. Tuy Hòa, UBND tỉnh đã trao quyết định Chủ trương đầu tư và Quyết định điều chỉnh chủ trương đầu tư 14 nhà đầu tư của 14 dự án với tổng số vốn đăng ký gần 10.500 tỷ đồng và 5 Biên bản ghi nhớ hợp tác đầu tư với tổng số vốn dự kiến 128.800 tỷ đồng. Trong đó,riêng Công ty Cổ phần Tập đoàn Hòa Phát đăng ký tìm hiểu cơ hội đầu tư 3 dự án với tổng quy mô đầu tư dự kiến trên 120.000 tỷ đồng (khoảng 5 tỷ USD), gồm: Dự án Cảng Bãi Gốc (dự kiến khoảng 24.000 tỷ đồng); Dự án Đầu tư và kinh doanh kết cấu hạ tầng Khu công nghiệp Hòa Tâm (dự kiến khoảng 13.300 tỷ đồng); và Dự án Khu liên hợp Gang thép Hòa Phát tại Khu công nghiệp Hòa Tâm (dự kiến khoảng 86.000 tỷ đồng). Cả 3 dự án này dự kiến sẽ được triển khai tại Khu Kinh tế Nam Phú Yên. Phát biểu tại Hội nghị, ông Trần Đình Long - Chủ tịch HĐQT Tập đoàn Hoà Phát, cho biết, tỉnh Phú Yên sở hữu những điều kiện thuận lợi để phát triển công nghiệp luyện kim quy mô lớn. Dự kiến các dự án trên khi đi vào hoạt động sẽ sẽ giải quyết việc làm cho 20.000 lao động tại Phú Yên; đóng góp ngân sách mỗi năm trên dưới 10.000 tỷ đồng cho địa phương. Về công nghệ, Tập đoàn Hòa Phát cho biết sẽ đầu tư trang thiết bị công nghệ, hệ thống công trình bảo vệ môi trường (hệ thống quan trắc môi trường tự động, xử lý nước, lọc bụi, xử lý khí thải, xử lý chất thải rắn,…) theo tiêu chuẩn châu Âu, G7, G20 và đáp ứng các tiêu chuẩn, quy định của Việt Nam tại các dự án trên. Bên cạnh Hòa Phát, 4 nhà đầu tư khác nhận Biên bản ghi nhớ hợp tác đầu tư với UBND tỉnh đó là: Công ty CP Tập đoàn N&G với dự án Đầu tư và kinh doanh kết cấu hạ tầng KCN Công Nghệ cao; Công ty TNHH Công nghệ thực phẩm Phú Yên (Tập đoàn TH) với dự án Tiếp tục đầu tư Cụm nhà máy thực phẩm sạch Phú Yên; Công ty CP Nông nghiệp Công nghệ cao Trung An với dự án Nhà máy xử lý chất thải sinh hoạt và phát điện; Công ty CP Tập đoàn Vietravel với dự án Phối hợp, hỗ trợ, hợp tác phát triển lĩnh vực du lịch, dịch vụ. Tại Hội nghĩ, UBND tỉnh cũng công bố Quyết định phê duyệt Danh mục 70 dự án kêu gọi đầu tư trên địa bàn tỉnh, giai đoạn 2024-2030 trên 7 lĩnh vực: Công nghiệp và hạ tầng khu, cụm công nghiệp; logictics; đô thị, nhà ở xã hội; thương mại, dịch vụ, du lịch; nông nghiệp; giáo dục, văn hóa, xã hội; công nghệ thông tin và khoa học công nghiệp. Trong số Khu kinh tế Nam Phú Yên có 33/70 dự án kêu gọi đầu tư."
2024-02-15,"Tự doanh CTCK bán ròng 400 tỷ trong phiên giao dịch đầu năm Âm lịch, HPG và NVL là tâm điểm","Thị trường chứng khoán có phiên giao dịch đầu tiên của năm Giáp Thìn 2024 tương đối khởi sắc. Đà tăng của nhiều nhóm cổ phiếu với tâm điểm là ngành ngân hàng giúp chỉ số chính duy trì sắc xanh trong toàn bộ thời gian giao dịch. VN-Index đóng cửa tăng 3,97 điểm lên mức 1.202,5 điểm, chính thức vượt mốc 1.200. Giao dịch khối ngoại là điểm trừ khi bán ròng hơn 360 tỷ đồng trên toàn thị trường. Trong bối cảnh đó, tự doanh CTCK ghi nhận bán ròng mạnhvới giá trị 401 tỷ đồng.  Trên sàn HoSE, tự doanh CTCK ghi nhận bán ròng399tỷ đồng,trong đó bán ròng gần 424 tỷ đồng trên kênh khớp lệnh nhưng mua ròng 25 tỷ tại kênh thoả thuận. Cụ thể, giao dịch của các CTCK tập trung bán ròng cổ phiếu HPG và NVL với lần lượt 58 tỷ và 50 tỷ đồng. Bên cạnh đó, VPB cũng bị bán ròng 41 tỷ. Các cổ phiếu bị bán ròng trong phiên hôm nay còn có loạt mã VSC, STB, TCB, MBB… Ngược lại, nhóm CTCK mua ròng mạnh nhất tại cổ phiếu GEX và AAA với lần lượt 25 tỷ và 22 tỷ. Bên cạnh đó, chứng chỉ quỹ E1VFVN30 cũng được mua ròng 14 tỷ đồng tại mỗi mã. Trên HNX, tự doanh CTCK bán ròng nhẹ,trong đó MBS bị bán ròng hơn 4 tỷ, ngược lại LAS được mua ròng gần 2 tỷ, PVS được mua ròng gần 1 tỷ. Trên UPCoM, tự doanh CTCK bánròng gần2 tỷ đồng,trong đó BSR bị bán ròng gần 2 tỷ."
2024-06-26,"Top 50 công ty niêm yết lớn nhất của Forbes gọi tên Big4 Ngân hàng, Vinamilk, Hòa Phát, Vietjet Air...","Forbes Việt Nam vừa công bố danh sách 50 công ty niêm yết tốt nhất năm 2024 dựa trên báo cáo kết quả tài chính kiểm toán năm 2023. Theo đó, các doanh nghiệp xuất hiện trong danh sách này là ""đầu tàu"" của nền kinh tế và là đại diện tiêu biểu cho ngành mà mình kinh doanh. Trong 10 cái tên có doanh thu lớn nhất, có tới 4 cái tên thuộc trong nhóm tài chính – ngân hàng là Vietcombank, Vietinbank, BIDV và Bảo Việt. Ở nhóm công nghệ, đại diện là tập đoàn FPT đứng ở vị trí thứ 9 với doanh thu 52,6 nghìn tỷ đồng, lợi nhuận sau thuế đạt 6,4 nghìn tỷ đồng. Đây cũng là doanh nghiệp công nghệ duy nhất góp mặt trong top 10. Trong nhóm ba ngân hàng ""quốc dân"" là Vietcombank dù chỉ có doanh thu đứng thứ hai, nhưng lợi nhuận sau thuế cao nhất, đạt 33 nghìn tỷ đồng. Còn lại, BIDV và Vietinbank đuổi nhau sát nút về mặt lợi nhuận, chênh lệch gần 2 nghìn tỷ đồng. Lợi nhuận sau thuế của nhóm ngân hàng đứng đầu trong top 10, dù doanh thu không phải là cao nhất.  Đại diện cho nhóm hàng không là Vietjet Air đứng thứ 5 về doanh thu, đạt 58,3 nghìn tỷ đồng, lợi nhuận 230,6 tỷ đồng. Giá nhiên liệu tăng, số lượng tàu bay hạn chế có thể là nguyên nhân khiến cho năm vừa rồi kết quả kinh doanh của hãng hàng không. Vinamilk có doanh thu lớn thứ 4 trong danh sách. Kết thúc năm 2023, đại gia ngành sữa Việt Nam ghi nhận doanh thu 60,3 nghìn tỷ đồng với lợi nhuận sau thuế 8,8 nghìn tỷ. 3 công ty niêm yết có doanh thu cao nhất trong danh sách năm nay là các doanh nghiệp trong ngành năng lượng và thép, lần lượt là PV GAS, Hòa Phát và Petrolimex. Doanh thu các doanh nghiệp này tương ứng đạt 90 nghìn tỷ, 119 nghìn tỷ và 274 nghìn tỷ còn lợi nhuận lại giảm dần, lần lượt là 11,6 nghìn tỷ, 6,8 nghìn tỷ và 2,8 nghìn tỷ."
2024-02-29,Ống thép Hòa Phát lần đầu tiên thâm nhập vào chuỗi bán lẻ của quốc gia khó tính hàng đầu Châu Á,"Ống thép Hòa Phát xuất sang Nhật Bản được bán theo hình thức “DIY” nghĩa là sản phẩm tới tận tay người dân. Người tiêu dùng Nhật sẽ mua ống thép để ứng dụng vào nhiều việc khác nhau như: làm giàn giáo để trồng cây, các giá kệ chứa gỗ, làm nhà để xe, hay các sản phẩm gia dụng…. Để thâm nhập được vào thị trường này, Ống thép Hòa Phát đã đáp ứng được các tiêu chuẩn chất lượng về độ chịu lực và ăn mòn, kháng thời tiết cao, đặc biệt là khí hậu lạnh của Nhật Bản. Sản phẩm được ứng dụng cho cả các sản phẩm ngoài trời trong điều kiện thời tiết khắc nghiệt. Lãnh đạo Công ty Ống thép Hòa Phát cho biết, dự kiến trong thời gian tới, đối tác Nhật Bản sẽ sang Việt Nam trao đổi về các đơn hàng cho năm 2024 và có kế hoạch tiếp tục nhập thêm các dòng sản phẩm khác sau đơn hàng này. Nhật Bản là thị trường đòi hỏi các tiêu chuẩn khắt khe về chất lượng cũng như tính thẩm mỹ của sản phẩm. Việc đưa hàng vào hệ thống chuỗi bán lẻ toàn quốc mở ra cơ hội cho Ống thép Hòa Phát thâm nhập sâu hơn các kênh bán lẻ đa dạng, phong phú tại đây. Điều này chứng tỏ Ống thép Hòa Phát đã chinh phục được thị trường mới, khó tính như Nhật Bản. Năm 2023, sản lượng bán hàng của Ống thép Hòa Phát ghi nhận 685.000 tấn. Trong đó xuất khẩu tăng trưởng gần 40% so với năm trước trong điều kiện thị trường thép chưa thực sự khởi sắc. Các đơn hàng xuất khẩu có đóng góp đáng kể vào sản lượng bán hàng chung của Công ty khi thị trường nội địa gặp khó khăn. Bên cạnh mảng ống thép, từ năm 2024, sản phẩm tôn cuộn mạ kẽm của Công ty Ống thép Hòa Phát sản xuất cũng thâm nhập vào các thị trường châu Á, Châu Âu, Châu Mỹ và nhận được sự phản hồi tốt về chất lượng từ phía đối tác. Với chủng loại đa dạng, phù hợp các tiêu chuẩn nghiêm ngặt của thế giới, sản phẩm ống thép của Công ty đã xuất khẩu sang các thị trường châu Úc, châu Mỹ và châu Á. "
2024-08-22,"Cổ phiếu VHM vượt mốc 40.000 đồng, vốn hóa của Vinhomes đã tăng gần 1 tỷ USD sau khi công bố thương vụ 'lớn chưa từng có', vượt Hòa Phát, Vinamilk hay Techcombank","Kết thúc phiên giao dịch sáng ngày 22/8, cổ phiếuVHMcủa Vinhomes tiếp tục ghi nhận sắc xanh phiên thứ 7 liên tiếp , qua đó giúp thị giá của VHM vượt mốc 40.000 đồng/cp lần đầu tiên sau 3 tháng. Khối lượng khớp lệnh đã đạt hơn 4 triệu đơn vị. Tuy nhiên, các nhà đầu tư nước ngoài lại cũng đã bán ròng hơn 1 triệu cổ phiếu VHM, tương đương giá trị khoảng hơn 52 tỷ đồng.  Cổ phiếu VHM liên tục tăng ngay sau khi Vinhomes công bố sẽ mua 370 triệu cổ phiếu quỹ, tương đương 8,5% khối lượng cổ phiếu đang lưu hành. Thời gian dự kiến mua lại là sau khi được UBCK nhà nước chấp thuận và công ty đã công bố thông tin về việc mua lại cổ phiếu theo quy định. Phương thức giao dịch khớp lệnh hoặc thỏa thuận. Dự kiến, để mua lại hết số cổ phiếu trên Vinhomes sẽ phải chi ra hàng chục nghìn tỷ đồng. Việc mua lại 370 triệu cổ phiếu sẽ khiến cho vốn điều lệ của Vinhomes giảm tương ứng 3.700 tỷ đồng. Số lượng cổ phiếu đang lưu hành giảm đi sẽ giúp chỉ số thu nhập trên 1 cổ phiếu (EPS) tăng lên. Kể từ lúc công bố mua lại cổ phiếu quỹ cho đến nay, vốn hóa của Vinhomes đã tăng khoảng 22.800 tỷ đồng, hiện đạt mức 174.392 tỷ đồng. Giá trị thị trường của Vinhomes hiện tại đã vượt nhiều tên tuổi như Hòa Phát, Vinamilk hay chính công ty mẹ Vingroup.  Theo nhận định của Chứng khoán An Bình (ABS) trong báo cáo hồi cuối tháng 7/2024, triển vọng tăng trưởng của Vinhomes vẫn tích cực trong nửa cuối năm. Đầu tiên phải kể đến ""Doanh số bán hàng lũy kế chưa ghi nhận"" ở mức cao, đảm bảo lợi nhuận cho doanh nghiệp. Với giá trị lũy kế doanh số bán hàng chưa ghi nhận cuối quý 2/2024 là 118.700 tỷ đồng, đây sẽ là nguồn đảm bảo cho doanh thu và lợi nhuận trong tương lai của Vinhomes, giúp doanh nghiệp hoàn thành mục tiêu kết quả kinh doanh trong năm 2024. Thứ hai là doanh số bán hàng dự kiến của Vinhomes tiếp tục tăng với các dự án lớn sắp ra mắt. Doanh nghiệp cũng cho biết đang trong giai đoạn gần hoàn tất 2 giao dịch bán buôn với tổng giá trị khoảng 40.000 tỷ đồng. ABS cho biết triển vọng nửa cuối năm 2024 sẽ tập trung bàn giao các dự án Vinhomes Ocean Park 3, Sky Park, Golden Avenue, Royal Island cũng như ghi nhận doanh thu từ hoạt động bán buôn. Ngoài ra, trong các năm tới, các dự án lớn gối đầu như Vinhomes Cổ Loa (Đông Anh, Hà Nội), Vinhomes Wonder Park (Đan Phượng, Hà Nội) giúp duy trì doanh số bán hàng cho doanh nghiệp. Xa hơn, Vinhomes đã được phê duyệt nhiều dự án tại nhiều tỉnh thành như Hải Phòng, Đà Nẵng, Khánh Hòa, Hà Tĩnh, Tuyên Quang, Hưng Yên, Long An… đảm bảo nguồn quỹ đất và dự án gối đầu cho nhiều năm. Cuối cùng, CTCK này cho rằng bộ 3 luật liên quan đến ngành bất động có hiệu lực từ 01/08/2024 (Luật Kinh doanh Bất động sản 2023, Luật Nhà ở 2023 và Luật Đất đai 2024) sẽ góp phần tác động tích cực tới thị trường bất động sản. Vinhomes với vị thế là chủ đầu tư phát triển BĐS hàng đầu cả nước với quỹ đất lớn, sạch, tiềm lực tài chính mạnh mẽ sẽ được hưởng lợi lớn từ các quy định mới này. "
