publish_date,title,content
2024-07-31,"Đại gia ngành khí Việt Nam “ôm” lượng tiền mặt khổng lồ, lớn hơn vốn hoá Đức Giang, PV Power và nhiều ngân hàng","Theo báo cáo tài chính hợp nhất quý 2/2024, Tổng Công ty Khí Việt Nam-CTCP (PV Gas – mã GAS) có đến hơn 43.900 tỷ đồng tiền mặt (tiền, tương đương tiền và tiền gửi ngắn hạn) vào ngày 30/6, tăng hơn 3.000 tỷ so với thời điểm đầu năm. Đây là lượng tiền mặt lớn nhất PV Gas từng nắm giữ tại ngày cuối quý kể từ khi hoạt động. Với số tiền khổng lồ trên, PV Gas đang là ""vua"" tiền mặt trên sàn chứng khoán quý 2/2024. Để dễ hình dung, 43.900 tỷ còn lớn hơn vốn hoá của hơn 1.500 doanh nghiệp trên sàn chứng khoán, trong đó có cả những cái tên ""đình đám"" như Hoá chất Đức Giang (DGC), Vincom Retail (VRE), REE Corp (REE), PNJ, PV Power (POW) và nhiều ngân hàng như SHB, TPB, OCB, MSB,… Nhờ nắm giữ một lượng tiền gửi lớn, PV Gas ""ngồi không"" cũng bỏ túi hàng trăm tỷ lãi tiền gửi mỗi quý. Trong quý 2 vừa qua, doanh thu tài chính của doanh nghiệp này đạt gần 445 tỷ đồng, trong đó chủ yếu là lãi tiền gửi. Con số này thấp hơn mức gần 600 tỷ cùng kỳ 2023 chủ yếu do mặt bằng lãi suất thấp hơn. Luỹ kế 6 tháng đầu năm, PV Gas ""bỏ túi"" gần 831 tỷ đồng lãi tiền gửi, tương ứng trung bình mỗi ngày lãi 4,5 tỷ đồng.  Về kết quả kinh doanh quý 2, PV Gas ghi nhận doanh thu thuần đạt 30.052 tỷ đồng, tăng 25% so với cùng kỳ năm ngoái. Lợi nhuận sau thuế đạt 3.416 tỷ đồng, tăng gần 7% so với quý 2/2023. Trong đó, lãi ròng thuộc về cổ đông công ty mẹ đạt 3.321 tỷ đồng, cũng tăng 5% so với cùng kỳ năm ngoái. Lũy kế 6 tháng đầu năm, PV Gas ghi nhận doanh thu thuần đạt 53.367 tỷ đồng và lợi nhuận sau thuế đạt 5.960 tỷ đồng, lần lượt tăng 18% và giảm 10% so với nửa đầu năm ngoái. Với kết quả đạt được, ""gã khổng lồ"" ngành khí Việt Nam đã thực hiên 75% kế hoạch doanh thu và vượt mục tiêu lợi nhuận cả năm đề ra.  Năm 2024, PV Gas lên kế hoạch thận trọng với mục tiêu doanh thu hợp nhất đạt 70.716 tỷ đồng và lợi nhuận sau thuế 5.798 tỷ đồng, lần lượt giảm 22% và 51% so với thực hiện 2023. Đây là chỉ tiêu lợi nhuận thấp nhất kể từ khi PV Gas niêm yết năm 2012. Kế hoạch thận trọng được xây dựng trên cơ sở đánh giá năm 2024 còn nhiều thách thức. Trong một diễn biến khác, PV Gas mới đây đã công bố nghị quyết HĐQT về việc thông qua kế hoạch chi trả cổ tức bằng tiền cho năm 2023. Theo đó, tổng công ty sẽ trả cổ tức năm 2023 tỷ lệ 60%, tương đương cổ đông sở hữu 1 cổ phiếu nhận được 6.000 đồng. Đây là tỷ lệ cổ tức cao kỷ lục của PV Gas. Với khoảng gần 2,3 tỷ cổ phiếu đang lưu hành, PV Gas dự chi khoảng hơn 13.780 tỷ đồng để trả cổ tức cho cổ đông. Trong đó, hầu hết số tiền (hơn 13.200 tỷ đồng) sẽ chảy về Tập đoàn Dầu khí Việt Nam (PVN) – công ty mẹ của GAS, hiện đang sở hữu tới 95,76% vốn điều lệ Doanh nghiệp. Thời gian bắt đầu chi trả là từ 14/10 – 29/11/2024."
2024-10-15,PV Power ước lãi 833 tỷ đồng sau 9 tháng,"Tổng Công ty Điện lực Dầu khí Việt Nam - CTCP (PV Power, mãPOW) vừa thông tin về tình hình kinh doanh 9 tháng năm 2024 với tổng sản lượng điện ước đạt 11,42 tỷ kWh, tăng 2% so với cùng kỳ và hoàn thành 92% kế hoạch năm. Doanh thu của toàn tổng công ty đạt 22.374 tỷ đồng, tăng 1% so với cùng kỳ và chỉ đạt 95% kế hoạch. Trong đó, doanh thu công ty mẹ ước đạt 17.102 tỷ đồng, tăng 4% so với cùng kỳ năm 2023 (bao gồm 16.935 tỷ đồng doanh thu trực tiếp của công ty mẹ và 173 tỷ đồng cổ tức từ đơn vị thành viên). Sản lượng điện 9 tháng năm 2024 của PV Power Theo PV Power, doanh thu 9 tháng của toàn tổng công ty không đạt kế hoạch chủ yếu do doanh thu trực tiếp của công ty mẹ chỉ đạt 96% kế hoạch. Ngoài ra, doanh thu tại các công ty con cũng chỉ đạt 93% so với kế hoạch do sản lượng điện thương mại đạt thấp hơn kế hoạch. Dù vậy lợi nhuận trước thuế hợp nhất 9 tháng của PV Power vẫn vượt 6% kế hoạch, ước đạt 833 tỷ đồng. Tuy nhiên, so với cùng kỳ năm 2023, lợi nhuận của công vẫn giảm 18%. Năm 2024, PV Power đặt mục tiêu tổng doanh thu 31.736 tỷ đồng, lãi trước thuế 995 tỷ đồng. Với kết quả trên, sau 3 quý, công ty thực hiện được 71% kế hoạch doanh thu và 84% chỉ tiêu lợi nhuận đặt ra. Như vậy, tính riêng quý III/2023, doanh thu của PV Power ước đạt 6.749 tỷ đồng và lãi trước thuế khoảng 113 tỷ đồng, lần lượt tăng 19% và 38% so với quý III/2023. Kết quả sản xuất kinh doanh 9 tháng của PV Power PV Power cho biết, trong 9 tháng đầu năm nay, công tác sữa chữa bảo dưỡng các nhà máy điện được thực hiện tốt, đảm bảo các nhà máy luôn khả dụng cao. Đối với dự án Nhiệt điện Nhơn Trạch 3&4, tiến độ tổng thể của gói thầu EPC ước đạt 94%, ngày 4/10 công ty đã ký hợp đồng mua bán điện (PPA) với Công ty Mua bán điện (EVNEPTC). Về hợp đồng mua bán khí (GSA), PV Power và Ban quản lý dự án điện đang xem xét dự thảo Hợp đồng khung với PV GAS để hai bên ký kết, làm cơ sở cho PV GAS thực hiện công tác chuẩn bị thu xếp nguồn cung LNG cho dự án. Về tình hình thu xếp vốn cho dự án Nhiệt điện Nhơn Trạch 3&4, PV Power cho hay đã đảm bảo cân đối đủ nguồn vốn chủ sở hữu cho dự án. Đối với vốn vay, tổng công ty đã thu xếp thành công nguồn vốn vay ECA không ràng buộc xuất xứ thiết bị trị giá 200 triệu USD tại ngân hàng SMBC do SACE bảo lãnh. Ngày 1/10, PV Power đã công bố hợp đồng khoản vay ECAs trị giá 521,5 triệu USD, đảm bảo đủ vốn cho dự án. Thu xếp thành công khoản vay trong nước trị giá 4.000 tỷ đồng tại ngân hàng Vietcombank. Về công tác thoái vốn, PV Power gặp nhiều khó khăn khi thực hiện do tình hình chung của thị trường và danh mục thoái vốn phần lớn là các công ty chưa đại chúng. Trong 3 tháng cuối năm, PV Power đặt kỳ vọng đạt 8.197 tỷ đồng doanh thu và 210 tỷ đồng lãi trước thuế. Để đạt mục tiêu, trong 3 tháng cuối năm, công ty sẽ quản lý vận hành sản xuất, bảo dưỡng sửa chữa các nhà máy điện, phấn đấu tổng sản lượng điện sản xuất cả năm 2024 đạt 16,7 tỷ kWh. Đồng thời, công ty sẽ tìm kiếm nguồn và đảm bảo cấp than ổn định, liên tục và dài hạn cho nhà máy điện Vũng Áng 1. Cùng với đó, công ty tiếp tục trung tu Tổ máy số 2 nhà máy Vũng Áng 1 từ ngày 15/8 - 30/10 đảm bảo chất lượng, tiến độ, an toàn. Về dự án nhà máy điện Nhơn Trạch 3&4, PV Power sẽ giám sát, quản lý thực hiện hợp đồng EPC; hợp đồng tư vấn kỹ thuật dự án, các hợp đồng tư vấn phục vụ thu xếp vốn và các hợp đồng dự án còn lại đảm bảo chất lượng, phù hợp với nhu cầu, tiến độ dự án; hoàn thành đàm phán ký kết hợp đồng GSA với PV Gas."
2024-09-10,"Sau VinFast, đến lượt PV Power với tham vọng 1.000 trạm sạc xe điện năm 2035","Mới đây, Tổng Công ty Điện lực Dầu khí Việt Nam (PV Power, mã POW) đã ký biên bản thỏa thuận hợp tác với đối tác Hàn Quốc để nghiên cứu và phát triển hệ thống trạm sạc tại Việt Nam. Trước mắt, trong năm nay, PV Power sẽ thí điểm đặt trạm sạc đầu tiên tại số 6 phố Huỳnh Thúc Kháng, Hà Nội. Diện tích đặt trạm khoảng 30 - 35 m2. Trạm sạc gồm 2 cây sạc dạng tủ đứng, có trang bị 2 cổng sạc với công suất 50 - 60 kW/cổng sạc, tổng chi phí đầu tư của dự án khoảng hơn 1,8 tỷ đồng, tổng công suất sử dụng 100 -120 kW. Dự kiến trạm sạc này sẽ đi vào hoạt động từ tháng 9/2024. Theo Petrotimes, sau khi trạm sạc số 6 Huỳnh Thúc Kháng đi vào hoạt động, PV Power tiếp tục triển khai thí điểm thêm 2 trạm sạc nữa tại 222 đường Trần Duy Hưng, Cầu Giấy, Hà Nội (Big C Thăng Long). Dự án phát triển hệ thống trạm sạc xe điện củaPV Powerkhông chỉ dừng lại ở việc xây dựng các trạm sạc mà còn hướng tới việc phát triển một mạng lưới trạm sạc đồng bộ trên toàn quốc. PV Power sẽ tiếp tục nghiên cứu và áp dụng các công nghệ tiên tiến để nâng cao hiệu quả và khả năng phục vụ của các trạm sạc. Theo nhận định của PV Power, Việt Nam đang đứng trước cơ hội lớn trong việc phát triển thị trường xe điện, điều này cũng mở ra triển vọng cho sự phát triển của hệ thống trạm sạc xe điện. Cụ thể, tháng 7/2022, Thủ tướng Chính phủ đã ban hành Quyết định 876/QĐ-TTg về lộ trình chuyển đổi sang xe điện với các mốc quan trọng: 100% xe buýt sẽ sử dụng điện vào năm 2025, 100% taxi vào năm 2030 và 100% phương tiện giao thông cơ giới vào năm 2050. Hiệp hội Nhà sản xuất ô tô Việt Nam (VAMA) cũng dự báo đến năm 2028, Việt Nam sẽ đạt mốc 1 triệu xe điện và khoảng 3,5 triệu xe điện vào năm 2040. Từ những cơ sở trên, PV Power cho rằng, đây là cơ hội cho doanh nghiệp Việt khai thác thị trường này. Tuy vậy, việc đầu tư vào phát triển trạm sạc xe điện vẫn còn nhiều rủi ro và thách thức. Việc phát triển trạm sạc đòi hỏi một khoản đầu tư lớn vào cơ sở hạ tầng và công nghệ. Chi phí đầu tư ban đầu có thể rất cao và việc thu hồi vốn có thể kéo dài nếu doanh thu không đạt như dự kiến. Trong đầu tư, doanh nghiệp thường phải đi vay đến 70% vốn, ít có doanh nghiệp nào có sẵn tiền để đầu tư, đặc biệt đối với những lĩnh vực mới như trạm sạc, thì mức độ rủi ro càng cao. Chính vì vậy, đến nay, chưa có công ty nào đầu tư thương mại vào lĩnh vực này, hiện chỉ có VinFast đầu tư xây dựng trạm sạc tại Việt Nam nhưng chỉ dành cho các xe điện do VinFatst sản xuất. Bên cạnh rủi ro về tài chính, việc phát triển trạm sạc tại Việt Nam còn gặp nhiều khó khăn, thách thức cần phải tháo gỡ. Theo PV Power, trong quá trình làm thủ tục xây dựng trạm sạc thí điểm, PV Power gặp nhiều khó khăn trong việc hoàn thiện hồ sơ dự án, chẳng hạn như thoải thuận đấu nối giữa bên mua điện và EVN còn nhiều thủ tục phức tạp; việc tìm vị trí đặt trạm sạc và công suất trạm sạc phụ thuộc nhiều vào sơ đồ tải của nguồn điện, không phải chỗ nào cũng đủ công suất để lắp đặt… Để phát triển hệ thống xe điện toàn diện, đồng bộ, đòi hỏi phải có hệ thống trạm sạc đa năng, có khả năng hỗ trợ sạc cho nhiều dòng xe của các thương hiệu khác nhau. Do vậy, việc phát triển hệ thống trạm sạc có thể đáp ứng nhu cầu cho tất cả các loại xe điện có chuẩn sạc khác nhau cũng là một thách thức. Hiện nay, Công ty CP Phát triển Trạm sạc Toàn cầu V-GREEN, công ty riêng của tỷ phú Phạm Nhật Vượng, Chủ tịch HĐQT Vingroup là đơn vị phát triển trạm sạc “hùng hậu” nhất sở hữu mạng lưới trạm sạc dành cho ô tô và xe máy điện lớn nhất tại Việt Nam, với quy hoạch 150.000 cổng sạc tại tất cả 63 tỉnh thành trên cả nước nhưng chỉ cho xe VinFast sạc. Với cam kết đầu tư 10.000 tỷ đồng trong vòng hai năm tới để xây mới, nâng cấp và hoàn thiện hệ thống, V-GREEN đang tích cực đẩy mạnh việc phủ sóng trạm sạc xe điện VinFast trên quy mô toàn quốc. Thậm chí, doanh nghiệp này vừa thông báo triển khai mô hình trạm sạc nhượng quyền tại Việt Nam vào ngày 4/9. Trạm sạc nhượng quyền V-GREEN được triển khai theo mô hình “doanh nghiệp và nhân dân cùng làm”, hứa hẹn mở ra một ngành nghề kinh doanh mới cho tất cả các chủ sở hữu mặt bằng trên toàn quốc. Tương tự trạm sạc chính hãng do V-GREEN đầu tư, trạm sạc nhượng quyền V-GREEN sẽ phục vụ các chủ sở hữu ô tô điện và xe máy điện VinFast trên toàn quốc . V-GREEN cam kết đồng hành, chia sẻ doanh thu ở mức cố định 750 đồng cho mỗi 1 kWh điện sạc cho các đối tác trong vòng tối thiểu 10 năm. V-GREEN cũng cam kết đền bù cho các chủ trạm sạc nếu công ty dừng kinh doanh trước hạn cam kết 10 năm. Đặc biệt, các bãi gửi xe, cửa hàng xăng dầu, siêu thị, quán café, nhà hàng, khách sạn… cũng sẽ có cơ hội mở rộng tệp khách hàng khi đầu tư kinh doanh trạm sạc nhượng quyền V-GREEN."
2024-10-31,"PV GAS vẫn còn 4.400 tỷ nợ xấu, một nửa đến từ PV POWER, cầm 44.800 tỷ tiền mặt hưởng lãi hơn 1.100 tỷ trong 9T2024","Tổng Công ty khí Việt Nam (PV GAS,mã chứng khoán GAS) vừa công bố BCTC hợp nhất quý 3/2024 cho biết đã giảm được 2.067 tỷ đồng nợ xấu so với cuối quý 2/2024, còn 4.407 tỷ đồng. Trong đó, khoản nợ xấu lớn nhất là của Tổng công ty điện lực dầu khí Việt Nam (PV Power, mã chứng khoán POW) có giá trị hơn 2.020 tỷ đồng - giảm 1.655 tỷ đồng so với cuối quý 2. PV GAS đánh giá giá trị có thể thu hồi của khoản nợ xấu với PV POWER là 1.099 tỷ đồng (bằng 54% giá gốc). Nợ xấu giảm mạnh so với đầu quý, nhưng ﻿vẫn tăng hơn 3.100 tỷ đồng so với hồi đầu năm. Hơn 4.400 tỷ đồng nợ xấu này chiếm tỷ lệ gần bằng 5% tổng tài sản củaPV GASvà thấp hơn rất nhiều so với 44.800 tỷ tiền mặt và tiền gửi ngân hàng mà ""vua tiền mặt"" đang nắm giữ.  Trong quý 3/2024, PV GAS ghi nhận doanh thu 25.257 tỷ đồng - tăng 14% so với cùng kỳ. Khấu trừ chi phí, Công ty lãi sau thuế 2.578 tỷ đồng, tăng nhẹ so với quý 3/2023. Phía GAS cho biết, lợi nhuận sau thuế quý 3 tăng nhờ: + Giá dầu bình quân 80,34 USD/thùng - giảm 6,41 USD/thùng so với cùng kỳ năm ngoái; + Sản lượng khí khô tiêu thụ giảm 1%, tuy nhiên sản lượng LPG tiêu thụ tăng 22% làm doanh thu tăng, lợi nhuận tăng tuơng ứng; + Các hoạt động khác diễn ra bình thường.﻿  Luỹ kế 9 tháng đầu năm, GAS đạt 78.643 tỷ doanh thu - tăng hơn 10.000 tỷ đồng so với cùng kỳ. Lợi nhuận sau thuế 8.538 tỷ đồng - giảm 5%. Lãi từ tiền gửi là 1.125 tỷ đồng, tương đương hơn 4 tỷ đồng/ngày.﻿ Năm 2024, GAS đặt mục tiêu doanh thu hợp nhất đạt 70.716 tỷ đồng và lợi nhuận sau thuế 5.798 tỷ đồng, lần lượt giảm 22% và 51% so với thực hiện 2023. Do chỉ tiêu đề ra thấp nên Công ty đã vượt xa kế hoạch sau 9 tháng."
2024-06-25,"CTCK ước tính KQKD quý 2/2024 của 53 doanh nghiệp ""hot"": HPG, BCM, POW, FRT, VJC được dự báo có lợi nhuận đột biến, một tên tuổi đầu ngành có thể tăng trưởng gần 3.000%","Chứng khoán MBS vừa đưa ra dự báo về bức tranh lợi nhuận ngành và một số doanh nghiệp trong quý 2/2024. Theo đó, MBS dự báo lợi nhuận toàn thị trường có thể đạt mức tăng 9,5% so với cùng kỳ trong quý 2/2024 hỗ trợ bởi mức nền thấp cùng kỳ trong khi sản xuất và tiêu dùng có sự phục hồi nhẹ. Lợi nhuận ngành ngân hàng được dự báo tăng trưởng chậm lại ở mức 12% so với cùng kỳ. Các ngành đạt mức tăng trưởng lợi nhuận nổi bật gồm bán lẻ (+379%), vật liệu cơ bản (+63%) tới từ mức nền thấp năm ngoái. Một số ngành ước tính tăng trưởng lợi nhuận giảm như Bất động sản KCN (-26%) do mức nền cao năm ngoái hay dầu khí (-2%) do kết quả kém tích cực ở các doanh nghiệp hạ nguồn. Cụ thể, hàng loạt cổ phiếu dự báo ghi nhận lợi nhuận ""tăng bằng lần"" trong quý 2/2024 gồm LPB, FRT, BCM, HDG, HPG, PC1, POW, VJC.  Ngược chiều, nhiều doanh nghiệp sẽ có lợi nhuận tăng trưởng âm trong quý này như OCB, BID, STB, DBC, BSR, SZC, IDC, KBC, DXG, KDH, DGC, BMP, HAH, GMD.     Với nhóm ngân hàng, MBS dự báoLPBsẽ là ""ngôi sao"" tăng trưởng lợi nhuận quý 2 với mức tăng 146% nhờ mức nền thấp trong cùng kỳ, tăng trưởng tín dụng tăng trưởng 12,8% nhờ đẩy mạnh khách hàng doanh nghiệp. Xếp sau,VPBvàHDBcũng ghi nhận lợi nhuận tăng lần lượt 62% và 38% so với cùng kỳ nhờ tăng trưởng tín dụng cải thiện. Trong khi đó, hai ""ông lớn"" CTG và VCB được dự báo lợi nhuận tăng 8% và 4% so với cùng kỳ. Trái chiều, lợi nhuận BID có thể giảm 14% do NIM chưa cải thiện rõ rệt do ngân hàng vẫn đang thực hiện chính sách ưu đãi lãi suất cho vay ở mức thấp so với toàn ngành. Đại diện nhóm công nghệ, FPT được MBS dự báo sẽ tiếp tục duy trì đà tăng trưởng 21% trong quý 2 nhờ tăng trưởng ổn định từ tất cả các mảng kinh doanh. Trong đó mảng CNTT nước ngoài tăng trưởng 26% svck nhờ được dẫn dắt bởi sức tăng của các thị trường Nhật Bản và APAC. Mảng Dịch vụ CNTT trong nước ghi nhận doanh thu đạt 3.015 tỷ đồng, tương đương mức tăng trưởng 7%, thúc đẩy bởi nhu cầu đầu tư cho công nghệ từ khối ngân hàng và tài chính. Tại nhóm bán lẻ,MWGđược dự báo sẽ ""tỏa sáng"" trong quý 2 với mức tăng trưởng lợi nhuận đột biến 2.944% nhờ biên lợi nhuận gộp cải thiện khi mức nền giá các sản phẩm ICT-CE đều tăng trở lại, cao hơn 5-10% svck và BHX duy trì doanh thu trung bình/cửa hàng đạt 1,9 tỷ đồng/tháng cùng với biên LN gộp khoảng 25%. FRTcũng dự báo có tăng trưởng lợi nhuận tích cực 119% trong quý này nhờ mức nền thấp từ quý trước và biên lợi nhuận gộp cải thiện khi mức nền giá các sản phẩm ICT-CE đều tăng cao 5-10% so với cùng kỳ. Nhóm dầu khí chỉ cóPVSvàPVDđược dự báo tăng trưởng hai chữ số, lần lượt là 23% và 18% nhờ triển vọng từ các gói thầu hạn chế tại Lô B và giá thuê giàn khoan tiếp tục duy trì mức cao. MBS dự báo kết quả kinh doanh của nhóm BĐS hầu như suy giảm, duy chỉ cóBCM(+165%) do bật tăng từ mức nền thấp cùng kỳ,HDG(+319%) nhờ sản lượng thủy điệnu cải thiện, chi phí tài chính giảm. Tại nhóm thép,HPGdự kiến sẽ ghi nhận lợi nhuận tăng vọt 127% do sản lượng bán hàng tăng nhờ tiêu thụ thép xây dựng khả quan, giá nguyên vật liệu giảm 15% và chi phí tài chính giảm nhẹ trong bối cảnh lãi vay và tỷ giá hạ nhiệt. POWtrở thành điểm sáng trong nhóm năng lượng với mức tăng trưởng lợi nhuận dự báo đạt 210%. Động lực đến từ sản lượng điện khí , sản lượng thủy điện và sản lượng điện than quý 2 được cải thiện đáng kể so với cùng kỳ. "
2024-11-23,"Vingroup và PV Power chính thức bắt tay, muốn hợp lực phát triển hệ thống trạm sạc xe điện toàn quốc","Vingroup và PV Power sẽ ưu tiên xem xét sử dụng các sản phẩm, dịch vụ của nhau nhằm khai thác tối đa tiềm năng, tạo hiệu quả kinh doanh và nâng cao sức cạnh tranh của mỗi bên. Với thế mạnh trong lĩnh vực kinh doanh năng lượng,PV Powersẽ nghiên cứu giải pháp cung cấp điện xanh và giải pháp tiết kiệm năng lượng choVingroup, xây dựng phương án bán và cung cấp điện cho Vingroup cùng các đơn vị thành viên với mức giá cạnh tranh. Trong khi đó, Vingroup sẽ tạo điều kiện để PV Power nghiên cứu, lắp đặt hệ thống điện mặt trời áp mái tại các nhà xưởng, văn phòng, cơ sở hạ tầng do Vingroup và các công ty thành viên quản lý, cũng như tại các khu đô thị trên toàn quốc. Trong lĩnh vực trạm sạc xe điện, với việc thành lập công ty V-GREEN chuyên phát triển hạ tầng trạm sạc cho xe điện cùng những chiến lược kinh doanh như mô hình trạm sạc nhượng quyền, mạng lưới trạm sạc dành cho ô tô điện VinFast đã liên tục được mở rộng trong thời gian qua. Thông qua thỏa thuận mới được ký kết, PV Power và đối tác sẽ sản xuất và cung cấp các thiết bị chất lượng cao, giá cả cạnh tranh cho V-GREEN, đồng thời mạng lưới 1.000 trạm sạc xe điện do PV Power quy hoạch triển khai trong giai đoạn 2025 - 2030 sẽ được chuyển giao cho V-GREEN tiếp tục nghiên cứu và phát triển để phục vụ cho các khách hàng. Hiện tại, V-GREEN đã quy hoạch mạng lưới 150.000 cổng sạc ô tô, xe máy điện trên toàn quốc. Với sự hợp lực từ PV Power, việc mở rộng mạng lưới và chuyển đổi sang sử dụng năng lượng xanh dự kiến sẽ được thúc đẩy mạnh mẽ trong thời gian tới."
