publish_date,title,content
2024-05-11,"Từng hậu thuẫn cho Nutifood và PV Power vay hàng trăm triệu đô, Tập đoàn tài chính Ý SACE đang tìm kiếm doanh nghiệp bảo lãnh nguồn vốn “khủng” 1,3 tỷ USD","SACE là Tập đoàn Bảo hiểm và Tài chính tín dụng, trực thuộc Bộ Kinh tế và Tài chính Italia. Tập đoàn này chuyên cung cấp các công cụ và giải pháp toàn diện nhằm hỗ trợ doanh nghiệp và hệ thống kinh tế quốc gia, trong nhiệm vụ thúc đẩy năng lực cạnh tranh trong nước cũng như trên thị trường quốc tế của nền kinh tế Italia. Với danh mục hoạt động được bảo hiểm và các khoản đầu tư được bảo đảm trị giá 260 tỷ USD, SACE hỗ trợ hơn 50.000 công ty Italia - đặc biệt là SMEs, giúp họ tăng trưởng tại thị trường Italy và khoảng 200 thị trường nước ngoài khác. Không những thế, trong vài năm gần đây, họ đã chủ động đến các nước là đối tác thương mại quan trọng của Italia nhằm thực hiện bảo lãnh không ràng buộc, để các Ngân hàng cho DN nước sở tại vay. Và SACE đã chọn Việt Nam để bắt đầu hành trình này tại khu vực Đông Nam Á. SACE đã chọn Việt Nam để bắt đầu thâm nhập sâu thị trường Đông Nam Á ""Về vị trí địa lý, Việt Nam chính là trung tâm chiến lược của Đông Nam Á và là nền kinh tế lớn tại khu vực này. Hơn nữa, cơ cấu nền kinh tế Việt Nam và Italia tương đối giống nhau, khi SMEs chiếm 95% - là xương sống của cả nền kinh tế. 3 năm trước, khi các Hiệp định thương mại giữa EU-Việt Nam bắt đầu có hiệu lực, giao thương giữa Việt Nam – Italia cũng bắt đầu cất cánh, kim ngạch thương mại giữa cả hai tăng trung bình từ 10% đến 15%/năm. Để thúc đẩy tăng trưởng kim ngạch nhanh hơn nữa, SACE đang có ý định sẽ bảo lãnh thu xếp vốn vay cho các DN Việt Nam – Ý khoảng 1,3 tỷ USD trong năm 2024-2025"", ngàiMarco Della Seta - Đại sứ Italia tại Việt Nammở đầu câu chuyện. Ngài Marco Della Seta - Đại sứ Italia tại Việt Nam Số liệu của Hải quan Việt Nam cho thấy: năm 2022 kim ngạch xuất nhập khẩu giữa Việt Nam và Italy đạt 6,2 tỷ USD, tăng 11% so với năm 2021; trong đó, xuất khẩu Việt Nam sang Itali năm 2022 đạt 4,4 tỷ USD, tăng 14% so với năm trước. Ở chiều ngược lại, Việt Nam nhập khẩu từ Italia 1,7 tỷ USD, tăng 3,6% so với năm 2021. Năm 2023, kim ngạch thương mai song phương đạt 6,5 tỷ USD. Mặt hàng xuất khẩu chính của Việt Nam sang thị trường Italy gồm linh kiện điện tử, sắt thép, dệt may – da giày, cà phê, hạt điều, máy móc thiết bị... Ngược lại, Việt Nam nhập khẩu chính từ Italy máy móc thiết bị cơ khí, nhựa và các sản phẩm nhựa, tủ bàn ghế, phụ kiện dệt may, đồ uống, giấm… Đầu năm 2023, SACE đã đến và mở văn phòng tại TP.HCM. Động thái này, nói như bàMichal Ron - Giám đốc Kinh doanh Quốc tế của SACE, là để xúc tiến thương mại thực chất hơn cũng như mở rộng các lĩnh vực giao thương giữa Việt Nam – Italia. Bà Michal Ron - Giám đốc Kinh doanh Quốc tế của SACE Bà Michal Ron cho biết thêm: ""Chúng tôi đang quan tâm sâu sắc đến sự tăng trưởng đáng kể và các kế hoạch chuyển đổi bền vững của Việt Nam. Italy là một trong những nhà sản xuất hàng đầu tại châu Âu về máy móc chất lượng cao trong các lĩnh vực công nghiệp khác nhau như công nghệ năng lượng tái tạo và hàng hoá môi trường. Bên cạnh đó, chúng tôi cảm thấy những sản phẩm thế mạnh của Italia như ẩm thực, thời trang, chăm sóc sức y tế - sức khỏe…vẫn chưa phát huy hết tiềm năng khi xuất khẩu vào Việt Nam. SACE sẵn sàng cung cấp các sản phẩm và dịch vụ mang tính cạnh tranh cao thông qua giải pháp bảo hiểm và các giải pháp khác của chúng tôi. Bên cạnh đó, thông qua Chiến lược Thúc Đẩy (Push Strategy), chúng tôi cũng sẵn sàng với hơn 10 tỷ USD cho việc hỗ trợ các kế hoạch phát triển công nghiệp và cơ sở hạ tầng trên phạm toàn cầu với sự tham gia của các nhà cung cấp đến từ Italia"". Chiến lược Thúc đẩy (Push Strategy) 5 năm của SACE sẽ sử dụng các công cụ đổi mới như cung cấp tài chính cho các DN trên khắp thế giới trước khi họ ký hợp đồng thương mại với DN Italia. Một phần cơ bản và không thể thiếu của thỏa thuận với các khách hàng quốc tế là cam kết xem xét nguồn cung 'Made in Italy' phù hợp các kế hoạch đầu tư của họ. SACE hiện có 13 văn phòng trên khắp toàn cầu. Vậy DN Việt làm sao để đón được nguồn vốn 1,3 tỷ mà SACE lên kế hoạch thu xếp? Đại diện của SACE tham dự ""SACE meets Vietnam"". Cũng theo bà Michal Ron, phương cách hoạt động của SACE như thế này: họ sẽ làm việc với các ngân hàng quốc tế và địa phương, sau đó tổ chức các buổi gặp gỡ giữa DN Việt Nam – Italia để người mua gặp được người bán, tiếp theo họ sẽ hỗ trợ tài chính không ràng buộc, đứng trung gian kết nối giữa ngân hàng và doanh nghiệp. ""Hiện tại, trong hệ sinh thái của chúng tôi có khoảng 20 Ngân hàng - chủ yếu là ngân hàng nước ngoài. Trong thời gian tới, chúng tôi sẽ chọn 10 ngân hàng quốc nội uy tín để tham gia vào hệ sinh thái. Thời hạn một khoản vay trung bình có thể kéo dài từ 3 đến 5 năm, lãi suất có thể theo thị trường hoặc theo giá kỳ vọng của DN hoặc mong muốn từ Ngân hàng. Về phía DN, trước khi kết nối với Ngân hàng phù hợp, chúng tôi cũng sẽ có những bài kiểm tra dưới góc độ tín dụng, như: họ có kinh doanh hiệu quả hay không?, có hệ thống tài chính chặt chẽ hay không?... Hơn nữa, chúng tôi cũng sẽ không can thiệp sâu vào quyết định của doanh nghiệp Việt. DN có thể ngay lập tức nhận được vốn vay sau khi hợp tác được ký kết hoặc nhận từng phần tùy nhu cầu và kế hoạch kinh doanh. Hoặc thậm chí ngay sau khi ký kết, DN lại không muốn vay vốn nữa cũng không sao!"", bà Michal Ron làm rõ. Giám đốc Tài chính - Max Sunarcia đại diện Tập đoàn Thaco tham dự Hội nghị ""SACE meets Vietnam"" qua online. Nếu DN Việt muốn vay vốn trung – dài hạn để thực hiện các dự án về ESG hoặc có kế hoạch mở rộng sản xuất – kinh doanh ở các lĩnh vực như thiết bị điện, ô tô và năng lượng tái tạo trong nông nghiệp thì hãy tìm đến với SACE. Tất nhiên, điều kiện tiên quyết là khi muốn nhập khẩu bất cứ thứ gì thì DN đó phải ưu tiên nguồn cung đến từ Italia. Kế hoạch thu xếp 1,3 tỷ USD trong chỉ 2 năm, theo bà Michal Ron, là không phải quá khó khăn. Họ vẫn đang tích cực làm việc với các DN Việt Nam và đến cuối 2024, nhiều khả năng sẽ có từ 370 triệu - 380 triệu USD sẽ được các Ngân hàng rót vào DN Việt, dưới sự bảo lãnh của SACE. Ngoài ra, trong các năm trước, SACE từng đứng ra bảo lãnh các khoản vay lớn cho NutiFood và PVPower. Vào 2021, NutiFood đã nhận được khoản vay 31 triệu USD với thời hạn 5 năm, để hỗ trợ chi phí vốn và vốn lưu động của mình; bao gồm khoản đầu tư vào kho bãi mới, thay thế 4 dây chuyền chiết rót hiện có trong hoạt động sản xuất sữa. Trong khoản tín dụng trên, SACE cung cấp bảo lãnh đến 80% khoản vay còn HSBC đóng vai trò là bên thu xếp vốn duy nhất (MLA). Đây là khoản vay đầu tiên mà SACE đứng ra bảo lãnh tại khu vực Đông Nam Á. Vào 2023, PVPower cho hay, họ đã thành công vay 200 triệu USD từ SMBC (Nhật) do SACE bảo lãnh, với thời hạn 12 năm. Khoản vay này nằm trong kế hoạch huy động vốn để triển khai gói thầu EPC dự án Nhà máy Nhiệt điện Nhơn Trạch 3 và 4, dự án này có tổng đầu tư khoản 1,4 tỷ USD. Sau Việt Nam, SACE cũng có kế hoạch bảo lãnh các khoản vay tầm 2 tỷ USD cho các dự án giao thương giữa DN Singapore - Italia. Theo SACE, thì các lĩnh vực xuất - nhập khẩu giữa Italia và Singapore khác hoàn toàn so với Việt Nam, nên sẽ không có sự mâu thuẫn hoặc cạnh tranh ở đây."
2024-10-03,"PV Power ký hợp đồng tín dụng ""khủng"" cho Dự án điện Nhơn Trạch 3, 4","Dự án Nhà máy điện Nhơn Trạch 3 và 4 là dự án nhà máy điện sử dụng LNG đầu tiên tại Việt Nam, có ý nghĩa quan trọng trong quá trình dịch chuyển năng lượng quốc gia, với có tổng mức đầu tư gần 1,4 tỷ USD, có cơ cấu vốn chủ sở hữu/vốn vay là 25/75%. Theo ông Hoàng Văn Quang, Chủ tịch HĐQT PV Power, PV Power xác định phát triển chủ đạo ngành công nghiệp điện khí và lựa chọn các dự án năng lượng tái tạo, năng lượng sạch để phù hợp với chủ trương của Chính phủ hướng tới Net Zero vào năm 2050 và xu hướng thế giới. Ông Hoàng Văn Quang cũng khẳng định, hợp đồng tín dụng trị giá 521,5 triệu USD là hợp đồng tín dụng với giá trị khoản vay lớn nhất để tài trợ cho Dự án Nhà máy điện Nhơn Trạch 3 và 4. Phát biểu tại buổi lễ, đại diện các bên tài trợ và bảo hiểm cho Dự án Nhà máy điện Nhơn Trạch 3 và 4 khẳng định đây là minh chứng cho những nỗ lực của các bên tham gia. Đồng thời, bày tỏ hy vọng Dự án này sẽ góp phần đảm bảo ổn định năng lượng tại Việt Nam, hỗ trợ quá trình chuyển đổi năng lượng theo hướng giảm sự phụ thuộc vào năng lượng than, mang lại giá trị kinh tế cho các doanh nghiệp và người dân. Theo ông Dương Mạnh Sơn, Phó TGĐ Petrovietnam, Petrovietnam và các đơn vị thành viên đã và đang triển khai có hiệu quả các dự án đầu tư quan trọng trong lĩnh vực năng lượng, trong đó có Dự án Nhà máy điện Nhơn Trạch 3 và 4 của PV Power. Dự án đạt được những mốc quan trọng như hiện nay, một phần nhờ có sự đồng hành, chia sẻ, hợp tác tích cực từ các cơ quan tín dụng xuất khẩu KSURE và SERV cùng các ngân hàng như Citi và ING.  Tổng công ty Điện lực Dầu khí Việt Nam - CTCP (PV Power) là đơn vị thành viên của Petrovietnam, được thành lập ngày 17/5/2007. Hiện nay, PV Power đang sở hữu và vận hành 7 nhà máy điện và các dự án năng lượng tái tạo với tổng công suất đặt hơn 4.205MW. PV Power ghi dấu ấn tiên phong với việc đạt xếp hạng tín nhiệm quốc tế ở mức BB+ triển vọng ổn định do Fitch Ratings thực hiện. Cùng với đó, PV Power liên tiếp lọt Top 50 Công ty niêm yết tốt nhất do Tạp chí Forbes bình chọn và Top 100 doanh nghiệp bền vững tại Việt Nam do Hội đồng doanh nghiệp vì sự phát triển bền vững Việt Nam bình chọn. Citilà ngân hàng toàn cầu với lịch sử hơn 200 năm, hoạt động tại gần 100 thị trường trên toàn thế giới. Tại Việt Nam, Citi cũng là ngân hàng Mỹ đầu tiên được cấp phép thành lập, cung cấp các dịch vụ tài chính đa dạng cho các khách hàng doanh nghiệp tại đây từ năm 1994.  Trong 30 năm qua, Citi Việt Nam đóng góp tích cực cho sự phát triển kinh tế Việt Nam, trở thành cố vấn tài chính đáng tin cậy, được các tập đoàn, các tổ chức tài chính cũng như các công ty đa quốc gia lớn nhất tại Việt Nam tin tưởng lựa chọn. Citi đã điều phối và thu xếp gần 12 tỷ USD nguồn vốn dài hạn cho các dự án phát triển hạ tầng và tăng quy mô vốn hoạt động cho các khách hàng tại Việt Nam. INGlà một tổ chức tài chính toàn cầu với nền tảng vững chắc tại châu Âu, cung cấp dịch vụ ngân hàng thông qua công ty con ING Bank, với sứ mệnh hỗ trợ cộng đồng vươn lên trong cuộc sống và kinh doanh. Thành lập năm 2012, Văn phòng đại diện của ING Bank tại Hà Nội tận dụng sức mạnh từ mạng lưới toàn cầu rộng lớn, với hơn 1.000 chuyên gia ngân hàng giàu kinh nghiệm, cung cấp cho khách hàng nhiều dịch vụ như cho vay, ngân hàng giao dịch, tài chính doanh nghiệp và các giải pháp thị trường tài chính. Từ khi thành lập, ING Việt Nam đã đóng vai trò quan trọng trong việc tài trợ cho các dự án năng lượng trọng điểm, góp phần vào sự phát triển bền vững của đất nước."
2024-03-12,"PV Power báo doanh thu sụt giảm 1/3 trong tháng 2, chốt xong giá điện cho nhà máy điện Nhơn Trạch 3 và 4","Tổng Công ty Điện lực Dầu khí Việt Nam (PV Power, mã: POW)đã công bố kết quả kinh doanh ước tính trong tháng 2/2024 với doanh thu ước đạt 1.589 tỷ đồng, giảm 43% so với cùng kỳ năm trước và đạt 74% kế hoạch tháng. Trong đó Nhà máy điện Cà Mau 1&2 đóng góp nhiều nhất với 850 tỷ đồng doanh thu, Nhà máy điện Vũng Áng 1 đóng góp 649 tỷ đồng doanh thu.  Doanh thu bán điện trong tháng 2 ước đạt 1.560 tỷ đồng. Sản lượng phát điện ước đạt 912 triệu kWh. Theo PV Power, tháng 2 là thời điểm cuối mùa khô tại miền Bắc và miền Nam, bắt đầu mùa khô ở miền Trung. Trong tháng 2 là dịp nghỉ lễ Tết Nguyên Đán, phụ tải toàn hệ thống giảm sâu làm giảm khả năng huy động của các NMĐ trên toàn hệ thống. Giá điện thị trường toàn phần FMP bình quân dự kiến khoảng 1.420 VNĐ/kWh, thấp hơn giá biến đổi bình quân nhiên liệu đối với các nhà máy điện khí của PV Power. Việc này ảnh hưởng đến khả năng chào giá, vận hành các NMĐ. Lũy kế 2 tháng đầu năm 2024, doanh thu ước đạt 3.604 tỷ đồng, giảm 20% so với cùng kỳ năm trước.  Về tình hình hoạt động của các nhà máy điện, tạiNMĐ Cà Mau 1 và 2, nhà máy vận hành đảm bảo không phát sinh nghĩa vụ bao tiêu khí, để đạt hiệu quả tối ưu. Trong giai đoạn cuối tháng, giá thị trường tăng so với đầu tháng nên NMĐ Cà Mau 1&2 được huy động với sản lượng cao. TạiNMĐ Vũng Áng 1giá thị trường cao hơn so với chi phí biến đổi nhiên liệu than và nhà máy chào giá vận hành đảm bảo hiệu quả, đạt sản lượng tương đối cao trong điều kiện nhu cầu phụ tải toàn hệ thống giảm thấp Tuy nhiên tạiNhà máy điện Nhơn Trạch 1, trong bối cảnh giá điện thị trường thấp so với chi phí biến đổi và nhu cầu phụ tải thấp, nhà máy không được huy động khi chào giá vận hành cao hơn giá điện thị trường. Tương tự, nhu cầu phụ tải của toàn hệ thống thấp,Nhà máy điện Nhơn Trạch 2chỉ được huy động sản lượng thấp khi chào giá vận hành cao hơn giá điện thị trường. TạiNMĐ Đakđrinh, NMĐ đã cân đối chào giá vận hành đáp ứng Qc được giao, ưu tiên vận hành sản lượng lớn tại các chu kỳ có giá thị trường cao. Trong khi đó,NMĐ Hủa Nađược giao Qc thấp (27,4 triệu kWh, A0 điều chỉnh còn 14,0 triệu kWh). Nhà máy chào giá vận hành cân đối tối ưu lợi nhuận và giữ nước cho giai đoạn vận hành mùa nắng nóng với giá thị trường cao. Thông tin về tình hình đầu tư dự án mới, PV Power cho biết, tính đến thời điểm 26/1/2024, tiến độ tổng thể EPC dự án Nhà máy điện Nhơn Trạch 3 và Nhơn Trạch 4 ước đạt 80,2% so với kế hoạch là 86,2%. Với hợp đồng PPA, PV Power và EPTC đã thống nhất giá điện NMNĐ Nhơn Trạch 3&4. Công ty sẽ tiếp tục thực hiện công tác thu xếp vốn, đàm phán hợp đồng mua bán khí và hợp đồng mua bán điện cho dự án theo đúng tiến độ. Bước sang tháng 3, PV Power đặt mục tiêu doanh thu là 3.002 tỷ đồng, sản lượng điện dự kiến đạt 1.601 triệu kWh.  "
2024-11-25,"Cổ phiếu PV Power (POW) được nhà đầu tư “gom” mạnh, trong ngày thị trường “cạn” thanh khoản","Cụ thể, kết phiên 25/11, giá cổ phiếu POW của Tổng Công ty Điện lực Dầu khí Việt Nam (PV Power) ở mức 12.150 đồng/cổ phiếu, tăng trần 6,58% so với phiên trước, khối lượng cổ phiếu giao dịch khớp lệnh đột biến đạt hơn 18,6 triệu đơn vị - gấp gần 6 lần phiên trước. Cổ phiếu POW rơi về mức đấy giá thấp nhất trong vòng 6 tháng qua tại phiên 19/11 ở mức giá 11.200 đồng/cổ phiếu. Sau đó, cổ phiếu POW đã có điều chỉnh nhẹ ở 3 phiên gần nhất, trước khi tăng trần ở phiên giao dịch hôm nay. Rộng hơn cổ phiếu POW lập đỉnh giá cao nhất kể từ đầu năm ở đầu tháng 7 vừa qua, ở mức 15.300 đồng/cổ phiếu. Sau đó, thị giá của mã cổ phiếu này liên tục điều chỉnh theo hướng sụt giảm, trước khi tăng trần mạnh trong phiên giao dịch hôm nay. Cổ phiếu POW thanh khoản đột biến, thị giá tăng trần trong phiên hôm nay. (Nguồn: Cafef) Cổ phiếu POW bùng nổ giao dịch ngay sau động thái ký kết thỏa thuận hợp tác giữa PV Power với Tập đoàn Vingroup (HoSE: VIC) nhằm phát triển hệ thống trạm sạc xe điện trên quy mô toàn quốc và thúc đẩy việc sử dụng năng lượng tái tạo thông qua hệ thống điện mặt trời áp mái. Cùng với đó, PV Power cũng mới cho biết, Nhà máy điện Nhơn Trạch 3 và 4 đang hoàn thiện các công đoạn cuối cùng, tập trung lắp đặt và chuẩn bị cho giai đoạn thử nghiệm. Theo kế hoạch, Nhà máy điện Nhơn Trạch 3 sẽ chính thức vận hành thương mại vào tháng 6/2025, trong khi Nhà máy điện Nhơn Trạch 4 dự kiến đi vào hoạt động vào tháng 9/2025. Đây là dự án trọng điểm quốc gia với tổng công suất 1.624 MW, vốn đầu tư khoảng 1,4 tỷ USD, đặt tại huyện Nhơn Trạch, tỉnh Đồng Nai. Dự kiến, khi chính thức phát điện thương mại, dự án sẽ bổ sung hơn 9 tỷ kWh điện thương phẩm/năm cho hệ thống điện. Về tình hinh kinh doanh, lũy kế 9 tháng đầu năm,PV Powerbáo lãi sau thuế 1.111 tỷ đồng, tăng 25,73% so với cùng kỳ năm 2023, tương ứng tăng hơn 227 tỷ đồng. Thị trường “cạn” thanh khoản, VN-Index tiếp đà hồi phục Đà rung lắc mạnh của thị trường trong những phiên gần đây, đã ảnh hưởng phần nào đến tâm lý của các nhà đầu tư. Dù chỉ số chính VN-Index đã có sự hồi phục mạnh trong 4 phiên gần đây, nhưng thanh khoản trên thị trường vẫn ở mức thấp. Nhiều nhà đầu tư vẫn chọn phương án đứng ngoài quan sát. Kết phiên 25/11, chỉ số VN-Index tăng 6,6 điểm, lên 1.234,7 điểm. Tương tự, chỉ số HNX-Index tăng 0,96 điểm, lên 222,25 điểm. Chỉ số UPCoM-Index tăng 0,11 điểm, lên 91,82 điểm. Thanh khoản trên thị trường ở mức thấp, khi tổng giá trị giao dịch trên cả 3 sàn chỉ ở mức hơn 13.000 tỷ đồng. Riêng trên sàn HoSE, thanh khoản đạt gần 12.000 tỷ đồng. Sắc xanh xuất hiện ở hầu hết các nhóm ngành trong phiên 25/11. Hôm nay, sắc xanh bao phủ hầu hết các nhóm ngành, đặc biệt tăng mạnh ở các nhóm bất động sản, hàng không, logictics, sản xuất điện, … Tại nhóm bất động sản, tăng 2,64% lên 42.700 đồng, cổ phiếu VHM của Vinhomes dẫn đầu đà tăng. Theo sa là các cổ phiếu tăng trên 1% như VIC, HDG, DXG, KBC, IDC, SZC, … Nhóm cổ phiếu hàng không tăng mạnh với HVN +2,37% và VJC +1,08%. Cổ phiếu logictics cũng hút mạnh dòng tiền của các nhà đầu tư với VTP +2,23%, HAH +1,4%, VSC +1,27%, VOS +0,68%, VTO +3,47%, … Nhóm cổ phiếu sản xuất điện, dẫn đầu là cổ phiếu POW tăng trần 6,58%. Theo sau là cổ phiếu KHP +6,64%, GEG +1,87%, PPC +1,36%, QTP +1,46%, …."
2024-06-19,"Công ty con của PV Power báo lỗ ngay quý đầu tiên sau khi chuyển sàn, cổ phiếu vừa bất ngờ tăng vọt lập đỉnh mới","Ngoài sóng viễn thông, công nghệ, cổ phiếu ngành điện cũng đang thu hút sự chú ý trên sàn chứng khoán trong bối cảnh tiêu thụ điện tăng cao do thời tiết nắng nóng kéo dài. Trong bối cảnh đó, cổ phiếu HNA của Thuỷ điện Hủa Na gây ấn tượng mạnh khi vừa có phiên tăng kịch trần lên lập đỉnh mới tại mức 26.750 đồng/cp. Tính từ đầu năm, cổ phiếu này đã tăng gần 45%.  Thuỷ điện Hủa Na có vốn điều lệ hơn 2.300 tỷ đồng, trong đó Tổng Công ty Điện lực Dầu khí Việt Nam (PV Power –mã POW) là công ty mẹ nắm quyền chi phối đến 81% vốn điều lệ. Công ty đưa cổ phiếu lên giao dịch trên UPCoM từ đầu tháng 10/2017 với giá tham chiếu ngày giao dịch đầu tiên là 10.000 đồng/cp, tương ứng định giá khoảng 2.300 tỷ đồng. Cổ phiếu HNA chuyển sang niêm yết trên HoSE từ ngày 12/01/2024 với giá tham chiếu ngày giao dịch đầu tiên là 18.350 đồng/cổ phiếu. Mức định giá tương ứng hơn 4.300 tỷ đồng, cao hơn khoảng 90% so với thời điểm chào sàn chứng khoán hơn 6 năm trước. Hiện tại, giá trị vốn hóa của Thuỷ điện Hủa Na đang ở mức kỷ lục gần 6.300 tỷ đồng. Một điểm đáng chú ý là ngay trong quý đầu tiên sau khi chuyển sàn Thuỷ điện Hủa Na đã báo lỗ. Cụ thể, quý 1/2024, công ty ghi nhận doanh thu đạt 102,3 tỷ đồng, giảm 48% so với cùng kỳ năm 2023. Sau khi trừ chi phí, Thủy điện Hủa Na lỗ 3,8 tỷ đồng trong khi cùng kỳ vẫn lãi gần 70 tỷ đồng sau thuế.  Theo lý giải của ban lãnh đạo Thủy điện Hủa Na, lợi nhuận sau thuế quý 1/2024 của công ty giảm mạnh so với cùng kỳ 2023 là do lượng nước về hồ bình quân chỉ bằng chưa đến một nửa quý 1/2023. Điều này dẫn đến sản lượng điện giảm tới hơn 40% so với cùng kỳ năm ngoái, chỉ đạt 75,07 triệu kWh. Thủy điện Hủa Na là chủ đầu tư Dự án Nhà máy thủy điện Hủa Na trên thượng nguồn Sông Chu thuộc địa phận xã Đồng Văn, huyện Quế Phong, tỉnh Nghệ An, cách thành phố Vinh khoảng 180km. Nhà máy thủy điện Hủa Na có công suất thiết kế 180MW, bao gồm 02 tổ máy với tổng mức đầu tư khoảng 7.092 tỷ đồng, sản lượng điện trung bình năm là 712,7 triệu kwh. Nhà máy vận hành phát điện hòa vào mạng lưới Quốc gia tổ máy số 1 vào cuối tháng 12/2012, và tổ máy số 2 vào quý 1/2013. Nhà máy thủy điện Hủa Na còn tham gia phòng chống lũ cho hạ lưu với dung tích chống lũ 100 triệu m³, bổ sung nước mùa hạn cho hạ du và tăng thêm cho Thủy điện Cửa Đạt 20,1 triệu Kwh/năm và 7,4 MW công suất đảm bảo. Theo báo cáo phân tích của Agriseco Research, hiện tượng El Nino dự báo sẽ gây khó khăn cho thuỷ điện trong suốt nửa đầu năm. Viện Nghiên cứu Quốc tế (IRI) dự báo, El Nino sẽ có cường độ giảm dần trước khi chuyển sang pha trung tính vào giữa năm 2024. Điều này tiếp tục gây ra tình trạng khô hạn, ảnh hưởng tiêu cực đến lượng nước về hồ các nhà máy thuỷ điện. Về triển vọng kinh doanh năm nay, ban lãnh đạo Thủy điện Hủa Na cho biết, công ty đang dồn lực để mua lại  Nhà máy Thủy điện Nậm Nơn tại huyện Tương Dương, tỉnh Nghệ An. Nhà máy này đã vận hành từ năm 2014, có công suất 20 MW, bao gồm 2 tổ máy, sản lượng điện bình quân hàng năm theo thiết kế đạt 89,74 triệu kWh."
