publish_date,title,content
2024-01-13,"PV Power (POW) ước lãi 2023 sụt giảm 53% so với năm trước, mục tiêu lợi nhuận 2024 dưới nghìn tỷ","Tổng công ty Điện lực Dầu khí Việt Nam (PV Power, mã chứng khoán: POW)vừa công bố kết quả kinh doanh sơ bộ năm 2023 với sản lượng điện ước đạt 14.443 triệu kWH, hoàn thành 93% kế hoạch năm. Đóng góp lớn nhất tiếp tục là Nhà máy Cà Mau 1&2 với sản lượng phát điện ước đạt 5.277 triệu kWh, theo sau là Nhà máy Vũng Áng 1 với 4.337 triệu kWh; nhà máy NhơnTrạch 2 ước đạt 2.896 triệu kWh.  Về chỉ tiêu tài chính toàn Tổng công ty,doanh thu ước đạt 30.614 tỷ đồng, tăng 6% so với cùng kỳ năm trước và vượt 1% kế hoạch. Trong đó, CTCP ĐLDK Nhơn Trạch 2 ước đóng góp 7.063 tỷ doanh thu, giảm khoảng 20% so với năm trước; Thuỷ điện Hủa Na và Thủy điện Đakđrinh ước đạt lần lượt 761 tỷ đồng và 703 tỷ đồng doanh thu, giảm 36% và 17% so với thực hiện năm 2022. Ngược lại, Dịch vụ ĐLDK Việt Nam ước tăng doanh thu thêm 10% so với năm trước lên 294 tỷ, trong khi NLTT ĐLDK ước tăng 30% lên 13 tỷ đồng.  Lợi nhuận trước thuế đạt 1.327 tỷ đồng, vượt 4% kế hoạch.Lợi nhuận sau thuế đạt 1.194 tỷ, vượt 7% kế hoạch, tuy nhiên ước giảm 53% so với thực hiện trong năm 2022.Riêng lợi nhuận sau thuế của công ty mẹ ước đạt 1.194 tỷ đồng, hoàn thành 134% kế hoạch năm. Bước sang năm 2024,sản lượng điện mục tiêu đạt 16.703 triệu kWh, kế hoạch tổng doanh thu toàn Công ty ở mức 31.736 tỷ đồng, mục tiêu lợi nhuận sau thuế đạt 824 tỷ đồng. Riêng Công ty mẹ, PV Power đặt mục tiêu tổng doanh thu đạt 23.960 tỷ đồng và lợi nhuận sau thuế là 929 tỷ đồng.  Công ty cho biết sẽ quản lý vận hành sản xuất, bảo dưỡng sửa chữa các nhà máy điện đảm bảo thiết bị khả dụng cao, huy động tối đa công suất, an toàn, hiệu quả các nhà máy điện và quyền lợi của cổ đông. Đồng thời, POW sẽ tổ chức thực hiện sửa chữa định kỳ các nhà máy điện, cụ thể: trung tu tổ máy số 2 của Vũng Áng 1 (09-10/2024), trung tu Đakđrinh (07-08/2024), tiểu tu Cà Mau 2 (quý IV/2024), Nhơn Trạch 2 (09/2024), Hủa Na (03-04/2024) đảm bảo chất lượng, tiến độ, an toàn. Hoàn thành công tác quyết toán khắc phục sự cố tổ máy số 1 nhà máy điện Vũng Áng. Đối với dự án nhà máy điện Nhơn Trạch 3, 4, POW sẽ giám sát, quản lý thực hiện hợp đồng EPC; hợp đồng tư vấn Kỹ thuật dự án, các hợp đồng tư vấn phục vụ thu xếp vốn và các hợp đồng dự án còn lại đảm bảo chất lượng, phù hợp với nhu cầu, tiến độ dự án; hoàn thành đàm phán ký kết hợp đồng PPA với EPTC; hợp đồng GSA với PV Gas. Phấn đấu đốt lửa lần đầu Nhơn Trạch 3 vào tháng 5/2024 và phát điện thương mại vào cuối năm 2024. Trên thị trường chứng khoán, chốt phiên 12/1, cổ phiếu POW đạt 11.450 đồng/cp."
2024-05-31,"Việt Nam lần đầu tiêu thụ điện vượt 1 tỷ kWh/ngày, cổ phiếu PV Power lên cao nhất 8 tháng, gã khổng lồ ngành điện “thức giấc” sau khi nhiều thông tin quan trọng được hé lộ","Sau một thời gian có phần ""im hơi, lặng tiếng"", cổ phiếu POW của PV Power bất ngờ gây chú ý thời gian qua khi có nhiều phiên tăng nóng đi ngược thị trường. Sau hơn một tháng kể từ khi rơi xuống đáy trung hạn, POW đã tăng hơn 22% qua đó hồi ngược trở lại mức cao nhất trong vòng 8 tháng. Cổ phiếu tăng mạnh giúpPV Power""gỡ gạc"" được 5.500 tỷ vốn hóa sau hơn một tháng, đạt xấp xỉ 30.000 tỷ đồng, giữ vị trí số 1 ngành điện trên sàn chứng khoán. POW cũng là cổ phiếu duy nhất của ngành điện nằm trong nhóm VN30. Cổ phiếu này thường xuyên giao dịch sôi động và nằm trong top đầu thị trường về thanh khoản.  Bên ngoài sàn chứng khoán, PV Power cũng là một trong những đơn vị sản xuất điện lớn nhất của Việt Nam, nắm giữ 11% công suất phát điện cả nước. Tổng công ty hiện quản lý vận hành 7 nhà máy điện với tổng công suất 4.205MW, gồm điện khí, than và thủy điện. ""Gã khổng lồ"" ngành điện bất ngờ ""thức giấc"" khi nắng nóng gay gắt trên cả 3 miền đẩy tiêu thụ điện tăng cao kỷ lục. Theo số liệu từ Trung tâm Điều độ Hệ thống điện quốc gia, công suất đỉnh của toàn hệ thống dù chưa vượt qua đỉnh của cuối tháng 4 (đỉnh lịch sử) nhưng sản lượng điện tiêu thụ điện toàn quốc ngày 28/5 đã đạt đỉnh kỷ lục mới là 1,0019 tỷ hWh. Đây là lần đầu tiên trong lịch sử, tiêu thụ điện toàn quốc trong ngày vượt 1 tỷ kWh. Theo biên bản họp ĐHĐCĐ thường niên 2024 diễn ra ngày 23/5 vừa qua, sản lượng điện 5 tháng đầu năm của PV Power ước đạt 6.940 triệu kWWh, doanh thu tương ứng 13.052 tỷ đồng và lợi nhuận trước thuế ước gần 670 tỷ đồng. Với kết quả này, tổng công ty đã thực hiện 41% kế hoạch doanh thu (31.736 tỷ đồng) và 67% mục tiêu lợi nhuận (995 tỷ đồng) đề ra cho cả năm 2024.  Cũng tại ĐHĐCĐ thường niên 2024, Chủ tịch HĐQT PV Power cho biết phía bảo hiểm đã có văn bản chấp thuận bồi thường bảo hiểm tổn thất vật chất và gián đoạn kinh doanh liên quan đến sự cố tại Tổ máy số 1 nhà máy điện Vũng Áng 1 với tổng tiền bồi thuờng khoảng 1.000 tỷ, trong đó chi phí sửa chữa khoảng 600 tỷ đồng. Ngoài ra, PV Power còn đón nhận thêm một số thông tin liên quan đến tiến độ dự án nhà máy điện khí Nhơn Trạch 3&4. Theo đó, vào ngày 15/5, Ban Quản lý dự án điện thuộc PV Power, đã phát đi thông báo về việc đơn vị và Tổng thầu EPC phối hợp với các cơ quan của Tập đoàn điện lực Việt Nam (EVN) tiến hành nhận điện ngược thành công sân phân phối 220kV (theo phương án tạm) cho dự án nhà máy điện Nhơn Trạch 3, 4. Trước đó, Hội đồng nghiệm thu của dự án đã nghiệm thu tất cả các hạng mục cho công việc này. Đây là mốc tiến độ quan trọng để chuẩn bị cho công tác chạy thử từng khu vực và toàn nhà máy. Theo kế hoạch, nhà máy điện Nhơn Trạch 3 sẽ chính thức phát điện thương mại vào cuối năm 2024 và nhà máy điện Nhơn Trạch 4 là giữa năm 2025. Dự án nhà máy điện khí Nhơn Trạch 3&4 là công trình trọng điểm quốc gia, được xây dựng tại khu công nghiệp Ông Kèo, xã Phước Khánh, huyện Nhơn Trạch, tỉnh Đồng Nai. Dự án có quy mô công suất 1.500MW, tổng mức đầu tư 1,4 tỷ USD. Khi đi vào hoạt động, dự án sẽ bổ sung khoảng 9 tỷ kWh điện/năm cho hệ thống điện quốc gia."
2024-07-11,"Người nhà Kiểm toán nội bộ PV Power lên tiếng về việc mua “chui” cổ phiếu POW, lý do gây bất ngờ","Ông Ngô Nguyên Đán vừa có báo cáo giải trình về việc không công bố thông tin giao dịch cổ phiếu POW củaTổng Công ty Điện lực Dầu khí Việt Nam – CTCP(PV Power). Cụ thể, vào ngày 8/7, cá nhân này đã mua 5.000 cổ phiếu POW thông qua khớp lệnh trên sàn nhưng không đăng ký trước đó. Theo báo cáo giao dịch, ông Đán là chồng bà Nguyễn Thị Hằng, Kiểm toán nội bộ của PV Power. Theo quy định, người có liên quan đến người nội bộ của công ty đại chúng phải đăng ký giao dịch tối thiểu 5 ngày trước thời gian giao dịch dự kiến. Nguyên nhân dẫn đến việc mua ""chui"" được ông Đán đưa ra là do không thường xuyên giao dịch chứng khoán, chỉ giao dịch ngắn hạn với khối lượng nhỏ nên không biết các quy định về giao dịch cổ phiếu và quy định về công bố thông tin của người có liên quan đến người nội bộ. ""Đây là lần đầu tiên tôi mắc sai sót này, vì vậy tôi xin báo cáo giải trình và cam kết thực hiện nghiêm túc đúng quy định trong các lần giao dịch sau"", báo cáo giao dịch của ông Đán nêu. Trên thị trường, cổ phiếu POW đang giao dịch quanh vùng giá cao nhất 2 năm với 15.100 đồng/cp, tăng 34% so với đầu năm. Vốn hóa thị trường của PV Power tương ứng đạt 35.700 tỷ đồng, lớn nhất ngành điện trên sàn chứng khoán.  Tại Hội nghị sơ kết hoạt động sản xuất kinh doanh (SXKD) 6 tháng đầu năm diễn ra cuối tháng 6 vừa qua, ông Nguyễn Đình Thi, Trưởng Ban Kinh tế Kế hoạch PV Power cho biết tổng sản lượng điện toàn Tổng công ty 6 tháng đầu năm ước đạt 8.574 triệu kWh, bằng 103% cùng kỳ 2023 và đạt 98% kế hoạch. Doanh thu toàn Tổng công ty 6 tháng đầu năm ước đạt 16.169 tỷ đồng, đạt 97% kế hoạch và bằng 100% so với cùng kỳ năm ngoái. Ước tính trong quý 2, PV Power đạt gần 10.000 tỷ đồng doanh thu, tương ứng bình quân mỗi ngày thu khoảng 109 tỷ đồng. Trong báo cáo mới đây, MBS đánh giá PV Power là điểm sáng trong nhóm năng lượng với mức tăng trưởng lợi nhuận dự báo đạt 210%. Động lực đến từ sản lượng điện khí, sản lượng thủy điện và sản lượng điện than quý 2 được cải thiện đáng kể so với cùng kỳ. Về kế hoạch kinh doanh năm nay, PV Power đặt mục tiêu sản lượng và doanh thu lần lượt tăng 16% và 9% so với năm ngoái, lên 16,7 tỷ kWh và 31.700 tỷ đồng. Tuy nhiên, lợi nhuận trước thuế dự kiến lại giảm gần 31% so với thực hiện năm ngoái, xuống mức 995 tỷ đồng. Thực tế, trong giai đoạn 2019-2023, Tổng công ty đều thực hiện vượt kế hoạch lợi nhuận. "
2024-05-29,PV Power tiếp tục triển khai các giải pháp đảm bảo cấp điện trong mùa nóng,"Nhiệt độ bình quân trong tháng 4 tăng cao, gây nắng nóng gay gắt trên khắp cả nước. Nhu cầu tiêu thụ điện tăng cao trên cả 3 miền, đặc biệt tại TP.HCM nhiều ngày vượt đỉnh tiêu thụ điện trong lịch sử. Giá điện thị trường toàn phần (FMP) bình quân tháng 4 tăng so với các tháng đầu năm, dự kiến đạt khoảng 1.745 đồng/kWh. Trước thực tế này, PV Power đã điều hành linh hoạt các nguồn điện. Trong đó, nắm bắt tín hiệu tích cực của giá điện thị trường, Nhà máy điện Nhơn Trạch 2, Cà Mau 1&2 đang chào giá vận hành tăng tối đa sản lượng và hiệu quả. Khả năng cấp khí thực tế của PV Gas cho Nhà máy điện Cà Mau 1&2 đáp ứng yêu cầu vận hành. Đối với Nhà máy điện Hủa Na, chào giá vận hành cân đối tối ưu lợi nhuận và giữ nước cho giai đoạn vận hành mùa nắng nóng với giá thị trường cao. Nhà máy điện Đakđrinh cân đối chào giá vận hành đáp ứng Qc được giao, ưu tiên vận hành sản lượng lớn tại các chu kỳ có giá thị trường cao.  Nhà máy điện Cà Mau 1&2 đang chào giá vận hành tăng tối đa sản lượng và hiệu quả.  Do giá thị trường toàn phần bình quân cao hơn so với chi phí biến đổi nhiên liệu than, Nhà máy điện Vũng Áng 1 chào giá vận hành đạt sản lượng và lợi nhuận cao trong tháng 4. Với những nỗ lực trên, PV Power ghi nhận sản lượng phát điện tháng 4 đạt 1.7 tỉ kWh, doanh thu ước đạt hơn 3,2 nghìn tỉ đồng. Dự án Đầu tư nhà máy điện Nhơn Trạch 3 & Nhơn Trạch 4 cũng có những chuyển biến tích cực khi Ban QLDA Điện và EPTC/EVN đang đàm phán hợp đồng mua bán điện phục vụ giai đoạn thử nghiệm. Đồng thời, tiếp tục thực hiện công tác thu xếp vốn, đàm phán hợp đồng mua bán khí và hợp đồng mua bán điện cho dự án theo đúng tiến độ. Dự báo trong tháng 5/2024, áp thấp nóng phía Tây tiếp tục hoạt động mạnh, nên ở khu vực Bắc bộ (các tỉnh từ Thanh Hóa đến Phú Yên) xuất hiện nhiều ngày nắng nóng và nắng nóng gay gắt, có nơi đặc biệt gay gắt. Khu vực Tây Nguyên, Nam bộ tiếp tục xuất hiện nhiều ngày nắng nóng diện rộng, có nơi nắng nóng gay gắt, tập trung trong 20 ngày đầu tháng. Nhiệt độ trung bình trên cả nước phổ biến cao hơn so với trung bình nhiều năm từ 1,5-2,5 độ C. Do đó, nhu cầu điện sẽ tiếp tục tăng cao.  Nhà máy điện Vũng Áng 1 chào giá vận hành đạt sản lượng và lợi nhuận cao trong tháng 4  Để chủ động trong việc đảm bảo cung ứng điện cho hệ thống điện quốc gia, PV Power đặt mục tiêu sản lượng điện tháng 5 đạt 1.5 tỉ kWh, doanh thu đạt 2,9 nghìn tỷ đồng. Tiếp tục vận hành an toàn, ổn định và hiệu quả các Nhà máy điện. Nghiên cứu triển khai phát triển các dự án điện năng lượng tái tạo. Phối hợp với PV Gas, TKV để đảm bảo cung ứng đủ nhiên liệu cho các Nhà máy điện vận hành đáp ứng nhu cầu phụ tải, điều độ trong mùa nóng. Công tác bảo dưỡng sửa chữa tiếp tục thực hiện theo kế hoạch. Cũng như làm việc với EVN/EPTC về chủ trương giao Qc các nhà máy điện trong năm 2024. Với tất cả những nỗ lực của mình, PV Power quyết tâm triển khai linh hoạt các chiến lược sản xuất kinh doanh nhằm đảm bảo thực hiện tốt các mục tiêu đề ra, bám sát kế hoạch các dự án nguồn và lưới điện, đặc biệt là các công trình lưới điện cấp bách để đảm bảo phục vụ cấp điện mùa nắng nóng năm 2024. Với vị thế là nhà sản xuất điện năng hàng đầu trong khu vực, PV Power đặt ra chiến lược phát triển phù hợp với chiến lược phát triển ngành Điện Việt Nam, với lĩnh vực công nghiệp điện của Petrovietnam và xu thế chung của thế giới; tập trung phát triển nhiệt điện khí, năng lượng tái tạo, các lĩnh vực dịch vụ kỹ thuật điện, dịch vụ cung ứng nhiên liệu và các dịch vụ khác có liên quan để nâng cao khả năng cung ứng điện phục vụ đời sống và sản xuất nhân dân."
2024-07-17,PV Power (POW) báo lãi ‘đi lùi’ trong nửa đầu năm 2024,"PV Power (POW) báo lãi ‘đi lùi’ trong nửa đầu năm 2024. Ảnh minh hoạ. Tổng công ty Điện lực Dầu khí Việt Nam- CTCP (PV Power, MCK: POW) mới công bố kết quả kinh doanh 6 tháng đầu năm 2024. Theo đó, nửa đầu năm 2024, PV Power ghi nhận doanh thu đạt 15.822 tỷ đồng, giảm nhẹ so với cùng kỳ và lợi nhuận trước thuế ước tính đạt 657 tỷ đồng, giảm 29,3% so với cùng kỳ năm trước. Về sản lượng theo từng nhà máy, trong nửa đầu năm 2024, các nhà máy ghi nhận sản lượng vượt so với cùng kỳ như Nhà máy Cà Mau 1&2 ghi nhận 3.109,7 triệu kWh (cùng kỳ 3.098 triệu kWh), Nhà máy điện Vũng Áng ghi nhận 3.562,8 triệu kWh (cùng kỳ 2.107 triệu kWh). Ngược lại, sản lượng giảm tại các nhà máy như Nhà máy Nhơn Trạch 1, nhà máy Nhơn Trạch 2, Nhà máy điện Hủa Na, Nhà máy điện Đakđrinh ghi nhận sản lượng suy giảm so với cùng kỳ năm trước. Được biết, trong năm 2024, PV Power đặt kế hoạch tổng doanh thu 31.736 tỷ đồng, lợi nhuận trước thuế 995 tỷ đồng. Như vậy, sau 6 tháng đầu năm 2024, PV Power đã hoàn thành 49,9% kế hoạch doanh thu và 66% kế hoạch lợi nhuận năm. Về tiến độ tổng thể của tổ hợp Nhiệt điện Nhơn Trạch 3 và 4 ước đạt 90%. PV Power và EPTC/ EVN kết thúc quá trình đàm phán Hợp đồng mua bán điện, đang trình EVN xem xét hợp đồng. Hợp đồng mua bán khí (GSA) đang xem xét dự thảo với PV Gas để hai bên ký kết, làm cơ sở cho PV Gas thực hiện công tác chuẩn bị thu xếp nguồn cung LNG cho Dự án. PV Power đảm bảo cân đối đủ nguồn vốn chủ sở hữu cho dự án. Thu xếp thành công nguồn vốn vay ECA không ràng buộc xuất xứ thiết bị trị giá 200 triệu USD tại ngân hàng SMBC, đang hoàn tất các thủ tục cho khoản vay ECA tiếp theo. Thu xếp thành công khoản vay trong nước trị giá 4.000 tỷ đồng tại ngân hàng Vietcombank. Trong thời gian tới, tổng công ty sẽ đàm phán giá điện chính thức nhà máy điện Vũng Áng 1 sau khi quyết toán vốn đầu tư được phê duyệt, phấn đấu đốt lửa lần đầu Nhơn Trạch 3 và phát điện thương mại vào cuối năm 2024. Về kế hoạch sản xuất kinh doanh 6 tháng còn lại của năm 2024, PV Power đặt kế tổng sản lượng điện 7.923 triệu kWh, tổng doanh thu 15.008 tỷ đồng, tăng 37% và lợi nhuận trước thuế 340,61 tỷ đồng, giảm khoảng 35,7% so với 6 tháng cuối năm 2023. Trên thị trường, phiên sáng 17/7, cổ phiếu POW giảm 1,01% xuống mức 14.750 đồng/cổ phiếu."
