publish_date,title,content
2024-01-18,"Kết quả kinh doanh ngày 18/1: SSI, VIX cùng loạt CTCK, bất động sản, phân bón, thép ... báo lãi tăng trưởng mạnh, một ngân hàng bất ngờ lỗ","Các công ty chứng khoán đã công bố Những DN mới công bố BCTC quý 4/2023 ngày 18/1:   PGBank (PGB)bất ngờ báo lỗ trước hơn 4 tỷ đồng trong quý 4/2023. Đây là lần đầu tiên ngân hàng này báo lỗ trong một quý. Theo giải trình từ phía ngân hàng này, nguyên nhân chủ yếu dẫn đến khoản lỗ năm vừa rồi là do giảm lãi suất cho vay khách hàng theo chủ trương của Chính phủ, trong khi chi phí huy động chưa giảm do đỗ trễ và trưởng tín dụng của PGBank tập trung vào tháng cuối năm 2023. Ngoài ra PGBank chi trả thù lao cho công tác viên giới thiệu khách hàng vay để thúc đẩy tăng trưởng tín dụng làm chi phí hoạt động tăng. Chứng khoán Kỹ Thương (TCBS)công bố lợi nhuận trước thuế quý 4/2023 đạt 880 tỷ đồng, tăng 176% so với cùng kỳ năm ngoái. Lũy kế cả năm 2023, LNTT của Công ty đạt hơn 3.028 tỷ đồng, vượt 51% kế hoạch cả năm (kế hoạch 2.000 tỷ đồng) và gần như đi ngang so với năm trước. Tính tới thời điểm hiện tại, TCBS là công ty chứng khoán báo lãi đậm nhất trong quý 4 cũng như cả năm 2023. Tích cực không kém,Chứng khoán KB Việt Nam (KBSV)báo lãi trước thuế 66 tỷ đồng trong quý 4, trong khi cùng kỳ năm trước lỗ hơn 54 tỷ đồng. Chứng khoán VIX ( VIX)tiếp tục ghi nhận kết quả tích cực với 235,3 tỷ đồng lãi trước thuế, trong khi cùng kỳ lỗ 130 tỷ đồng. Lũy kế cả năm 2023, CTCK này lãi gần 1.200 tỷ đồng. Chứng khoán Thành Công (TCI)ghi nhận doanh thu hoạt động giảm 27% so với quý 4/2022 xuống gần 34 tỷ đồng. Khấu trừ chi phí, công ty báo lãi trước thuế hơn 9 tỷ đồng, trong khi cùng kỳ năm trước lỗ hơn 62 tỷ đồng. CTCP Nhà Đà Nẵng (NDN)trong quý 4/2023 ghi nhận doanh thu 68 tỷ đồng, trong khi quý 4/2022 gần như không có. Trừ các chi phí, doanh nghiệp bất động sản này lãi gần 30 tỷ đồng, trong khi cùng kỳ năm trước lỗ hơn 12 tỷ đồng. CTCP Licogi 14( L14)báo lãi qquý 4/2023 giảm 70% so với cùng kỳ năm trước còn 11 tỷ đồng. Ông lớn ngành phân bónDAP - Vinachem (DDV)ghi nhận doanh thu 835 tỷ đồng, tăng gần 4% so với cùng kỳ. Nhờ giá vốn giảm, công ty này lãi gần 71 tỷ đồng, gấp gần 8 lần cùng kỳ. Nhờ khoản doanh thu tài chính tăng vọt,CTCP Nam Tân Uyên (NTC)lãi hơn 76 tỷ đồng trong 4/2023, tăng 31% so với cùng kỳ năm trước. Lũy kế năm 2023, doanh nghiệp này lãi 346 tỷ đồng, tăng 13%.  CTCP Long Hậu (LHG)là doanh nghiệp bất động sản tiếp theo đón kết quả tích cực trong quý 4/2023 với doanh thu 145 tỷ đồng, lãi trước thuế 79 tỷ đồng, lần lượt tăng 40% và 104% so với cùng kỳ năm trước. Casumina (CSM)báo lãi trước thuế quý 4/2023 ở mức 27 tỷ đồng, giảm 29% so với cùng kỳ 2022. Lũy kế năm 2023, doanh nghiệp ghi nhận 72 tỷ đồng lợi nhuận, cũng giảm 29% so với năm trước đó. CTCP Đá Hóa An (DHA)lãi 23 tỷ đồng trong quý 4/2023, tăng 53% so với cùng kỳ năm trước. Công ty cũng có lãi trăm tỷ trở lại trong năm 2023 sau 3 năm. CTCP BOT Thái Hà (BOT)tiếp tục quý thứ 8 liên tiếp với con số gần 19 tỷ đồng. Lũy kế năm 2023, doanh nghiệp này lỗ tổng cộng hơn 90 tỷ đồng. Đây cũng là năm thứ 5 liên tiếp công ty báo lỗ kể từ khi giao dịch cổ phiếu trên UPCoM.  CTCP Nhựa Tiền Phong (NTP)vừa công bố kết quả kinh doanh quý 4/2023 với doanh thu 1.350 tỷ đồng, giảm 13,5% so với cùng kỳ năm trước. Tuy nhiên, nhờ giá vốn giảm công ty ghi nhận 194,6 tỷ đồng lãi trước thuế, gấp 2,4 lần cùng kỳ. Lũy kế cả năm 2023, Nhựa Tiền Phong lãi trước thuế 659 tỷ đồng, tăng 17% so với năm 2022. Đây cũng là khoản lãi kỷ lục của công ty này trong một năm.  CTCP Nhiệt điện Hải Phòng (mã chứng khoán: HND)vừa công bố BCTC quý 4/2023 với 2.620 tỷ đồng doanh thu, tăng 17% so với cùng kỳ năm trước. Tuy nhiên, kinh doanh dưới giá vốn nên công ty báo lỗ trước thuế 121 tỷ đồng. Cùng kỳ năm trước công ty này này cũng lỗ hơn 32,5 tỷ đồng. Theo giải trình từ phía công ty, nguyên nhân chủ yếu dẫn đến khoản lỗ này do sửa chữa tổ máy 1 hoàn thành nghiệm thu đưa vào sử dụng trong tháng 12/2023 nên chi phí này cũng được ghi nhận vào BCTC quý 4/2023 (267 tỷ đồng).  CTCP Điện lực Khánh Hòa (KHP)ghi nhận 1.673 tỷ đồng doanh thu trong quý 4/2023, tăng hơn 30% so với cùng kỳ năm trước. Sau khi trừ chi phí, công ty lãi trước thuế 103 tỷ đồng, tăng 61% so với cùng quý 4/2023. Điện lực Khánh Hòa cũng là một trong những trường hợp hiếm hoi trong ngành điện đón nhất kết quả tích cực tính đến lúc này. Nhiều công ty thủy điện công bố báo cáo tài chính quý 4/2023 trong hôm nay với lợi nhuận quý 4 sụt giảm so với cùng kỳ nhưThủy điện Sử Pan 2giảm 38%,Thủy điện Srok Phu Miêng IDICOgiảm 21%,Thủy điện A Vươnggiảm 44%. CTCP Đầu tư và Phát triển Cảng Đình Vũ (DVP)trong quý 4/2023 báo lãi trước thuế gần 69 tỷ đồng, tăng 1 tỷ đồng so với cùng kỳ năm trước. Lũy kế cả năm 2023, công ty lãi 396 tỷ đồng, tăng 15% so với năm 2022. Đây cũng là mức lợi nhuận kỷ lục của doanh nghiệp này trong lịch sử hoạt động.  Ngoài Nhựa Tiền Phong và Cảng Đình Vũ,CTCP Khử trùng Việt Nam (VFG) và Cảng Đồng Nai (PDN)cũng lập kỷ lục mới về lợi nhuận trong năm 2023. Trong khi Khử trùng Việt Nam mang về 376 tỷ đồng lãi trước thuế, tăng 31% so với năm 2022 thì Cảng Đồng Nai lãi 368 tỷ đồng, tăng 26%. CTCP Kim loại màu Thái Nguyên - Vimico (TMG)ghi nhận doanh thu quý 4 giảm 12% đạt 265 tỷ đồng. Chi phí tăng cao, TMG báo LNTT quý 4 chỉ hơn 4 tỷ, giảm 94% so với cùng kỳ. Lũy kế cả năm, TMG lãi trước thuế 40 tỷ, giảm 82% so với cùng kỳ. Những DN đã công bố BCTC quý 4/2023 tính đến ngày 18/1:"
2024-03-12,SSI Research dự báo BMP có thể vào VNDiamond thay thế MWG,"Chứng khoán      SSI Research dự báo BMP có thể vào VNDiamond thay thế MWG         Mai Hương                   •                   12/03/2024 - 15:29 SSI Research đã đưa ra dự báo về thay đổi của rổ chỉ số VNDiamond trong kỳ cơ cấu chỉ số quý I/2024. Đáng chú ý,cổ phiếu MWGvẫn được cho rằng có mức P/E không đáp ứng yêu cầu và có thể bị loại khỏi rổ trong khi BMP có thể được thêm mới.  Bộ chỉ số HOSE-Index, VNX-Index cùng các chỉ số đầu tư bao gồm VNDiamond, VNFIN Lead và VNFIN Select sẽ thực hiện tái cơ cấu danh mục cho kỳ quý I/2024 với các cột mốc thời gian là ngày chốt số liệu 29/3/2024 và ngày công bố 15/4/2024. Ngày hoàn thành cơ cấu danh mục 3/5/2024 và ngày chỉ số mới có hiệu lực 6/5/2024 Trong đó, chỉ số VNDiamond sẽ thực hiện rà soát thay đổi về danh mục thành phần, trong khi các chỉ số còn lại bao gồm VN30 và VNFIN Lead chỉ cập nhật số liệu và tính toán lại tỷ trọng danh mục. Với số liệu ước tính vào ngày 8/3/2024, SSI Research dự báo chỉ số VNDiamond sẽ loại MWG do không thỏa mãn yêu cầu về hệ số P/E. Trong khi đó, BMP có thể được thêm vào chỉ số khi là cổ phiếu nằm trong nhóm 8 công ty ngoài ngành tài chính sắp xếp theo tỷ lệ FOL từ cao nhất đến thấp nhất. Giả định với các thay đổi như trên, danh mục chỉ số mới sẽ bao gồm 18 cổ phiếu, trong đó 10 cổ phiếu thuộc nhóm ngành tài chính sẽ bị áp dụng mức tỷ trọng tối đa cho cả nhóm ngành là 40%. Trong các ETF trên thị trường, hiện có 3 ETF đang sử dụng chỉ số VNDiamond làm tham chiếu bao gồm VFMVN DIAMOND, MAFM VNDIAMOND và BVFVN DIAMOND với tổng giá trị tài sản ròng khoảng 17.615 tỷ đồng tại ngày 10/3/2024. Riêng quỹ VFMVN Diamond có tổng giá trị tài sản khoảng 17.187 tỷ đồng tại ngày 10/3/2024. Cụ thể, tổng giá trị tài sản quỹ đã giảm -0,43% so với đầu năm, trong đó giá trị vốn rút ròng là 2.280 tỷ đồng và NAV tăng 13,4% so với đầu năm. Theo đó, VFMVN Diamond ETF sẽ bán ra toàn bộ khoản đầu tư lớn thứ 2 trong danh mục là MWG với số lượng hơn 55 triệu cổ phiếu. Ước tính của SSI Research. Chiều ngược lại, BMP có thể được mua vào gần 500 nghìn đơn vị. Ngoài ra, các mã đang nằm sẵn trong danh mục chỉ số như VRE, HDB, REE, ACB, GMD, PNJ cũng sẽ được hưởng lợi nhiều nhất từ việc bán raMWG. Trên thị trường chứng khoán, BMP đã tăng hơn 8% từ đầu năm 2024 sau khi tăng gần 100% trong năm 2023. Các mã GMD, ACB, HDB, PNJ đã tăng hơn 10% từ đầu năm. Chia sẻ FacebookChia sẻ ZaloChia sẻ Zalo     Bài liên quan  Sáng ngày 09/3/2024, MarketVector Indexes đã công bố bổ sung FTS vào danh mục của MarketVector Vietnam Local Index - chỉ số tham chiếu cho VNM ETF.    Đọc tiếp        Gửi bình luận Bình luận của bạn đã được gửi và sẽ hiển thị sau khi được duyệt bởi ban biên tập. Ban biên tập giữ quyền biên tập nội dung bình luận để phù hợp với qui định nội dung của Báo. (0) Bình luận  "
2024-03-06,"Tăng trưởng lợi nhuận dự báo bước vào pha phục hồi, Giám đốc Phân tích SSI tiết lộ nhóm cổ phiếu yêu thích trong năm 2024","Động lực giúp chứng khoán hồi phục Chia sẻ tại Tọa đàm ""Thị trường chứng khoán: Xây nền - Tích lũy - Bứt tốc"" do Báo Đầu tư tổ chức mới đây, bà Phạm Huyền Trang, Giám đốc Phân tích cổ phiếu SSI Research cho rằng thị trường chứng khoán diễn biến tích cực trong thời gian gần đây nhờ niềm tin nhà đầu tư đã được củng cố. Năm 2023, những khó khăn nội tại của nền kinh tế khi Fed liên tục tăng lãi suất, thị trường trái phiếu, thị trường bất động sản ""đóng băng"" đã khiến tâm lý nhà đầu tư bị ảnh hưởng. Tuy nhiên, ngay sau đó, Chính phủ đã đưa ra những chính sách kịp thời hỗ trợ thị trường trái phiếu và bất động sản, điều hành chính sách linh hoạt thông qua 4 lần hạ lãi suất giúp dòng tiền chảy vào chứng khoán. Đặc biệt, tăng trưởng lợi nhuận doanh nghiệp cũng bắt đầu tạo đáy và trên đà phục hồi kể từ quý 3/2023. Nhà đầu tư khi nhìn vào bức tranh triển vọng của các ngành cũng như các doanh nghiệp trên thị trường đã thấy những gam màu tươi sáng hơn và đó cũng là những động lực giúp TTCK khởi sắc trong 2 tháng đầu năm nay. Nhìn rộng hơn, bức tranh vĩ mô đang có dấu hiệu của sự phục hồi khi xuất khẩu 2 tháng đầu năm tăng 20%, các chỉ số sản xuất công nghiệp cũng tăng trưởng, FDI vẫn tốt. Tuy nhiên, vị chuyên gia cho rằng còn quá sớm để nói về sự phục hồi. ""TTCK thường phản ảnh trước bức tranh vĩ mô. Chúng ta chỉ biết được nền kinh tế đã tạo đáy sau hai quý sau khi nền kinh tế đã tạo đáy. Tuy nhiên, đó là những yếu tố vĩ mô chúng ta phải quan sát vì nó sẽ tác động đến TTCK ngoài các vấn đề về lãi suất"", chuyên gia SSI chia sẻ. Margin chưa ""căng"", tăng trưởng lợi nhuận sẽ có sự phân hoá Theo dự báo của SSI, lợi nhuận các doanh nghiệp năm 2024 là năm đầu đánh dấu giai đoan phục hồi với mức tăng khoảng 15-16%. Con số này tích cực hơn so mức giảm 6% năm 2023, song nhà đầu tư sẽ cho rằng đây chưa phải là mức quá hấp dẫn. Dù vậy, SSI duy trì quan điểm 2024 sẽ là năm đầu tiên của sự phục hồi, năm 2025 mức tăng trưởng kỳ vọng 2 chữ số. Tuy nhiên, tăng trưởng lợi nhuận năm 2024 sẽ có sự phân hoá giữa các nhóm ngành.Những nhóm ngành đã tạo đáy trước, có biên lợi nhuận thấp trong năm 2023 sẽ bật tăng mạnh như VLXD (thép), bán lẻ, một số ngành xuất khẩu và chứng khoán. Nhưng một số ngành có độ trễ nhất định vì phụ thuộc vào bức tranh vĩ mô như ngành bất động sản, ngân hàng sẽ khó có mức lợi nhuận khả quan.  SSI kỳ vọng năm 2025 các ngân hàng sẽ có mức tăng trưởng cao hơn 2024. ""Tôi thích ngành thép bởi ngành này không chỉ có thể duy trì tăng trưởng lợi nhuận trong năm nay mà các năm tiếp theo vẫn tích cực nhờ sự phục hồi của BSĐ cũng như yếu tố từ nội tại doanh nghiệp như mở rộng công suất. Bên cạnh đó, ngành tiêu dùng liên quan đến câu chuyện dân số vàng, dù ngắn hạn vẫn có thử thách nhưng dài hạn khá tích cực"", bà Trang cho biết. Về áp lực margin trên thị trường, Giám đốc Phân tíchSSIcho rằng theo số liệu có thể thấy margin trên thị trường chưa ""căng"", có nghĩa nhà đầu tư chưa sử dụng hết sức mua. Bên cạnh đó, tiền gửi cá nhân của các tổ chức tín dụng mặc dù trong môi trường lãi suất tiết kiệm thấp nhất thập kỷ qua nhưng tiền gửi vẫn tăng, tức là có những nguồn tiền nhà đầu tư chờ sẵn, nhưng chưa quá hứng khởi để tham gia TTCK trong giai đoạn hiện nay. Thanh khoản thị trường tính từ tháng 10 năm ngoái cũng có những phiên khá cao trên 1 tỷ USD, nhưng chưa phải quá bùng nổ. Tâm lý nhà đầu tư sau khi phản ánh xong sự tích cực khi được củng cố các chính sách cũng như việc ngân hàng hạ lãi suất điều hành, họ cũng cần có thời gian quan sát độ thẩm thấu của những chính sách hỗ trợ đến sự phục hồi của thị trường BĐS, nợ xấu ngân hàng hay trái phiếu doanh nghiệp."
2024-09-10,SSI Research: Chứng khoán Việt Nam sẽ khởi sắc hơn trong nửa cuối của tháng 9,"Trong báo cáo mới cập nhật, Chứng khoán SSI cho biết thị trường chứng khoán Việt Nam là một trong các thị trường hồi phục nhanh trở lại sau đợt bán mạnh tuần đầu tháng 8. Lo ngại từ hoạt động “carry trade” khi Nhật Bản nâng lãi suất khiến các tài sản rủi ro, trong đó có cổ phiếu bị bán tháo trong tuần đầu tháng nhưng hầu hết các thị trường bật lại mạnh sau đó nhờ thông điệp mạnh mẽ hơn của FED về khả năng cắt giảm lãi suất trong tháng 9. Lực bán mạnh ở tuần đầu tiên của tháng 8 khiến chỉ số VN-Index lùi về mốc thấp nhất 1.188 điểm nhưng phục hồi ấn tượng ngay sau đó. Kết phiên 30/8 tại 1.283,87 điểm, VN-Index đã phục hồi 8% từ đáy ngắn hạn và tăng 32 điểm, tương ứng tăng 2,6% so với tháng cuối tháng 7. Theo SSI, chứng khoán Việt Nam được hỗ trợ tốt từ các yếu tố nội tại trong nước bù đắp cho biến động khó lường từ bên ngoài. Điển hình như xu hướng phục hồi của nền kinh tế và lợi nhuận của các doanh nghiệp niêm yết, rủi ro tỷ giá giảm đáng kể trước xu hướng hạ nhiệt của đồng USD và chính sách hỗ trợ của Chính phủ/ NHNN. Chứng khoán Việt Nam kỳ vọng là điểm đến của dòng tiền Trong tháng 9 này, SSI chỉ ra một số sự kiện có thể ảnh hưởng tới thị trường chứng khoán.  Về yếu tố lịch sử, tháng 9 thường là tháng không có quá nhiều biến động đối với chỉ số chính VN-Index, trừ các năm bị tác động mạnh bởi tỷ giá như 2022 và 2023. Về yếu tố định giá, P/E Forward của VN-Index tăng nhẹ lên 11,6 lần vào ngày 6/9/2024, mức hấp dẫn hơn so với một số TTCK khu vực Đông Nam Á. Các TTCK Đông Nam Á tạo điểm sáng trong nhịp hồi phục trong tháng 8 vừa qua. Trong bối cảnh khả năng các thị trường mới nổi hưởng lợi khi FED bắt đầu chu kỳ nới lỏng chính sách tiền tệ thì yếu tố định giá hấp dẫn có thể là một điểm đến của dòng tiền.  Thị trường chứng khoán Việt Nam có lợi thế, đã phục hồi ấn tượng trong tháng 8 nhờ xu hướng hồi phục của nền kinh tế, tăng trưởng lợi nhuận tích cực trên diện rộng. Dựa trên danh sách theo dõi của SSI Research, tăng trưởng lợi nhuận so với cùng kỳ có thể đạt mức 21,7% trong nửa cuối 2024; tăng tốc đáng kể so với mức chỉ 6,2% trong nửa đầu năm. Trong khi đó, dòng tiền từ khối NĐT trong nước kỳ vọng sẽ sôi động hơn khi NHNN có thể điều hành chính sách theo hướng nới lỏng khi FED chính thức hạ lãi suất và đồng USD hạ nhiệt. ""Nhìn chung, mặc dù có thể còn những biến động khi phải thận trọng theo dõi các dữ liệu về các kịch bản của nền kinh tế Mỹ, đã có nhiều hơn các yếu tố có thể tác động tích cực lên lên TTCK Việt Nam cho giai đoạn cuối năm khi tăng trưởng đi kèm với CSTT và chính sách tài khóa theo hướng hỗ trợ"", báo cáo nêu rõ. Nhóm phân tích SSI kỳ vọng điểm số và thanh khoản của thị trường sẽ khởi sắc hơn trong 2 tuần cuối tháng 9khi trọng tâm theo dõi sẽ quay lại tập trung vào các yếu tố nội tại trong nước. SSI cũng khuyến nghị nhà đầu tư tiếp tục phân bổ danh mục cân bằng, vừa đảm bảo hưởng lợi từ kỳ vọng hồi phục tăng trưởng như Tiêu dùng (Thực phẩm, Bán lẻ), Xuất khẩu, Ngân hàng, Xây dựng/VLXD."
2024-01-21,"Dư nợ cho vay tại các công ty chứng khoán lên cao nhất 7 quý, bất ngờ cái tên dẫn đầu không phải SSI, VNDirect, Mirae Asset hay VPS","Sau cú giảm mạnh trong tháng 10 năm ngoái, thị trường chứng khoán đã nhanh chóng quay đầu hồi phục. Tâm lý nhà đầu tư cũng được cải thiện rõ rệt trong phần còn lại của năm 2023. Nhu cầu sử dụng đòn bẩy (margin) để bắt sóng hồi phục cũng theo đó gia tăng đáng kể. Theo thống kê, dư nợ cho vay tại các công ty chứng khoán vào thời điểm cuối năm 2023 ước tính tăng 15.000 tỷ so với cuối quý 3, đạt khoảng 180.000 tỷ đồng. Đây là mức dư nợ cho vay lớn nhất trong vòng 7 quý kể từ quý 2/2022. Trong đó, dư nợ margin ước tính vào khoảng 172.000 tỷ đồng, cũng tăng 13.000 tỷ so với cuối quý 3.  Quý cuối năm 2023 chứng kiến sự phân hoá rõ rệt giữa các công ty chứng khoán trong hoạt động cho vay. Nhiều tên tuổi thường xuyên nằm trong top đầu như SSI, Mirae Asset, VNDirect đã chững lại trong khi một số công ty top sau lại có sự bứt phá mạnh mẽ. Ấn tượng nhất phải kể đến TCBS khi công ty chứng khoán này ghi nhận dư nợ cho vay tăng đến gần 3.800 tỷ sau một quý, lên trên 16.600 tỷ đồng qua đó trở thành quán quân về cho vay tại thời điểm cuối năm 2023. Đây là lần đầu tiên TCBS vươn lên vị trí này kể từ khi đi vào hoạt động năm 2008. Bên cạnh TCBS, những cái tên như MBS, Vietcap, VPBankS cũng ghi nhận dư nợ cho vay tăng mạnh trong quý cuối năm ngoái với giá trị đều trên 2.000 tỷ đồng. HSC, VPS, FPTS cũng tăng dư nợ cho vay nhưng khiêm tốn hơn. Ngược lại, Mirae Asset và VNDirect là 2 công ty chứng khoán có dư nợ cho vay sụt giảm mạnh nhất sau quý 4, tuy nhiên mức giảm không lớn so với quy mô.  Một trong những yếu tố kích thích nhu cầu đòn bẩy của nhà đầu tư là xu hướng giảm lãi suất trong phần lớn thời gian của năm 2023. Lãi suất cho vay của các ngân hàng thương mại giảm góp phần giảm chi phí vốn cho các công ty chứng khoán qua đó tạo thêm dư địa để giảm lãi suất cho vay margin. Bên cạnh đó, triển vọng của chứng khoán Việt Nam cũng được đánh giá lạc quan trong năm 2024 nhờ kinh tế vĩ mô ổn định, kỳ vọng lợi nhuận của các doanh nghiệp niêm yết phục hồi, câu chuyện nâng hạng ngày càng rõ ràng với việc KRX sớm đi vào vận hành,… Do đó, không bất ngờ khi đòn bẩy được nhà đầu tư kích hoạt ngay khi thị trường bắt đầu có dấu hiệu hồi phục. Trong thư gửi nhà đầu tư mới đây, Petri Deryng - người đứng đầu Pyn Elite Fund cho biết, chứng khoán Việt Nam thực sự bị chi phối bởi các giao dịch của nhà đầu tư cá nhân với chu kỳ giao dịch khá ngắn. Nhà đầu tư cá nhân chiếm đến hơn 80% giao dịch trên thị trường chứng khoán Việt Nam, con số vượt trội so với các thị trường khác trong khu vực. ""Các nhà đầu tư cánhânthường xuyêntăng gấp đôi và gấp ba số tiền đặt cược một cách nhanh chóng khi nhìn thấy được hướng đi của thị trường chứng khoán và các chỉ số kỹ thuật""nhấp nháy""màu xanh lá cây.Điều nàycó thểtạo cơ hội cho những đợt tăng giá mạnh bất ngờ"", ông Petri Deryng nhấn mạnh.  Về triển vọng thị trường chứng khoán năm 2024, theo Dragon Capital, cổ phiếu là kênh đầu tư hấp dẫn nhất năm 2024. Lãi suất tiền gửi 12 tháng tại ngân hàng chỉ còn khoảng 4,7% trong khi mức lợi nhuận của kênh đầu tư chứng khoán được dự báo đạt khoảng 10,9% (tính dựa trên tỷ lệ P/E dự kiến 9,1 của năm 2024). Hơn nữa, các kênh đầu tư khác như bất động sản có những giới hạn nhất định như quy mô vốn lớn, thanh khoản thấp, đặc biệt là khi các nhà đầu tư vẫn còn rất thận trọng về tiến độ pháp lý của các dự án. Do đó, quỹ ngoại này đánh giá các dòng vốn lớn có thể sẽ tìm đến thị trường chứng khoán."
