publish_date,title,content
2024-10-09,"SSI ước tính lợi nhuận của 46 DN 'hot' quý 3/2024: Công ty của một tỷ phú được dự báo lãi tăng hơn 1.200%, hàng loạt cái tên 'quen mặt' có thể giảm","SSI Research vừa ra bản báo cáo ước tính kết quả kinh doanh quý 3/2024 của 46 doanh nghiệp - ngân hàng đang niêm yết trên sàn chứng khoán. Đây chỉ là dự báo (miễn trừ trách nhiệm) của các chuyên gia nghiên cứu phân tích, và các con số này thậm chí có thể khác xa thực tế khi doanh nghiệp chính thức công bố. Trong số này, có 33 doanh nghiệp và ngân hàng được SSI Research nhận định là có kết quả tăng trưởng so với cùng kỳ năm trước.Các công ty được dự báo tăng trưởng gồm ACB, BCM, BID, CTG, CTR, DCM, DGW, DPR, FPT, DMG, GVR, HAH, HDB, HDG, HPG, KBC, MBB, MSB, MSN, PAN, POW, PTB, PVD, PVT, STB, STK, TCB, TPB, VCB, VNM, VPB,...    Theo SSI Research, một loạt các ngân hàng có vốn hóa lớn trên thị trường nhưACB, CTG, VCB, TCB, VPB, BID, TPB, MBB...sẽ tiếp tục có lợi nhuận tăng trưởng trong quý 3/2023 với câu chuyện chung là NIM tiếp tục duy trì mức ổn định. Thậm chí có ngân hàng NIM sẽ tiếp tục cải thiện.Ngoài nguyên nhân trên, tỷ lệ nợ xấu của các ngân hàng này tiếp tục ổn định ở mức thấp. Trong số những công ty được khảo sát,Masan Group (MSN)﻿là cái tên ghi nhận mức tăng trưởng LNST mạnh nhất với 1.250% lên 650 tỷ đồng. Theo SSI Research, Masan Consumer và Techcombank là 2 nguồn đóng góp chính vào lợi nhuận của Masan Group. Trong khi đó, quý 3/2024 nhiều khả năng WinCommerce có thể có quý đầu tiên báo lãi, MHT giảm lỗ cũng đóng góp tích cực vào lợi nhuận của Masan Group. Bên cạnh đó, chi phí lãi vay của tập đoàn này cũng giảm. ﻿Những cái tên SSI Research dự báo LNST sẽ tăng trưởng 3 chữ số bao gồmDCM, KBC, POW, STK, SZC. FPT, CTR, VNM hay HPGđược dự báo cũng sẽ tiếp tục duy trì đà tăng trưởng của mình như một thói quen. ﻿Bên cạnh những công ty tăng, SSI Research cũng dự đoán 13 cái tên sẽ báo lợi nhuận giảm hoặc không tăng gồm GAS, HHV, NT2, IMP, KDH, BSR, DRC, HSG, NLG, OCB, PLX, PNJ, VIB...   BSR, GAS, PLXlà 3 doanh nghiệp ngành dầu khí được SSI Research dự báo lợi nhuận giảm trong quý 3/2024. Theo CTCK này, việc giá xăng dầu giảm mạnh trong thời gian gần đây sẽ ảnh hưởng tiêu cực đến các công ty kể trên. ﻿PNJbất ngờ được dự báo lợi nhuận giảm 22%-25% dù giá vàng đang ở mức cao. SSI Research cho rằng chi phí đầu vào cao cùng việc thay đổi cơ cấu sản phẩm ảnh hưởng đến LNST của PNJ. "
2024-04-25,"Ông Nguyễn Duy Hưng: KRX lâu dài sẽ thay đổi bộ mặt TTCK Việt Nam, SSI đang dồn lực cho đợt kiểm tra cuối ngày 30/4","Chiều ngày 25/4, CTCP Chứng khoánSSI(mã chứng khoán SSI) đã tổ chức Đại hội đồng cổ đông thường niên 2024, thông qua kế hoạch doanh thu hợp nhất 8.112 tỷ đồng và lợi nhuận trước thuế 3.398 tỷ đồng, tăng lần lượt 13% và 19% so với năm 2023. Nếu hoàn thành, đây sẽ là mức doanh thu và lợi nhuận cao nhất của SSI từ trước đến nay. Con số lợi nhuận này nhỉnh hơn so với 3.365 tỷ đồng đạt được năm 2021 khithị trường chứng khoánbùng nổ, các mảng kinh doanh đều thuận lợi. HĐQT đồng thời muốn được cổ đông ủy quyền điều chỉnh kế hoạch phù hợp khi mức tăng trưởng và thanh khoản thị trường không đạt mức giả định. Kết thúc quý 1/2024, doanh thu hợp nhất ước đạt 2.022 tỷ đồng và lợi nhuận trước thuế 945 tỷ đồng, lần lượt thực hiện 25% và 28% so với kế hoạch cả năm. Riêng Công ty mẹ đạt lợi nhuận trước thuế 900 tỷ đồng, lợi nhuận sau thuế 727 tỷ đồng, tăng lần lượt 53% và 51% so với cùng kỳ. Năm 2023, SSI ghi nhận tổng doanh thu đạt 7.158 tỷ, tăng 13% so với 2022 và lợi nhuận trước thuế đạt 2.848,5 tỷ, tăng 35% so với năm 2022. Lợi nhuận sau thuế tương ứng thu về 2.493 tỷ đồng. Về kế hoạch phân phối lợi nhuận cho năm 2023, HĐQT đề xuất mức chi trả cổ tức bằng tiền mặt 10%, tương đương với số tiền dự chi 1.511 tỷ đồng. Tại đại hội, HĐQT cũng sẽ trình thông qua tiếp tục thực hiện các phương án chào bán, phát hành cổ phiếu đã được chấp thuận năm 2023, phát hành tối đa 10 triệu cổ phiếu ESOP năm 2024, bầu 2 thành viên hội đồng quản trị và các nội dung khác. Cuối năm 2023, SSI về 2 phương án tăng vốn bao gồm phát hành hơn 302 triệu cổ phiếu thưởng theo tỷ lệ 20% và chào bán hơn 151 triệu cổ phiếu cho cổ đông hiện hữu theo tỷ lệ 10%. Tổng khối lượng phát hành hơn 453 triệu đơn vị, qua đó tăng vốn điều lệ lên 19.645 tỷ đồng để tiếp tục dẫn đầu về vốn trong nhóm công ty chứng khoán. Chia sẻ tại Đại hội Chủ tịch HĐQTNguyễn Duy Hưngcho biết: ""Niềm vui của tôi là khi nhìn xuống thấy rất nhiều cổ đông đồng hành với SSI trên 20 năm"". Ông cũng thông tin theo quy định của Luật Doanh nghiệp có hiệu lực từ 2021 thì Tổng Giám đốc và chủ tịch HĐQT không phải là người có liên quan. Tuy nhiên, hiện Chủ tịch HĐQT Nguyễn Duy Hưng và CEO Nguyễn Hồng Nam (được bổ nhiệm CEO từ 2020) là anh em ruột. Theo ông Hưng, Công ty đã có sự chuẩn bị lực lượng, người kế cận để có người làm Tổng Giám đốc trong tương lai nhằm không vi phạm các quy định mới. Thảo luận tại Đại hội 1. Hoạt độngtự doanh củaSSIđang ra sao? Giám đốc Tự doanh, Kinh doanh nguồn vốn Nguyễn Vũ Thùy Hương: Mảng tự doanh và nguồn vốn đang chiếm khoảng 60% lợi nhuận SSI. Tại Công ty, tự doanh gồm 3 mảng: kinh doanh nguồn vốn, kinh doanh cổ phiếu và kinh doanh phái sinh. Trong đó, kinh doanh nguồn vốn chiếm lớn nhất 45% lợi nhuận SSI và kinh doanh cổ phiếu khoảng 15%. Trong năm 2023, kinh doanh cổ phiếu có tỷ suất lợi nhuận khoảng 20%, cao hơn mức tăng VN-Index. 2. Động lực tăng trưởng lợi nhuận củaSSI chủ yếu đến từ đâu? Bà Nguyễn Vũ Thùy Hương: Dựa trên kế hoạch kinh doanh 2024 thì có 4 khối kinh doanh chính: bán lẻ, đầu tư nguồn vốn, dịch vụ ngân hàng đầu tư và bán buôn. Với kế hoạch tăng trưởng lợi nhuận 19% thì Công ty đặt kế hoạch chung cho tất cả các mảng tương đương với tỷ lệ tăng lợi nhuận của công ty. 3. SSI có làmMarkerMaker (vừa mua vừa bán cùng cổ phiếu) không? Chủ tịch HĐQTNguyễn Duy Hưng: Hiện Công ty chưa có hoạt động này. Tuy nhiên, SSI có mảng phái sinh là một dạng này. Phó tổng giám đốc Nguyễn Đức Thông: Chứng quyền do SSI phát hành thì có làm Maket Maker để thuận lợi cho việc giao dịch của nhà đầu tư, một cách an toàn và thông suốt. 4. SSI đánh giálộ trình nâng hạng ra sao? Nâng hạng là chuyện của thị trường, còn SSI chuẩn bị những điều kiện cần thiết để đón đầu cơ hôi, hỗ trợ các yếu tố cho nâng hạng thị trường. 5. Hiện tỷ lệ Margin tại SSI ra sao? Bà Nguyễn Vũ Thùy Hương: Đối với phần cho vay margin đây là điều quan tâm của nhiều nhà đầu tư. Mảng này có lợi đôi bên: công ty chứng khoán có thêm nguồn thu và với nhà đầu tư có thêm đòn bẩy để đầu tư. Do đó, Công ty sẽ tiếp tục đẩy mạnh mảng này. Với SSI, song song với phát triển dư nợ margin thì cũng cung cấp dịch vụ quản trị rủi ro an toàn cho khách hàng. 6. Chiến lược zero fee và cho vay marginra sao? Ông Nguyễn Duy Hưng: Việc cung cấp dịch vụ phụ thuộc nhu cầu khách hàng, Công ty sẽ điều chỉnh bước đi phù hợp, đảm bảo lợi ích Công ty và hoạt động cho khách hàng. 7. Kế hoạch phát hành cổ phiếu hiệntiến độ đến đâu? Kể từ khi phát hành từ năm ngoái nhưng việc phê duyệt mất thời gian, việc phát hành theo đó chưa hoàn tất. 8. SSI đã kết nốiHệ thốngKRXchưa? Về các đợt test với VSD thì Công ty đã qua các đợt thử nghiệm không có vấn đề gì, dự kiến đợt 30/4 là đợt kiểm định cuối. Công ty khá tự tin kết nối với KRX. Giai đoạn đầu chưa có nhiều thay đổi nhưng KRX là nền tảng, điều kiện cần để có thêm các sản phẩm mới như Day trading, quyền chọn bán, quyền chọn mua. Lâu dài sẽ giúp thay đổi bộ mặt thị trường. 9. Chi phí lãi vay củaSSI hiệnra sao? SSI có thể huy động vốn giá rẻ, còn việc cho vay cụ thể phù thuộc vào điều kiện thị trường. Cá nhân tôi thấy lãi suất cho vay của SSI đang thấp hơn thị trường, đang cho hiệu quả và cân đối được nguồn. 10. Tại sao tốc độ tăng lợi nhuận nhanh hơndoanh thu? Chứng khoán không giống sản xuất hàng hóa, đôi khi doanh thu tăng 1% nhưng lợi nhuận có thể tăng hơn 1% là bình thường. 11. Sau sự cố củaChứng khoán VNDirect thì SSI tăng cường bảo mật ra sao? Đây là sự cố không tốt cho thị trường chứng khoán nói chung. Không phải sau sự việc VNDirect Công ty mới quan tâm, mà trước đó SSI đã quan tâm rồi, thậm chí nhân viên còn cảm thấy tại sao SSI quan tâm hơi quá vấn đề này. Việc đầu tư vào an toàn hệ thống lúc nào cũng là quan tâm hàng đầu, để đảm bảo là làm sao để người xấu vào hệ thống thì phát hiện được ngay và loại càng sớm càng tốt. Nên chúng tôi rất quan tâm và có nhiều kịch bản để xử lý. Chúng tôi luôn cập nhật các phương pháp tấn công mới để rà soát lại hệ thống và thích ứng, cũng như sao lưu và phục hồi được dữ liệu. 12. Có phát hành cổ phiếu riêng lẻ cho cổ đông chiến lược? Đối tác phát hành thì phải xem đóng góp gì cho Công ty. SSI quan trọng phải đúng người, đúng giá trị, hợp tác giá trị hơn là việc chỉ phát hành tăng vốn. Công ty vẫn đang theo đuổi và khi nào có sẽ xin ý kiến cổ đông. 13. Thị phần SSIđang giảm,Công ty có chiến lược tăngtrở lại ra sao? Điều này không chỉ SSI mà nhiều công ty lớn cũng đang giảm, chỉ riêng VPS tăng lên. SSI đưa ra rất nhiều giải pháp nhưng phục hồi thị phần nhưng câu chuyện không phải là ngày một ngày hai. Công ty coi thị phần là một điều để phấn đấu chứ không phải là mục tiêu duy nhất. Công ty còn nhiều mục tiêu khác để phấn đấu, không thể bỏ qua yếu tố phát triển bền vững. 14. Côngty đã chuẩn bị đến đâu cho nghiệpvụ prefunding? SSI là đơn vị đầu tiên đưa ra ý tưởng về prefunding và sẵn sàng đứng ra thực hiện, đảm bảo tự tin nhận thực hiện. 15. Dự báo của SSIvề Chỉ số VN-Index lên 1.300 điểm cóquá thấp? SSI không dự báo VN-Index lên 1.300 điểm mà đây chỉ là giả định dao động quanh mức 1.300 điểm. SSI từ lâu đã không tiên đoán VN-Index cuối năm sẽ chạm ngưỡng bao nhiêu. 16. Theo SSI thì đâu là yếu tố rủi ro lớn nhất cho thị trường? Rủi ro lớn nhất là lòng tin của nhà đầu tư. May là nhà đầu tư vẫn giữ niềm tin với thị trường chứng khoán, hiện thanh khoản thị trường cũng đã cải thiện. "
2024-08-13,"SSI Research: Lợi nhuận 2024 của FPT có thể vượt 9.000 tỷ, AI Factory sẽ ""mang tiền về cho mẹ"" từ năm 2025","Tiếp tục đà tăng trưởng ấn tượng trong nửa đầu năm 2024 Trong báo cáo mới đây, Chứng khoán SSI cho biết đã tham dự cuộc họp với chuyên viên phân tích của Tập đoàn FPT (mã: FPT) nửa đầu năm 2024. FPT cho biết doanh thu và lợi nhuận sau thuế trong 6 tháng đầu 2024 đạt lần lượt 29.300 tỷ đồng và 4.400 tỷ đồng, cùng tăng trưởng 21% so với cùng kỳ năm trước, chủ yếu nhờ mảng công nghệ. Tạimảng công nghệ thông tin (CNTT),kết quả từ mảng này ở nước ngoài và trong nước ghi nhận kết quả trái chiều trong nửa đầu năm. Trong khi mảng CNTT nước ngoài gây ấn tượng với mức tăng trưởng cả về doanh thu và lợi nhuận trước thuế lần lượt tăng 30% và 25% so với cùng kỳ, mảng CNTT trong nước chỉ ghi nhận tăng trưởng về doanh thu tăng 18%, ngược chiều, lãi trước thuế lại giảm 8% so với cùng kỳ. Đối với mảng CNTT nước ngoài, tiếp tục ghi nhận tăng trưởng ở tất cả các thị trường, bao gồm Nhật Bản (+35% YoY), Châu Mỹ (+15% YoY), Châu Âu (+54% YoY) và Châu Á Thái Bình Dương (không gồm Nhật Bản, +32% YoY). Đối với mảng CNTT trong nước, biên lợi nhuận trước thuế giảm xuống còn 4,5% (từ mức 5,7% trong nửa đầu năm 2023), chủ yếu là do tỷ trọng doanh thu từ phần cứng cao hơn (vì biên lợi nhuận của phần cứng tương đối thấp hơn so với dịch vụ CNTT và phần mềm). Tạimảng viễn thông, SSI đánh giá mảng băng rộng cố định là động lực tăng trưởng chính cho doanh thu mảng viễn thông trong nửa đầu năm 2024. Mảng này đạt doanh thu 8.200 tỷ đồng và lợi nhuận trước thuế 1.800 tỷ đồng, lần lượt tăng 7,3% và 16,2% so với cùng kỳ, trong đó doanh thu từ băng rộng cố định chiếm hơn 50%. Tại mảng giáo dục, đẩu tư và các mảng khác, doanh thu mảng giáo dục đạt mức tăng trưởng 24% so với cùng kỳ trong nửa đầu 2024. SSI cho biết mảng giáo dục đã có mức tăng trưởng ấn tượng trong khoảng 30-50% so với cùng kỳ trong giai đoạn 2021-2023. Thêm vào đó, do khoảng cách giữa cung và cầu trong giáo dục tại Việt Nam vẫn còn cao, SSI Research kỳ vọng mảng này sẽ tiếp tục tăng trưởng trong trung hạn, nhưng mức tăng trưởng sẽ thấp hơn đôi chút. Tập đoàn FPT cũng chia sẻ kế hoạch đầu tư của công ty trong năm 2024 chủ yếu tập trung vào việc đầu tư vào các trường K-12.  Mục tiêu dịch vụ đám mây GPU từ AI Factory sẽ tạo ra doanh thu 100 triệu USD vào năm 2027 Theo SSI, một nội dung quan trọng tại cuộc họp là Tập đoàn FPT đặt mục tiêu dịch vụ đám mây GPU từ AI Factory dự kiến sẽ tạo ra doanh thu lên tới 100 triệu USD vào năm 2027. AI Factory (với chi phí đầu tư dự kiến là 200 triệu USD) là một phần trong mối quan hệ hợp tác AI với NVIDIA để cung cấp dịch vụ đám mây GPU, cho phép FPT tiếp cận GPU NVIDIA H100 Tensor Core và triển khai máy chủ từ dòng chipset và đẩy nhanh tốc độ ứng dụng AI ở Châu Á, bao gồm cả ở Việt Nam, Nhật Bản và Hàn Quốc. Đối với chipset, theo NVIDIA, loại chip dòng H100 yêu cầu phải có giấy phép xuất khẩu sang Việt Nam (theo quy định của chính phủ Hoa Kỳ) và FPT đang chờ được phê duyệt giấy phép này. Để cung cấp dịch vụ này tại thị trường Nhật Bản, FPT cho biết đang nghiên cứu thị trường để cân nhắc việc phát triển AI Factory tại quốc gia này. FPT có thể thuê các trung tâm dữ liệu tại chính Nhật Bản để triển khai dịch vụ thay vì xây dựng một trung tâm dữ liệu mới. Liên quan đến tính khả thi về mặt hiệu quả,FPT đặt mục tiêu đạt được doanh thu từ dịch vụ từ năm 2025và kỳ vọngdoanh thu sẽ tăng lên tới 100 triệu USD mỗi năm vào năm 2027. Biên lợi nhuận trước thuế là 20-30% và công suất hoạt động đạt trên 80%. Nhóm phân tích SSI đánh giá rằng vẫn cần thời gian để quan hệ Đối tác chiến lược giữa FPT và NVIDIA tạo ra tác động đáng kể đến hiệu quả hoạt động củaFPT. Về việc đồng JPY tăng giá thời gian gần đây, lãnh đạo FPT nhận định biến động này sẽ không có tác động đáng kể đến biên lợi nhuận ròng của công ty. Trên thực tế, công ty đã vay nợ bằng đồng JPY (8,3 triệu JPY tính đến cuối quý 2/2024) để phòng ngừa cho doanh thu bằng đồng JPY (35,9 triệu JPY trong nửa đầu năm 2024). FPT ước tính biên lợi nhuận của công ty chỉ có thể cải thiện 50 điểm cơ bản cho mỗi 10% tăng giá của đồng JPY. Tựu chung lại, SSI Research ước tính lợi nhuận sau thuế của FPT trong năm 2024 và 2025 lần lượt đạt 9.300 tỷ đồng và 11.100 tỷ đồng, cùng đạt mức tăng trưởng 19% so với cùng kỳ. Nguồn: SSI Rereach"
2024-09-05,Chứng khoán SSI sắp chi hơn 1.500 tỷ đồng trả cổ tức,"HĐQT Công ty chứng khoán SSI (mã: SSI) thông báo ngày 24/9 tới đây sẽ là ngày đăng ký cuối cùng chốt danh sách cổ đông chi trả cổ tức 2023 bằng tiền mặt, tỷ lệ 10% (1.000 đồng/cổ phần). Ngày chi trả cổ tức dự kiến vào 18/10/2024. Với hơn 1,5 tỷ cổ phiếu đang lưu hành, dự kiến SSI sẽ phải chi hơn 1.500 tỷ đồng để thanh toán cho cổ đông đợt này. Cũng trong ngày 24/9, SSI sẽ chốt danh sách cổ đông để phát hành tổng cộng hơn 453 triệu cổ phiếu. Trong đó, SSI dự kiến phát hành hơn 302 triệu cổ phiếu thưởng để tăng vốn cổ phần từ nguồn vốn chủ sở hữu; đồng thời chào bán 151 triệu cổ phiếu cho cổ đông hiện hữu. Thời gian đăng ký và nộp tiền mua từ ngày 7/10/2024 đến 4/11/2024. Thời gian chuyển nhượng quyền mua từ 7/10 đến 24/10/2024. Nếu hoàn tất, vốn điều lệ SSI sẽ tăng từ 15.111 tỷ đồng lên thành 19.645 tỷ đồng, qua đó “giành” lại ngôi đầu quy mô vốn điều lệ trong nhóm các công ty chứng khoán.﻿ Trước SSI, VNDirect vừa hoàn tất chào bán ra công chúng và phát hành cổ phiếu trả cổ tức với tổng khối lượng hơn 304 triệu cổ phiếu. Vốn điều lệ sau khi hoàn tất phát hành tăng lên gần 15.223 tỷ và hiện đang là công ty chứng khoán có vốn điều lệ lớn nhất thị trường.﻿  Về tình hình kinh doanh, năm 2024 SSI lên kế hoạch doanh thu hợp nhất năm 2024 đạt 8.112 tỷ đồng. Mục tiêu lợi nhuận trước thuế hợp nhất đạt 3.398 tỷ đồng, tương ứng tăng 19% so với năm trước. ﻿ Sau nửa đầu năm, doanh thu hoạt động đạt 4.280 tỷ, tăng 35% so với cùng kỳ năm 2023. Công ty chứng khoán này báo lãi trước thuế  2.002 tỷ đồng, tăng 51% so với cùng kỳ và hoàn thành 59% mục tiêu cả năm.﻿ Trên thị trường,cổ phiếu SSIđang tăng nhẹ ﻿1,2% so với phiên trước lên mức 33.550 đồng/cp. Dù vậy, cổ phiếu này vẫn loanh quanh vùng giá hồi đầu năm. "
2024-07-08,"SSI Research: Rủi ro ngắn hạn tăng cao, nhưng chứng khoán vẫn có ""cửa tăng"" trong nửa cuối năm 2024","Vượt qua các ""cơn gió ngược"", TTCK Việt Nam vẫn mang nhiều gam màu sáng khi nối tiếp đà hồi phục từ tháng 11/2023 và tiếp tục bứt phá về điểm số. Dù đi qua nhịp điều chỉnh ngắn những chỉ số vẫn giữ được xu hướng tăng trưởng từ đầu năm. Rủi ro ngắn hạn gia tăng Trong báo cáo mới đây, SSI Research cho rằng trong ngắn hạn các chỉ báo kỹ thuật RSI duy trì trung tính, ADX trung hạn quay lại vị thế yếu. Điều này thể hiện xu hướng chỉ số VN-Index trong chu kỳ tháng 7/2024 sẽ có những biến động chưa thực sự lạc quan như kỳ vọng. Dù vậy xu hướng tăng trung hạn của chỉ số VN-Index vẫn giữ vững, do chưa xâm phạm ngưỡng hỗ trợ 1.195-1.205. Dự kiến, chỉ số VN-Index vận động ở phạm vi điểm số 1.220-1.295 trong tháng 7/2024.  Với các yếu tố tác động trái chiều, đội ngũ phân tích tin rằng sự thận trọng quan sát trong giai đoạn này là cần thiết khi rủi ro thị trường chung đang gia tăng. NĐT nên kiên nhẫn chờ đợi vùng giá thật sự hấp dẫn, tập trung câu chuyện riêng của từng cổ phiếu để giải ngân mới; trong khi có thể tiếp tục nắm giữ các cổ phiếu được kỳ vọng tăng trưởng mạnh. Ở góc nhìn dòng tiền, cũng không loại trừ xu hướng tiếp tục xoay vòng và luân chuyển đến những nhóm được hưởng lợi trực tiếp từ chính sách bao gồm Bất động sản, Bán lẻ, Xuất khẩu. Một số nhóm có hiệu suất kém hơn mặt bằng chung trong nửa đầu năm 2024 cũng có thể được chú ý như Dịch vụ tài chính. ""Cửa tăng"" trong nửa cuối năm khá cao Về trung và dài hạn, đội ngũ phân tích cho rằng hai điểm tựa chính cho thị trường trong năm 2024 gồm yếu tố cơ bản và dòng tiền đang chuyển biến tích cực hơn kỳ vọng. Đà hồi phục kinh tế sẽ diễn ra rõ nét hơn trong nửa cuối năm nay. Với số liệu tăng trưởng GDP 6 tháng đầu năm vượt kỳ vọng, khả năng chính sách điều hành có thể sẽ tập trung hơn vào các yếu tố mang tính ổn định kinh tế vĩ mô như lạm phát và tỷ giá trong khi lãi suất có thể tiếp tục tăng nhẹ. Điều này có thể đã phản ánh lên sự sụt giảm của thanh khoản TTCK thời gian gần đây. Ngược lại về dòng tiền khối ngoại, áp lực rút vốn từ dòng vốn ngoại nếu nhẹ bớt về cuối năm với kỳ vọng Mỹ giảm lãi suất thì sẽ tạo động lực tích cực mới cho thị trường.  Nửa cuối năm 2024, SSI Research vẫn nghiêng về kịch bản thị trường tiếp tục xu hướng tăng trưởng, dù các biến số rủi ro đang vẫn còn hiện diện và có thể khiến thị trường biến động. P/E ước tính năm 2024 của VN-Index hiện ở mức 11,5 lần, thấp hơn mức trung bình 5 năm 13,4 lần. ""Với mức định giá này thì ""cửa tăng"" của VN-Index vẫn sáng trong nửa cuối năm và sang năm 2025, nhất là khi tình hình kinh tế tiếp tục quá trình hồi phục. Tăng lương cơ sở cho khu vực công bắt đầu từ 1/7; chính sách kích cầu tiêu dùng giảm thuế VAT 2% được gia hạn đến hết năm; Hoạt động xuất khẩu sẽ thuận lợi hơn nếu Mỹ công nhận Việt Nam là nền kinh tế thị trường vào cuối tháng 7; Vướng mắc trong quá trình nâng hạng vẫn đang dần dần được tháo gỡ. Chúng tôi tiếp tục duy trì mục tiêu 1.300- 1.350 cho VN-Index vào cuối năm 2024"", SSI Research dự báo.  Với triển vọng KQKD Q2/2024, trong danh sách theo dõi của SSI Research, triển vọng tăng trưởng tích cực được ghi nhận ở nhiều mã Ngân hàng lớn, nhóm Thép, nhóm Tiêu dùng thiết yếu và Tiêu dùng không thiết yếu, nhóm Cảng & Vận tải biển. Mặc dù giai đoạn một số nhóm cổ phiếu lên mạnh vừa qua có thể đã phản ánh phần lớn triển vọng tăng trưởng lợi nhuận của nhóm này, tăng trưởng KQKD tích cực thay phiên nhau giữa các nhóm ngành và cổ phiếu vẫn sẽ tiếp tục là động lực của thị trường. "
