publish_date,title,content
2024-07-05,"SSI Research dự báo lợi nhuận của 11 nhà băng: VPBank có thể tăng trưởng đến 60%, OCB và VIB đi lùi","VPBank dẫn đầu tăng trưởng VPBankđược SSI dự báo đạt tăng trưởng lợi nhuận khoảng 60% trong quý II/2024, dẫn đầu danh sách. Theo báo cáo, trong quý này, nhà băng có thể ghi nhận mức lợi nhuận đạt 4.200 tỷ đồng, do FE Credit có thể đạt được điểm hòa vốn. Trước đó, tại Đại hội cổ đông, ông Nguyễn Đức Vinh – Tổng giám đốc của VPBank cho biết: ""Chúng tôi đã có lộ trình bù lỗ cho FE Credit. Dự kiến năm nay, doanh nghiệp này có thể lãi hơn 1.200 tỷ đồng. Lợi nhuận các năm tiếp theo, từ 2025 trở đi có thể rơi vào mức 3.000-4.000 tỷ đồng"". Sau VPBank,Techcombanklà nhà băng khác được SSI kỳ vọng đạt tăng trưởng trên 30% trong quý này. Nhóm phân tích đánh giá, Techcombank sẽ duy trì đà tăng tốt trong quý II, đạt 10 - 11% so với đầu năm với NIM và tỷ lệ nợ xấu được kỳ vọng sẽ tương đối ổn định so với quý trước. Về lợi nhuận, thu nhập ngoài lãi dự báo sẽ duy trì ổn định trong bối cảnh hoạt động bảo lãnh và phát hành trái phiếu, lợi nhuận bất thường từ kinh doanh trái phiếu Chính phủ có thể không lớn như trong quý I. Do vậy, lợi nhuận trước thuế của Techcombank có thể đạt 7.000 tỷ đồng, tăng 31% so với cùng kỳ nhưng giảm 5% nếu so với quý liền trước. Kế tiếp làHDBank. Quý II/2024, nhà băng này có thể đạt 3.500-3.600 tỷ đồng lợi nhuận tăng từ 28-31% so với cùng kỳ nhờ tăng trưởng tín dụng. Tuy nhiên, NIM quý II/2024 có thể giảm so với quý I/2024. Với nhóm ngân hàng quốc doanh, SSI Research dự báo, ba ""ông lớn"" gồmVietcombank, BIDV, VietinBankđều sẽ đạt tăng trưởng lợi nhuận lần lượt từ 8-10%, 12% và 15% so với cùng kỳ. Lợi nhuận trong quý I của nhóm Big 4 Cụ thể, với Vietcombank, do tăng trưởng tín dụng tăng lên khoảng 4% so với đầu năm vào cuối tháng 6, trong khi, huy động giảm, NIM của nhà băng này vẫn sẽ ổn định trong quý II. Chất lượng tài sản vẫn sẽ được kiểm soát ổn định. Lợi nhuận trước thuế quý II của Vietcombank có thể đạt khoảng 10.000-10.300 tỷ đồng, tương ứng mức tăng 8-10%. Trong khi đó, BIDV có thể đạt tăng trưởng lợi nhuận 12% do NIM có thể cải thiện khá tốt so với quý trước đó. Dự báo, nhà băng này có thể lãi trước thuế 7.800 tỷ đồng. Ngân hàng được đánh giá sẽ có mức tăng trưởng lợi nhuận ấn tượng nhất trong ""Big 3"" là Vietinbank. ""CTG duy trì quỹ đạo tăng trưởng ổn định trong nửa đầu năm 2024, giúp NIM duy trì ổn định so với quý trước. Chúng tôi đánh giá, ngân hàng có thể tiếp tục xử lý nợ xấu mạnh mẽ trong quý II/2024, do đó, lợi nhuận trước thuế dự kiến tăng 15% so với cùng kỳ, đạt 7.500 tỷ đồng"", báo cáo SSI Research viết. Trái ngược với bức tranh tích cực của VPBank hay Techcombank, hai ngân hàng có thể ghi nhận đà tăng trưởng lợi nhuận kém khả quan hơn trong quý II/2024 là VIB và OCB. Cụ thể, tại VIB, việc giảm lãi suất để kích cầu tín dụng có thể giúp ngân hàng đạt mức tăng trưởng tín dụng 3% so với đầu năm. Tuy nhiên, động thái này cũng có thể khiến NIM giảm trong quý II/2024 do chi phí tín dụng cao. ""Chúng tôi ước tính, lợi nhuận trước thuế sẽ đạt 2.100-2.200 tỷ đồng, giảm 25-28% so với cùng kỳ"", báo cáo của SSI viết. Còn OCB, tỷ lệ NIM và nợ xấu dự kiến sẽ duy trì ổn định so với quý trước, tăng trưởng tín dụng sẽ đạt 7-8% so với đầu năm. Tuy nhiên, theo nhóm phân tích, chi phí dự phòng có thể tăng đáng kể trong quý II/2024 làm lợi nhuận trước thuế giảm 5-14% so với cùng kỳ, đạt 1.350-1.500 tỷ đồng."
2024-08-15,SSI Research dự báo Bách Hoá Xanh có thể lãi 228 tỷ trong năm 2024,"Theo báo cáo mới cập nhật về Công ty CP Thế Giới Di Động (mã MWG), SSI Research cho biết, doanh thu của Bách Hóa Xanh trong quý II/2024 đạt hơn 10.200 tỷ đồng, tăng 41% so với năm trước. Doanh thu/tháng/cửa hàng tiếp tục tăng, đạt mức 2 tỷ đồng trong quý vừa qua nhờ cơ cấu sản phẩm tốt hơn (nhiều rau hơn ở các cửa hàng khu vực thành phố, nhiều trái cây nhập khẩu hơn ở các cửa hàng nông thôn, nhiều thịt/hải sản có thương hiệu hơn). Các cửa hàng Bách Hóa Xanh cung cấp cho khách hàng đa dạng các sản phẩm hơn so với đối thủ là Winmart, nhờ đó thu hút khách hàng mới từ chợ truyền thống hiệu quả hơn. Theo đó, chuỗi Bách Hoá Xanh đã lãi trước thuế 7 tỷ đồng trong quý II. SSI Research cho rằng với mô hình cửa hàng hiện tại, Bách Hoá Xanh khó có thể tăng doanh thu hơn nữa. Khi doanh thu /cửa hàng đi vào ổn định (2,1-2,2 tỷ đồng), SSI Research kỳ vọng MWG sẽ tối ưu hóa chi phí (tự động hóa hoạt động vận hành để giảm chi phí lao động và logistics) để nâng cao biên lợi nhuận trước thuế.  Theo SSI Research, MWG sẽ mở rộng mạng lưới cửa hàng Bách Hoá Xanh để đảm bảo tăng trưởng dài hạn. MWG dự kiến số lượng cửa hàng bách hoá khoảng 1.700 cửa hàng tính đến cuối quý II/2024 sẽ vượt số lượng cửa hàng điện thoại điện máy (khoảng 3.200 cửa hàng) trong trung hạn. SSI Reseach ước tính Bách Hóa Xanh có thể đạt 40.000 tỷ doanh thu trong năm 2024 và có thể tăng lên 45.000 tỷ trong năm 2025, tương ứng với doanh thu/tháng/cửa hàng đạt 1,95-2,1 tỷ đồng trong giai đoạn 2024-2025. Ước tính lợi nhuận ròng lần lượt là 228 tỷ đồng và 668 tỷ đồng trong năm 2024-2025 (so với khoản lỗ 1.200 tỷ đồng trong năm 2023). Tương tự, báo cáo của Công ty Chứng khoán FPT (FPTS) cho biết, so với các chuỗi siêu thị mini khác (WinMart+, Satrafoods, Co.op Food), danh mục sản phẩm của Bách Hóa Xanh đa dạng hơn ở cả mặt hàng tươi sống và hàng tiêu dùng nhanh (FMCG). Lợi thế cạnh tranh này giúp Bách Hóa Xanh thu hút khách hàng mới và gia tăng tần suất mua hàng của khách hàng hiện hữu. Bên cạnh đó, các sản phẩm tươi sống cũng đóng vai trò là kênh dẫn truyền để khách hàng mua thêm các sản phẩm FMCG với biên lãi gộp cao hơn. FPTS cho rằng, Bách Hóa Xanh định hướng sẽ mở dày thay vì mở rộng để tối ưu công suất hoạt động của trung tâm phân phối. Dự phóng chuỗi bán lẻ thực phẩm thuộc MWG sẽ nâng số lượng cửa hàng lên 1.740 cửa hàng vào cuối năm 2024, trước khi mở mới thêm 100 cửa hàng/năm trong giai đoạn 2025-2029. Doanh thu trung bình/cửa hàng có thể chạm ngưỡng 2,65 tỷ đồng/tháng trong năm 2029. Trong khi Bách Hoá Xanh đã “mang tiền về cho mẹ”, chuỗi nhà thuốc An Khang dự báo sẽ tiếp tục thua lỗ 2 năm tiếp theo. Từ giữa năm 2022, MWG đã ngừng mở nhà thuốc mới để điều chỉnh mô hình kinh doanh trước khi tiến hành mở rộng mạng lưới. Tuy nhiên, lợi nhuận của chuỗi nhà thuốc An Khang vẫn chững lại. Theo ước tính của SSI Research, biên lợi nhuận trước thuế đã giảm 15% trong năm 2023 và và giảm 10% trong nửa đầu năm 2024) do cơ cấu sản phẩm chưa hợp lý. Do đó, MWG đã quyết định đóng cửa 45 nhà thuốc An Khang trong tháng 6. Trong tháng 7, công ty tiếp tục tăng cường tốc độ đóng cửa các nhà thuốc. Tính từ đầu năm đến nay, MWG đã đóng cửa 139 nhà thuốc (tương đương khoảng 25% tổng số nhà thuốc). SSI Research cho rằng, chuỗi nhà thuốc An Khang sẽ chịu khoản lỗ lần lượt là 339 tỷ đồng và 243 tỷ đồng trong năm 2024-2025. Như vậy, việc đóng cửa các nhà thuốc An Khang có thể không ảnh hưởng đáng kể đến tổng lợi nhuận ròng của MWG. "
2024-04-18,"Cập nhật số liệu CTCK ngày 18/4: Thêm SSI, FPTS, Vietinbank Securities,... ồ ạt công bố KQKD quý 1, một công ty tăng lãi hơn 800%","Cập nhật mới nhất tới sáng ngày 18/4, đã có 34 công ty chứng khoán công bố BCTC quý 1/2024.  Tại nhóm lãi cao nhất tính tới hiện tại,Chứng khoán SSIđã công bố báo cáo tài chính riêng lẻ quý 1 với tổng doanh thu đạt 1.945 tỷ đồng, tăng 33% so với cùng kỳ năm trước. Trong quý đầu năm, mảng dịch vụ chứng khoán ghi nhận doanh thu gần 911 tỷ đồng, chiếm tỷ trọng lớn nhất vào tổng doanh thu với 47%. nghiệp vụ môi giới, lưu ký, tư vấn đầu tư và khác đạt 464 tỷ đồng, tăng 66% so với cùng kỳ. Lãi cho vay ký quỹ và ứng trước tiền bán đạt 447 tỷ đồng, tăng 32% so với cùng kỳ. Doanh thu từ hoạt động đầu tư đạt xấp xỉ 902 tỷ đồng, tăng 33% so với cùng kỳ và đóng góp 46% vào tổng doanh thu hoạt động. ngoài ra, doanh thu từ nguồn vốn & kinh doanh tài chính ghi nhận gần 132 tỷ đồng, chiếm 7% tổng doanh thu. Kết quả, lợi nhuận trước thuế quý 1/2024 của SSI đạt 900 tỷ đồng, tăng 53% so với cùng kỳ 2023. Chứng khoán FPT (FPTS, mã FTS)ghi nhận doanh thu hoạt động quý 1/2024 hơn 299 tỷ đồng, tăng trưởng 68% so với cùng kỳ. Kết quả, LNTT tăng 93% lên 191 tỷ đồng, trong đó lợi nhuận đã thực hiện hơn 123 tỷ đồng, tăng trưởng 25% trong khi lợi nhuận chưa thực hiện hơn 68 tỷ. Tại nhóm CTCK thuộc ngân hàng,Chứng khoán Vietinbank (mã CTS)ghi nhận doanh thu hoạt động tăng trưởng 63% lên gần 324 tỷ đồng. Đà tăng tốt nhất ghi nhận tại lãi từ tài sản FVTPL với mức tăng gần 88% lên hơn 165 tỷ đồng. Lãi từ cho vay và phải thu cũng tăng gần 72% so với cùng kỳ lên hơn 79 tỷ. Khấu trừ chi phí, CTS lãi trước thuế hơn 124 tỷ đồng, tăng trưởng 822% so với mức lãi khiêm tốn 13 tỷ trong quý 1 năm trước. Đà tăng trưởng lợi nhuận còn ghi nhận tạiChứng khoán Bảo Việt (BVSC, mã BVS)với LNTT đạt 67 tỷ đồng, gần gấp đôi con số của cùng kỳ năm trước. Cụ thể, nhờ thị trường thuận lợi, tổng doanh thu của BVSC tăng 71% lên 236 tỷ, trong đó 219 tỷ đồng doanh thu hoạt động, tăng hơn 86%. Chiếm tỷ trọng lớn nhất là doanh thu môi giới với hơn 91 tỷ, theo sau là lãi từ cho vay và phải thu với 75 tỷ đồng. Trái ngược,Chứng khoán VinavàChứng khoán Stanley Brotherslà những cái tên tiếp theo báo lỗ trong quý 1/2024. Trong khi Chứng khoán Vina lỗ gần 6 tỷ, cùng kỳ năm 2023 vẫn lãi gần 1 tỷ; thì Stanley Brothers (VUA) lỗ hơn 5 tỷ đồng, đậm hơn khoản lỗ gần 4 tỷ của quý 1 năm ngoái."
2024-10-10,Trong dự báo lợi nhuận quý III của SSI có một doanh nghiệp VN30 tăng 1250%,"Theo báo cáo, Masan Consumer và Techcombank là 2 nguồn đóng góp chính vào lợi nhuận của Masan Group. Trong khi đó, quý 3/2024 nhiều khả năng WinCommerce có thể có quý đầu tiên báo lãi, Masan High-Tech Materials giảm lỗ cũng đóng góp tích cực vào lợi nhuận của Masan Group. Bên cạnh đó, chi phí lãi vay của tập đoàn này cũng giảm. MSN: Lãi quý III cao hơn quý II; Quý IV kế hoạch nhận về đến 80 triệu USD Trong tháng 5 vừa qua, Masan công bố thông tin về việc ký kết Hợp đồng mua bán giữa Mitsubishi Materials Corporation Group (MMC) và Masan High - Tech Materials (MHT, công ty con của Tập đoàn Masan). Theo nội dung công bố, Tập đoàn Masan dự kiến sẽ ghi nhận khoản lợi nhuận một lần khoảng 40 triệu USD từ giao dịch bán HCS và hưởng lợi từ việc tăng lợi nhuận thuần sau thuế thêm 20 - 30 triệu USD trong dài hạn. Đã nhận phần đặt cọc từ MMC là 54 triệu USD, Masan kỳ vọng sẽ hoàn tất thương vụ và nhận về 70-80 triệu USD tiền mặt trong quý IV/2024.  ""Chúng tôi kỳ vọng lợi nhuận quý III sẽ cao hơn quý II vừa qua, nhờ vào khả năng sinh lời liên được cải thiện của WinCommerce, sự tăng trưởng của Masan Consumer cũng như những tín hiệu tích cực từ các mảng kinh doanh khác."", đại diện Masan chia sẻ về triển vọng lợi nhuận quý III/2024 của Masan trong cuộc họp với các nhà đầu tư. Quỹ ngoại ""rót"" 5 tỷ USD Theo ông Michael Hung Nguyen, Phó tổng giám đốc Masan Group: ""Trong 17 năm qua, Masan đã huy động vốn thành công xấp xỉ 5 tỷ đô. Masan tự hào là các nhà đầu tư như KKR, TPG, SK group đều đầu tư nhiều lần vào Masan và hướng tới sự hợp tác lâu dài."" Vị PTGĐ cho rằng để gia tăng cơ hội huy động vốn thành công, doanh nghiệp cần phải có chiến lược rõ ràng khiến nhà đầu tư có thể hiểu và tin được. Ông Michael Hung Nguyen đưa ra dẫn chứng về thương vụ giúp Masan bước chân vào lĩnh vực bán lẻ và gặt hái thành công.  ""Cuối năm 2019, Masan bước vào thị trường bán lẻ bằng thương vụ mua VinCommerce (sau đổi tên là WinCommerce). Tại thời điểm đó, EBITDA của WinCommerce là âm 7% và bây giờ chỉ số này đang là dương 4% có nghĩa là thay đổi 11% trong vòng 4 năm sau khi WinCommerce được Masan Group mua lại. Chúng tôi cũng kỳ vọng trong Quý III này, WinCommerce sẽ đạt lợi nhuận dương."" J.P Morgan đánh giá tích cực Tập đoàn tài chính J.P Morgan vừa công bố báo cáo phân tích triển vọng thị trường chứng khoán Việt Nam và lựa chọn cổ phiếu MSN của Tập đoàn Masan là ưu tiên hàng đầu. Báo cáo của J.P Morgan nêu rõ các động lực tích cực của thị trường chứng khoán Việt Nam gồm Nâng hạng thị trường; chu kỳ kinh tế tăng tốc vào giai đoạn cuối và đầu năm (từ quý IV đến quý I năm sau). Cụ thể, J.P Morgan cho rằng Việt Nam sẽ tăng trưởng vượt dự báo so với các nước trong khối ASEAN với sự tăng trưởng vững chắc trong các quý tớ. Nền kinh tế Việt Nam có xu hướng tăng tốc trong quý 4 do chu kỳ kinh doanh (các nhà xuất khẩu tăng tốc trước kỳ nghỉ lễ), đầu tư công (Chính Phủ thúc đẩy giải ngân trước cuối năm) và dòng khách du lịch sôi động. Ngoài ra, Chính Phủ đang cố gắng đẩy mạnh giải ngân đầu tư công và mở rộng hạn ngạch tín dụng để hỗ trợ tăng trưởng với mục tiêu tăng trưởng GDP trong khoảng 6,5-7% (tăng từ mức 6-6,5% vào đầu năm). Đặc biệt, trong bốn quý gần đây, tăng trưởng của Việt Nam đã vượt xa các nước ASEAN còn lại.  Với những triển vọng tích cực của thị trường chứng khoán và nền kinh tế Việt Nam, J.P Morgan cũng đưa ra những chiến lược đầu tư trong báo cáo lần này. Trong đó, tập đoàn tài chính này đánh giá cao ngành tiêu dùng thiết yếu. ""Chúng tôi tin rằng động lực thuận lợi trong ngắn hạn đang ủng hộ cổ phiếu ngành hàng tiêu dùng thiết yếu với: Dòng tiền tiềm năng từ nâng cấp thị trường chứng khoán, Đồng USD thấp hơn giúp giảm chi phí đầu vào và Tăng trưởng doanh thu ổn định."", báo cáo nêu rõ. Trong ngành hàng tiêu dùng thiết yếu, J.P Morgan lựa chọn cổ phiếu MSN của Tập đoàn Masan là mục tiêu ưu tiên hàng đầu. "
2024-01-18,SSI báo lãi trước thuế quý 4/2023 tăng 151% so với cùng kỳ năm trước,"CTCP Chứng khoán SSI (mã SSI) vừa công bố báo cáo tài chính riêng lẻ quý 4/2023 với tổng doanh thu và lợi nhuận trước thuế (LNTT) đạt 2.023 và 616 tỷ đồng, lần lượt tăng 48% và 151% so với cùng kỳ 2022. Về cơ cấu doanh thu trong quý 4, mảng Dịch vụ Chứng khoán (bao gồm doanh thu từ môi giới, tư vấn, lưu ký và cho vay ký quỹ) đóng góp gần 827 tỷ đồng, tăng 22% so với cùng kỳ 2022. Trong đó, mảng môi giới, lưu ký, tư vấn đầu tư và khác đạt 387 tỷ đồng. Mảng cho vay ký quỹ và ứng trước tiền bán đạt 439 tỷ đồng. Trong quý cuối năm, doanh thu từ hoạt động Đầu tư đạt 1.000 tỷ đồng, tăng 97% so với cùng kỳ và đóng góp 49% vào tổng doanh thu hoạt động. Doanh thu từ Nguồn vốn & Kinh doanh tài chính (KDTC) ghi nhận gần 180 tỷ đồng, tăng 7% so với cùng kỳ và chiếm 9% tổng doanh thu. Mảng Dịch vụ Ngân hàng Đầu tư và khác ghi nhận doanh thu 16 tỷ đồng.  Luỹ kế cả năm 2023, SSI ghi nhận tổng doanh thu đạt 6.984 tỷ đồng và LNTT đạt 2.705 tỷ đồng trên BCTC riêng lẻ, lần lượt tăng 12% và 35% so với năm 2022. Về kết quả hợp nhất, tổng doanh thu cả năm 2023 ước đạt 7.285 tỷ đồng, tăng 11,8% so với 2022, hoàn thành 105% kế hoạch. LNTT đạt 2.848 tỷ đồng, tăng 35% so với năm 2022 và hoàn thành 112% kế hoạch Đại hội đồng cổ đông thông qua.  Trong năm 2023, mảng Dịch vụ chứng khoán ghi nhận 3.135 tỷ đồng doanh thu. Mảng môi giới, lưu ký, tư vấn đầu tư và khác đạt hơn 1.566 tỷ đồng. Mảng cho vay ký quỹ và ứng trước tiền bán đạt hơn 1.568 tỷ đồng. Mảng Đầu tư ghi nhận 3.128 tỷ doanh thu, tăng 58% so với năm 2022. Mảng đầu tư có kết quả khả quan nhờ đóng góp phần lớn từ các khoản đầu tư giấy tờ có giá, danh mục trái phiếu do SSI đầu tư đảm bảo các nghĩa vụ thanh toán gốc và lãi đúng hạn. Mảng Nguồn vốn & KDTC ghi nhận 669,8 tỷ doanh thu, tăng 6% so với năm 2022. Đây là mảng kinh doanh truyền thống dựa trên quy mô tổng tài sản, quan hệ với các định chế tài chính và môi trường lãi suất từng thời điểm. Mảng Ngân hàng đầu tư & Khác ghi nhận 52 tỷ doanh thu. SSI đã ký kết các hợp đồng tư vấn phát hành cho một số doanh nghiệp lớn, dự kiến hoạt động ngân hàng đầu tư sẽ có sự bùng nổ mạnh mẽ trong năm 2024 khi thị trường huy động vốn và mua bán, sáp nhập sôi động trở lại. Tại thời điểm 31/12/2023, tổng tài sản và vốn chủ sở hữu đạt lần lượt 68.519 và 22.584 tỷ đồng, tăng lần lượt 33% và 3% so với cuối năm 2022. Dư nợ cho vay margin của SSI đạt 14.672 tỷ đồng, tăng 35% so với cuối năm 2022. Thị phần môi giới cổ phiếu, chứng chỉ quỹ và chứng quyền có đảm bảo của SSI tại HoSE trong quý 4 tiếp tục duy trì nằm trong top 2 thị trường với 9,78%. Cho cả năm 2023, thị phần của SSI đạt 10,44%, tăng 0,6 điểm % so với năm 2022."
