publish_date,title,content
2024-05-08,VIB đồng hành cùng sự kiện Chuyển đổi số ngành ngân hàng năm 2024,"Thủ tướng Phạm Minh Chính, Thống đốc Nguyễn Thị Hồng cùng đại diện các cơ quan nhà nước tham quan gian hàng của VIB tại Sự kiện Chuyển đổi số ngành Ngân hàng năm 2024. Tại sự kiện, VIB đã giới thiệu các giải pháp công nghệ số nổi bật của ngân hàng như: Ngân hàng số MyVIB với công nghệ giao dịch bằng giọng nói (AI Voice), thực tế tăng cường (AR); Ngân hàng số VIB Checkout biến điện thoại thông minh thành máy POS để thanh toán; VIB Verse đem đến trải nghiệm khám phá sản phẩm, dịch vụ của thành phố ngân hàng VIB qua kính thực tế ảo Oculus; Và trải nghiệm công nghệ thực tế ảo (AR) với chuyên gia tài chính ảo Vie 3D. Gian hàng của VIB đã nhận được sự quan tâm của lãnh đạo chính phủ, các cơ quan nhà nước và được đông đảo đại biểu tham gia trải nghiệm. Tại Hội thảo chuyên đề trong khuôn khổ của sự kiện diễn ra vào sáng ngày 08/05, ông Trần Nhất Minh – Phó Tổng Giám đốc kiêm Giám đốc Khối Ngân hàng số VIB đã tham gia tham luận với chủ đề ""Tích hợp công nghệ phát triển dịch vụ tài chính thông minh cho doanh nghiệp vừa và nhỏ trên ứng dụng Mobile banking"". Theo đó, đại diện VIB đã giới thiệu các giải pháp tài chính số dành riêng cho khách hàng doanh nghiệp vừa và nhỏ như: gói tài khoản iBusiness dành cho khách hàng cá nhân kinh doanh, gói tài khoản sBussiness dành cho khách hàng doanh nghiệp siêu nhỏ/hộ kinh doanh, ngân hàng số VIB Checkout. Ông Trần Nhất Minh trình bày tham luận tại Hội nghị. Trong đó, VIB Checkout là một giải pháp thanh toán và quản lý tài chính toàn diện cho các doanh nghiệp siêu nhỏ, hộ kinh doanh và cá nhân kinh doanh. Với VIB Checkout, VIB là ngân hàng đầu tiên tích hợp Soft POS trực tiếp vào ứng dụng ngân hàng số, biến chiếc điện thoại thông minh thành một máy POS di động, mà không cần việc lắp đặt máy POS thông thường, giúp tiết kiệm chi phí cho doanh nghiệp. Cũng trong khuôn khổ của sự kiện, VIB đã vinh dự nhận bằng khen của Thống đốc NHNN dành cho Khối Ngân hàng số vì đã có thành tích xuất sắc trong triển khai Kế hoạch chuyển đổi số ngành Ngân hàng theo Quyết định 810/QĐ-NHNN. Đại diện VIB cùng các ngân hàng nhận bằng khen từ Thống đốc NHNN. Trong những năm qua, VIB luôn là ngân hàng tiên phong trong chuyển đổi số với việc đầu tư thúc đẩy các sáng kiến công nghệ, số hóa và xây dựng một nền tảng công nghệ tiên tiến, vững chắc.VIBđang triển khai chiến lược số hóa dài hạn, chứng kiến sự tăng trưởng mạnh mẽ cùng tỷ lệ thâm nhập và chuyển đổi số cao. Trong giai đoạn 2016 - 2023, tốc độ tăng trưởng giao dịch qua kênh số tăng 50 lần, với 340 triệu giao dịch thực hiện trong năm 2023. Trong quý 1 năm 2024, 96% giao dịch ngân hàng bán lẻ được thực hiện trên kênh số và hàng triệu khách hàng sử dụng dịch vụ ngân hàng số thường xuyên mỗi tháng. Khách hàng trải nghiệm công nghệ số tại gian hàng VIB. Với hệ sinh thái sản phẩm đa dạng, tích hợp công nghệ tiên tiến, sự tiện lợi và tốc độ nhanh vượt trội, VIB đã và đang khẳng định vị thế là một trong những ngân hàng đi đầu trong chuyển đổi số và mang đến các sản phẩm số sáng tạo, lấy khách hàng làm trọng tâm. Chiến lược số hóa còn giúp VIB được công nhận bởi các tổ chức trong và ngoài nước cho sản phẩm – dịch vụ với hàm lượng công nghệ cao, dẫn đầu xu thế công nghệ."
2024-01-02,"Cảm ơn 5 năm đồng hành, VIB tặng hàng nghìn ưu đãi cho khách hàng","Chương trình áp dụng cho tất cả thẻ tín dụng hiện hữu từ nay đến hết ngày 30/11/2023. Gần 1.200 voucher ăn uống, hỗ trợ sân bay và tiền mặt trị giá đến 3 triệu đồng Với chương trình “Quà tặng tri ân”, VIB dành lời cảm ơn đến những khách hàng có thời gian gắn bó lâu dài với các dòng thẻ tín dụng tính đến tháng10/2023 hoặc có đóng góp ý kiến, phản hồi tích cực đến Ngân hàng. Bên cạnh đó, nhóm khách hàng này có tần suất và số tiền chi tiêu qua thẻ VIB cao, lịch sử thanh toán thẻ tốt, góp phần tạo nên cộng đồng thanh toán không tiền mặt hiện đại, năng động, thúc đẩy sự phát triển của nền kinh tế số. VIB dành tặng 100 Giải Nhất (3 triệu đồng/ giải) là e-voucher ăn uống tại các nhà hàng sang trọng tại TP.HCM và Hà Nội đến Top 100 khách hàng có quá trình sử dụng thẻ tốt.  Top 80 khách hàng tiếp theo sẽ nhận được Giải Nhì (1 triệu đồng/ giải) là e-voucher dịch vụ hỗ trợ tại sân bay (Fast Track). Dịch vụ này được rất nhiều khách hàng ưa chuộng bởi tính chu đáo, tiện lợi, nhanh chóng khi được hỗ trợ làm thủ tục check-in tại quầy ưu tiên, theo lối đi riêng qua cửa kiểm soát an ninh giấy tờ. Ngoài ra, 1.000 giải Ba (200.000 đồng/ giải) của chương trình tri ân sẽ đượcVIBgởi đến 1.000 khách hàng đạt tiêu chuẩn về chi tiêu qua thẻ. 5.000 điểm thưởng và dặm thưởng Khách hàng được đồng thời tham gia chương trình “Điểm thưởng tri ân” với cơ hội tích lũy điểm thưởng và dặm thưởng tùy thuộc vào thời gian gắn bó với các dòng thẻ VIB. Theo đó, chủ thẻ Rewards Unlimited, Family Link, LazCard, Super Card, Cash Back và Online Plus 2in1 sẽ được tặng 5.000 điểm (hoặc mức điểm tương đương tùy thẻ) cho mỗi năm sử dụng thẻ xuyên suốt. Số điểm thưởng này sẽ được cộng vào tài khoản điểm tích lũy thẻ tín dụng và được quy đổi thành voucher mua sắm, ẩm thực, du lịch, giải trí, đổ xăng… hoặc đổi sang tiền mặt. Người dùng dễ dàng thực hiện các thao tác đổi quà/ tiền qua ứng dụng ngân hàng số MyVIB. Riêng các dòng thẻ chuyên dùng cho du lịch như Travel Élite và Premier Boundless, khách hàng sẽ được nhận 25 dặm thưởng cho mỗi năm sử dụng thẻ. Dặm thưởng được cộng vào tài khoản của chủ thẻ và có thể dùng để nâng hạng ghế ngồi hoặc đổi dặm bay Vietnam Airlines. Cặp vé và ly mascot The Masked Singer phiên bản giới hạn Với Top 20 giao dịch chi tiêu cao nhất qua thẻ VIB từ nay đến hết ngày 30/11/2023, khách hàng có cơ hội nhận được 01 cặp vé Platinum tham dự The Masked Singer Vietnam: Concert (2023) trị giá 5 triệu đồng. Concert sẽ được diễn ra vào ngày 16/12/2023, tại TP.HCM.  Ngoài ra, 200 khách hàng có chi tiêu cao nhất tiếp theo sẽ nhận được quà tặng là ly mascot phiên bản giới hạn, trị giá 500.000 đồng/ ly. Trong vòng 10 ngày kể từ khi kết thúc chương trình, kết quả trúng thưởng sẽ được VIB thông báo đến khách hàng. Theo sau đó, các cặp vé điện tử Platinum tham dự The Masked Singer Vietnam - Concert (2023) sẽ được gửi đến địa chỉ email và ly mascot sẽ được gửi đến địa chỉ giao nhận mà khách hàng đăng ký với VIB. Hệ sinh tháithẻ tín dụngVIB hiện có nhiều dòng thẻ được thiết kế chuyên biệt cho từng phân khúc khách hàng ở mọi lứa tuổi. Trong đó, nhóm các dòng thẻ hoàn tiền/ tích điểm được yêu thích nhất của VIB là Cash Back (đến 24 triệu đồng/năm), Super Card (đến 15%) và Rewards Unlimited (đến 10 điểm cho mỗi 1.000 đồng và nhân đôi điểm thưởng khi chi tiêu trên 10 triệu đồng). Riêng nhóm thẻ du lịch, Travel Élite có mức phí giao dịch ngoại tệ thấp nhất thị trường, chỉ 1% và Premier Boundless cho phép sử dụng miễn phí hơn 1.000 phòng chờ thương gia khi đáp ứng điều kiện chi tiêu, tích lũy dặm thưởng để đổi vé máy bay hoặc nâng cấp hạng ghế Vietnam Airlines. Dành cho nhu cầu mua sắm, VIB LazCard hoàn đến 50% khi mua sắm tại Lazada; Online Plus 2in1 hoàn 3% khi chi tiêu online trong nước và 6% tại nước ngoài. Chủ thẻ gia đình hiện rất ưa chuộng dòng thẻ Family Link khi tích lũy 40 điểm Smile trên mỗi 1.000 đồng chi tiêu cho giáo dục, giải trí, y tế, ăn uống… , đồng thời có thể chuyển đổi điểm thưởng thành tiền mặt/e-voucher/phí thường niên hoặc chuyển sang tài khoản tiết kiệm Daily Saving cho con. Bên cạnh đó, với dòng thẻ Financial Free, người dùng VIB được miễn phí thường niên trọn đời và không giới hạn rút tiền đến 100% hạn mức. Mở thẻ ngaytại đâyđể được miễn phí thường niên trọn đời và tận hưởng các ưu đãi hấp dẫn từ VIB! "
2024-06-15,VIB tung loạt ưu đãi thẻ hấp dẫn hưởng ứng 'Cashless Day 2024',"   Khởi động mùa ưu đãi thẻ lớn nhất năm 2024 Đến hẹn lại lên, ""Ngày không tiền mặt (Cashless Day)"" luôn là mùa mua sắm được nhiều người tiêu dùng chờ đón nhất hằng năm. Chương trình do các sở ban ngành phối hợp tổ chức trên quy mô khắp cả nước, bao phủ mọi ngành hàng và trải dài suốt hơn một tháng, mang lại cơ hội mua sắm và chi tiêu tiết kiệm cho mọi gia đình. Trải qua 5 mùa Cashless Day, VIB luôn đồng hành với hàng loạt ưu đãi hấp dẫn dành cho chủ thẻ tín dụng nhằm thúc đẩy thói quen thanh toán không tiền mặt tại Việt Nam. Thời gian qua, VIB đã khẳng định được vị thế ""Dẫn đầu xu thế thẻ"" với tổng chi tiêu qua thẻ tín dụng ở trong nước, tổng chi tiêu qua thẻ ở nước ngoài, tổng chi tiêu thương mại điện tử đều nằm top đầu ngành, theo ghi nhận từ Mastercard. Năm nay, VIB tiếp tục khởi động mùa ưu đãi thẻ lớn nhất năm trên 4 danh mục - VIB Shop (mua sắm), VIB Travel (du lịch), VIB Dine (ăn uống) và VIB Move (di chuyển) - nhằm gia tăng trải nghiệm mua sắm không lo về giá cho người dùng. Hàng trăm thương hiệu nổi tiếng kết hợp với hệ sinh thái đa dạng 10 dòng thẻ tín dụng củaVIBhứa hẹn sẽ mang đến cho chủ thẻ một mùa lễ hội mua sắm đáng nhớ, tiện lợi và hiệu quả trên từng khoản chi tiêu. Tận hưởng ưu đãi ngập tràn cùng thẻ tín dụng VIB Hưởng ứng Cashless Day 2024, các sàn thương mại điện tử lớn sẽ liên tục tổ chức những phiên livestream quy mô với nhiều sản phẩm hot và vạn deal siêu hời. Nếu sở hữu thẻ tín dụng VIB, người dùng sẽ được tận hưởng thêm ưu đãi độc quyền với hạng mục VIB Shop gồm mã giảm giá lên đến 200.000 VNĐ trên Shopee và Lazada trong 4 ngày cao điểm 15, 16, 17 và 20/6. Các sản phẩm điện tử cũng có giá cả phải chăng hơn với ưu đãi đến 45% khi mua sắm trên cửa hàng trực tuyến LG, Electrolux… và thanh toán bằng thẻ tín dụng VIB ở bước cuối cùng. Sự hợp tác của VIB với các thương hiệu điện gia dụng 'quốc dân' sẽ mang đến cho chủ thẻ trải nghiệm mua sắm đáng tin cậy, thảnh thơi với dịch vụ miễn phí vận chuyển và lắp đặt tận nhà. Chủ thẻ đang lên kế hoạch vi vu trong nước cho cả gia đình, đừng bỏ lỡ ưu đãi giảm giá mùa hè đến hàng triệu đồng từ VIB Travel. Dù là đặt vé máy bay, khách sạn hay tour du lịch, chủ thẻ đều có thể tiết kiệm khoản chi phí đáng kể khi thanh toán bằng thẻ tín dụng VIB, lên đến 300.000 VNĐ tại Traveloka, 200.000 VNĐ tại Klook… Nếu đặt tour nước ngoài giá trị cao, bạn nên tận dụng ưu đãi giảm 1,5 triệu tại Vietravel, giảm đến 1 triệu tại Lửa Việt Tours… để có kỳ nghỉ trọn vẹn, thú vị và tiết kiệm. Các tín đồ ẩm thực cũng được VIB Dine tiếp lửa đam mê với ưu đãi giảm 50.000 VNĐ khi đặt đồ ăn trưa tại văn phòng hoặc chiêu đãi bạn bè dịp cuối tuần qua GrabFoodvà ShopeeFood. Cùng với đó là ưu đãi giảm giá đến 20% tại nhiều nhà hàng và quán chay sang trọng như Papas' Chicken, Beauty in The Pot, Capos Spanish Tapas Bar, Araham Vegan, Miyen Japanese Cuisine, ...   VIB Dine cũng vừa bổ sung thêm danh mục nhà hàng mới với ưu đãi chưa từng có như giảm đến 30 - 50% tại Kasa Sushi, Shamoji Robata Yaki… Chủ thẻ còn được tận hưởng mức ưu đãi 10% tại chuỗi 12 nhà hàng của IN Dining: Sushi Tei, Shri Lounge, The Log, Âu Lạc Do Brazil, Carpaccio, Jumbo Seafood, Crystal Jade Palace, Dynasty House, Marina Seafood, Tib, GEM Café và Mojo Café. Đối với chủ thẻ thường xuyên di chuyển, VIB Move tặng ngay 35.000 VNĐ khi sử dụng dịch vụ của Vexere và Grab. Dù là xe khách đường dài hay xe công nghệ nội đô, đi công tác hay du lịch, thao tác đặt xe trực tuyến và thanh toán không tiền mặt với thẻ VIB đều dễ dàng và hiệu quả về chi phí. Đặc biệt, ""Ngày Hội Chi Tiêu"" diễn ra định kỳ vào ngày 20 hàng tháng này sẽ được VIB triển khai sớm từ ngày 16/6 và kéo dài đến hết 20/6 nhân dịp Cashless Day. Như vậy, chủ thẻ có thể nhận đến 100.000 điểm thưởng đổi quà mỗi ngày, tối đa đến 500.000 điểm thưởng nếu tham gia chi tiêu tất cả các ngày. Riêng giá trị giao dịch ngày 20/6 sẽ được tích lũy để tiếp tục tranh giải quý và năm với giải thưởng lên đến 100 triệu đồng. ""Trẩy hội"" mở thẻ để hoàn phí thường niên Mọi nhu cầu mua sắm, du lịch, ăn uống đến di chuyển của chủ thẻ đều được VIB chăm sóc với những ưu đãi tốt nhất. Nhân dịp Cashless Day 2024, VIB triển khai chương trìnhưu đãimở thẻ cho khách hàng mới trong năm ngày 16 – 20/6, gia tăng điểm chạm để khi người dùng tiếp xúc và tận hưởng những tiện ích của kênh thanh toán không tiền mặt. Chớp ngay cơ hội hiếm có này để mở thẻ và được hoàn phí thường niên năm đầu chỉ với điều kiện chi tiêu cực dễ: chi tiêu từ 3 triệu đồng trong vòng 30 ngày kể từ ngày kích hoạt và 45 ngày kể từ khi phát hành thẻ! Nếu bạn đang phân vân mở thẻ nào trong hệ sinh thái thẻ tín dụng VIB, hãy đánh giá thói quen chi tiêu của bản thân. Các tín đồ mua sắm sẽ tiết kiệm nhiều nhất nếu mở thẻ VIB Cash Back hoàn tiền đến 24 triệu đồng mỗi năm, VIB Super Card hoàn linh hoạt 15% trên danh mục chi tiêu cố định, VIB LazCard hoàn 6% giao dịch chi tiêu tại Lazada và 3% ở các sàn thương mại điện tử khác…   Chuẩn bị xuất ngoại tận hưởng mùa du lịch hè, các tín đồ đam mê dịch chuyển nên ""chọn mặt gửi vàng"" cho 3 dòng thẻ chi tiêu nước ngoài tốt nhất: VIB Travel Élite có phí chuyển đổi ngoại tệ 0% trong 3 tháng đầu mở thẻ và chỉ 1% cho các tháng sau, VIB Super Card hoàn 10% chi tiêu nước ngoài, VIB Online Plus 2in1 hoàn 6% chi tiêu trực tuyến tại nước ngoài. Mở thẻ tín dụng VIB ngaytại đâyđể sẵn sàng hòa mình vào Cashless Day 2024 và không khí mua sắm ngập tràn ưu đãi trong tháng 6 đặc biệt này nhé!"
2024-01-05,"VIB đồng hành Giải thưởng Sách Quốc Gia, đóng góp tích cực vào các hoạt động tôn vinh tri thức và văn hóa Việt Nam"," Với mục tiêu góp phần lan tỏa giá trị của tri thức và nét đẹp văn hóa Việt Nam, VIB đã và đang tham gia, đồng hành trong nhiều hoạt động xã hội, văn hóa có ý nghĩa. Góp phần lan toả văn hóa đọc và xây dựng tri thức Giải thưởng Sách Quốc Gia là sự kiện thường niên được mong đợi hàng đầu của những người yêu đọc sách, những người làm khoa học và các tác giả, dịch giả, các đơn vị xuất bản. 41 tác phẩm được vinh danh trong khuôn khổ giải thưởng lần thứ 6 (năm 2023) bao gồm 2 tác phẩm đạt giải A, 10 giải B, 11 giải C và 18 giải khuyến khích (Danh sách tác phẩm đạt giải thưởng Sách Quốc Gia lần thứ 6 xemtại đây).Đâylà các tác phẩm giàu hàm lượng sáng tạo, nhân văn, những công trình nghiên cứu khoa học nghiêm túc, có giá trị khoa học, xã hội và thực tiễn cao, bao quát 5 lĩnh vực Chính trị, Kinh tế: Khoa học xã hội và nhân văn; Khoa học tự nhiên và công nghệ; Văn hóa, văn học và nghệ thuật; Thiếu nhi. Phát biểu tại lễ trao giải, đồng chí Đỗ Văn Chiến, Bí thư Trung ương Đảng, Chủ tịch Ủy ban Trung ương Mặt trận Tổ quốc Việt Nam chia sẻ: ""Văn hoá là nền tảng tinh thần của xã hội, vừa là mục tiêu, vừa là sức mạnh nội sinh, động lực quan trọng để phát triển đất nước. Xuất bản với sản phẩm chính là sách, có vai trò rất quan trọng trong việc lưu giữ, truyền bá và phát triển văn hoá. Trải qua các mùa giải, Giải thưởng sách Quốc gia đã tác động mạnh mẽ đến cộng đồng, đóng góp sâu rộng về chuyên môn và được công chúng đón nhận, đánh giá cao. Chúng ta tôn vinh các tác giả, dịch giả, người làm công tác xuất bản, cũng chính là tôn vinh văn hoá đọc."" Chia sẻ về việc VIB đồng hành cùng Giải thưởng Sách Quốc Gia, ông Hàn Ngọc Vũ - Tổng giám đốc VIB cho biết: ""Giải thưởng Sách Quốc Gia không chỉ là nơi vinh danh các tác phẩm xuất sắc mà còn là động lực mạnh mẽ để toàn xã hội hướng về văn hóa đọc, tạo nên một môi trường thúc đẩy sự sáng tạo và học hỏi. Chia sẻ quan điểm văn hóa đọc là cầu nối quan trọng giữa tri thức và sự phát triển cá nhân, xã hội, chúng tôi tự hào đồng hành giải thưởng Sách Quốc Gia để tôn vinh tri thức và văn hóa đọc, chung tay lan tỏa mạnh mẽ lối sống văn minh, hiện đại, mang lại giá trị bền vững cho sự phát triển của cộng đồng."" Xuyên suốt quá trình hơn 27 năm hình thành phát triển, bên cạnh những thành quả trong hoạt động về dịch vụ tài chính, ngân hàng, VIB là ngân hàng tích cực tham gia và đầu tư nghiêm túc cho nhiều chương trình văn hóa, xã hội ý nghĩa. Ngoài việc đồng hành cùng Giải thưởng Sách Quốc gia, VIB còn tích cực tham gia các chương trình, hoạt động tôn vinh tri thức, tinh thần sáng tạo, bản sắc văn hóa dân tộc, đóng góp cho sự phát triển bền vững của cộng đồng, xã hội Việt Nam. Tích cực tham gia vào hoạt động thúc đẩy sáng kiến, tinh thần sáng tạo  VIB là đơn vị đồng hành của nhiều chương trình tạo môi trường bổ ích để vận dụng kiến thức từ giảng đường, thúc đẩy sự sáng tạo. Gần đây nhất, VIB là ngân hàng đầu tiên góp mặt và nhiều năm liên tục đồng hành vớiVietnam Young Lions, một trong những cuộc thi sáng tạo lớn nhất ngành Truyền thông và Tiếp Thị nhằm tìm kiếm và tôn vinh những tài năng trẻ dưới 30 tuổi, mang sứ mệnh đại diện Việt Nam tham gia 2 đấu trường quốc tế là Young Lions (Cannes Lions) và Young Spikes (Spikes Asia). Việc khuyến khích tinh thần sáng tạo từ VIB nói riêng và các doanh nghiệp nói chung sẽ góp phần tích cực vào sự phát triển nền văn hóa tri thức, góp phần nâng cao nguồn lực cho sự phát triển của đất nước. Chung tay quảng bá nét đẹp văn hóa của Việt Nam tới thế giới Bên cạnh các hoạt động tôn vinh tri thức, VIB còn tích cực đồng hành với các chương trình, dự án giúp quảng bá văn hóa Việt Nam tới bạn bè trên khắp thế giới. Năm 2023, VIB là nhà tài trợ chính cho chương trình Let's Feast Vietnam (Hành trình kỳ thú) – chương trình truyền hình thực tế về văn hóa, du lịch và ẩm thực của Việt Nam được phát sóng trên Netflix – nền tảng streaming lớn nhất thế giới. Chương trình đã được đón nhận bởi hơn 100 triệu khán giả và là chương trình Việt Nam đầu tiên nằm trong Top 10 thịnh hành trên Netflix. Tại Liên hoan phim quốc tế Busan 2023, Let's Feast Vietnam vượt qua nhiều đối thủ nặng ký để giành giải Best Reality and Variety. Sự thành công và phổ biến của chương trình đã góp phần không nhỏ lan tỏa rộng rãi hình ảnh và nét đẹp văn hóa, con người Việt Nam ra thế giới.  Những hoạt động tôn vinh tri thức và văn hóa là một phần vô cùng quan trọng để xây dựng xã hội văn minh, đất nước ngày càng giàu mạnh, phát triển. Việc VIB tích cực đồng hành, hỗ trợ nhiều chương trình, dự án về văn hóa, xã hội đã và đang góp phần lan tỏa mạnh mẽ lối sống văn minh, tạo nên giá trị tích cực cho cộng đồng, cho quốc gia."
2024-02-16,VIB lì xì tiền mặt cho khách hàng giao dịch đầu Xuân," Lì xì 100.000 đồng khi nhận kiều hối qua RIA Khách hàng nhận tiền kiều hối tại VIB từ công ty chuyển tiền RIA sẽ đượchoàn 100.000 đồngvào tài khoản thanh toán, không giới hạn số lần nhận hoàn tiền. Ưu đãi áp dụng đến hết ngày 29/02/2024 cho khách hàng có tài khoản thanh toán Việt Nam đồng tại VIB tại thời điểm nhận tiền và áp dụng cho mọi số tiền nhận. Khách hàng được hoàn tiền không giới hạn trong suốt thời gian diễn ra chương trình, tương ứng với số lần nhận kiều hối. Gửi tiền khai Xuân, đón lộc lên đến 5 triệu đồng Khách hàng doanh nghiệp siêu nhỏ sẽ được lì xì tới 5 triệu đồng khi mở mới tiền gửi trực tuyến trên ứng dụng ngân hàng số VIB Checkout với giá trị từ 1 tỷ đồng, kỳ hạn tối thiểu 1 tháng, ưu đãi áp dụng đến hết ngày 21/07/2024. Khách hàng cá nhân sẽ được lì xì tới 500.000 đồng khi mở mới tiền gửi iDepo trực tuyến/ tiền gửi tiết kiệm trực tuyến hoặc nhận chuyển nhượng tiền gửi iDepo trực tuyến có giá trị từ 50 triệu đồng với kỳ hạn tối thiểu 1 tháng; Hoặc mở mới tiền gửi tiết kiệm/ tiền gửi iDepo tại quầy hoặc nhận chuyển nhượng tiền gửi iDepo có giá trị từ 300 triệu đồng trở lên (bao gồm cả ngoại tệ quy đổi). Thời gian ưu đãi áp dụng đến hết ngày 31/03/2024. Tăng lãi suất tiền gửi ngoại tệ Từ ngày 25/1/2024,VIBtăng lãi suất tiền gửi ngoại tệ tới 2%/năm, áp dụng cho khách hàng doanh nghiệp siêu nhỏ gửi tiền bằng đồng EUR/ AUD. Đối với khách hàng cá nhân, bên cạnh việc được hưởng mức lãi suất cao, khách hàng cá nhân gửi tiền bằng đồng EUR/ AUD còn được lì xì đến 500.000 đồng khi mở mới tiền gửi tiết kiệm/ tiền gửi iDepo tại VIB có giá trị từ 300 triệu đồng trở lên (bao gồm cả ngoại tệ quy đổi). Tham khảo thêm các ưu đãi cho khách hàng cá nhân và doanh nghiệp siêu nhỏtại đây. Hãy đến VIB để nhận lì xì đầu Xuân và tận hưởng nhiều ưu đãi hấp dẫn khác!"
