publish_date,title,content
2024-10-09,Khám phá Series Card Education của VIB – Bí quyết khai thác tối đa lợi ích thẻ tín dụng dành cho bạn!,"Đây là lần đầu tiên đội ngũ phát triển thẻ hàng đầu của VIB trực tiếp chia sẻ các mẹo chi tiêu và quản lý thẻ sao cho hiệu quả nhất. Những thông tin giá trị này chỉ có trong chuỗi video này và được thiết kế riêng cho bạn – người đang muốn tận dụng tối đa chiếc thẻ tín dụng trong tay mình.    VIB khuyến khích khách hàng khai thác tối đa tiện ích thẻ – Không ngại chi tiêu, càng dùng càng lợi Kể từ khi chuyển đổi mảng thẻ tín dụng vào năm 2019, VIB đã liên tục khẳng định vị thế dẫn đầu xu thế thẻ, góp phần thúc đẩy mạnh mẽ sự phổ biến của phương thức thanh toán không tiền mặt qua thẻ, sự phát triển của công nghệ thẻ tại Việt Nam và thay đổi quan điểm người dùng từ ""ngại"" sang ""thích"" và rủ nhau tìm cách khai thác tối đa lợi ích từ thẻ tín dụng. Với cách tiếp cận hiện đại và gần gũi,Series Card Educationcủa VIB giúp người dùng hiểu rõ hơn về các ưu đãi, tính năng của thẻ và các bí quyết độc quyền từ VIB để sử dụng thẻ hiệu quả. Đây là một bước đi táo bạo, thể hiện sự khác biệt của VIB trong việc tiên phong thúc đẩy xu hướng khai thác tối đa tiện ích thẻ tại Việt Nam. Cùng thời điểm với sự ra mắt của Series Card Education của VIB, chỉ trong một thời gian ngắn,phong trào khai thác tối đa tiện ích thẻ– sử dụng thẻ tối đa để tận dụng ưu đãi và tích điểm – đã thực sự trở thành xu hướng rõ rệt. Hiện nay, đã có nhiều hội nhóm người dùng rủ nhau cùng khai thác tối đa tiện ích thẻ để trải nghiệm và tận dụng lợi ích từ các chương trình ưu đãi mà VIB mang lại. Bạn đã sẵn sàng tận dụng trọn vẹn các ưu đãi độc quyền từ thẻ tín dụng VIB? Hãynhấp vào đâyđể khám phá loạt bí quyết độc quyền, giúp bạn biến chiếc thẻ tín dụng trở thành công cụ tài chính mạnh mẽ. Rất nhiều bí quyết đã được VIB giới thiệu và hướng dẫn chi tiết đến người dùng thẻ tại fanpage của ngân hàng. Đó là bí quyết đểMua ngay, góp nhẹvới chương trình trả góp tự động 0 lãi suất, 0 phí, kèm theo ưu đãi thêm đến 40% cho 5 danh mục chi tiêu chính, từ du lịch, mua sắm, mua xe, làm đẹp cho đến thanh toán học phí. Hay cách tận hưởngVIB Privileges – Hệ sinh thái ưu đãi đỉnh caotừ hơn 150 đối tác với ưu đãi VIB Travel - Giảm đến 40% cho tour du lịch và khách sạn, VIB Dine - Giảm 30% khi thưởng thức ẩm thực,VIBShop - Mua sắm thời trang, điện máy với ưu đãi lên đến 20%, và VIB Move - Giảm 20% cho vé máy bay, tàu, xe khách và dịch vụ gọi xe. Thay đổi danh mục ưu đãi siêu linh hoạt là một trong những bí quyết cực kỳ hữu ích chỉ có tại VIB và được quan tâm nhiều nhất! Chỉ với vài thao tác đơn giản trên ứng dụng MyVIB, bạn có thể chuyển đổi danh mục từ mua sắm sang giáo dục hay chăm sóc sức khỏe và tận hưởng ngay ưu đãi tốt nhất cho mọi giao dịch. CáchSử dụng thẻ an toàn, hiệu quả, tránh bị lộ thông tin thẻcũng là nội dung được nhiều người tìm kiếm, quan tâm, chia sẻ. Hay làm sao đểđượctăng hạn mức tín dụng tự độngchỉ sau 3 tháng mà không cần yêu cầu, không cần cung cấp thêm thông tin. Bí quyết này đã được bật mí trong chuỗi video! Hoặc cách để nhậnƯu đãi lãi suất và trả góp tối ưuvới lãi suất thẻ tín dụng cạnh tranh nhất trên thị trường chỉ từ 9,9%/năm cùng chương trình trả góp ""3 không"": Không lãi, Không phí chuyển đổi, Không phí duy trì. Tất cả các bí quyết đều được VIB hướng dẫn chi tiết cách đăng ký và sử dụng trong chuỗi videoSeries Card Education. Đặc biệt trong tháng 10: Bí quyết trở thành cộng tác viên thẻ và kiếm tiền đến trăm triệu từ VIB Không chỉ dừng lại ở việc chia sẻ những bí quyết sử dụng thẻ hiệu quả, trong tháng 10 này, VIB giới thiệu đến khách hàng cách trở thànhCộng tác viên thẻ tín dụngvà kiếm tiền từ việc mời bạn bè, người thân, khách hàng… mở thẻ tín dụng. Đây là cơ hội tuyệt vời để bạn gia tăng thu nhập với những dòng thẻ hàng đầu thị trường.  Trong các tập video sắp tới, VIB sẽ bật mí cách mở thẻ tín dụng VIB một cách tiện lợi nhanh chóng qua các nền tảng online như Website VIB, ứng dụng Max, ứng dụng MyVIB hay các hệ sinh thái nền tảng mà VIB kết nối. Đồng thời, sẽ cung cấp những hướng dẫn chi tiết để bạn đăng ký trở thành cộng tác viên của VIB qua ứng dụng Max và bắt đầu kiếm tiền ngay từ việc giới thiệu khách hàng mở thẻ. Mỗi tập củaSeries Card Educationsẽ cung cấp những kiến thức và bí quyết hữu ích mà bạn khó có thể tìm thấy ở bất kỳ đâu để tận dụng tối đa mọi ưu đãi từ thẻ tín dụng và mang lại cơ hội kiếm tiền từ việc trở thành cộng tác viên của VIB. Bạn đã sẵn sàng khám phá những lợi ích vượt trội từ thẻ VIB? Hãy xem ngay các video trong chuỗiCard Education Seriesđể hiểu thêm về cách bạn có thể khai thác tối đa tiện ích thẻ một cách thông minh và tận dụng tất cả ưu đãi đặc quyềntại đây."
2024-11-11,"VIB chuyển đổi website sang nền tảng đám mây AWS, bước tiến trong chiến lược Cloud First, AI First"," Lợi ích của việc chuyển đổi sang AWS Cloud Một trong những yếu tố then chốt trong quyết định này là khả năng cung cấp băng thông mạng lên đến 100 Gbps của AWS, cho phép VIB hỗ trợ hàng triệu khách hàng truy cập đồng thời mà không gặp gián đoạn, đồng thời duy trì thời gian phản hồi nhanh chóng ngay cả khi lưu lượng truy cập gia tăng. VIB cũng được hưởng lợi từ hệ thống hạ tầng máy chủ của AWS, một nền tảng điện toán đám mây và lưu trữ linh hoạt, cho phép phân bổ tài nguyên tự động, qua đó giảm thiểu chi phí vận hành và tối ưu hóa hiệu suất tổng thể. Người dùng sẽ trải nghiệm tốc độ tải trang nhanh hơn và giảm thời gian chờ đợi khi truy cập vào các dịch vụ ngân hàng trực tuyến, điều này đặc biệt quan trọng trong việc cải thiện trải nghiệm khách hàng. An ninh là một yếu tố quan trọng trong quá trình chuyển đổi lên nền tảng đám mây. AWS cung cấp hạ tầng bảo mật cao, bảo vệ dữ liệu của VIB khỏi các mối đe dọa tiềm ẩn như ransomware và đảm bảo an toàn dữ liệu trong mọi tình huống. Hơn nữa, khả năng phục hồi nhanh chóng khi gặp sự cố giúp VIB duy trì tính liên tục trong dịch vụ và bảo vệ thông tin giao dịch của khách hàng. Bên cạnh đó, với AWS, VIB có thể mở rộng dịch vụ ra thị trường toàn cầu trong vòng 5 phút, đáp ứng chiến lược Cloud-First và AI-First của ngân hàng. Điều này cho phép VIB nhanh chóng tiếp cận các thị trường mới, thúc đẩy sự đổi mới và hỗ trợ ra quyết định dựa trên dữ liệu một cách hiệu quả. VIB và chiến lược Cloud-First Vào tháng 2 năm nay, VIB cùng đối tác là Tập đoàn Temenos đã thông báo triển khai Dự án hiện đại hóa hệ thống ngân hàng lõi (Core banking) củaVIBtrên nền tảng điện toán đám mây của Amazon Web Services (AWS). Đây là lần đầu tiên tại Việt Nam, một ngân hàng triển khai Core banking Temenos trên nền tảng điện toán đám mây. Hiện VIB đang triển khai Core banking phiên bản mới nhất của Temenos là R23 trên nền tảng điện toán đám mây của AWS và điện toán đám mây riêng của VIB (VIB Private cloud). Trước đó, từ năm 2021, VIB đã tiên phong triển khai nền tảng điện toán đa đám mây (multi-cloud) với việc sử dụng Microsoft Azure làm đám mây chính cho VIB thông qua thỏa thuận hợp tác chiến lược với Microsoft trong 3 năm, từ đó thúc đẩy tiến trình đổi mới sáng tạo, tạo ra những giá trị khác biệt nhằm đáp ứng nhu cầu và trải nghiệm số ngày một đa dạng của khách hàng.  Cùng với mục tiêu trở thành Ngân hàng sáng tạo nhất Việt Nam, VIB đang triển khai chiến lược số hóa dài hạn với Ngân hàng số chứng kiến sự tăng trưởng mạnh mẽ cùng tỷ lệ thâm nhập và chuyển đổi số cao. Trong giai đoạn 2017 - 2024, tốc độ tăng trưởng giao dịch số đạt bình quân hơn 90% mỗi năm với hơn 510 triệu giao dịch số ước đạt trong năm 2024. Trong đó, hơn 97% giao dịch cá nhân được thực hiện trên kênh số và hàng triệu khách hàng sử dụng dịch vụ ngân hàng số thường xuyên mỗi tháng. Việc triển khai một loạt dự án chuyển dịch lên điện toán đám mây không chỉ thể hiện nỗ lực hiện đại hóa và tối ưu hóa dịch vụ mà còn khẳng định tầm nhìn chiến lược của VIB trong bối cảnh cạnh tranh công nghệ ngày càng gay gắt. Với những ưu thế mà công nghệ này mang lại, VIB tự tin trong việc đáp ứng nhu cầu ngày càng cao của khách hàng, đồng thời khẳng định vị thế của mình như một ngân hàng tiên phong về công nghệ tại Việt Nam."
2024-06-19,Cùng Bảo Thy ‘săn’ ưu đãi giảm đến 67% khi mua sắm bằng thẻ VIB," Cùng Bảo Thy săn deal mua sắm và nhận ngay 1 triệu đồng khi mở thẻ Hàng loạt ưu đãi giá trị sẽ được áp dụng cho các chủ thẻ mới của VIB Cash Back và VIB Family Link - 2 dòng thẻ đang được đông đảo khách hàng ưa chuộng khi thanh toán cho các chi tiêu dành cho gia đình, con cái và bản thân chủ thẻ. Theo đó, 400 món đồ gia dụng gồm bộ nồi, nồi chiên không dầu, máy ép chậm, bếp từ đến từ thương hiệu Hàn Quốc Hawonkoo xuất hiện trong livestream tối 20/6 sẽ làm nức lòng chị em nội trợ khi giảm đến 67% (tương đương hàng triệu đồng). Riêng nhu cầu làm đẹp, 1.200 sản phẩm dưỡng da La Roche Posay và vô vàn deal từ ONYX, đi kèm mẹo làm đẹp từ Bảo Thy chắc chắn thu hút sự quan tâm của nhiều người xem. ""Là một người mẹ và thường xuyên mua sắm đồ gia dụng, đồ chơi cho con, mỹ phẩm cho bản thân, Thy thấy thẻ tín dụng VIB thực sự rất hữu ích, không chỉ mang đến những ưu đãi hấp dẫn, càng mua càng tiết kiệm được nhiều, mà còn giúp chủ thẻ thuận tiện hơn khi thao tác hoàn toàn qua điện thoại. Thanh toán nhanh gọn quathẻ VIBvà chờ hàng hóa được giao tận nhà, vậy là tiết kiệm được bao nhiêu thời gian dành cho con yêu"", Bảo Thy chia sẻ. Với những người xem livestream đang chuẩn bị cho chuyến du lịch hè, 200 chiếc vali xịn xò của thương hiệu Bamozo đã sẵn sàng tìm chủ sở hữu với giá chỉ 349.000 đồng cho size 20 (giá gốc 999.000 đồng) và 449.000 đồng cho size 24 (giá gốc 1.099.000 đồng). Đặc biệt,chỉ áp dụng duy nhất trong livestream, VIB và Bảo Thy sẽ tặng ngay 1.000.000 đồng cho 100 khách hàng đầu tiên mở thẻ theo đường dẫn xuất hiện trong chương trình và kích hoạt trước ngày 12/7/2024; nhữngkhách hàng cònsẽlại đượctặng 500.000 đồng khi mở thẻ VIB thông qua livestream và kích hoạt cùng thời điểm nói trên.   Xuyên suốt 2 giờ lên sóng trực tuyến tới đây, VIB còn mang đến hơn 15.000 voucher giảm giá khi mua hàng trực tiếp tại hệ thống Highlands trên toàn quốc và không giới hạn số lượng mã giảm giá cho toàn bộ hóa đơn trên 250.000 tại gian hàng của thương hiệu này trên Shopee. Ngoài mức giảm giá trực tiếp trên các sản phẩm xuất hiện trong phiên livestream, chủ thẻ Cash Back còn được hoàn tiền tới 10% khi thanh toán (đến 24 triệu điểm thưởng/năm), trong khi người dùng thẻ Family Link được trả góp 0% (không phí, không lãi) khi chi tiêu ở lĩnh vực giáo dục và đổi điểm thưởng thành tài khoản tiết kiệm Daily Saving cho con hoặc quy đổi sang tiền mặt/ eVoucher/ Phí thường niên thông qua ứng dụng MyVIB.Thương hiệu đồ chơi Mykingdom dành ưu đãi độc quyền giảm 30% cho chủ thẻ tín dụng Family Link khi mua sắm trên toàn hệ thống. Đây là dịp để các bậc phụ huynh mua sắm cho con những món đồ chơi đặc sắc với giá cực ưu đãi. Cùng với đó, người dùng thẻ tín dụngVIBsẽ được tận hưởng cácưu đãi bất tậngiảm 40% với VIB Travel, 30% với VIB Dine, 20% với VIB Shop, 10% với VIB Move và hoàn tiền 5-10% kèm trả góp 0% lãi suất khi mua bảo hiểm Prudential qua thẻ VIB. Ngoài ra, khi mở mới thẻ tín dụng từ nay đến 30/6/2024, khách hàng sẽ nhận ngay ưu đãi miễn phí thường niên năm đầu khi chi tiêu từ 3 triệu đồngtrong 30 ngày kể từ ngày thẻ được kích hoạt và không quá 45 ngày kể từ ngày phát hành thẻ. Mỗi dịp VIB livestream: Chi tiêu càng nhiều, ưu đãi càng lớn Những ngày gần đây, thông tin về buổi livestream ""Siêu thẻ Siêu deal - Trọn dealgia đình""củaVIBvàotối 20/6 liên tục khuấy động cộng đồng mạng bởi mức giảm giá khủng cho các mặt hàng chất lượng. Đây cũng là hiệu ứng từ sau chương trình giao lưu trực tuyến VIB tổ chức hằng tháng, gần nhất là tháng 5 vừa qua. ""Đợt trước, nhờ chớp được deal siêu tốt giảm hơn 60% từ livestream VIB mà mình đã ‘tái đầu tư’ được một bộ mỹ phẩm xịn ngay khi những sản phẩm đang xài gần hết. Nếu không xài thẻ VIB, chắc mình phải để tiết kiệm thêm mới có thể sở hữu được combo dưỡng da từ thương hiệu yêu thích này"", Hồng Hạnh (nhân sự ngành quảng cáo, TP.HCM) hào hứng cho biết.  Trong khi đó, gia đình chị Quỳnh Chi (nội trợ, Vũng Tàu) cũng đã kịp mua được một số sản phẩm chuẩn bị cho chuyến du lịch hè. Chị sắm thêm 2 chiếc vali cỡ lớn để đáp ứng nhu cầu đi chơi nhiều ngày của các thành viên trong nhà, đặt tour trekking để các con trải nghiệm, sẵn rèn luyện tinh thần thể thao, ngoài ra chị còn mua thêm ít áo thun cho chồng đi làm… ""Càng mua nhiều càng được ưu đãi nên cả nhà mình đều thích mê và chờ đến mỗi cuối tháng để đón xem livestream từ VIB"", chị vui vẻ nói. ""Mình và các đồng nghiệp, đặc biệt là những người chưa có thẻ tín dụng, đã set sẵn lịch để không bỏ lỡ phiên live ngày 20/6 của VIB, vì rất háo hức với những ưu đãi từ ngân hàng này"", Trung Kiên (thiết kế đồ họa, Hà Nội) bật mí. Cùng đón xem buổi livestream của VIB: - Thời gian: 20h00 - 22h00, thứ Năm – 20/6/2024 - Kênh phát sóng:Fanpage VIBvàFanpage Bao Thy Tran Đừng quên tìm hiểu trướccác dòngthẻtín dụngVIBtại đâyđể sẵn sàngmởthẻtrong livestream,cũng như khám pháthêm nhiều ưu đãiquanh nămdành cho chủ thẻ!    "
2024-04-10,"Vay VIB mua ô tô Huyndai lãi suất 1,5%/năm, duyệt vay siêu tốc trong 15 phút"," Lãi suất chỉ 1,5%/năm, vay đến 80% giá trị xe, không lo trả gốc trong 6 tháng Đây là mức lãi suất ưu đãi áp dụng cho tất cả khách hàng vay VIB mua các dòng xe Huyndai Grand I10, Accent, Elantra, Custin từ nay đến hết ngày 30/04/2024. Thời gian ưu đãi lãi suất là 12 tháng. Với các dòng xe khác của Huyndai do HTV phân phối, VIB cũng đang áp dụng mức lãi suất vay ưu đãi hàng đầu thị trường, chỉ từ 7,5%/năm. Bên cạnh lãi suất hấp dẫn, chương trình còn tích hợp bộ 3 giá trị cộng thêm giúp khách hàng hoàn toàn chủ động về kế hoạch tài chính khi vay mua xe như: Hạn mức vay đến 80% giá trị xe; Thời gian vay lên đến 8 năm; Không lo trả gốc trong 6 tháng, sau thời gian ưu đãi khách hàng có thể lựa chọn linh hoạt trả theo tháng hoặc theo quý. Song song đó, khách hàng mua xe ô tô Huyndai trong thời gian này còn được hưởng ưu đãi kép với nhiều quyền lợi hấp dẫn từ HTV. 15 phút duyệt vay siêu tốc tại VIB Chương trình hợp tác với các đối tác ô tô hàng đầu thị trường của VIB luôn thu hút sự quan tâm từ khách hàng khi là ngân hàng chiếm giữ thị phần top đầu về cho vay mua ô tô suốt nhiều năm liền với quy trình duyệt vay siêu tốc, chỉ 15 phút qua ứng dụng VIB Champion. Đây là ứng dụng được VIB phát triển dành riêng cho các đối tác ô tô, kết nối khách hàng – showroom – ngân hàng, được tích hợp toàn bộ quy trình tiếp nhận, xử lý hồ sơ vay mua ô tô. Với VIB Champion, khách hàng khi đến xem xe và có nhu cầu vay mua xe tại showroom ô tô bất kỳ trên toàn quốc, chỉ cần cung cấp cho nhân viên showroom các thông tin nhân thân cơ bản,VIBsẽ thông báo ngay kết quả phê duyệt khoản vay chỉ trong vòng 15 phút thông qua ứng dụng. Thị trường hạ nhiệt là thời điểm thích hợp nhất để mua xe  Thị trường ô tô từ ra Tết đến nay có xu hướng hạ nhiệt, nhiều hãng xe triển khai giảm giá, khuyến mãi để kích cầu tiêu dùng. Một số chuyên gia nhận định, đây là thời điểm thích hợp nhất để mua xe đối với những người mua xe phục vụ nhu cầu đi lại của gia đình hoặc kinh doanh, bởi hầu hết các phân khúc ôtô đều đang ở vùng giá tốt, cộng với lãi suất vay ngân hàng đã xuống mức thấp nhất. Thương hiệu Hyundai bán ra tổng cộng 67.450 xe tại Việt Nam trong năm 2023. Người Việt ưa chuộng xe Huyndai bởi kiểu dáng thiết kế bắt mắt, thường xuyên đưa ra những sản phẩm mới, nhiều trang bị tính năng và giá bán dễ tiếp cận. Với mạng lưới triển khai rộng rãi tại gần 180 chi nhánh VIB và 70 đại lý phân phối xe Hyundai của HTV trên toàn quốc, khách hàng vay mua xe Hyundai tại VIB sẽ được phục vụ bởi kênh riêng theo tiêu chuẩn quốc tế với đội ngũ tư vấn tài chính chuyên nghiệp, quy trình riêng biệt và thủ tục đơn giản từ ngân hàng cho vay mua ô tô hàng đầu Việt Nam. Đây là vị thế đến từ thị phần top đầu về cho vay mua ô tô mà VIB đã chiếm lĩnh và giữ vững suốt nhiều năm qua vớinhững giải pháp cho vay mua ô tô ưu việt, quy trình duyệt vay siêu tốc, ứng dụng công nghệ hiện đại cùng với mối quan hệ hợp tác chiến lược với các đối tác ô tô hàng đầu.Tham khảo thêm thông tin chi tiếttại đây."
2024-07-29,"'Sướng' như bankers: Nhân viên VIB được thưởng cổ phiếu trị giá 230 tỷ đồng, người Nam A Bank và Techcombank được mua cổ phiếu ESOP giá rẻ"," Ngân hàng Quốc tế Việt Nam (VIB)vừa thông báo về chính sách phát hành cổ phiếu thưởng cho cán bộ nhân viên. Nhà băng này sử dụng hơn 110 tỷ đồng từ nguồn vốn chủ sở hữu để phát hành cổ phiếu thưởng cho nhân viên (ESOP), tương ứng tổng 11 triệu cổ phiếu. Nếu tính theo vùng giá 21.000 đồng mỗi cổ phiếu VIB duy trì từ đầu năm đến nay, số cổ phiếu thưởng này có trị giá hơn 230 tỷ đồng. Danh sách cán bộ được nhận cổ phiếu thưởng của VIB bao gồm 1.918 người. Trong đó, số cổ phiếu mỗi người được thưởng dao động 1.000 đến 600.000 cổ phiếu, tùy chức vụ và hiệu quả làm việc. Tính trên 12.000 nhân sự đang làm việc tại VIB, khoảng 16% nhân sự nhà băng này được phát thưởng cổ phiếu trong đợt này. Hiện, người được thưởng nhiều nhất là ông Lê Quang Trung - Giám đốc Khối nguồn vốn nhà băng, với gần 620.000 cổ phiếu, gấp hơn 4 lần Tổng giám đốc Hàn Ngọc Vũ. Tính theo giá chốt phiên ngày 26/7 là 20.900 đồng/cổ phiếu, ước tính giá trị thị trường của số cổ phiếu ông Trung được nhận sẽ rơi vào khoảng 12,9 tỷ đồng. Trong năm 2023, ngân hàng đã phát hành 7,6 triệu cổ phiếu cho 1.700 nhân viên. Còn vào năm 2019, VIB cũng thực hiện phát hành 7,8 triệu cổ phiếu thưởng cho người lao động. Ngoài VIB,Techcombankcũng đang lên kế hoạch phát hành ESOP. Nội dung phát hành ESOP năm 2024 chưa được nhắc đến trong tài liệu và nghị quyết Đại hội đồng cổ đông thường niên năm nay. Tuy nhiên, ngân hàng này đang rục rịch kế hoạch ESOP sau khi được Ngân hàng Nhà nước chấp thuận tăng vốn điều lệ lên 70.450 tỷ đồng bằng hình thức phát hành cổ phiếu từ nguồn vốn chủ sở hữu. Nếu kế hoạch ESOP mới được thông qua, vốn điều lệ của Techcombank sẽ sớm vượt mốc 70.450 tỷ đồng. Tuy nhiên, quy mô tăng vốn từ phát hành ESOP có thể sẽ không quá lớn.  Trước đó, Techcombank đã phát hành 5,27 triệu cổ phiếu ESOP, thu về 52 tỷ đồng và đưa vốn điều lệ lên mức 35.225 tỷ đồng trong năm 2023. Vào năm 2022, ngân hàng cũng đã chào bán 6,3 triệu cổ phiếu ESOP cho người lao động. Từ năm 2018 - 2021, Techcombank luôn duy trì chương trình này. Bên cạnh đó,Nam A Bankcũng vừa thông qua quy chế phát hành cổ phiếu theo chương trình lựa chọn cho người lao động (ESOP). Nam A Bank dự kiến phát hành 50 triệu cổ phiếu ESOP với giá chào bán 10.000 đồng/cổ phiếu, tăng vốn điều lệ thêm 500 tỷ đồng. Tỷ lệ phát hành tương đương 4,726% số lượng cổ phiếu đang lưu hành. Thời gian dự kiến thực hiện trong năm 2024. Số lượng cổ phiếu ESOP trên bị hạn chế chuyển nhượng 100% trong thời hạn 1 năm kể từ ngày kết thúc đợt phát hành, trong năm thứ 2 sẽ giải tỏa 50% số cổ phiếu còn lại. ESOP (phát hành cổ phiếu ưu đãi cho người lao động) được hiểu là việc các doanh nghiệp bán cổ phiếu cho các nhân viên xuất sắc, người lao động theo các tiêu chí được chọn với giá ưu đãi, thường thấp hơn nhiều so với giá giao dịch trên thị trường. Giới tài chính đánh giá, đây là chính sách đảm bảo phúc lợi cho nhân viên ngân hàng nhưng không tốn quá nhiều chi phí. Theo chuẩn mực kế toán đang áp dụng tại Việt Nam, khoản chênh lệch giữa giá bán cổ phiếu ESOP và thị giá không bị phản ánh vào chi phí lương, thưởng. Do đó, chính sách phúc lợi không làm các ngân hàng phát sinh thêm chi phí, lợi nhuận trên báo cáo đẹp mắt hơn so với việc thưởng bằng tiền. ESOP ngoài là chiến lược giúp giữ chân nhân sự giỏi của doanh nghiệp còn giúp các đơn vị này tăng vốn. Tuy nhiên, các đợt phát hành này có thể dẫn đến tình trạng pha loãng cổ phần."
